{"ts": "2026-09-26T14:53:44Z", "decision": "skip", "before_score": 0.9071, "after_score": 0.9071, "delta": 0.0, "mutation": "", "kind": "", "note": "No pending hard-tier lemma mutations (catalog exhausted or empty).", "themes": ["AI Safety via Debate", "Thresholds and spread in set systems of bounded VC-dimension", "Temporal Gradient Inversion for Private Trajectory Reconstru", "A quasisymmetric analog of Grassmannian Schubert varieties"]}
{"ts": "2026-09-26T14:53:46Z", "decision": "skip", "before_score": 0.9071, "after_score": 0.9071, "delta": 0.0, "mutation": "", "kind": "", "note": "No pending hard-tier lemma mutations (catalog exhausted or empty).", "themes": ["AI Safety via Debate", "Thresholds and spread in set systems of bounded VC-dimension", "Temporal Gradient Inversion for Private Trajectory Reconstru", "A quasisymmetric analog of Grassmannian Schubert varieties"]}
{"ts": "2026-09-26T14:53:47Z", "decision": "skip", "before_score": 0.9071, "after_score": 0.9071, "delta": 0.0, "mutation": "", "kind": "", "note": "No pending hard-tier lemma mutations (catalog exhausted or empty).", "themes": ["AI Safety via Debate", "Thresholds and spread in set systems of bounded VC-dimension", "Temporal Gradient Inversion for Private Trajectory Reconstru", "A quasisymmetric analog of Grassmannian Schubert varieties"]}
{"ts": "2026-09-26T14:53:49Z", "decision": "skip", "before_score": 0.9071, "after_score": 0.9071, "delta": 0.0, "mutation": "", "kind": "", "note": "No pending hard-tier lemma mutations (catalog exhausted or empty).", "themes": ["AI Safety via Debate", "Thresholds and spread in set systems of bounded VC-dimension", "Temporal Gradient Inversion for Private Trajectory Reconstru", "A quasisymmetric analog of Grassmannian Schubert varieties"]}
{"ts": "2026-09-26T14:54:22Z", "decision": "skip", "before_score": 0.9071, "after_score": 0.9071, "delta": 0.0, "mutation": "", "kind": "", "note": "No pending hard-tier lemma mutations (catalog exhausted or empty).", "themes": ["Attention Is All You Need", "G\u00f6del Machines: Fully Self-Referential Optimal Universal Sel", "Reflexion: Language Agents with Verbal Reinforcement Learnin", "Darwin G\u00f6del Machine: Open-Ended Evolution of Self-Improving"]}
{"ts": "2026-09-26T15:08:05Z", "decision": "keep", "before_score": 0.9071, "after_score": 0.9071, "delta": 0.0, "mutation": "gcd_fibonacci", "kind": "hard_enable", "note": "Kept `gcd_fibonacci` (hard_enable): lemma score 0.9071\u21920.9071 checks 22\u219223 hard_pass 12\u219213 (machine-checked; not novel discovery). | novelty_gate novel=False kills=['already_in_lesson_ledger_or_history', 'already_enabled_in_impl', 'stripped_baseline_does_not_fail_usefulness']", "themes": ["Attention Is All You Need", "G\u00f6del Machines: Fully Self-Referential Optimal Universal Sel", "Reflexion: Language Agents with Verbal Reinforcement Learnin", "Darwin G\u00f6del Machine: Open-Ended Evolution of Self-Improving"]}
{"ts": "2026-09-26T15:08:09Z", "decision": "revert", "before_score": 0.9071, "after_score": 0.9071, "delta": 0.0, "mutation": "easy_pad_commutativity", "kind": "easy_pad", "note": "Reverted `easy_pad_commutativity` (easy_pad): score 0.9071\u21920.9229 ok=True hard_pass 13\u219213 \u2014 hard-tier lift required for keep; easy pads fail. | novelty_gate novel=False kills=['already_in_lesson_ledger_or_history', 'textbook_reuse=1.0', 'stripped_baseline_does_not_fail_usefulness', 'held_out:easy_pad_fails_held_out_harder']", "themes": ["Attention Is All You Need", "G\u00f6del Machines: Fully Self-Referential Optimal Universal Sel", "Reflexion: Language Agents with Verbal Reinforcement Learnin", "Darwin G\u00f6del Machine: Open-Ended Evolution of Self-Improving"]}
{"ts": "2026-09-26T15:08:09Z", "decision": "revert", "before_score": 0.9071, "after_score": 0.9071, "delta": 0.0, "mutation": "easy_pad_abs_identity", "kind": "easy_pad", "note": "Reverted `easy_pad_abs_identity` (easy_pad): score 0.9071\u21920.9229 ok=True hard_pass 13\u219213 \u2014 hard-tier lift required for keep; easy pads fail. | novelty_gate novel=False kills=['already_in_lesson_ledger_or_history', 'textbook_reuse=1.0', 'stripped_baseline_does_not_fail_usefulness', 'held_out:easy_pad_fails_held_out_harder']", "themes": ["Attention Is All You Need", "G\u00f6del Machines: Fully Self-Referential Optimal Universal Sel", "Reflexion: Language Agents with Verbal Reinforcement Learnin", "Darwin G\u00f6del Machine: Open-Ended Evolution of Self-Improving"]}
{"ts": "2026-09-26T15:08:10Z", "decision": "revert", "before_score": 0.9071, "after_score": 0.9071, "delta": 0.0, "mutation": "easy_pad_square_again", "kind": "easy_pad", "note": "Reverted `easy_pad_square_again` (easy_pad): score 0.9071\u21920.9229 ok=True hard_pass 13\u219213 \u2014 hard-tier lift required for keep; easy pads fail. | novelty_gate novel=False kills=['already_in_lesson_ledger_or_history', 'textbook_reuse=1.0', 'stripped_baseline_does_not_fail_usefulness', 'held_out:easy_pad_fails_held_out_harder']", "themes": ["Attention Is All You Need", "G\u00f6del Machines: Fully Self-Referential Optimal Universal Sel", "Reflexion: Language Agents with Verbal Reinforcement Learnin", "Darwin G\u00f6del Machine: Open-Ended Evolution of Self-Improving"]}
{"ts": "2026-09-26T15:08:13Z", "decision": "keep", "before_score": 0.9071, "after_score": 0.9071, "delta": 0.0, "mutation": "stirling_second_row", "kind": "hard_enable", "note": "Kept `stirling_second_row` (hard_enable): lemma score 0.9071\u21920.9071 checks 23\u219224 hard_pass 13\u219214 (machine-checked; not novel discovery). | novelty_gate novel=False kills=['already_in_lesson_ledger_or_history', 'already_enabled_in_impl', 'stripped_baseline_does_not_fail_usefulness']", "themes": ["Attention Is All You Need", "G\u00f6del Machines: Fully Self-Referential Optimal Universal Sel", "Reflexion: Language Agents with Verbal Reinforcement Learnin", "Darwin G\u00f6del Machine: Open-Ended Evolution of Self-Improving"]}
{"ts": "2026-09-26T15:08:15Z", "decision": "keep", "before_score": 0.9071, "after_score": 0.9071, "delta": 0.0, "mutation": "pythagorean_generation", "kind": "hard_enable", "note": "Kept `pythagorean_generation` (hard_enable): lemma score 0.9071\u21920.9071 checks 24\u219225 hard_pass 14\u219215 (machine-checked; not novel discovery). | novelty_gate novel=False kills=['already_in_lesson_ledger_or_history', 'already_enabled_in_impl', 'stripped_baseline_does_not_fail_usefulness']", "themes": ["Attention Is All You Need", "G\u00f6del Machines: Fully Self-Referential Optimal Universal Sel", "Reflexion: Language Agents with Verbal Reinforcement Learnin", "Darwin G\u00f6del Machine: Open-Ended Evolution of Self-Improving"]}
{"ts": "2026-09-26T15:08:16Z", "decision": "keep", "before_score": 0.9071, "after_score": 0.9071, "delta": 0.0, "mutation": "motzkin_bounded", "kind": "hard_enable", "note": "Kept `motzkin_bounded` (hard_enable): lemma score 0.9071\u21920.9071 checks 25\u219226 hard_pass 15\u219216 (machine-checked; not novel discovery). | novelty_gate novel=False kills=['already_in_lesson_ledger_or_history', 'already_enabled_in_impl', 'stripped_baseline_does_not_fail_usefulness']", "themes": ["Attention Is All You Need", "G\u00f6del Machines: Fully Self-Referential Optimal Universal Sel", "Reflexion: Language Agents with Verbal Reinforcement Learnin", "Darwin G\u00f6del Machine: Open-Ended Evolution of Self-Improving"]}
{"ts": "2026-09-26T15:08:17Z", "decision": "revert", "before_score": 0.9071, "after_score": 0.9071, "delta": 0.0, "mutation": "easy_pad_diff_squares", "kind": "easy_pad", "note": "Reverted `easy_pad_diff_squares` (easy_pad): score 0.9071\u21920.9229 ok=True hard_pass 16\u219216 \u2014 hard-tier lift required for keep; easy pads fail. | novelty_gate novel=False kills=['already_in_lesson_ledger_or_history', 'textbook_reuse=1.0', 'stripped_baseline_does_not_fail_usefulness', 'held_out:easy_pad_fails_held_out_harder']", "themes": ["Attention Is All You Need", "G\u00f6del Machines: Fully Self-Referential Optimal Universal Sel", "Reflexion: Language Agents with Verbal Reinforcement Learnin", "Darwin G\u00f6del Machine: Open-Ended Evolution of Self-Improving"]}
{"ts": "2026-09-26T15:08:19Z", "decision": "revert", "before_score": 0.9071, "after_score": 0.9071, "delta": 0.0, "mutation": "easy_pad_commutativity", "kind": "easy_pad", "note": "Reverted `easy_pad_commutativity` (easy_pad): score 0.9071\u21920.9229 ok=True hard_pass 16\u219216 \u2014 hard-tier lift required for keep; easy pads fail. | novelty_gate novel=False kills=['already_in_lesson_ledger_or_history', 'textbook_reuse=1.0', 'stripped_baseline_does_not_fail_usefulness', 'held_out:easy_pad_fails_held_out_harder']", "themes": ["Attention Is All You Need", "G\u00f6del Machines: Fully Self-Referential Optimal Universal Sel", "Reflexion: Language Agents with Verbal Reinforcement Learnin", "Darwin G\u00f6del Machine: Open-Ended Evolution of Self-Improving"]}
{"ts": "2026-09-26T15:08:20Z", "decision": "revert", "before_score": 0.9071, "after_score": 0.9071, "delta": 0.0, "mutation": "easy_pad_square_again", "kind": "easy_pad", "note": "Reverted `easy_pad_square_again` (easy_pad): score 0.9071\u21920.9229 ok=True hard_pass 16\u219216 \u2014 hard-tier lift required for keep; easy pads fail. | novelty_gate novel=False kills=['already_in_lesson_ledger_or_history', 'textbook_reuse=1.0', 'stripped_baseline_does_not_fail_usefulness', 'held_out:easy_pad_fails_held_out_harder']", "themes": ["Attention Is All You Need", "G\u00f6del Machines: Fully Self-Referential Optimal Universal Sel", "Reflexion: Language Agents with Verbal Reinforcement Learnin", "Darwin G\u00f6del Machine: Open-Ended Evolution of Self-Improving"]}
{"ts": "2026-09-26T15:08:21Z", "decision": "revert", "before_score": 0.9071, "after_score": 0.9071, "delta": 0.0, "mutation": "easy_pad_commutativity", "kind": "easy_pad", "note": "Reverted `easy_pad_commutativity` (easy_pad): score 0.9071\u21920.9229 ok=True hard_pass 16\u219216 \u2014 hard-tier lift required for keep; easy pads fail. | novelty_gate novel=False kills=['already_in_lesson_ledger_or_history', 'textbook_reuse=1.0', 'stripped_baseline_does_not_fail_usefulness', 'held_out:easy_pad_fails_held_out_harder']", "themes": ["Attention Is All You Need", "G\u00f6del Machines: Fully Self-Referential Optimal Universal Sel", "Reflexion: Language Agents with Verbal Reinforcement Learnin", "Darwin G\u00f6del Machine: Open-Ended Evolution of Self-Improving"]}
{"ts": "2026-09-26T15:08:22Z", "decision": "revert", "before_score": 0.9071, "after_score": 0.9071, "delta": 0.0, "mutation": "easy_pad_abs_identity", "kind": "easy_pad", "note": "Reverted `easy_pad_abs_identity` (easy_pad): score 0.9071\u21920.9229 ok=True hard_pass 16\u219216 \u2014 hard-tier lift required for keep; easy pads fail. | novelty_gate novel=False kills=['already_in_lesson_ledger_or_history', 'textbook_reuse=1.0', 'stripped_baseline_does_not_fail_usefulness', 'held_out:easy_pad_fails_held_out_harder']", "themes": ["Attention Is All You Need", "G\u00f6del Machines: Fully Self-Referential Optimal Universal Sel", "Reflexion: Language Agents with Verbal Reinforcement Learnin", "Darwin G\u00f6del Machine: Open-Ended Evolution of Self-Improving"]}
{"ts": "2026-09-26T15:08:29Z", "decision": "revert", "before_score": 0.9071, "after_score": 0.9071, "delta": 0.0, "mutation": "easy_pad_abs_identity", "kind": "easy_pad", "note": "Reverted `easy_pad_abs_identity` (easy_pad): score 0.9071\u21920.9229 ok=True hard_pass 16\u219216 \u2014 hard-tier lift required for keep; easy pads fail. | novelty_gate novel=False kills=['already_in_lesson_ledger_or_history', 'textbook_reuse=1.0', 'stripped_baseline_does_not_fail_usefulness', 'held_out:easy_pad_fails_held_out_harder']", "themes": ["Attention Is All You Need", "G\u00f6del Machines: Fully Self-Referential Optimal Universal Sel", "Reflexion: Language Agents with Verbal Reinforcement Learnin", "Darwin G\u00f6del Machine: Open-Ended Evolution of Self-Improving"]}
{"ts": "2026-09-26T15:08:29Z", "decision": "skip", "before_score": 0.9071, "after_score": 0.9071, "delta": 0.0, "mutation": "", "kind": "", "note": "No pending hard-tier lemma mutations (catalog exhausted or empty).", "themes": ["Attention Is All You Need", "G\u00f6del Machines: Fully Self-Referential Optimal Universal Sel", "Reflexion: Language Agents with Verbal Reinforcement Learnin", "Darwin G\u00f6del Machine: Open-Ended Evolution of Self-Improving"]}
{"ts": "2026-09-27T05:29:57Z", "decision": "skip", "before_score": 0.825, "after_score": 0.825, "delta": 0.0, "mutation": "", "kind": "", "note": "No pending hard-tier lemma mutations (catalog exhausted or empty).", "themes": ["Agentic Detection of Online Conspiracies", "Frobenius lifts and point counting for smooth curves", "The Sociolinguistics of Machine Identity: LLM Personality an", "Fast Solution Methods for the Classical 0\u20131 Knapsack Problem"]}
{"ts": "2026-09-27T05:30:17Z", "decision": "skip", "before_score": 0.825, "after_score": 0.825, "delta": 0.0, "mutation": "", "kind": "", "note": "No pending hard-tier lemma mutations (catalog exhausted or empty).", "themes": ["AI Safety via Debate", "Thresholds and spread in set systems of bounded VC-dimension", "Temporal Gradient Inversion for Private Trajectory Reconstru", "A quasisymmetric analog of Grassmannian Schubert varieties"]}
{"ts": "2026-09-27T05:30:37Z", "decision": "skip", "before_score": 0.825, "after_score": 0.825, "delta": 0.0, "mutation": "", "kind": "", "note": "No pending hard-tier lemma mutations (catalog exhausted or empty).", "themes": ["AI Safety via Debate", "Thresholds and spread in set systems of bounded VC-dimension", "Temporal Gradient Inversion for Private Trajectory Reconstru", "A quasisymmetric analog of Grassmannian Schubert varieties"]}
{"ts": "2026-09-27T12:16:23Z", "decision": "skip", "before_score": 0.825, "after_score": 0.825, "delta": 0.0, "mutation": "", "kind": "", "note": "No pending hard-tier lemma mutations (catalog exhausted or empty).", "themes": ["Agentic Detection of Online Conspiracies", "Frobenius lifts and point counting for smooth curves", "The Sociolinguistics of Machine Identity: LLM Personality an", "Fast Solution Methods for the Classical 0\u20131 Knapsack Problem"]}
{"ts": "2026-09-27T12:16:45Z", "decision": "skip", "before_score": 0.825, "after_score": 0.825, "delta": 0.0, "mutation": "", "kind": "", "note": "No pending hard-tier lemma mutations (catalog exhausted or empty).", "themes": ["Agentic Detection of Online Conspiracies", "Frobenius lifts and point counting for smooth curves", "The Sociolinguistics of Machine Identity: LLM Personality an", "Fast Solution Methods for the Classical 0\u20131 Knapsack Problem"]}
{"ts": "2026-09-27T12:17:07Z", "decision": "skip", "before_score": 0.825, "after_score": 0.825, "delta": 0.0, "mutation": "", "kind": "", "note": "No pending hard-tier lemma mutations (catalog exhausted or empty).", "themes": ["Agentic Detection of Online Conspiracies", "Frobenius lifts and point counting for smooth curves", "The Sociolinguistics of Machine Identity: LLM Personality an", "Fast Solution Methods for the Classical 0\u20131 Knapsack Problem"]}
{"ts": "2026-09-27T17:07:05Z", "decision": "skip", "before_score": 0.825, "after_score": 0.825, "delta": 0.0, "mutation": "", "kind": "", "note": "No pending hard-tier lemma mutations (catalog exhausted or empty).", "themes": ["Agentic Detection of Online Conspiracies", "Frobenius lifts and point counting for smooth curves", "The Sociolinguistics of Machine Identity: LLM Personality an", "Fast Solution Methods for the Classical 0\u20131 Knapsack Problem"]}
{"ts": "2026-09-27T17:07:43Z", "decision": "skip", "before_score": 0.825, "after_score": 0.825, "delta": 0.0, "mutation": "", "kind": "", "note": "No pending hard-tier lemma mutations (catalog exhausted or empty).", "themes": ["Agentic Detection of Online Conspiracies", "Frobenius lifts and point counting for smooth curves", "The Sociolinguistics of Machine Identity: LLM Personality an", "Fast Solution Methods for the Classical 0\u20131 Knapsack Problem"]}
{"ts": "2026-09-27T17:08:12Z", "decision": "skip", "before_score": 0.825, "after_score": 0.825, "delta": 0.0, "mutation": "", "kind": "", "note": "No pending hard-tier lemma mutations (catalog exhausted or empty).", "themes": ["Agentic Detection of Online Conspiracies", "Frobenius lifts and point counting for smooth curves", "The Sociolinguistics of Machine Identity: LLM Personality an", "Fast Solution Methods for the Classical 0\u20131 Knapsack Problem"]}
{"ts": "2026-09-27T21:29:57Z", "decision": "skip", "before_score": 0.825, "after_score": 0.825, "delta": 0.0, "mutation": "", "kind": "", "note": "No pending hard-tier lemma mutations (catalog exhausted or empty).", "themes": ["Agentic Detection of Online Conspiracies", "Frobenius lifts and point counting for smooth curves", "The Sociolinguistics of Machine Identity: LLM Personality an", "Fast Solution Methods for the Classical 0\u20131 Knapsack Problem"]}
{"ts": "2026-09-27T21:30:40Z", "decision": "skip", "before_score": 0.825, "after_score": 0.825, "delta": 0.0, "mutation": "", "kind": "", "note": "No pending hard-tier lemma mutations (catalog exhausted or empty).", "themes": ["Agentic Detection of Online Conspiracies", "Frobenius lifts and point counting for smooth curves", "The Sociolinguistics of Machine Identity: LLM Personality an", "Fast Solution Methods for the Classical 0\u20131 Knapsack Problem"]}
{"ts": "2026-09-27T21:31:09Z", "decision": "skip", "before_score": 0.825, "after_score": 0.825, "delta": 0.0, "mutation": "", "kind": "", "note": "No pending hard-tier lemma mutations (catalog exhausted or empty).", "themes": ["Agentic Detection of Online Conspiracies", "Frobenius lifts and point counting for smooth curves", "The Sociolinguistics of Machine Identity: LLM Personality an", "Fast Solution Methods for the Classical 0\u20131 Knapsack Problem"]}
{"ts": "2026-09-28T05:39:40Z", "decision": "skip", "before_score": 0.825, "after_score": 0.825, "delta": 0.0, "mutation": "", "kind": "", "note": "No pending hard-tier lemma mutations (catalog exhausted or empty).", "themes": ["First-Order Stationarity of Reverse Diffusions", "Formal groups and $(\\varphi,\u0393)$-modules", "The Sociolinguistics of Machine Identity: LLM Personality an", "Fast Solution Methods for the Classical 0\u20131 Knapsack Problem"]}
{"ts": "2026-09-28T05:40:18Z", "decision": "skip", "before_score": 0.825, "after_score": 0.825, "delta": 0.0, "mutation": "", "kind": "", "note": "No pending hard-tier lemma mutations (catalog exhausted or empty).", "themes": ["First-Order Stationarity of Reverse Diffusions", "Formal groups and $(\\varphi,\u0393)$-modules", "The Sociolinguistics of Machine Identity: LLM Personality an", "Fast Solution Methods for the Classical 0\u20131 Knapsack Problem"]}
{"ts": "2026-09-28T05:40:45Z", "decision": "skip", "before_score": 0.825, "after_score": 0.825, "delta": 0.0, "mutation": "", "kind": "", "note": "No pending hard-tier lemma mutations (catalog exhausted or empty).", "themes": ["First-Order Stationarity of Reverse Diffusions", "Formal groups and $(\\varphi,\u0393)$-modules", "The Sociolinguistics of Machine Identity: LLM Personality an", "Fast Solution Methods for the Classical 0\u20131 Knapsack Problem"]}
{"ts": "2026-09-28T14:16:41Z", "decision": "skip", "before_score": 0.825, "after_score": 0.825, "delta": 0.0, "mutation": "", "kind": "", "note": "No pending hard-tier lemma mutations (catalog exhausted or empty).", "themes": ["Learning to Stop without Learning to Stop: Self-Supervised C", "Gap-free Differentially Private PCA for Gaussian Data", "Galois groups of twisted reciprocal polynomials: a uniform a", "First-Order Stationarity of Reverse Diffusions"]}
{"ts": "2026-09-28T14:17:19Z", "decision": "skip", "before_score": 0.825, "after_score": 0.825, "delta": 0.0, "mutation": "", "kind": "", "note": "No pending hard-tier lemma mutations (catalog exhausted or empty).", "themes": ["First-Order Stationarity of Reverse Diffusions", "Formal groups and $(\\varphi,\u0393)$-modules", "The Sociolinguistics of Machine Identity: LLM Personality an", "Fast Solution Methods for the Classical 0\u20131 Knapsack Problem"]}
{"ts": "2026-09-28T14:17:45Z", "decision": "skip", "before_score": 0.825, "after_score": 0.825, "delta": 0.0, "mutation": "", "kind": "", "note": "No pending hard-tier lemma mutations (catalog exhausted or empty).", "themes": ["AI Safety via Debate", "Learning to Stop without Learning to Stop: Self-Supervised C", "Gap-free Differentially Private PCA for Gaussian Data", "Galois groups of twisted reciprocal polynomials: a uniform a"]}
{"ts": "2026-09-28T23:24:50Z", "decision": "skip", "before_score": 0.825, "after_score": 0.825, "delta": 0.0, "mutation": "", "kind": "", "note": "No pending hard-tier lemma mutations (catalog exhausted or empty).", "themes": ["First-Order Stationarity of Reverse Diffusions", "Formal groups and $(\\varphi,\u0393)$-modules", "The Sociolinguistics of Machine Identity: LLM Personality an", "Fast Solution Methods for the Classical 0\u20131 Knapsack Problem"]}
{"ts": "2026-09-28T23:25:30Z", "decision": "skip", "before_score": 0.825, "after_score": 0.825, "delta": 0.0, "mutation": "", "kind": "", "note": "No pending hard-tier lemma mutations (catalog exhausted or empty).", "themes": ["First-Order Stationarity of Reverse Diffusions", "Formal groups and $(\\varphi,\u0393)$-modules", "The Sociolinguistics of Machine Identity: LLM Personality an", "Fast Solution Methods for the Classical 0\u20131 Knapsack Problem"]}
