{"ts": "2026-10-07T21:52:00Z", "decision": "keep", "before_score": 0.9071, "after_score": 0.9071, "delta": 0.0, "mutation": "authored_oeis_a000045__cassini", "kind": "hard_enable", "note": "Kept `authored_oeis_a000045__cassini` (hard_enable): lemma score 0.9071\u21920.9071 checks 46\u219247 hard_pass 36\u219237 (machine-checked + Oracle pass; not novel discovery). | oracle=PASS fitness_credit=True kills=[]", "themes": ["New algebraic points on covers of elliptic curves", "The Sociolinguistics of Machine Identity: LLM Personality an", "Fast Solution Methods for the Classical 0\u20131 Knapsack Problem", "Digital-Twin-Driven Predictive Maintenance and Fault-Toleran"]}
{"ts": "2026-10-07T21:52:44Z", "decision": "revert", "before_score": 0.825, "after_score": 0.825, "delta": 0.0, "mutation": "stem_easy_pad_units", "kind": "stem_easy_pad", "note": "Reverted `stem_easy_pad_units` (stem_easy_pad): score 0.825\u21920.825 ok=True hard_pass 4\u21924 \u2014 Oracle/hard-tier required for keep; easy pads die on Oracle. | oracle=KILL fitness_credit=False kills=['tentative_not_keep']", "themes": ["New algebraic points on covers of elliptic curves", "The Sociolinguistics of Machine Identity: LLM Personality an", "Fast Solution Methods for the Classical 0\u20131 Knapsack Problem", "Digital-Twin-Driven Predictive Maintenance and Fault-Toleran"]}
{"ts": "2026-10-07T23:04:32Z", "decision": "keep", "before_score": 0.9071, "after_score": 0.9071, "delta": 0.0, "mutation": "authored_binomial_symmetry__catalan_convolution_w1", "kind": "hard_enable", "note": "Kept `authored_binomial_symmetry__catalan_convolution_w1` (hard_enable): lemma score 0.9071\u21920.9071 checks 47\u219248 hard_pass 37\u219238 (machine-checked + Oracle pass; not novel discovery). | oracle=PASS fitness_credit=True kills=[]", "themes": ["New algebraic points on covers of elliptic curves", "The Sociolinguistics of Machine Identity: LLM Personality an", "Fast Solution Methods for the Classical 0\u20131 Knapsack Problem", "Digital-Twin-Driven Predictive Maintenance and Fault-Toleran"]}
{"ts": "2026-10-07T23:05:12Z", "decision": "revert", "before_score": 0.825, "after_score": 0.825, "delta": 0.0, "mutation": "stem_easy_pad_units", "kind": "stem_easy_pad", "note": "Reverted `stem_easy_pad_units` (stem_easy_pad): score 0.825\u21920.825 ok=True hard_pass 4\u21924 \u2014 Oracle/hard-tier required for keep; easy pads die on Oracle. | oracle=KILL fitness_credit=False kills=['tentative_not_keep']", "themes": ["New algebraic points on covers of elliptic curves", "The Sociolinguistics of Machine Identity: LLM Personality an", "Fast Solution Methods for the Classical 0\u20131 Knapsack Problem", "Digital-Twin-Driven Predictive Maintenance and Fault-Toleran"]}
{"ts": "2026-10-07T23:05:52Z", "decision": "keep", "before_score": 0.9071, "after_score": 0.9071, "delta": 0.0, "mutation": "authored_central_binom_bound__derangement_subfactorial_w1", "kind": "hard_enable", "note": "Kept `authored_central_binom_bound__derangement_subfactorial_w1` (hard_enable): lemma score 0.9071\u21920.9071 checks 48\u219249 hard_pass 38\u219239 (machine-checked + Oracle pass; not novel discovery). | oracle=PASS fitness_credit=True kills=[]", "themes": ["New algebraic points on covers of elliptic curves", "The Sociolinguistics of Machine Identity: LLM Personality an", "Fast Solution Methods for the Classical 0\u20131 Knapsack Problem", "Digital-Twin-Driven Predictive Maintenance and Fault-Toleran"]}
{"ts": "2026-10-07T23:13:51Z", "decision": "revert", "before_score": 0.9071, "after_score": 0.9071, "delta": 0.0, "mutation": "easy_pad_assoc_add", "kind": "easy_pad", "note": "Reverted `easy_pad_assoc_add` (easy_pad): score 0.9071\u21920.9229 ok=True hard_pass 39\u219239 \u2014 Oracle/hard-tier required for keep; easy pads die on Oracle. | oracle=KILL fitness_credit=False kills=['stripped:easy_pad_baseline_already_useful', 'held_out:easy_pad_dies_on_held_out', 'cas:easy_pad_fails_cas_usefulness', 'easy_pad_oracle_kill', 'collective_kill']", "themes": ["New algebraic points on covers of elliptic curves", "The Sociolinguistics of Machine Identity: LLM Personality an", "Fast Solution Methods for the Classical 0\u20131 Knapsack Problem", "Digital-Twin-Driven Predictive Maintenance and Fault-Toleran"]}
{"ts": "2026-10-07T23:14:19Z", "decision": "keep", "before_score": 0.9071, "after_score": 0.9071, "delta": 0.0, "mutation": "authored_euler_totient_multiplicative__hermite_recurrence_w1", "kind": "hard_enable", "note": "Kept `authored_euler_totient_multiplicative__hermite_recurrence_w1` (hard_enable): lemma score 0.9071\u21920.9071 checks 49\u219250 hard_pass 39\u219240 (machine-checked + Oracle pass; not novel discovery). | oracle=PASS fitness_credit=True kills=[]", "themes": ["New algebraic points on covers of elliptic curves", "The Sociolinguistics of Machine Identity: LLM Personality an", "Fast Solution Methods for the Classical 0\u20131 Knapsack Problem", "Digital-Twin-Driven Predictive Maintenance and Fault-Toleran"]}
{"ts": "2026-10-07T23:14:34Z", "decision": "revert", "before_score": 0.9071, "after_score": 0.9071, "delta": 0.0, "mutation": "easy_pad_assoc_add", "kind": "easy_pad", "note": "Reverted `easy_pad_assoc_add` (easy_pad): score 0.9071\u21920.9229 ok=True hard_pass 40\u219240 \u2014 Oracle/hard-tier required for keep; easy pads die on Oracle. | oracle=KILL fitness_credit=False kills=['stripped:easy_pad_baseline_already_useful', 'held_out:easy_pad_dies_on_held_out', 'cas:easy_pad_fails_cas_usefulness', 'easy_pad_oracle_kill', 'collective_kill']", "themes": ["New algebraic points on covers of elliptic curves", "The Sociolinguistics of Machine Identity: LLM Personality an", "Fast Solution Methods for the Classical 0\u20131 Knapsack Problem", "Digital-Twin-Driven Predictive Maintenance and Fault-Toleran"]}
{"ts": "2026-10-08T01:11:46Z", "decision": "keep", "before_score": 0.9071, "after_score": 0.9071, "delta": 0.0, "mutation": "authored_fibonacci_addition__gcd_fibonacci_w1", "kind": "hard_enable", "note": "Kept `authored_fibonacci_addition__gcd_fibonacci_w1` (hard_enable): lemma score 0.9071\u21920.9071 checks 50\u219251 hard_pass 40\u219241 (machine-checked + Oracle pass; not novel discovery). | oracle=PASS fitness_credit=True kills=[]", "themes": ["Paper: Towards Looped Models Done Right, Part II: Rethinking", "The Sociolinguistics of Machine Identity: LLM Personality an", "Fast Solution Methods for the Classical 0\u20131 Knapsack Problem", "Digital-Twin-Driven Predictive Maintenance and Fault-Toleran"]}
{"ts": "2026-10-08T01:12:48Z", "decision": "revert", "before_score": 0.9071, "after_score": 0.9071, "delta": 0.0, "mutation": "easy_pad_assoc_add", "kind": "easy_pad", "note": "Reverted `easy_pad_assoc_add` (easy_pad): score 0.9071\u21920.9229 ok=True hard_pass 41\u219241 \u2014 Oracle/hard-tier required for keep; easy pads die on Oracle. | oracle=KILL fitness_credit=False kills=['stripped:easy_pad_baseline_already_useful', 'held_out:easy_pad_dies_on_held_out', 'cas:easy_pad_fails_cas_usefulness', 'easy_pad_oracle_kill', 'collective_kill']", "themes": ["AI Safety via Debate", "The Sociolinguistics of Machine Identity: LLM Personality an", "Fast Solution Methods for the Classical 0\u20131 Knapsack Problem", "Digital-Twin-Driven Predictive Maintenance and Fault-Toleran"]}
{"ts": "2026-10-08T01:13:45Z", "decision": "keep", "before_score": 0.9071, "after_score": 0.9071, "delta": 0.0, "mutation": "authored_geometric_sum__hockey_stick_w1", "kind": "hard_enable", "note": "Kept `authored_geometric_sum__hockey_stick_w1` (hard_enable): lemma score 0.9071\u21920.9071 checks 51\u219252 hard_pass 41\u219242 (machine-checked + Oracle pass; not novel discovery). | oracle=PASS fitness_credit=True kills=[]", "themes": ["AI Safety via Debate", "The Sociolinguistics of Machine Identity: LLM Personality an", "Fast Solution Methods for the Classical 0\u20131 Knapsack Problem", "Digital-Twin-Driven Predictive Maintenance and Fault-Toleran"]}
{"ts": "2026-10-08T01:16:12Z", "decision": "revert", "before_score": 0.9071, "after_score": 0.9071, "delta": 0.0, "mutation": "easy_pad_zero_identity", "kind": "easy_pad", "note": "Reverted `easy_pad_zero_identity` (easy_pad): score 0.9071\u21920.9229 ok=True hard_pass 42\u219242 \u2014 Oracle/hard-tier required for keep; easy pads die on Oracle. | oracle=KILL fitness_credit=False kills=['stripped:easy_pad_baseline_already_useful', 'held_out:easy_pad_dies_on_held_out', 'cas:easy_pad_fails_cas_usefulness', 'easy_pad_oracle_kill', 'collective_kill']", "themes": ["Paper: Towards Looped Models Done Right, Part II: Rethinking", "The Sociolinguistics of Machine Identity: LLM Personality an", "Fast Solution Methods for the Classical 0\u20131 Knapsack Problem", "Digital-Twin-Driven Predictive Maintenance and Fault-Toleran"]}
{"ts": "2026-10-08T01:17:01Z", "decision": "keep", "before_score": 0.9071, "after_score": 0.9071, "delta": 0.0, "mutation": "authored_motzkin_bounded__legendre_duplication_small_w1", "kind": "hard_enable", "note": "Kept `authored_motzkin_bounded__legendre_duplication_small_w1` (hard_enable): lemma score 0.9071\u21920.9071 checks 52\u219253 hard_pass 42\u219243 (machine-checked + Oracle pass; not novel discovery). | oracle=PASS fitness_credit=True kills=[]", "themes": ["AI Safety via Debate", "The Sociolinguistics of Machine Identity: LLM Personality an", "Fast Solution Methods for the Classical 0\u20131 Knapsack Problem", "Digital-Twin-Driven Predictive Maintenance and Fault-Toleran"]}
{"ts": "2026-10-08T01:17:40Z", "decision": "revert", "before_score": 0.9071, "after_score": 0.9071, "delta": 0.0, "mutation": "easy_pad_zero_identity", "kind": "easy_pad", "note": "Reverted `easy_pad_zero_identity` (easy_pad): score 0.9071\u21920.9229 ok=True hard_pass 43\u219243 \u2014 Oracle/hard-tier required for keep; easy pads die on Oracle. | oracle=KILL fitness_credit=False kills=['stripped:easy_pad_baseline_already_useful', 'held_out:easy_pad_dies_on_held_out', 'cas:easy_pad_fails_cas_usefulness', 'easy_pad_oracle_kill', 'collective_kill']", "themes": ["An $n^{0.3+\\varepsilon}$-Approximation for Steiner $k$-Fores", "The Sociolinguistics of Machine Identity: LLM Personality an", "Fast Solution Methods for the Classical 0\u20131 Knapsack Problem", "Digital-Twin-Driven Predictive Maintenance and Fault-Toleran"]}
{"ts": "2026-10-08T06:24:52Z", "decision": "keep", "before_score": 0.9071, "after_score": 0.9071, "delta": 0.0, "mutation": "authored_pascal_identity__narayana_sum_w1", "kind": "hard_enable", "note": "Kept `authored_pascal_identity__narayana_sum_w1` (hard_enable): lemma score 0.9071\u21920.9071 checks 53\u219254 hard_pass 43\u219244 (machine-checked + Oracle pass; not novel discovery). | oracle=PASS fitness_credit=True kills=[]", "themes": ["Why Forget-Only Unlearning Needs Memorization", "The Sociolinguistics of Machine Identity: LLM Personality an", "Fast Solution Methods for the Classical 0\u20131 Knapsack Problem", "Digital-Twin-Driven Predictive Maintenance and Fault-Toleran"]}
{"ts": "2026-10-08T06:25:29Z", "decision": "revert", "before_score": 0.9071, "after_score": 0.9071, "delta": 0.0, "mutation": "easy_pad_zero_identity", "kind": "easy_pad", "note": "Reverted `easy_pad_zero_identity` (easy_pad): score 0.9071\u21920.9229 ok=True hard_pass 44\u219244 \u2014 Oracle/hard-tier required for keep; easy pads die on Oracle. | oracle=KILL fitness_credit=False kills=['stripped:easy_pad_baseline_already_useful', 'held_out:easy_pad_dies_on_held_out', 'cas:easy_pad_fails_cas_usefulness', 'easy_pad_oracle_kill', 'collective_kill']", "themes": ["Why Forget-Only Unlearning Needs Memorization", "The Sociolinguistics of Machine Identity: LLM Personality an", "Fast Solution Methods for the Classical 0\u20131 Knapsack Problem", "Digital-Twin-Driven Predictive Maintenance and Fault-Toleran"]}
{"ts": "2026-10-08T06:26:06Z", "decision": "keep", "before_score": 0.9071, "after_score": 0.9071, "delta": 0.0, "mutation": "authored_oeis_a000984__central_binom_bound", "kind": "hard_enable", "note": "Kept `authored_oeis_a000984__central_binom_bound` (hard_enable): lemma score 0.9071\u21920.9071 checks 54\u219255 hard_pass 44\u219245 (machine-checked + Oracle pass; not novel discovery). | oracle=PASS fitness_credit=True kills=[]", "themes": ["Why Forget-Only Unlearning Needs Memorization", "The Sociolinguistics of Machine Identity: LLM Personality an", "Fast Solution Methods for the Classical 0\u20131 Knapsack Problem", "Digital-Twin-Driven Predictive Maintenance and Fault-Toleran"]}
{"ts": "2026-10-08T07:26:42Z", "decision": "revert", "before_score": 0.9071, "after_score": 0.9071, "delta": 0.0, "mutation": "easy_pad_square_again", "kind": "easy_pad", "note": "Reverted `easy_pad_square_again` (easy_pad): score 0.9071\u21920.9229 ok=True hard_pass 45\u219245 \u2014 Oracle/hard-tier required for keep; easy pads die on Oracle. | oracle=KILL fitness_credit=False kills=['stripped:easy_pad_baseline_already_useful', 'held_out:easy_pad_dies_on_held_out', 'cas:easy_pad_fails_cas_usefulness', 'easy_pad_oracle_kill', 'collective_kill'] | novelty_gate novel=False kills=['already_in_lesson_ledger_or_history', 'textbook_reuse=1.0', 'stripped_baseline_does_not_fail_usefulness', 'held_out:easy_pad_fails_held_out_harder', \"oracle_kill:['stripped:easy_pad_baseline_already_useful', 'held_out:easy_pad_dies_on_held_out', 'cas:easy_pad_fails_cas_usefulness', 'easy_pad_oracle_kill', 'collective_kill']\"]", "themes": ["Why Forget-Only Unlearning Needs Memorization", "The Sociolinguistics of Machine Identity: LLM Personality an", "Fast Solution Methods for the Classical 0\u20131 Knapsack Problem", "Digital-Twin-Driven Predictive Maintenance and Fault-Toleran"]}
{"ts": "2026-10-08T07:27:15Z", "decision": "keep", "before_score": 0.9071, "after_score": 0.9071, "delta": 0.0, "mutation": "authored_pell_companion__pythagorean_generation_w1", "kind": "hard_enable", "note": "Kept `authored_pell_companion__pythagorean_generation_w1` (hard_enable): lemma score 0.9071\u21920.9071 checks 55\u219256 hard_pass 45\u219246 (machine-checked + Oracle pass; not novel discovery). | oracle=PASS fitness_credit=True kills=[] | novelty_gate novel=True kills=[]", "themes": ["Why Forget-Only Unlearning Needs Memorization", "The Sociolinguistics of Machine Identity: LLM Personality an", "Fast Solution Methods for the Classical 0\u20131 Knapsack Problem", "Digital-Twin-Driven Predictive Maintenance and Fault-Toleran"]}
{"ts": "2026-10-08T07:27:47Z", "decision": "revert", "before_score": 0.9071, "after_score": 0.9071, "delta": 0.0, "mutation": "easy_pad_square_again", "kind": "easy_pad", "note": "Reverted `easy_pad_square_again` (easy_pad): score 0.9071\u21920.9229 ok=True hard_pass 46\u219246 \u2014 Oracle/hard-tier required for keep; easy pads die on Oracle. | oracle=KILL fitness_credit=False kills=['stripped:easy_pad_baseline_already_useful', 'held_out:easy_pad_dies_on_held_out', 'cas:easy_pad_fails_cas_usefulness', 'easy_pad_oracle_kill', 'collective_kill'] | novelty_gate novel=False kills=['already_in_lesson_ledger_or_history', 'textbook_reuse=1.0', 'stripped_baseline_does_not_fail_usefulness', 'held_out:easy_pad_fails_held_out_harder', \"oracle_kill:['stripped:easy_pad_baseline_already_useful', 'held_out:easy_pad_dies_on_held_out', 'cas:easy_pad_fails_cas_usefulness', 'easy_pad_oracle_kill', 'collective_kill']\"]", "themes": ["Why Forget-Only Unlearning Needs Memorization", "The Sociolinguistics of Machine Identity: LLM Personality an", "Fast Solution Methods for the Classical 0\u20131 Knapsack Problem", "Digital-Twin-Driven Predictive Maintenance and Fault-Toleran"]}
{"ts": "2026-10-08T07:42:55Z", "decision": "keep", "before_score": 0.9071, "after_score": 0.9071, "delta": 0.0, "mutation": "authored_sum_first_n_cubes__stirling_second_row_w1", "kind": "hard_enable", "note": "Kept `authored_sum_first_n_cubes__stirling_second_row_w1` (hard_enable): lemma score 0.9071\u21920.9071 checks 56\u219257 hard_pass 46\u219247 (machine-checked + Oracle pass; not novel discovery). | oracle=PASS fitness_credit=True kills=[] | novelty_gate novel=True kills=[]", "themes": ["Why Forget-Only Unlearning Needs Memorization", "The Sociolinguistics of Machine Identity: LLM Personality an", "Fast Solution Methods for the Classical 0\u20131 Knapsack Problem", "Digital-Twin-Driven Predictive Maintenance and Fault-Toleran"]}
{"ts": "2026-10-08T07:43:35Z", "decision": "revert", "before_score": 0.9071, "after_score": 0.9071, "delta": 0.0, "mutation": "easy_pad_square_again", "kind": "easy_pad", "note": "Reverted `easy_pad_square_again` (easy_pad): score 0.9071\u21920.9229 ok=True hard_pass 47\u219247 \u2014 Oracle/hard-tier required for keep; easy pads die on Oracle. | oracle=KILL fitness_credit=False kills=['stripped:easy_pad_baseline_already_useful', 'held_out:easy_pad_dies_on_held_out', 'cas:easy_pad_fails_cas_usefulness', 'easy_pad_oracle_kill', 'collective_kill'] | novelty_gate novel=False kills=['already_in_lesson_ledger_or_history', 'textbook_reuse=1.0', 'stripped_baseline_does_not_fail_usefulness', 'held_out:easy_pad_fails_held_out_harder', \"oracle_kill:['stripped:easy_pad_baseline_already_useful', 'held_out:easy_pad_dies_on_held_out', 'cas:easy_pad_fails_cas_usefulness', 'easy_pad_oracle_kill', 'collective_kill']\"]", "themes": ["Why Forget-Only Unlearning Needs Memorization", "The Sociolinguistics of Machine Identity: LLM Personality an", "Fast Solution Methods for the Classical 0\u20131 Knapsack Problem", "Digital-Twin-Driven Predictive Maintenance and Fault-Toleran"]}
{"ts": "2026-10-08T07:44:14Z", "decision": "keep", "before_score": 0.9071, "after_score": 0.9071, "delta": 0.0, "mutation": "authored_sum_first_n_odds__vandermonde_conv_w1", "kind": "hard_enable", "note": "Kept `authored_sum_first_n_odds__vandermonde_conv_w1` (hard_enable): lemma score 0.9071\u21920.9071 checks 57\u219258 hard_pass 47\u219248 (machine-checked + Oracle pass; not novel discovery). | oracle=PASS fitness_credit=True kills=[] | novelty_gate novel=False kills=['textbook_reuse=0.6667']", "themes": ["Why Forget-Only Unlearning Needs Memorization", "The Sociolinguistics of Machine Identity: LLM Personality an", "Fast Solution Methods for the Classical 0\u20131 Knapsack Problem", "Digital-Twin-Driven Predictive Maintenance and Fault-Toleran"]}
{"ts": "2026-10-08T07:46:38Z", "decision": "revert", "before_score": 0.9071, "after_score": 0.9071, "delta": 0.0, "mutation": "easy_pad_diff_squares", "kind": "easy_pad", "note": "Reverted `easy_pad_diff_squares` (easy_pad): score 0.9071\u21920.9229 ok=True hard_pass 48\u219248 \u2014 Oracle/hard-tier required for keep; easy pads die on Oracle. | oracle=KILL fitness_credit=False kills=['stripped:easy_pad_baseline_already_useful', 'held_out:easy_pad_dies_on_held_out', 'cas:easy_pad_fails_cas_usefulness', 'easy_pad_oracle_kill', 'collective_kill'] | novelty_gate novel=False kills=['already_in_lesson_ledger_or_history', 'textbook_reuse=1.0', 'stripped_baseline_does_not_fail_usefulness', 'held_out:easy_pad_fails_held_out_harder', \"oracle_kill:['stripped:easy_pad_baseline_already_useful', 'held_out:easy_pad_dies_on_held_out', 'cas:easy_pad_fails_cas_usefulness', 'easy_pad_oracle_kill', 'collective_kill']\"]", "themes": ["Why Forget-Only Unlearning Needs Memorization", "The Sociolinguistics of Machine Identity: LLM Personality an", "Fast Solution Methods for the Classical 0\u20131 Knapsack Problem", "Digital-Twin-Driven Predictive Maintenance and Fault-Toleran"]}
{"ts": "2026-10-08T07:47:18Z", "decision": "keep", "before_score": 0.9071, "after_score": 0.9071, "delta": 0.0, "mutation": "authored_bell_triangle_recurrence__hermite_recurrence_w1", "kind": "hard_enable", "note": "Kept `authored_bell_triangle_recurrence__hermite_recurrence_w1` (hard_enable): lemma score 0.9071\u21920.9071 checks 58\u219259 hard_pass 48\u219249 (machine-checked + Oracle pass; not novel discovery). | oracle=PASS fitness_credit=True kills=[] | novelty_gate novel=True kills=[]", "themes": ["Why Forget-Only Unlearning Needs Memorization", "The Sociolinguistics of Machine Identity: LLM Personality an", "Fast Solution Methods for the Classical 0\u20131 Knapsack Problem", "Digital-Twin-Driven Predictive Maintenance and Fault-Toleran"]}
{"ts": "2026-10-08T07:47:59Z", "decision": "revert", "before_score": 0.9071, "after_score": 0.9071, "delta": 0.0, "mutation": "easy_pad_commutativity", "kind": "easy_pad", "note": "Reverted `easy_pad_commutativity` (easy_pad): score 0.9071\u21920.9229 ok=True hard_pass 49\u219249 \u2014 Oracle/hard-tier required for keep; easy pads die on Oracle. | oracle=KILL fitness_credit=False kills=['stripped:easy_pad_baseline_already_useful', 'held_out:easy_pad_dies_on_held_out', 'cas:easy_pad_fails_cas_usefulness', 'easy_pad_oracle_kill', 'collective_kill'] | novelty_gate novel=False kills=['already_in_lesson_ledger_or_history', 'textbook_reuse=1.0', 'stripped_baseline_does_not_fail_usefulness', 'held_out:easy_pad_fails_held_out_harder', \"oracle_kill:['stripped:easy_pad_baseline_already_useful', 'held_out:easy_pad_dies_on_held_out', 'cas:easy_pad_fails_cas_usefulness', 'easy_pad_oracle_kill', 'collective_kill']\"]", "themes": ["Why Forget-Only Unlearning Needs Memorization", "The Sociolinguistics of Machine Identity: LLM Personality an", "Fast Solution Methods for the Classical 0\u20131 Knapsack Problem", "Digital-Twin-Driven Predictive Maintenance and Fault-Toleran"]}
