{"ts": "2026-10-03T16:34:50Z", "decision": "skip", "before_score": 0.825, "after_score": 0.825, "delta": 0.0, "mutation": "", "kind": "", "note": "No pending hard-tier lemma mutations (catalog exhausted or empty).", "themes": ["TACO: Ternary Absolute-max Column-wise One-sparse Optimizer ", "FERPO: Forward Entropy-Regularized Policy Optimization", "The Sociolinguistics of Machine Identity: LLM Personality an", "Fast Solution Methods for the Classical 0\u20131 Knapsack Problem"]}
{"ts": "2026-10-03T21:36:02Z", "decision": "skip", "before_score": 0.825, "after_score": 0.825, "delta": 0.0, "mutation": "", "kind": "", "note": "No pending hard-tier lemma mutations (catalog exhausted or empty).", "themes": ["TACO: Ternary Absolute-max Column-wise One-sparse Optimizer ", "FERPO: Forward Entropy-Regularized Policy Optimization", "The Sociolinguistics of Machine Identity: LLM Personality an", "Fast Solution Methods for the Classical 0\u20131 Knapsack Problem"]}
{"ts": "2026-10-03T21:36:41Z", "decision": "skip", "before_score": 0.825, "after_score": 0.825, "delta": 0.0, "mutation": "", "kind": "", "note": "No pending hard-tier lemma mutations (catalog exhausted or empty).", "themes": ["TACO: Ternary Absolute-max Column-wise One-sparse Optimizer ", "FERPO: Forward Entropy-Regularized Policy Optimization", "The Sociolinguistics of Machine Identity: LLM Personality an", "Fast Solution Methods for the Classical 0\u20131 Knapsack Problem"]}
{"ts": "2026-10-03T21:37:08Z", "decision": "skip", "before_score": 0.825, "after_score": 0.825, "delta": 0.0, "mutation": "", "kind": "", "note": "No pending hard-tier lemma mutations (catalog exhausted or empty).", "themes": ["TACO: Ternary Absolute-max Column-wise One-sparse Optimizer ", "FERPO: Forward Entropy-Regularized Policy Optimization", "The Sociolinguistics of Machine Identity: LLM Personality an", "Fast Solution Methods for the Classical 0\u20131 Knapsack Problem"]}
{"ts": "2026-10-04T06:07:33Z", "decision": "skip", "before_score": 0.825, "after_score": 0.825, "delta": 0.0, "mutation": "", "kind": "", "note": "No pending hard-tier lemma mutations (catalog exhausted or empty).", "themes": ["TACO: Ternary Absolute-max Column-wise One-sparse Optimizer ", "FERPO: Forward Entropy-Regularized Policy Optimization", "The Sociolinguistics of Machine Identity: LLM Personality an", "Fast Solution Methods for the Classical 0\u20131 Knapsack Problem"]}
{"ts": "2026-10-04T06:07:59Z", "decision": "skip", "before_score": 0.825, "after_score": 0.825, "delta": 0.0, "mutation": "", "kind": "", "note": "No pending hard-tier lemma mutations (catalog exhausted or empty).", "themes": ["TACO: Ternary Absolute-max Column-wise One-sparse Optimizer ", "FERPO: Forward Entropy-Regularized Policy Optimization", "The Sociolinguistics of Machine Identity: LLM Personality an", "Fast Solution Methods for the Classical 0\u20131 Knapsack Problem"]}
{"ts": "2026-10-04T06:08:37Z", "decision": "skip", "before_score": 0.825, "after_score": 0.825, "delta": 0.0, "mutation": "", "kind": "", "note": "No pending hard-tier lemma mutations (catalog exhausted or empty).", "themes": ["TACO: Ternary Absolute-max Column-wise One-sparse Optimizer ", "FERPO: Forward Entropy-Regularized Policy Optimization", "The Sociolinguistics of Machine Identity: LLM Personality an", "Fast Solution Methods for the Classical 0\u20131 Knapsack Problem"]}
{"ts": "2026-10-04T12:40:08Z", "decision": "skip", "before_score": 0.825, "after_score": 0.825, "delta": 0.0, "mutation": "", "kind": "", "note": "No pending hard-tier lemma mutations (catalog exhausted or empty).", "themes": ["TACO: Ternary Absolute-max Column-wise One-sparse Optimizer ", "FERPO: Forward Entropy-Regularized Policy Optimization", "The Sociolinguistics of Machine Identity: LLM Personality an", "Fast Solution Methods for the Classical 0\u20131 Knapsack Problem"]}
{"ts": "2026-10-04T12:40:45Z", "decision": "skip", "before_score": 0.825, "after_score": 0.825, "delta": 0.0, "mutation": "", "kind": "", "note": "No pending hard-tier lemma mutations (catalog exhausted or empty).", "themes": ["TACO: Ternary Absolute-max Column-wise One-sparse Optimizer ", "FERPO: Forward Entropy-Regularized Policy Optimization", "The Sociolinguistics of Machine Identity: LLM Personality an", "Fast Solution Methods for the Classical 0\u20131 Knapsack Problem"]}
{"ts": "2026-10-04T12:41:24Z", "decision": "skip", "before_score": 0.825, "after_score": 0.825, "delta": 0.0, "mutation": "", "kind": "", "note": "No pending hard-tier lemma mutations (catalog exhausted or empty).", "themes": ["TACO: Ternary Absolute-max Column-wise One-sparse Optimizer ", "FERPO: Forward Entropy-Regularized Policy Optimization", "The Sociolinguistics of Machine Identity: LLM Personality an", "Fast Solution Methods for the Classical 0\u20131 Knapsack Problem"]}
{"ts": "2026-10-04T21:43:31Z", "decision": "skip", "before_score": 0.825, "after_score": 0.825, "delta": 0.0, "mutation": "", "kind": "", "note": "No pending hard-tier lemma mutations (catalog exhausted or empty).", "themes": ["TACO: Ternary Absolute-max Column-wise One-sparse Optimizer ", "FERPO: Forward Entropy-Regularized Policy Optimization", "The Sociolinguistics of Machine Identity: LLM Personality an", "Fast Solution Methods for the Classical 0\u20131 Knapsack Problem"]}
{"ts": "2026-10-04T21:44:09Z", "decision": "skip", "before_score": 0.825, "after_score": 0.825, "delta": 0.0, "mutation": "", "kind": "", "note": "No pending hard-tier lemma mutations (catalog exhausted or empty).", "themes": ["TACO: Ternary Absolute-max Column-wise One-sparse Optimizer ", "FERPO: Forward Entropy-Regularized Policy Optimization", "The Sociolinguistics of Machine Identity: LLM Personality an", "Fast Solution Methods for the Classical 0\u20131 Knapsack Problem"]}
{"ts": "2026-10-04T21:44:34Z", "decision": "skip", "before_score": 0.825, "after_score": 0.825, "delta": 0.0, "mutation": "", "kind": "", "note": "No pending hard-tier lemma mutations (catalog exhausted or empty).", "themes": ["TACO: Ternary Absolute-max Column-wise One-sparse Optimizer ", "FERPO: Forward Entropy-Regularized Policy Optimization", "The Sociolinguistics of Machine Identity: LLM Personality an", "Fast Solution Methods for the Classical 0\u20131 Knapsack Problem"]}
{"ts": "2026-10-05T05:59:44Z", "decision": "skip", "before_score": 0.825, "after_score": 0.825, "delta": 0.0, "mutation": "", "kind": "", "note": "No pending hard-tier lemma mutations (catalog exhausted or empty).", "themes": ["Quantitative Gowers uniformity of the primes in intervals of", "Non-isomorphic graphs have distinct vertex-Ramsey classes", "The Sociolinguistics of Machine Identity: LLM Personality an", "Fast Solution Methods for the Classical 0\u20131 Knapsack Problem"]}
{"ts": "2026-10-05T06:00:21Z", "decision": "skip", "before_score": 0.825, "after_score": 0.825, "delta": 0.0, "mutation": "", "kind": "", "note": "No pending hard-tier lemma mutations (catalog exhausted or empty).", "themes": ["Quantitative Gowers uniformity of the primes in intervals of", "Non-isomorphic graphs have distinct vertex-Ramsey classes", "The Sociolinguistics of Machine Identity: LLM Personality an", "Fast Solution Methods for the Classical 0\u20131 Knapsack Problem"]}
{"ts": "2026-10-05T06:00:45Z", "decision": "skip", "before_score": 0.825, "after_score": 0.825, "delta": 0.0, "mutation": "", "kind": "", "note": "No pending hard-tier lemma mutations (catalog exhausted or empty).", "themes": ["Quantitative Gowers uniformity of the primes in intervals of", "Non-isomorphic graphs have distinct vertex-Ramsey classes", "The Sociolinguistics of Machine Identity: LLM Personality an", "Fast Solution Methods for the Classical 0\u20131 Knapsack Problem"]}
{"ts": "2026-10-05T15:04:46Z", "decision": "skip", "before_score": 0.825, "after_score": 0.825, "delta": 0.0, "mutation": "", "kind": "", "note": "No pending hard-tier lemma mutations (catalog exhausted or empty).", "themes": ["Quantitative Gowers uniformity of the primes in intervals of", "Non-isomorphic graphs have distinct vertex-Ramsey classes", "The Sociolinguistics of Machine Identity: LLM Personality an", "Fast Solution Methods for the Classical 0\u20131 Knapsack Problem"]}
{"ts": "2026-10-05T15:05:28Z", "decision": "skip", "before_score": 0.825, "after_score": 0.825, "delta": 0.0, "mutation": "", "kind": "", "note": "No pending hard-tier lemma mutations (catalog exhausted or empty).", "themes": ["Quantitative Gowers uniformity of the primes in intervals of", "Non-isomorphic graphs have distinct vertex-Ramsey classes", "The Sociolinguistics of Machine Identity: LLM Personality an", "Fast Solution Methods for the Classical 0\u20131 Knapsack Problem"]}
{"ts": "2026-10-05T15:06:10Z", "decision": "skip", "before_score": 0.825, "after_score": 0.825, "delta": 0.0, "mutation": "", "kind": "", "note": "No pending hard-tier lemma mutations (catalog exhausted or empty).", "themes": ["Quantitative Gowers uniformity of the primes in intervals of", "Non-isomorphic graphs have distinct vertex-Ramsey classes", "The Sociolinguistics of Machine Identity: LLM Personality an", "Fast Solution Methods for the Classical 0\u20131 Knapsack Problem"]}
{"ts": "2026-10-06T00:13:04Z", "decision": "skip", "before_score": 0.825, "after_score": 0.825, "delta": 0.0, "mutation": "", "kind": "", "note": "No pending hard-tier lemma mutations (catalog exhausted or empty).", "themes": ["Quantitative Gowers uniformity of the primes in intervals of", "Non-isomorphic graphs have distinct vertex-Ramsey classes", "The Sociolinguistics of Machine Identity: LLM Personality an", "Fast Solution Methods for the Classical 0\u20131 Knapsack Problem"]}
{"ts": "2026-10-06T00:13:33Z", "decision": "skip", "before_score": 0.825, "after_score": 0.825, "delta": 0.0, "mutation": "", "kind": "", "note": "No pending hard-tier lemma mutations (catalog exhausted or empty).", "themes": ["Quantitative Gowers uniformity of the primes in intervals of", "Non-isomorphic graphs have distinct vertex-Ramsey classes", "The Sociolinguistics of Machine Identity: LLM Personality an", "Fast Solution Methods for the Classical 0\u20131 Knapsack Problem"]}
{"ts": "2026-10-06T00:14:13Z", "decision": "skip", "before_score": 0.825, "after_score": 0.825, "delta": 0.0, "mutation": "", "kind": "", "note": "No pending hard-tier lemma mutations (catalog exhausted or empty).", "themes": ["Quantitative Gowers uniformity of the primes in intervals of", "Non-isomorphic graphs have distinct vertex-Ramsey classes", "The Sociolinguistics of Machine Identity: LLM Personality an", "Fast Solution Methods for the Classical 0\u20131 Knapsack Problem"]}
{"ts": "2026-10-06T06:38:15Z", "decision": "skip", "before_score": 0.825, "after_score": 0.825, "delta": 0.0, "mutation": "", "kind": "", "note": "No pending hard-tier lemma mutations (catalog exhausted or empty).", "themes": ["Direct Intermediate Initialization for Tilted Diffusion Samp", "Towards Looped Models Done Right, Part II: Rethinking at Fix", "The Sociolinguistics of Machine Identity: LLM Personality an", "Fast Solution Methods for the Classical 0\u20131 Knapsack Problem"]}
{"ts": "2026-10-06T06:38:58Z", "decision": "skip", "before_score": 0.825, "after_score": 0.825, "delta": 0.0, "mutation": "", "kind": "", "note": "No pending hard-tier lemma mutations (catalog exhausted or empty).", "themes": ["Direct Intermediate Initialization for Tilted Diffusion Samp", "Towards Looped Models Done Right, Part II: Rethinking at Fix", "The Sociolinguistics of Machine Identity: LLM Personality an", "Fast Solution Methods for the Classical 0\u20131 Knapsack Problem"]}
{"ts": "2026-10-06T06:39:40Z", "decision": "skip", "before_score": 0.825, "after_score": 0.825, "delta": 0.0, "mutation": "", "kind": "", "note": "No pending hard-tier lemma mutations (catalog exhausted or empty).", "themes": ["Direct Intermediate Initialization for Tilted Diffusion Samp", "Towards Looped Models Done Right, Part II: Rethinking at Fix", "The Sociolinguistics of Machine Identity: LLM Personality an", "Fast Solution Methods for the Classical 0\u20131 Knapsack Problem"]}
{"ts": "2026-10-06T14:33:04Z", "decision": "keep", "before_score": 0.8771, "after_score": 0.8871, "delta": 0.01, "mutation": "vandermonde_asymmetric", "kind": "hard_enable", "note": "Kept `vandermonde_asymmetric` (hard_enable): lemma score 0.8771\u21920.8871 checks 35\u219236 hard_pass 25\u219226 (machine-checked + Oracle pass; not novel discovery). | oracle=PASS fitness_credit=True kills=[]", "themes": ["Attention Is All You Need", "G\u00f6del Machines: Fully Self-Referential Optimal Universal Sel", "Reflexion: Language Agents with Verbal Reinforcement Learnin", "Darwin G\u00f6del Machine: Open-Ended Evolution of Self-Improving"]}
{"ts": "2026-10-06T18:31:23Z", "decision": "keep", "before_score": 0.8871, "after_score": 0.8971, "delta": 0.01, "mutation": "binomial_hockey_deep", "kind": "hard_enable", "note": "Kept `binomial_hockey_deep` (hard_enable): lemma score 0.8871\u21920.8971 checks 36\u219237 hard_pass 26\u219227 (machine-checked + Oracle pass; not novel discovery). | oracle=PASS fitness_credit=True kills=[]", "themes": ["Towards Looped Models Done Right, Part II: Rethinking at Fix", "The Sociolinguistics of Machine Identity: LLM Personality an", "Fast Solution Methods for the Classical 0\u20131 Knapsack Problem", "Digital-Twin-Driven Predictive Maintenance and Fault-Toleran"]}
{"ts": "2026-10-06T18:32:05Z", "decision": "keep", "before_score": 0.8971, "after_score": 0.9071, "delta": 0.01, "mutation": "fibonacci_cassini_ext", "kind": "hard_enable", "note": "Kept `fibonacci_cassini_ext` (hard_enable): lemma score 0.8971\u21920.9071 checks 37\u219238 hard_pass 27\u219228 (machine-checked + Oracle pass; not novel discovery). | oracle=PASS fitness_credit=True kills=[]", "themes": ["Towards Looped Models Done Right, Part II: Rethinking at Fix", "The Sociolinguistics of Machine Identity: LLM Personality an", "Fast Solution Methods for the Classical 0\u20131 Knapsack Problem", "Digital-Twin-Driven Predictive Maintenance and Fault-Toleran"]}
{"ts": "2026-10-06T18:32:48Z", "decision": "keep", "before_score": 0.9071, "after_score": 0.9071, "delta": 0.0, "mutation": "derived_chain_stress", "kind": "hard_enable", "note": "Kept `derived_chain_stress` (hard_enable): lemma score 0.9071\u21920.9071 checks 38\u219239 hard_pass 28\u219229 (machine-checked + Oracle pass; not novel discovery). | oracle=PASS fitness_credit=True kills=[]", "themes": ["Towards Looped Models Done Right, Part II: Rethinking at Fix", "The Sociolinguistics of Machine Identity: LLM Personality an", "Fast Solution Methods for the Classical 0\u20131 Knapsack Problem", "Digital-Twin-Driven Predictive Maintenance and Fault-Toleran"]}
{"ts": "2026-10-07T09:03:44Z", "decision": "skip", "before_score": 0.825, "after_score": 0.825, "delta": 0.0, "mutation": "", "kind": "", "note": "No pending hard-tier lemma mutations (catalog exhausted or empty).", "themes": ["New algebraic points on covers of elliptic curves", "The Sociolinguistics of Machine Identity: LLM Personality an", "Fast Solution Methods for the Classical 0\u20131 Knapsack Problem", "Digital-Twin-Driven Predictive Maintenance and Fault-Toleran"]}
{"ts": "2026-10-07T09:04:25Z", "decision": "skip", "before_score": 0.825, "after_score": 0.825, "delta": 0.0, "mutation": "", "kind": "", "note": "No pending hard-tier lemma mutations (catalog exhausted or empty).", "themes": ["New algebraic points on covers of elliptic curves", "The Sociolinguistics of Machine Identity: LLM Personality an", "Fast Solution Methods for the Classical 0\u20131 Knapsack Problem", "Digital-Twin-Driven Predictive Maintenance and Fault-Toleran"]}
{"ts": "2026-10-07T09:04:54Z", "decision": "skip", "before_score": 0.825, "after_score": 0.825, "delta": 0.0, "mutation": "", "kind": "", "note": "No pending hard-tier lemma mutations (catalog exhausted or empty).", "themes": ["New algebraic points on covers of elliptic curves", "The Sociolinguistics of Machine Identity: LLM Personality an", "Fast Solution Methods for the Classical 0\u20131 Knapsack Problem", "Digital-Twin-Driven Predictive Maintenance and Fault-Toleran"]}
{"ts": "2026-10-07T11:25:47Z", "decision": "skip", "before_score": 0.825, "after_score": 0.825, "delta": 0.0, "mutation": "", "kind": "", "note": "No pending hard-tier lemma mutations (catalog exhausted or empty).", "themes": ["New algebraic points on covers of elliptic curves", "The Sociolinguistics of Machine Identity: LLM Personality an", "Fast Solution Methods for the Classical 0\u20131 Knapsack Problem", "Digital-Twin-Driven Predictive Maintenance and Fault-Toleran"]}
{"ts": "2026-10-07T11:25:59Z", "decision": "skip", "before_score": 0.825, "after_score": 0.825, "delta": 0.0, "mutation": "", "kind": "", "note": "No pending hard-tier lemma mutations (catalog exhausted or empty).", "themes": ["New algebraic points on covers of elliptic curves", "The Sociolinguistics of Machine Identity: LLM Personality an", "Fast Solution Methods for the Classical 0\u20131 Knapsack Problem", "Digital-Twin-Driven Predictive Maintenance and Fault-Toleran"]}
{"ts": "2026-10-07T11:26:23Z", "decision": "skip", "before_score": 0.825, "after_score": 0.825, "delta": 0.0, "mutation": "", "kind": "", "note": "No pending hard-tier lemma mutations (catalog exhausted or empty).", "themes": ["New algebraic points on covers of elliptic curves", "The Sociolinguistics of Machine Identity: LLM Personality an", "Fast Solution Methods for the Classical 0\u20131 Knapsack Problem", "Digital-Twin-Driven Predictive Maintenance and Fault-Toleran"]}
{"ts": "2026-10-07T11:27:22Z", "decision": "skip", "before_score": 0.825, "after_score": 0.825, "delta": 0.0, "mutation": "", "kind": "", "note": "No pending hard-tier lemma mutations (catalog exhausted or empty).", "themes": ["New algebraic points on covers of elliptic curves", "The Sociolinguistics of Machine Identity: LLM Personality an", "Fast Solution Methods for the Classical 0\u20131 Knapsack Problem", "Digital-Twin-Driven Predictive Maintenance and Fault-Toleran"]}
{"ts": "2026-10-07T11:28:04Z", "decision": "skip", "before_score": 0.825, "after_score": 0.825, "delta": 0.0, "mutation": "", "kind": "", "note": "No pending hard-tier lemma mutations (catalog exhausted or empty).", "themes": ["New algebraic points on covers of elliptic curves", "The Sociolinguistics of Machine Identity: LLM Personality an", "Fast Solution Methods for the Classical 0\u20131 Knapsack Problem", "Digital-Twin-Driven Predictive Maintenance and Fault-Toleran"]}
{"ts": "2026-10-07T11:28:46Z", "decision": "skip", "before_score": 0.825, "after_score": 0.825, "delta": 0.0, "mutation": "", "kind": "", "note": "No pending hard-tier lemma mutations (catalog exhausted or empty).", "themes": ["New algebraic points on covers of elliptic curves", "The Sociolinguistics of Machine Identity: LLM Personality an", "Fast Solution Methods for the Classical 0\u20131 Knapsack Problem", "Digital-Twin-Driven Predictive Maintenance and Fault-Toleran"]}
{"ts": "2026-10-07T11:30:19Z", "decision": "skip", "before_score": 0.825, "after_score": 0.825, "delta": 0.0, "mutation": "", "kind": "", "note": "No pending hard-tier lemma mutations (catalog exhausted or empty).", "themes": ["New algebraic points on covers of elliptic curves", "The Sociolinguistics of Machine Identity: LLM Personality an", "Fast Solution Methods for the Classical 0\u20131 Knapsack Problem", "Digital-Twin-Driven Predictive Maintenance and Fault-Toleran"]}
{"ts": "2026-10-07T11:31:01Z", "decision": "skip", "before_score": 0.825, "after_score": 0.825, "delta": 0.0, "mutation": "", "kind": "", "note": "No pending hard-tier lemma mutations (catalog exhausted or empty).", "themes": ["New algebraic points on covers of elliptic curves", "The Sociolinguistics of Machine Identity: LLM Personality an", "Fast Solution Methods for the Classical 0\u20131 Knapsack Problem", "Digital-Twin-Driven Predictive Maintenance and Fault-Toleran"]}
{"ts": "2026-10-07T11:31:43Z", "decision": "skip", "before_score": 0.825, "after_score": 0.825, "delta": 0.0, "mutation": "", "kind": "", "note": "No pending hard-tier lemma mutations (catalog exhausted or empty).", "themes": ["New algebraic points on covers of elliptic curves", "The Sociolinguistics of Machine Identity: LLM Personality an", "Fast Solution Methods for the Classical 0\u20131 Knapsack Problem", "Digital-Twin-Driven Predictive Maintenance and Fault-Toleran"]}
{"ts": "2026-10-07T11:34:35Z", "decision": "revert", "before_score": 0.825, "after_score": 0.825, "delta": 0.0, "mutation": "stem_easy_pad_units", "kind": "stem_easy_pad", "note": "Reverted `stem_easy_pad_units` (stem_easy_pad): score 0.825\u21920.825 ok=True hard_pass 4\u21924 \u2014 Oracle/hard-tier required for keep; easy pads die on Oracle. | oracle=KILL fitness_credit=False kills=['tentative_not_keep']", "themes": ["New algebraic points on covers of elliptic curves", "The Sociolinguistics of Machine Identity: LLM Personality an", "Fast Solution Methods for the Classical 0\u20131 Knapsack Problem", "Digital-Twin-Driven Predictive Maintenance and Fault-Toleran"]}
{"ts": "2026-10-07T11:35:17Z", "decision": "revert", "before_score": 0.825, "after_score": 0.825, "delta": 0.0, "mutation": "stem_easy_pad_units", "kind": "stem_easy_pad", "note": "Reverted `stem_easy_pad_units` (stem_easy_pad): score 0.825\u21920.825 ok=True hard_pass 4\u21924 \u2014 Oracle/hard-tier required for keep; easy pads die on Oracle. | oracle=KILL fitness_credit=False kills=['tentative_not_keep']", "themes": ["New algebraic points on covers of elliptic curves", "The Sociolinguistics of Machine Identity: LLM Personality an", "Fast Solution Methods for the Classical 0\u20131 Knapsack Problem", "Digital-Twin-Driven Predictive Maintenance and Fault-Toleran"]}
