{"ts": "2026-10-09T07:56:25Z", "decision": "keep", "before_score": 0.9071, "after_score": 0.9071, "delta": 0.0, "mutation": "authored_sum_first_n_cubes__vandermonde_conv_w1", "kind": "hard_enable", "note": "Kept `authored_sum_first_n_cubes__vandermonde_conv_w1` (hard_enable): lemma score 0.9071\u21920.9071 checks 68\u219269 hard_pass 58\u219259 (machine-checked + Oracle pass; not novel discovery). | oracle=PASS fitness_credit=True kills=[] | novelty_gate novel=False kills=['textbook_reuse=0.6667']", "themes": ["Bi-FORK: Generative Modeling of High-Dimensional Bifurcating", "The Sociolinguistics of Machine Identity: LLM Personality an", "Fast Solution Methods for the Classical 0\u20131 Knapsack Problem", "Digital-Twin-Driven Predictive Maintenance and Fault-Toleran"], "why_believe": {"components": ["check_sum_first_n_cubes", "check_vandermonde_convolution"], "ranges_tested": {"g0": {"n": [30, 44]}, "g1": {"m": [12, 17], "n": [12, 17], "r": "dependent"}}, "challenger": "Challenger not broken: 12169 probes (boundary 1024, far 5994, sample 5151, edge 0; seed 86150644478494) in 3.00s [budget hit]", "challenger_blocked": false, "seed": 86150644478494, "text": "Believe `authored_sum_first_n_cubes__vandermonde_conv_w1`: components check_sum_first_n_cubes, check_vandermonde_convolution; ranges tested {\"g0\": {\"n\": [30, 44]}, \"g1\": {\"m\": [12, 17], \"n\": [12, 17], \"r\": \"dependent\"}}; Challenger not broken: 12169 probes (boundary 1024, far 5994, sample 5151, edge 0; seed 86150644478494) in 3.00s [budget hit].", "generated_by": "colony.challenger", "free_text_from_feeds": false, "before_score": 0.9071, "after_score": 0.9071, "hard_pass_delta": 1}, "self_rejected": false}
{"ts": "2026-10-09T07:57:04Z", "decision": "skip", "before_score": 0.9071, "after_score": 0.9071, "delta": 0.0, "mutation": "", "kind": "", "note": "No pending hard-tier lemma mutations (catalog exhausted or empty). Cooled/blocked skipped: ['easy_pad_abs_identity', 'easy_pad_assoc_add', 'easy_pad_commutativity', 'easy_pad_diff_squares', 'easy_pad_square_again', 'easy_pad_zero_identity', 'stem_easy_pad_units', 'vandermonde_asymmetric']. Authored new disabled checks: ['authored_sum_first_n_odds__stirling_second_row_w1'].", "themes": ["Bi-FORK: Generative Modeling of High-Dimensional Bifurcating", "The Sociolinguistics of Machine Identity: LLM Personality an", "Fast Solution Methods for the Classical 0\u20131 Knapsack Problem", "Digital-Twin-Driven Predictive Maintenance and Fault-Toleran"]}
{"ts": "2026-10-09T07:57:42Z", "decision": "keep", "before_score": 0.9071, "after_score": 0.9071, "delta": 0.0, "mutation": "authored_sum_first_n_odds__stirling_second_row_w1", "kind": "hard_enable", "note": "Kept `authored_sum_first_n_odds__stirling_second_row_w1` (hard_enable): lemma score 0.9071\u21920.9071 checks 69\u219270 hard_pass 59\u219260 (machine-checked + Oracle pass; not novel discovery). | oracle=PASS fitness_credit=True kills=[] | novelty_gate novel=True kills=[]", "themes": ["Bi-FORK: Generative Modeling of High-Dimensional Bifurcating", "The Sociolinguistics of Machine Identity: LLM Personality an", "Fast Solution Methods for the Classical 0\u20131 Knapsack Problem", "Digital-Twin-Driven Predictive Maintenance and Fault-Toleran"], "why_believe": {"components": ["check_sum_first_n_odds", "check_stirling_second_row"], "ranges_tested": {"g0": {"n": [40, 59]}, "g1": {"n": [12, 16]}}, "challenger": "Challenger not broken: 52 probes (boundary 14, far 18, sample 20, edge 0; seed 223803734785304) in 0.04s", "challenger_blocked": false, "seed": 223803734785304, "text": "Believe `authored_sum_first_n_odds__stirling_second_row_w1`: components check_sum_first_n_odds, check_stirling_second_row; ranges tested {\"g0\": {\"n\": [40, 59]}, \"g1\": {\"n\": [12, 16]}}; Challenger not broken: 52 probes (boundary 14, far 18, sample 20, edge 0; seed 223803734785304) in 0.04s.", "generated_by": "colony.challenger", "free_text_from_feeds": false, "before_score": 0.9071, "after_score": 0.9071, "hard_pass_delta": 1}, "self_rejected": false}
{"ts": "2026-10-09T13:38:46Z", "decision": "skip", "before_score": 0.9071, "after_score": 0.9071, "delta": 0.0, "mutation": "", "kind": "", "note": "No pending hard-tier lemma mutations (catalog exhausted or empty). Cooled/blocked skipped: ['easy_pad_abs_identity', 'easy_pad_assoc_add', 'easy_pad_commutativity', 'easy_pad_diff_squares', 'easy_pad_square_again', 'easy_pad_zero_identity', 'stem_easy_pad_units', 'vandermonde_asymmetric']. Authored new disabled checks: ['authored_bell_triangle_recurrence__legendre_duplication_small_w1'].", "themes": ["Bi-FORK: Generative Modeling of High-Dimensional Bifurcating", "The Sociolinguistics of Machine Identity: LLM Personality an", "Fast Solution Methods for the Classical 0\u20131 Knapsack Problem", "Digital-Twin-Driven Predictive Maintenance and Fault-Toleran"]}
{"ts": "2026-10-09T13:39:28Z", "decision": "keep", "before_score": 0.9071, "after_score": 0.9071, "delta": 0.0, "mutation": "authored_bell_triangle_recurrence__legendre_duplication_small_w1", "kind": "hard_enable", "note": "Kept `authored_bell_triangle_recurrence__legendre_duplication_small_w1` (hard_enable): lemma score 0.9071\u21920.9071 checks 70\u219271 hard_pass 60\u219261 (machine-checked + Oracle pass; not novel discovery). | oracle=PASS fitness_credit=True kills=[] | novelty_gate novel=True kills=[]", "themes": ["Bi-FORK: Generative Modeling of High-Dimensional Bifurcating", "The Sociolinguistics of Machine Identity: LLM Personality an", "Fast Solution Methods for the Classical 0\u20131 Knapsack Problem", "Digital-Twin-Driven Predictive Maintenance and Fault-Toleran"], "why_believe": {"components": ["check_bell_triangle_recurrence", "check_legendre_duplication_small"], "ranges_tested": {"g0": {"n": [12, 17]}, "g1": {"n": [12, 17]}}, "challenger": "Challenger not broken: 52 probes (boundary 14, far 18, sample 20, edge 0; seed 11380745482553) in 0.09s", "challenger_blocked": false, "seed": 11380745482553, "text": "Believe `authored_bell_triangle_recurrence__legendre_duplication_small_w1`: components check_bell_triangle_recurrence, check_legendre_duplication_small; ranges tested {\"g0\": {\"n\": [12, 17]}, \"g1\": {\"n\": [12, 17]}}; Challenger not broken: 52 probes (boundary 14, far 18, sample 20, edge 0; seed 11380745482553) in 0.09s.", "generated_by": "colony.challenger", "free_text_from_feeds": false, "before_score": 0.9071, "after_score": 0.9071, "hard_pass_delta": 1}, "self_rejected": false}
{"ts": "2026-10-09T13:40:11Z", "decision": "skip", "before_score": 0.9071, "after_score": 0.9071, "delta": 0.0, "mutation": "", "kind": "", "note": "No pending hard-tier lemma mutations (catalog exhausted or empty). Cooled/blocked skipped: ['easy_pad_abs_identity', 'easy_pad_assoc_add', 'easy_pad_commutativity', 'easy_pad_diff_squares', 'easy_pad_square_again', 'easy_pad_zero_identity', 'stem_easy_pad_units', 'vandermonde_asymmetric']. Authored new disabled checks: ['authored_binomial_sum_row__binomial_inversion_small_w1'].", "themes": ["Bi-FORK: Generative Modeling of High-Dimensional Bifurcating", "The Sociolinguistics of Machine Identity: LLM Personality an", "Fast Solution Methods for the Classical 0\u20131 Knapsack Problem", "Digital-Twin-Driven Predictive Maintenance and Fault-Toleran"]}
{"ts": "2026-10-09T22:47:29Z", "decision": "keep", "before_score": 0.9071, "after_score": 0.9071, "delta": 0.0, "mutation": "authored_binomial_sum_row__binomial_inversion_small_w1", "kind": "hard_enable", "note": "Kept `authored_binomial_sum_row__binomial_inversion_small_w1` (hard_enable): lemma score 0.9071\u21920.9071 checks 71\u219272 hard_pass 61\u219262 (machine-checked + Oracle pass; not novel discovery). | oracle=PASS fitness_credit=True kills=[] | novelty_gate novel=True kills=[]", "themes": ["Bi-FORK: Generative Modeling of High-Dimensional Bifurcating", "The Sociolinguistics of Machine Identity: LLM Personality an", "Fast Solution Methods for the Classical 0\u20131 Knapsack Problem", "Digital-Twin-Driven Predictive Maintenance and Fault-Toleran"], "why_believe": {"components": ["check_binomial_sum_row", "check_binomial_inversion_small"], "ranges_tested": {"g0": {"n": [22, 32]}, "g1": {"n": [9, 12]}}, "challenger": "Challenger not broken: 52 probes (boundary 14, far 18, sample 20, edge 0; seed 250380944667580) in 0.03s", "challenger_blocked": false, "seed": 250380944667580, "text": "Believe `authored_binomial_sum_row__binomial_inversion_small_w1`: components check_binomial_sum_row, check_binomial_inversion_small; ranges tested {\"g0\": {\"n\": [22, 32]}, \"g1\": {\"n\": [9, 12]}}; Challenger not broken: 52 probes (boundary 14, far 18, sample 20, edge 0; seed 250380944667580) in 0.03s.", "generated_by": "colony.challenger", "free_text_from_feeds": false, "before_score": 0.9071, "after_score": 0.9071, "hard_pass_delta": 1}, "self_rejected": false}
{"ts": "2026-10-09T22:47:53Z", "decision": "skip", "before_score": 0.9071, "after_score": 0.9071, "delta": 0.0, "mutation": "", "kind": "", "note": "No pending hard-tier lemma mutations (catalog exhausted or empty). Cooled/blocked skipped: ['easy_pad_abs_identity', 'easy_pad_assoc_add', 'easy_pad_commutativity', 'easy_pad_diff_squares', 'easy_pad_square_again', 'easy_pad_zero_identity', 'stem_easy_pad_units', 'vandermonde_asymmetric']. Authored new disabled checks: ['authored_binomial_symmetry__catalan_bounded_w1'].", "themes": ["Bi-FORK: Generative Modeling of High-Dimensional Bifurcating", "The Sociolinguistics of Machine Identity: LLM Personality an", "Fast Solution Methods for the Classical 0\u20131 Knapsack Problem", "Digital-Twin-Driven Predictive Maintenance and Fault-Toleran"]}
{"ts": "2026-10-09T22:48:16Z", "decision": "keep", "before_score": 0.9071, "after_score": 0.9071, "delta": 0.0, "mutation": "authored_binomial_symmetry__catalan_bounded_w1", "kind": "hard_enable", "note": "Kept `authored_binomial_symmetry__catalan_bounded_w1` (hard_enable): lemma score 0.9071\u21920.9071 checks 72\u219273 hard_pass 62\u219263 (machine-checked + Oracle pass; not novel discovery). | oracle=PASS fitness_credit=True kills=[] | novelty_gate novel=False kills=['textbook_reuse=0.6667']", "themes": ["Bi-FORK: Generative Modeling of High-Dimensional Bifurcating", "The Sociolinguistics of Machine Identity: LLM Personality an", "Fast Solution Methods for the Classical 0\u20131 Knapsack Problem", "Digital-Twin-Driven Predictive Maintenance and Fault-Toleran"], "why_believe": {"components": ["check_binomial_symmetry", "check_catalan_bounded"], "ranges_tested": {"g0": {"n": [16, 23], "k": "dependent"}, "g1": {"n": [12, 17]}}, "challenger": "Challenger not broken: 2409 probes (boundary 95, far 1164, sample 1150, edge 0; seed 86507091581301) in 0.07s", "challenger_blocked": false, "seed": 86507091581301, "text": "Believe `authored_binomial_symmetry__catalan_bounded_w1`: components check_binomial_symmetry, check_catalan_bounded; ranges tested {\"g0\": {\"k\": \"dependent\", \"n\": [16, 23]}, \"g1\": {\"n\": [12, 17]}}; Challenger not broken: 2409 probes (boundary 95, far 1164, sample 1150, edge 0; seed 86507091581301) in 0.07s.", "generated_by": "colony.challenger", "free_text_from_feeds": false, "before_score": 0.9071, "after_score": 0.9071, "hard_pass_delta": 1}, "self_rejected": false}
{"ts": "2026-10-10T06:08:49Z", "decision": "skip", "before_score": 0.9071, "after_score": 0.9071, "delta": 0.0, "mutation": "", "kind": "", "note": "No pending hard-tier lemma mutations (catalog exhausted or empty). Cooled/blocked skipped: ['easy_pad_abs_identity', 'easy_pad_assoc_add', 'easy_pad_commutativity', 'easy_pad_diff_squares', 'easy_pad_square_again', 'easy_pad_zero_identity', 'stem_easy_pad_units', 'vandermonde_asymmetric']. Authored new disabled checks: ['authored_cassini__catalan_convolution_w1'].", "themes": ["Bi-FORK: Generative Modeling of High-Dimensional Bifurcating", "The Sociolinguistics of Machine Identity: LLM Personality an", "Fast Solution Methods for the Classical 0\u20131 Knapsack Problem", "Digital-Twin-Driven Predictive Maintenance and Fault-Toleran"]}
{"ts": "2026-10-10T06:09:31Z", "decision": "keep", "before_score": 0.9071, "after_score": 0.9071, "delta": 0.0, "mutation": "authored_cassini__catalan_convolution_w1", "kind": "hard_enable", "note": "Kept `authored_cassini__catalan_convolution_w1` (hard_enable): lemma score 0.9071\u21920.9071 checks 73\u219274 hard_pass 63\u219264 (machine-checked + Oracle pass; not novel discovery). | oracle=PASS fitness_credit=True kills=[] | novelty_gate novel=False kills=['textbook_reuse=0.6667']", "themes": ["Bi-FORK: Generative Modeling of High-Dimensional Bifurcating", "The Sociolinguistics of Machine Identity: LLM Personality an", "Fast Solution Methods for the Classical 0\u20131 Knapsack Problem", "Digital-Twin-Driven Predictive Maintenance and Fault-Toleran"], "why_believe": {"components": ["check_cassini_identity", "check_catalan_convolution"], "ranges_tested": {"g0": {"n": [40, 58]}, "g1": {"n": [12, 17]}}, "challenger": "Challenger not broken: 52 probes (boundary 14, far 18, sample 20, edge 0; seed 140552119291486) in 0.04s", "challenger_blocked": false, "seed": 140552119291486, "text": "Believe `authored_cassini__catalan_convolution_w1`: components check_cassini_identity, check_catalan_convolution; ranges tested {\"g0\": {\"n\": [40, 58]}, \"g1\": {\"n\": [12, 17]}}; Challenger not broken: 52 probes (boundary 14, far 18, sample 20, edge 0; seed 140552119291486) in 0.04s.", "generated_by": "colony.challenger", "free_text_from_feeds": false, "before_score": 0.9071, "after_score": 0.9071, "hard_pass_delta": 1}, "self_rejected": false}
{"ts": "2026-10-10T06:10:13Z", "decision": "skip", "before_score": 0.9071, "after_score": 0.9071, "delta": 0.0, "mutation": "", "kind": "", "note": "No pending hard-tier lemma mutations (catalog exhausted or empty). Cooled/blocked skipped: ['easy_pad_abs_identity', 'easy_pad_assoc_add', 'easy_pad_commutativity', 'easy_pad_diff_squares', 'easy_pad_square_again', 'easy_pad_zero_identity', 'stem_easy_pad_units', 'vandermonde_asymmetric']. Authored new disabled checks: ['authored_central_binom_bound__euler_totient_multiplicative_w1'].", "themes": ["Bi-FORK: Generative Modeling of High-Dimensional Bifurcating", "The Sociolinguistics of Machine Identity: LLM Personality an", "Fast Solution Methods for the Classical 0\u20131 Knapsack Problem", "Digital-Twin-Driven Predictive Maintenance and Fault-Toleran"]}
{"ts": "2026-10-10T12:49:14Z", "decision": "keep", "before_score": 0.9071, "after_score": 0.9071, "delta": 0.0, "mutation": "authored_central_binom_bound__euler_totient_multiplicative_w1", "kind": "hard_enable", "note": "Kept `authored_central_binom_bound__euler_totient_multiplicative_w1` (hard_enable): lemma score 0.9071\u21920.9071 checks 74\u219275 hard_pass 64\u219265 (machine-checked + Oracle pass; not novel discovery). | oracle=PASS fitness_credit=True kills=[] | novelty_gate novel=True kills=[]", "themes": ["Bi-FORK: Generative Modeling of High-Dimensional Bifurcating", "The Sociolinguistics of Machine Identity: LLM Personality an", "Fast Solution Methods for the Classical 0\u20131 Knapsack Problem", "Digital-Twin-Driven Predictive Maintenance and Fault-Toleran"], "why_believe": {"components": ["check_central_binom_bound", "check_euler_totient_multiplicative"], "ranges_tested": {"g0": {"n": [18, 25]}, "g1": {"a": [16, 22], "b": [16, 22]}}, "challenger": "Challenger not broken: 383 probes (boundary 105, far 135, sample 143, edge 0; seed 143982866243157) in 0.03s", "challenger_blocked": false, "seed": 143982866243157, "text": "Believe `authored_central_binom_bound__euler_totient_multiplicative_w1`: components check_central_binom_bound, check_euler_totient_multiplicative; ranges tested {\"g0\": {\"n\": [18, 25]}, \"g1\": {\"a\": [16, 22], \"b\": [16, 22]}}; Challenger not broken: 383 probes (boundary 105, far 135, sample 143, edge 0; seed 143982866243157) in 0.03s.", "generated_by": "colony.challenger", "free_text_from_feeds": false, "before_score": 0.9071, "after_score": 0.9071, "hard_pass_delta": 1}, "self_rejected": false}
{"ts": "2026-10-10T12:49:56Z", "decision": "skip", "before_score": 0.9071, "after_score": 0.9071, "delta": 0.0, "mutation": "", "kind": "", "note": "No pending hard-tier lemma mutations (catalog exhausted or empty). Cooled/blocked skipped: ['easy_pad_abs_identity', 'easy_pad_assoc_add', 'easy_pad_commutativity', 'easy_pad_diff_squares', 'easy_pad_square_again', 'easy_pad_zero_identity', 'stem_easy_pad_units', 'vandermonde_asymmetric']. Authored new disabled checks: ['authored_derangement_subfactorial__hermite_recurrence_w1'].", "themes": ["Bi-FORK: Generative Modeling of High-Dimensional Bifurcating", "The Sociolinguistics of Machine Identity: LLM Personality an", "Fast Solution Methods for the Classical 0\u20131 Knapsack Problem", "Digital-Twin-Driven Predictive Maintenance and Fault-Toleran"]}
{"ts": "2026-10-10T12:50:37Z", "decision": "keep", "before_score": 0.9071, "after_score": 0.9071, "delta": 0.0, "mutation": "authored_derangement_subfactorial__hermite_recurrence_w1", "kind": "hard_enable", "note": "Kept `authored_derangement_subfactorial__hermite_recurrence_w1` (hard_enable): lemma score 0.9071\u21920.9071 checks 75\u219276 hard_pass 65\u219266 (machine-checked + Oracle pass; not novel discovery). | oracle=PASS fitness_credit=True kills=[] | novelty_gate novel=True kills=[]", "themes": ["Bi-FORK: Generative Modeling of High-Dimensional Bifurcating", "The Sociolinguistics of Machine Identity: LLM Personality an", "Fast Solution Methods for the Classical 0\u20131 Knapsack Problem", "Digital-Twin-Driven Predictive Maintenance and Fault-Toleran"], "why_believe": {"components": ["check_derangement_subfactorial", "check_hermite_recurrence"], "ranges_tested": {"g0": {"n": [12, 17]}, "g1": {"n": [10, 13], "x": [-4, 4]}}, "challenger": "Challenger not broken: 387 probes (boundary 106, far 162, sample 119, edge 0; seed 151278012417483) in 0.04s", "challenger_blocked": false, "seed": 151278012417483, "text": "Believe `authored_derangement_subfactorial__hermite_recurrence_w1`: components check_derangement_subfactorial, check_hermite_recurrence; ranges tested {\"g0\": {\"n\": [12, 17]}, \"g1\": {\"n\": [10, 13], \"x\": [-4, 4]}}; Challenger not broken: 387 probes (boundary 106, far 162, sample 119, edge 0; seed 151278012417483) in 0.04s.", "generated_by": "colony.challenger", "free_text_from_feeds": false, "before_score": 0.9071, "after_score": 0.9071, "hard_pass_delta": 1}, "self_rejected": false}
{"ts": "2026-10-10T21:54:35Z", "decision": "skip", "before_score": 0.9071, "after_score": 0.9071, "delta": 0.0, "mutation": "", "kind": "", "note": "No pending hard-tier lemma mutations (catalog exhausted or empty). Cooled/blocked skipped: ['easy_pad_abs_identity', 'easy_pad_assoc_add', 'easy_pad_commutativity', 'easy_pad_diff_squares', 'easy_pad_square_again', 'easy_pad_zero_identity', 'stem_easy_pad_units', 'vandermonde_asymmetric']. Authored new disabled checks: ['authored_fibonacci_addition__motzkin_bounded_w1'].", "themes": ["Bi-FORK: Generative Modeling of High-Dimensional Bifurcating", "The Sociolinguistics of Machine Identity: LLM Personality an", "Fast Solution Methods for the Classical 0\u20131 Knapsack Problem", "Digital-Twin-Driven Predictive Maintenance and Fault-Toleran"]}
{"ts": "2026-10-10T21:55:22Z", "decision": "keep", "before_score": 0.9071, "after_score": 0.9071, "delta": 0.0, "mutation": "authored_fibonacci_addition__motzkin_bounded_w1", "kind": "hard_enable", "note": "Kept `authored_fibonacci_addition__motzkin_bounded_w1` (hard_enable): lemma score 0.9071\u21920.9071 checks 76\u219277 hard_pass 66\u219267 (machine-checked + Oracle pass; not novel discovery). | oracle=PASS fitness_credit=True kills=[] | novelty_gate novel=True kills=[]", "themes": ["Bi-FORK: Generative Modeling of High-Dimensional Bifurcating", "The Sociolinguistics of Machine Identity: LLM Personality an", "Fast Solution Methods for the Classical 0\u20131 Knapsack Problem", "Digital-Twin-Driven Predictive Maintenance and Fault-Toleran"], "why_believe": {"components": ["check_fibonacci_addition", "check_motzkin_bounded"], "ranges_tested": {"g0": {"m": [15, 21], "n": [15, 21]}, "g1": {"n": [14, 20]}}, "challenger": "Challenger not broken: 389 probes (boundary 105, far 135, sample 149, edge 0; seed 199492688596056) in 0.03s", "challenger_blocked": false, "seed": 199492688596056, "text": "Believe `authored_fibonacci_addition__motzkin_bounded_w1`: components check_fibonacci_addition, check_motzkin_bounded; ranges tested {\"g0\": {\"m\": [15, 21], \"n\": [15, 21]}, \"g1\": {\"n\": [14, 20]}}; Challenger not broken: 389 probes (boundary 105, far 135, sample 149, edge 0; seed 199492688596056) in 0.03s.", "generated_by": "colony.challenger", "free_text_from_feeds": false, "before_score": 0.9071, "after_score": 0.9071, "hard_pass_delta": 1}, "self_rejected": false}
{"ts": "2026-10-10T21:55:55Z", "decision": "skip", "before_score": 0.9071, "after_score": 0.9071, "delta": 0.0, "mutation": "", "kind": "", "note": "No pending hard-tier lemma mutations (catalog exhausted or empty). Cooled/blocked skipped: ['easy_pad_abs_identity', 'easy_pad_assoc_add', 'easy_pad_commutativity', 'easy_pad_diff_squares', 'easy_pad_square_again', 'easy_pad_zero_identity', 'stem_easy_pad_units', 'vandermonde_asymmetric']. Authored new disabled checks: ['authored_gcd_fibonacci__narayana_sum_w1'].", "themes": ["Bi-FORK: Generative Modeling of High-Dimensional Bifurcating", "The Sociolinguistics of Machine Identity: LLM Personality an", "Fast Solution Methods for the Classical 0\u20131 Knapsack Problem", "Digital-Twin-Driven Predictive Maintenance and Fault-Toleran"]}
