{"ts": "2026-09-26T12:57:35Z", "decision": "keep", "before_score": 1.0, "after_score": 1.0, "delta": 0.0, "mutation": "sum_first_n_cubes", "note": "Kept `sum_first_n_cubes`: lemma score 1.0\u21921.0 (machine-checked).", "themes": ["Thresholds and spread in set systems of bounded VC-dimension", "Temporal Gradient Inversion for Private Trajectory Reconstru", "A quasisymmetric analog of Grassmannian Schubert varieties", "Agentic Detection of Online Conspiracies"]}
{"ts": "2026-09-26T12:57:58Z", "decision": "keep", "before_score": 0.8833, "after_score": 0.9125, "delta": 0.0292, "mutation": "geometric_sum", "note": "Kept `geometric_sum`: lemma score 0.8833\u21920.9125 checks 8\u21929 (machine-checked).", "themes": ["Thresholds and spread in set systems of bounded VC-dimension", "Temporal Gradient Inversion for Private Trajectory Reconstru", "A quasisymmetric analog of Grassmannian Schubert varieties", "Agentic Detection of Online Conspiracies"]}
{"ts": "2026-09-26T12:58:03Z", "decision": "keep", "before_score": 0.9125, "after_score": 0.9417, "delta": 0.0292, "mutation": "handshaking_small", "note": "Kept `handshaking_small`: lemma score 0.9125\u21920.9417 checks 9\u219210 (machine-checked).", "themes": ["Attention Is All You Need", "G\u00f6del Machines: Fully Self-Referential Optimal Universal Sel", "Reflexion: Language Agents with Verbal Reinforcement Learnin", "Darwin G\u00f6del Machine: Open-Ended Evolution of Self-Improving"]}
{"ts": "2026-09-26T12:58:04Z", "decision": "skip", "before_score": 0.9417, "after_score": 0.9417, "delta": 0.0, "mutation": "", "note": "No pending lemma mutations (catalog already extended or empty).", "themes": ["Attention Is All You Need", "G\u00f6del Machines: Fully Self-Referential Optimal Universal Sel", "Reflexion: Language Agents with Verbal Reinforcement Learnin", "Darwin G\u00f6del Machine: Open-Ended Evolution of Self-Improving"]}
{"ts": "2026-09-26T12:58:05Z", "decision": "skip", "before_score": 0.9417, "after_score": 0.9417, "delta": 0.0, "mutation": "", "note": "No pending lemma mutations (catalog already extended or empty).", "themes": ["Attention Is All You Need", "G\u00f6del Machines: Fully Self-Referential Optimal Universal Sel", "Reflexion: Language Agents with Verbal Reinforcement Learnin", "Darwin G\u00f6del Machine: Open-Ended Evolution of Self-Improving"]}
{"ts": "2026-09-26T12:58:06Z", "decision": "skip", "before_score": 0.9417, "after_score": 0.9417, "delta": 0.0, "mutation": "", "note": "No pending lemma mutations (catalog already extended or empty).", "themes": ["Attention Is All You Need", "G\u00f6del Machines: Fully Self-Referential Optimal Universal Sel", "Reflexion: Language Agents with Verbal Reinforcement Learnin", "Darwin G\u00f6del Machine: Open-Ended Evolution of Self-Improving"]}
{"ts": "2026-09-26T12:58:08Z", "decision": "skip", "before_score": 0.9417, "after_score": 0.9417, "delta": 0.0, "mutation": "", "note": "No pending lemma mutations (catalog already extended or empty).", "themes": ["Attention Is All You Need", "G\u00f6del Machines: Fully Self-Referential Optimal Universal Sel", "Reflexion: Language Agents with Verbal Reinforcement Learnin", "Darwin G\u00f6del Machine: Open-Ended Evolution of Self-Improving"]}
{"ts": "2026-09-26T12:58:09Z", "decision": "skip", "before_score": 0.9417, "after_score": 0.9417, "delta": 0.0, "mutation": "", "note": "No pending lemma mutations (catalog already extended or empty).", "themes": ["Attention Is All You Need", "G\u00f6del Machines: Fully Self-Referential Optimal Universal Sel", "Reflexion: Language Agents with Verbal Reinforcement Learnin", "Darwin G\u00f6del Machine: Open-Ended Evolution of Self-Improving"]}
{"ts": "2026-09-26T14:12:35Z", "decision": "keep", "before_score": 0.6971, "after_score": 0.7321, "delta": 0.035, "mutation": "vandermonde_conv", "kind": "hard_enable", "note": "Kept `vandermonde_conv` (hard_enable): lemma score 0.6971\u21920.7321 checks 12\u219213 hard_pass 2\u21923 (machine-checked; not novel discovery).", "themes": ["Darwin G\u00f6del Machine: Open-Ended Evolution of Self-Improving", "Adam: A Method for Stochastic Optimization", "AI Safety via Debate", "G\u00f6del Machines: Fully Self-Referential Optimal Universal Sel"]}
{"ts": "2026-09-26T14:12:35Z", "decision": "keep", "before_score": 0.7321, "after_score": 0.7671, "delta": 0.035, "mutation": "hockey_stick", "kind": "hard_enable", "note": "Kept `hockey_stick` (hard_enable): lemma score 0.7321\u21920.7671 checks 13\u219214 hard_pass 3\u21924 (machine-checked; not novel discovery).", "themes": ["Darwin G\u00f6del Machine: Open-Ended Evolution of Self-Improving", "Adam: A Method for Stochastic Optimization", "AI Safety via Debate", "G\u00f6del Machines: Fully Self-Referential Optimal Universal Sel"]}
{"ts": "2026-09-26T14:12:35Z", "decision": "keep", "before_score": 0.7671, "after_score": 0.8021, "delta": 0.035, "mutation": "cassini", "kind": "hard_enable", "note": "Kept `cassini` (hard_enable): lemma score 0.7671\u21920.8021 checks 14\u219215 hard_pass 4\u21925 (machine-checked; not novel discovery).", "themes": ["Darwin G\u00f6del Machine: Open-Ended Evolution of Self-Improving", "Adam: A Method for Stochastic Optimization", "AI Safety via Debate", "G\u00f6del Machines: Fully Self-Referential Optimal Universal Sel"]}
{"ts": "2026-09-26T14:12:35Z", "decision": "keep", "before_score": 0.8021, "after_score": 0.8371, "delta": 0.035, "mutation": "workload_derived_chain", "kind": "hard_enable", "note": "Kept `workload_derived_chain` (hard_enable): lemma score 0.8021\u21920.8371 checks 15\u219216 hard_pass 5\u21926 (machine-checked; not novel discovery).", "themes": ["Darwin G\u00f6del Machine: Open-Ended Evolution of Self-Improving", "Adam: A Method for Stochastic Optimization", "AI Safety via Debate", "G\u00f6del Machines: Fully Self-Referential Optimal Universal Sel"]}
{"ts": "2026-09-26T14:12:35Z", "decision": "revert", "before_score": 0.8371, "after_score": 0.8371, "delta": 0.0, "mutation": "easy_pad_square_again", "kind": "easy_pad", "note": "Reverted `easy_pad_square_again` (easy_pad): score 0.8371\u21920.8529 ok=True hard_pass 6\u21926 \u2014 hard-tier lift required for keep; easy pads fail.", "themes": ["Darwin G\u00f6del Machine: Open-Ended Evolution of Self-Improving", "Adam: A Method for Stochastic Optimization", "AI Safety via Debate", "G\u00f6del Machines: Fully Self-Referential Optimal Universal Sel"]}
{"ts": "2026-09-26T14:12:35Z", "decision": "revert", "before_score": 0.8371, "after_score": 0.8371, "delta": 0.0, "mutation": "easy_pad_square_again", "kind": "easy_pad", "note": "Reverted `easy_pad_square_again` (easy_pad): score 0.8371\u21920.8529 ok=True hard_pass 6\u21926 \u2014 hard-tier lift required for keep; easy pads fail.", "themes": ["Darwin G\u00f6del Machine: Open-Ended Evolution of Self-Improving", "Adam: A Method for Stochastic Optimization", "AI Safety via Debate", "G\u00f6del Machines: Fully Self-Referential Optimal Universal Sel"]}
{"ts": "2026-09-26T14:13:21Z", "decision": "skip", "before_score": 0.8371, "after_score": 0.8371, "delta": 0.0, "mutation": "", "kind": "", "note": "No pending hard-tier lemma mutations (catalog exhausted or empty).", "themes": ["Attention Is All You Need", "G\u00f6del Machines: Fully Self-Referential Optimal Universal Sel", "Reflexion: Language Agents with Verbal Reinforcement Learnin", "Darwin G\u00f6del Machine: Open-Ended Evolution of Self-Improving"]}
{"ts": "2026-09-26T14:13:22Z", "decision": "skip", "before_score": 0.8371, "after_score": 0.8371, "delta": 0.0, "mutation": "", "kind": "", "note": "No pending hard-tier lemma mutations (catalog exhausted or empty).", "themes": ["Attention Is All You Need", "G\u00f6del Machines: Fully Self-Referential Optimal Universal Sel", "Reflexion: Language Agents with Verbal Reinforcement Learnin", "Darwin G\u00f6del Machine: Open-Ended Evolution of Self-Improving"]}
{"ts": "2026-09-26T14:13:22Z", "decision": "skip", "before_score": 0.8371, "after_score": 0.8371, "delta": 0.0, "mutation": "", "kind": "", "note": "No pending hard-tier lemma mutations (catalog exhausted or empty).", "themes": ["Attention Is All You Need", "G\u00f6del Machines: Fully Self-Referential Optimal Universal Sel", "Reflexion: Language Agents with Verbal Reinforcement Learnin", "Darwin G\u00f6del Machine: Open-Ended Evolution of Self-Improving"]}
{"ts": "2026-09-26T14:13:23Z", "decision": "skip", "before_score": 0.8371, "after_score": 0.8371, "delta": 0.0, "mutation": "", "kind": "", "note": "No pending hard-tier lemma mutations (catalog exhausted or empty).", "themes": ["Attention Is All You Need", "G\u00f6del Machines: Fully Self-Referential Optimal Universal Sel", "Reflexion: Language Agents with Verbal Reinforcement Learnin", "Darwin G\u00f6del Machine: Open-Ended Evolution of Self-Improving"]}
{"ts": "2026-09-26T14:13:24Z", "decision": "skip", "before_score": 0.8371, "after_score": 0.8371, "delta": 0.0, "mutation": "", "kind": "", "note": "No pending hard-tier lemma mutations (catalog exhausted or empty).", "themes": ["Attention Is All You Need", "G\u00f6del Machines: Fully Self-Referential Optimal Universal Sel", "Reflexion: Language Agents with Verbal Reinforcement Learnin", "Darwin G\u00f6del Machine: Open-Ended Evolution of Self-Improving"]}
{"ts": "2026-09-26T14:13:24Z", "decision": "skip", "before_score": 0.8371, "after_score": 0.8371, "delta": 0.0, "mutation": "", "kind": "", "note": "No pending hard-tier lemma mutations (catalog exhausted or empty).", "themes": ["Attention Is All You Need", "G\u00f6del Machines: Fully Self-Referential Optimal Universal Sel", "Reflexion: Language Agents with Verbal Reinforcement Learnin", "Darwin G\u00f6del Machine: Open-Ended Evolution of Self-Improving"]}
{"ts": "2026-09-26T14:13:25Z", "decision": "skip", "before_score": 0.8371, "after_score": 0.8371, "delta": 0.0, "mutation": "", "kind": "", "note": "No pending hard-tier lemma mutations (catalog exhausted or empty).", "themes": ["Attention Is All You Need", "G\u00f6del Machines: Fully Self-Referential Optimal Universal Sel", "Reflexion: Language Agents with Verbal Reinforcement Learnin", "Darwin G\u00f6del Machine: Open-Ended Evolution of Self-Improving"]}
{"ts": "2026-09-26T14:13:25Z", "decision": "skip", "before_score": 0.8371, "after_score": 0.8371, "delta": 0.0, "mutation": "", "kind": "", "note": "No pending hard-tier lemma mutations (catalog exhausted or empty).", "themes": ["Attention Is All You Need", "G\u00f6del Machines: Fully Self-Referential Optimal Universal Sel", "Reflexion: Language Agents with Verbal Reinforcement Learnin", "Darwin G\u00f6del Machine: Open-Ended Evolution of Self-Improving"]}
{"ts": "2026-09-26T14:13:26Z", "decision": "skip", "before_score": 0.8371, "after_score": 0.8371, "delta": 0.0, "mutation": "", "kind": "", "note": "No pending hard-tier lemma mutations (catalog exhausted or empty).", "themes": ["Attention Is All You Need", "G\u00f6del Machines: Fully Self-Referential Optimal Universal Sel", "Reflexion: Language Agents with Verbal Reinforcement Learnin", "Darwin G\u00f6del Machine: Open-Ended Evolution of Self-Improving"]}
{"ts": "2026-09-26T14:13:26Z", "decision": "skip", "before_score": 0.8371, "after_score": 0.8371, "delta": 0.0, "mutation": "", "kind": "", "note": "No pending hard-tier lemma mutations (catalog exhausted or empty).", "themes": ["Attention Is All You Need", "G\u00f6del Machines: Fully Self-Referential Optimal Universal Sel", "Reflexion: Language Agents with Verbal Reinforcement Learnin", "Darwin G\u00f6del Machine: Open-Ended Evolution of Self-Improving"]}
{"ts": "2026-09-26T14:28:23Z", "decision": "keep", "before_score": 0.8371, "after_score": 0.8721, "delta": 0.035, "mutation": "binomial_sum_row", "kind": "hard_enable", "note": "Kept `binomial_sum_row` (hard_enable): lemma score 0.8371\u21920.8721 checks 16\u219217 hard_pass 6\u21927 (machine-checked; not novel discovery).", "themes": ["Adam: A Method for Stochastic Optimization", "AI Safety via Debate", "Attention Is All You Need", "G\u00f6del Machines: Fully Self-Referential Optimal Universal Sel"]}
{"ts": "2026-09-26T14:28:23Z", "decision": "keep", "before_score": 0.8721, "after_score": 0.9071, "delta": 0.035, "mutation": "fibonacci_addition", "kind": "hard_enable", "note": "Kept `fibonacci_addition` (hard_enable): lemma score 0.8721\u21920.9071 checks 17\u219218 hard_pass 7\u21928 (machine-checked; not novel discovery).", "themes": ["Adam: A Method for Stochastic Optimization", "AI Safety via Debate", "Attention Is All You Need", "G\u00f6del Machines: Fully Self-Referential Optimal Universal Sel"]}
{"ts": "2026-09-26T14:28:23Z", "decision": "keep", "before_score": 0.9071, "after_score": 0.9071, "delta": 0.0, "mutation": "catalan_bounded", "kind": "hard_enable", "note": "Kept `catalan_bounded` (hard_enable): lemma score 0.9071\u21920.9071 checks 18\u219219 hard_pass 8\u21929 (machine-checked; not novel discovery).", "themes": ["Adam: A Method for Stochastic Optimization", "AI Safety via Debate", "Attention Is All You Need", "G\u00f6del Machines: Fully Self-Referential Optimal Universal Sel"]}
{"ts": "2026-09-26T14:28:23Z", "decision": "skip", "before_score": 0.9071, "after_score": 0.9071, "delta": 0.0, "mutation": "", "kind": "", "note": "No pending hard-tier lemma mutations (catalog exhausted or empty).", "themes": ["Adam: A Method for Stochastic Optimization", "AI Safety via Debate", "Attention Is All You Need", "G\u00f6del Machines: Fully Self-Referential Optimal Universal Sel"]}
{"ts": "2026-09-26T14:28:31Z", "decision": "revert", "before_score": 0.9071, "after_score": 0.9071, "delta": 0.0, "mutation": "easy_pad_square_again", "kind": "easy_pad", "note": "Reverted `easy_pad_square_again` (easy_pad): score 0.9071\u21920.9229 ok=True hard_pass 9\u21929 \u2014 hard-tier lift required for keep; easy pads fail.", "themes": ["Adam: A Method for Stochastic Optimization", "AI Safety via Debate", "Attention Is All You Need", "G\u00f6del Machines: Fully Self-Referential Optimal Universal Sel"]}
{"ts": "2026-09-26T14:28:55Z", "decision": "skip", "before_score": 0.9071, "after_score": 0.9071, "delta": 0.0, "mutation": "", "kind": "", "note": "No pending hard-tier lemma mutations (catalog exhausted or empty).", "themes": ["Agentic Detection of Online Conspiracies", "Thresholds and spread in set systems of bounded VC-dimension", "Temporal Gradient Inversion for Private Trajectory Reconstru", "A quasisymmetric analog of Grassmannian Schubert varieties"]}
{"ts": "2026-09-26T14:28:56Z", "decision": "skip", "before_score": 0.9071, "after_score": 0.9071, "delta": 0.0, "mutation": "", "kind": "", "note": "No pending hard-tier lemma mutations (catalog exhausted or empty).", "themes": ["AI Safety via Debate", "Thresholds and spread in set systems of bounded VC-dimension", "Temporal Gradient Inversion for Private Trajectory Reconstru", "A quasisymmetric analog of Grassmannian Schubert varieties"]}
{"ts": "2026-09-26T14:28:57Z", "decision": "skip", "before_score": 0.9071, "after_score": 0.9071, "delta": 0.0, "mutation": "", "kind": "", "note": "No pending hard-tier lemma mutations (catalog exhausted or empty).", "themes": ["AI Safety via Debate", "Thresholds and spread in set systems of bounded VC-dimension", "Temporal Gradient Inversion for Private Trajectory Reconstru", "A quasisymmetric analog of Grassmannian Schubert varieties"]}
{"ts": "2026-09-26T14:28:59Z", "decision": "skip", "before_score": 0.9071, "after_score": 0.9071, "delta": 0.0, "mutation": "", "kind": "", "note": "No pending hard-tier lemma mutations (catalog exhausted or empty).", "themes": ["AI Safety via Debate", "Thresholds and spread in set systems of bounded VC-dimension", "Temporal Gradient Inversion for Private Trajectory Reconstru", "A quasisymmetric analog of Grassmannian Schubert varieties"]}
{"ts": "2026-09-26T14:29:00Z", "decision": "skip", "before_score": 0.9071, "after_score": 0.9071, "delta": 0.0, "mutation": "", "kind": "", "note": "No pending hard-tier lemma mutations (catalog exhausted or empty).", "themes": ["AI Safety via Debate", "Thresholds and spread in set systems of bounded VC-dimension", "Temporal Gradient Inversion for Private Trajectory Reconstru", "A quasisymmetric analog of Grassmannian Schubert varieties"]}
{"ts": "2026-09-26T14:29:01Z", "decision": "skip", "before_score": 0.9071, "after_score": 0.9071, "delta": 0.0, "mutation": "", "kind": "", "note": "No pending hard-tier lemma mutations (catalog exhausted or empty).", "themes": ["AI Safety via Debate", "Thresholds and spread in set systems of bounded VC-dimension", "Temporal Gradient Inversion for Private Trajectory Reconstru", "A quasisymmetric analog of Grassmannian Schubert varieties"]}
{"ts": "2026-09-26T14:29:02Z", "decision": "skip", "before_score": 0.9071, "after_score": 0.9071, "delta": 0.0, "mutation": "", "kind": "", "note": "No pending hard-tier lemma mutations (catalog exhausted or empty).", "themes": ["AI Safety via Debate", "Thresholds and spread in set systems of bounded VC-dimension", "Temporal Gradient Inversion for Private Trajectory Reconstru", "A quasisymmetric analog of Grassmannian Schubert varieties"]}
{"ts": "2026-09-26T14:29:03Z", "decision": "skip", "before_score": 0.9071, "after_score": 0.9071, "delta": 0.0, "mutation": "", "kind": "", "note": "No pending hard-tier lemma mutations (catalog exhausted or empty).", "themes": ["AI Safety via Debate", "Thresholds and spread in set systems of bounded VC-dimension", "Temporal Gradient Inversion for Private Trajectory Reconstru", "A quasisymmetric analog of Grassmannian Schubert varieties"]}
{"ts": "2026-09-26T14:53:28Z", "decision": "keep", "before_score": 0.9071, "after_score": 0.9071, "delta": 0.0, "mutation": "lucas_addition", "kind": "hard_enable", "note": "Kept `lucas_addition` (hard_enable): lemma score 0.9071\u21920.9071 checks 19\u219220 hard_pass 9\u219210 (machine-checked; not novel discovery).", "themes": ["AI Safety via Debate", "Thresholds and spread in set systems of bounded VC-dimension", "Temporal Gradient Inversion for Private Trajectory Reconstru", "A quasisymmetric analog of Grassmannian Schubert varieties"]}
{"ts": "2026-09-26T14:53:28Z", "decision": "keep", "before_score": 0.9071, "after_score": 0.9071, "delta": 0.0, "mutation": "central_binom_bound", "kind": "hard_enable", "note": "Kept `central_binom_bound` (hard_enable): lemma score 0.9071\u21920.9071 checks 20\u219221 hard_pass 10\u219211 (machine-checked; not novel discovery).", "themes": ["AI Safety via Debate", "Thresholds and spread in set systems of bounded VC-dimension", "Temporal Gradient Inversion for Private Trajectory Reconstru", "A quasisymmetric analog of Grassmannian Schubert varieties"]}
{"ts": "2026-09-26T14:53:28Z", "decision": "keep", "before_score": 0.9071, "after_score": 0.9071, "delta": 0.0, "mutation": "pell_companion", "kind": "hard_enable", "note": "Kept `pell_companion` (hard_enable): lemma score 0.9071\u21920.9071 checks 21\u219222 hard_pass 11\u219212 (machine-checked; not novel discovery).", "themes": ["AI Safety via Debate", "Thresholds and spread in set systems of bounded VC-dimension", "Temporal Gradient Inversion for Private Trajectory Reconstru", "A quasisymmetric analog of Grassmannian Schubert varieties"]}
{"ts": "2026-09-26T14:53:28Z", "decision": "revert", "before_score": 0.9071, "after_score": 0.9071, "delta": 0.0, "mutation": "easy_pad_diff_squares", "kind": "easy_pad", "note": "Reverted `easy_pad_diff_squares` (easy_pad): score 0.9071\u21920.9229 ok=True hard_pass 12\u219212 \u2014 hard-tier lift required for keep; easy pads fail.", "themes": ["AI Safety via Debate", "Thresholds and spread in set systems of bounded VC-dimension", "Temporal Gradient Inversion for Private Trajectory Reconstru", "A quasisymmetric analog of Grassmannian Schubert varieties"]}
{"ts": "2026-09-26T14:53:38Z", "decision": "revert", "before_score": 0.9071, "after_score": 0.9071, "delta": 0.0, "mutation": "easy_pad_diff_squares", "kind": "easy_pad", "note": "Reverted `easy_pad_diff_squares` (easy_pad): score 0.9071\u21920.9229 ok=True hard_pass 12\u219212 \u2014 hard-tier lift required for keep; easy pads fail.", "themes": ["Agentic Detection of Online Conspiracies", "Thresholds and spread in set systems of bounded VC-dimension", "Temporal Gradient Inversion for Private Trajectory Reconstru", "A quasisymmetric analog of Grassmannian Schubert varieties"]}
{"ts": "2026-09-26T14:53:39Z", "decision": "skip", "before_score": 0.9071, "after_score": 0.9071, "delta": 0.0, "mutation": "", "kind": "", "note": "No pending hard-tier lemma mutations (catalog exhausted or empty).", "themes": ["AI Safety via Debate", "Thresholds and spread in set systems of bounded VC-dimension", "Temporal Gradient Inversion for Private Trajectory Reconstru", "A quasisymmetric analog of Grassmannian Schubert varieties"]}
{"ts": "2026-09-26T14:53:41Z", "decision": "skip", "before_score": 0.9071, "after_score": 0.9071, "delta": 0.0, "mutation": "", "kind": "", "note": "No pending hard-tier lemma mutations (catalog exhausted or empty).", "themes": ["AI Safety via Debate", "Thresholds and spread in set systems of bounded VC-dimension", "Temporal Gradient Inversion for Private Trajectory Reconstru", "A quasisymmetric analog of Grassmannian Schubert varieties"]}
{"ts": "2026-09-26T14:53:43Z", "decision": "revert", "before_score": 0.9071, "after_score": 0.9071, "delta": 0.0, "mutation": "easy_pad_square_again", "kind": "easy_pad", "note": "Reverted `easy_pad_square_again` (easy_pad): score 0.9071\u21920.9229 ok=True hard_pass 12\u219212 \u2014 hard-tier lift required for keep; easy pads fail.", "themes": ["AI Safety via Debate", "Thresholds and spread in set systems of bounded VC-dimension", "Temporal Gradient Inversion for Private Trajectory Reconstru", "A quasisymmetric analog of Grassmannian Schubert varieties"]}
