{"ts": "2026-10-08T13:53:46Z", "decision": "keep", "before_score": 0.9071, "after_score": 0.9071, "delta": 0.0, "mutation": "authored_binomial_inversion_small__legendre_duplication_small_w1", "kind": "hard_enable", "note": "Kept `authored_binomial_inversion_small__legendre_duplication_small_w1` (hard_enable): lemma score 0.9071\u21920.9071 checks 59\u219260 hard_pass 49\u219250 (machine-checked + Oracle pass; not novel discovery). | oracle=PASS fitness_credit=True kills=[] | novelty_gate novel=True kills=[]", "themes": ["Why Forget-Only Unlearning Needs Memorization", "The Sociolinguistics of Machine Identity: LLM Personality an", "Fast Solution Methods for the Classical 0\u20131 Knapsack Problem", "Digital-Twin-Driven Predictive Maintenance and Fault-Toleran"]}
{"ts": "2026-10-08T13:54:20Z", "decision": "revert", "before_score": 0.9071, "after_score": 0.9071, "delta": 0.0, "mutation": "easy_pad_abs_identity", "kind": "easy_pad", "note": "Reverted `easy_pad_abs_identity` (easy_pad): score 0.9071\u21920.9229 ok=True hard_pass 50\u219250 \u2014 Oracle/hard-tier required for keep; easy pads die on Oracle. | oracle=KILL fitness_credit=False kills=['stripped:easy_pad_baseline_already_useful', 'held_out:easy_pad_dies_on_held_out', 'cas:easy_pad_fails_cas_usefulness', 'easy_pad_oracle_kill', 'collective_kill'] | novelty_gate novel=False kills=['already_in_lesson_ledger_or_history', 'textbook_reuse=1.0', 'stripped_baseline_does_not_fail_usefulness', 'held_out:easy_pad_fails_held_out_harder', \"oracle_kill:['stripped:easy_pad_baseline_already_useful', 'held_out:easy_pad_dies_on_held_out', 'cas:easy_pad_fails_cas_usefulness', 'easy_pad_oracle_kill', 'collective_kill']\"]", "themes": ["Why Forget-Only Unlearning Needs Memorization", "The Sociolinguistics of Machine Identity: LLM Personality an", "Fast Solution Methods for the Classical 0\u20131 Knapsack Problem", "Digital-Twin-Driven Predictive Maintenance and Fault-Toleran"]}
{"ts": "2026-10-08T13:54:42Z", "decision": "keep", "before_score": 0.9071, "after_score": 0.9071, "delta": 0.0, "mutation": "authored_oeis_a000079__binomial_sum_row", "kind": "hard_enable", "note": "Kept `authored_oeis_a000079__binomial_sum_row` (hard_enable): lemma score 0.9071\u21920.9071 checks 60\u219261 hard_pass 50\u219251 (machine-checked + Oracle pass; not novel discovery). | oracle=PASS fitness_credit=True kills=[] | novelty_gate novel=True kills=[]", "themes": ["Why Forget-Only Unlearning Needs Memorization", "The Sociolinguistics of Machine Identity: LLM Personality an", "Fast Solution Methods for the Classical 0\u20131 Knapsack Problem", "Digital-Twin-Driven Predictive Maintenance and Fault-Toleran"]}
{"ts": "2026-10-08T23:29:33Z", "decision": "revert", "before_score": 0.9071, "after_score": 0.9071, "delta": 0.0, "mutation": "easy_pad_diff_squares", "kind": "easy_pad", "note": "Reverted `easy_pad_diff_squares` (easy_pad): score 0.9071\u21920.9229 ok=True hard_pass 51\u219251 \u2014 Oracle/hard-tier required for keep; easy pads die on Oracle. | oracle=KILL fitness_credit=False kills=['stripped:easy_pad_baseline_already_useful', 'held_out:easy_pad_dies_on_held_out', 'cas:easy_pad_fails_cas_usefulness', 'easy_pad_oracle_kill', 'collective_kill'] | novelty_gate novel=False kills=['already_in_lesson_ledger_or_history', 'textbook_reuse=1.0', 'stripped_baseline_does_not_fail_usefulness', 'held_out:easy_pad_fails_held_out_harder', \"oracle_kill:['stripped:easy_pad_baseline_already_useful', 'held_out:easy_pad_dies_on_held_out', 'cas:easy_pad_fails_cas_usefulness', 'easy_pad_oracle_kill', 'collective_kill']\"]", "themes": ["Why Forget-Only Unlearning Needs Memorization", "The Sociolinguistics of Machine Identity: LLM Personality an", "Fast Solution Methods for the Classical 0\u20131 Knapsack Problem", "Digital-Twin-Driven Predictive Maintenance and Fault-Toleran"]}
{"ts": "2026-10-08T23:30:07Z", "decision": "keep", "before_score": 0.9071, "after_score": 0.9071, "delta": 0.0, "mutation": "authored_binomial_symmetry__cassini_w1", "kind": "hard_enable", "note": "Kept `authored_binomial_symmetry__cassini_w1` (hard_enable): lemma score 0.9071\u21920.9071 checks 61\u219262 hard_pass 51\u219252 (machine-checked + Oracle pass; not novel discovery). | oracle=PASS fitness_credit=True kills=[] | novelty_gate novel=False kills=['textbook_reuse=0.6667']", "themes": ["Why Forget-Only Unlearning Needs Memorization", "The Sociolinguistics of Machine Identity: LLM Personality an", "Fast Solution Methods for the Classical 0\u20131 Knapsack Problem", "Digital-Twin-Driven Predictive Maintenance and Fault-Toleran"]}
{"ts": "2026-10-08T23:30:44Z", "decision": "revert", "before_score": 0.9071, "after_score": 0.9071, "delta": 0.0, "mutation": "easy_pad_diff_squares", "kind": "easy_pad", "note": "Reverted `easy_pad_diff_squares` (easy_pad): score 0.9071\u21920.9229 ok=True hard_pass 52\u219252 \u2014 Oracle/hard-tier required for keep; easy pads die on Oracle. | oracle=KILL fitness_credit=False kills=['stripped:easy_pad_baseline_already_useful', 'held_out:easy_pad_dies_on_held_out', 'cas:easy_pad_fails_cas_usefulness', 'easy_pad_oracle_kill', 'collective_kill'] | novelty_gate novel=False kills=['already_in_lesson_ledger_or_history', 'textbook_reuse=1.0', 'stripped_baseline_does_not_fail_usefulness', 'held_out:easy_pad_fails_held_out_harder', \"oracle_kill:['stripped:easy_pad_baseline_already_useful', 'held_out:easy_pad_dies_on_held_out', 'cas:easy_pad_fails_cas_usefulness', 'easy_pad_oracle_kill', 'collective_kill']\"]", "themes": ["Why Forget-Only Unlearning Needs Memorization", "The Sociolinguistics of Machine Identity: LLM Personality an", "Fast Solution Methods for the Classical 0\u20131 Knapsack Problem", "Digital-Twin-Driven Predictive Maintenance and Fault-Toleran"]}
{"ts": "2026-10-09T06:15:43Z", "decision": "keep", "before_score": 0.9071, "after_score": 0.9071, "delta": 0.0, "mutation": "authored_catalan_convolution__derangement_subfactorial_w1", "kind": "hard_enable", "note": "Kept `authored_catalan_convolution__derangement_subfactorial_w1` (hard_enable): lemma score 0.9071\u21920.9071 checks 62\u219263 hard_pass 52\u219253 (machine-checked + Oracle pass; not novel discovery). | oracle=PASS fitness_credit=True kills=[] | novelty_gate novel=True kills=[]", "themes": ["Bi-FORK: Generative Modeling of High-Dimensional Bifurcating", "The Sociolinguistics of Machine Identity: LLM Personality an", "Fast Solution Methods for the Classical 0\u20131 Knapsack Problem", "Digital-Twin-Driven Predictive Maintenance and Fault-Toleran"]}
{"ts": "2026-10-09T06:16:18Z", "decision": "skip", "before_score": 0.9071, "after_score": 0.9071, "delta": 0.0, "mutation": "", "kind": "", "note": "No pending hard-tier lemma mutations (catalog exhausted or empty). Cooled/blocked skipped: ['easy_pad_abs_identity', 'easy_pad_assoc_add', 'easy_pad_commutativity', 'easy_pad_diff_squares', 'easy_pad_square_again', 'easy_pad_zero_identity', 'stem_easy_pad_units', 'vandermonde_asymmetric']. Authored new disabled checks: ['authored_fibonacci_addition__euler_totient_multiplicative_w1'].", "themes": ["Bi-FORK: Generative Modeling of High-Dimensional Bifurcating", "The Sociolinguistics of Machine Identity: LLM Personality an", "Fast Solution Methods for the Classical 0\u20131 Knapsack Problem", "Digital-Twin-Driven Predictive Maintenance and Fault-Toleran"]}
{"ts": "2026-10-09T06:16:52Z", "decision": "keep", "before_score": 0.9071, "after_score": 0.9071, "delta": 0.0, "mutation": "authored_fibonacci_addition__euler_totient_multiplicative_w1", "kind": "hard_enable", "note": "Kept `authored_fibonacci_addition__euler_totient_multiplicative_w1` (hard_enable): lemma score 0.9071\u21920.9071 checks 63\u219264 hard_pass 53\u219254 (machine-checked + Oracle pass; not novel discovery). | oracle=PASS fitness_credit=True kills=[] | novelty_gate novel=True kills=[]", "themes": ["Bi-FORK: Generative Modeling of High-Dimensional Bifurcating", "The Sociolinguistics of Machine Identity: LLM Personality an", "Fast Solution Methods for the Classical 0\u20131 Knapsack Problem", "Digital-Twin-Driven Predictive Maintenance and Fault-Toleran"]}
{"ts": "2026-10-09T06:25:55Z", "decision": "skip", "before_score": 0.9071, "after_score": 0.9071, "delta": 0.0, "mutation": "", "kind": "", "note": "No pending hard-tier lemma mutations (catalog exhausted or empty). Cooled/blocked skipped: ['easy_pad_abs_identity', 'easy_pad_assoc_add', 'easy_pad_commutativity', 'easy_pad_diff_squares', 'easy_pad_square_again', 'easy_pad_zero_identity', 'stem_easy_pad_units', 'vandermonde_asymmetric']. Authored new disabled checks: ['authored_gcd_fibonacci__motzkin_bounded_w1'].", "themes": ["Bi-FORK: Generative Modeling of High-Dimensional Bifurcating", "The Sociolinguistics of Machine Identity: LLM Personality an", "Fast Solution Methods for the Classical 0\u20131 Knapsack Problem", "Digital-Twin-Driven Predictive Maintenance and Fault-Toleran"]}
{"ts": "2026-10-09T06:26:30Z", "decision": "keep", "before_score": 0.9071, "after_score": 0.9071, "delta": 0.0, "mutation": "authored_gcd_fibonacci__motzkin_bounded_w1", "kind": "hard_enable", "note": "Kept `authored_gcd_fibonacci__motzkin_bounded_w1` (hard_enable): lemma score 0.9071\u21920.9071 checks 64\u219265 hard_pass 54\u219255 (machine-checked + Oracle pass; not novel discovery). | oracle=PASS fitness_credit=True kills=[] | novelty_gate novel=True kills=[]", "themes": ["Bi-FORK: Generative Modeling of High-Dimensional Bifurcating", "The Sociolinguistics of Machine Identity: LLM Personality an", "Fast Solution Methods for the Classical 0\u20131 Knapsack Problem", "Digital-Twin-Driven Predictive Maintenance and Fault-Toleran"]}
{"ts": "2026-10-09T06:26:55Z", "decision": "skip", "before_score": 0.9071, "after_score": 0.9071, "delta": 0.0, "mutation": "", "kind": "", "note": "No pending hard-tier lemma mutations (catalog exhausted or empty). Cooled/blocked skipped: ['easy_pad_abs_identity', 'easy_pad_assoc_add', 'easy_pad_commutativity', 'easy_pad_diff_squares', 'easy_pad_square_again', 'easy_pad_zero_identity', 'stem_easy_pad_units', 'vandermonde_asymmetric']. Authored new disabled checks: ['authored_geometric_sum__narayana_sum_w1'].", "themes": ["Bi-FORK: Generative Modeling of High-Dimensional Bifurcating", "The Sociolinguistics of Machine Identity: LLM Personality an", "Fast Solution Methods for the Classical 0\u20131 Knapsack Problem", "Digital-Twin-Driven Predictive Maintenance and Fault-Toleran"]}
{"ts": "2026-10-09T06:28:58Z", "decision": "keep", "before_score": 0.9071, "after_score": 0.9071, "delta": 0.0, "mutation": "authored_geometric_sum__narayana_sum_w1", "kind": "hard_enable", "note": "Kept `authored_geometric_sum__narayana_sum_w1` (hard_enable): lemma score 0.9071\u21920.9071 checks 65\u219266 hard_pass 55\u219256 (machine-checked + Oracle pass; not novel discovery). | oracle=PASS fitness_credit=True kills=[] | novelty_gate novel=True kills=[]", "themes": ["Bi-FORK: Generative Modeling of High-Dimensional Bifurcating", "The Sociolinguistics of Machine Identity: LLM Personality an", "Fast Solution Methods for the Classical 0\u20131 Knapsack Problem", "Digital-Twin-Driven Predictive Maintenance and Fault-Toleran"]}
{"ts": "2026-10-09T06:29:37Z", "decision": "skip", "before_score": 0.9071, "after_score": 0.9071, "delta": 0.0, "mutation": "", "kind": "", "note": "No pending hard-tier lemma mutations (catalog exhausted or empty). Cooled/blocked skipped: ['easy_pad_abs_identity', 'easy_pad_assoc_add', 'easy_pad_commutativity', 'easy_pad_diff_squares', 'easy_pad_square_again', 'easy_pad_zero_identity', 'stem_easy_pad_units', 'vandermonde_asymmetric']. Authored new disabled checks: ['authored_hockey_stick__pell_companion_w1'].", "themes": ["Bi-FORK: Generative Modeling of High-Dimensional Bifurcating", "The Sociolinguistics of Machine Identity: LLM Personality an", "Fast Solution Methods for the Classical 0\u20131 Knapsack Problem", "Digital-Twin-Driven Predictive Maintenance and Fault-Toleran"]}
{"ts": "2026-10-09T06:30:15Z", "decision": "keep", "before_score": 0.9071, "after_score": 0.9071, "delta": 0.0, "mutation": "authored_hockey_stick__pell_companion_w1", "kind": "hard_enable", "note": "Kept `authored_hockey_stick__pell_companion_w1` (hard_enable): lemma score 0.9071\u21920.9071 checks 66\u219267 hard_pass 56\u219257 (machine-checked + Oracle pass; not novel discovery). | oracle=PASS fitness_credit=True kills=[] | novelty_gate novel=True kills=[]", "themes": ["Bi-FORK: Generative Modeling of High-Dimensional Bifurcating", "The Sociolinguistics of Machine Identity: LLM Personality an", "Fast Solution Methods for the Classical 0\u20131 Knapsack Problem", "Digital-Twin-Driven Predictive Maintenance and Fault-Toleran"]}
{"ts": "2026-10-09T06:32:12Z", "decision": "skip", "before_score": 0.9071, "after_score": 0.9071, "delta": 0.0, "mutation": "", "kind": "", "note": "No pending hard-tier lemma mutations (catalog exhausted or empty). Cooled/blocked skipped: ['easy_pad_abs_identity', 'easy_pad_assoc_add', 'easy_pad_commutativity', 'easy_pad_diff_squares', 'easy_pad_square_again', 'easy_pad_zero_identity', 'stem_easy_pad_units', 'vandermonde_asymmetric'].", "themes": ["Bi-FORK: Generative Modeling of High-Dimensional Bifurcating", "The Sociolinguistics of Machine Identity: LLM Personality an", "Fast Solution Methods for the Classical 0\u20131 Knapsack Problem", "Digital-Twin-Driven Predictive Maintenance and Fault-Toleran"]}
{"ts": "2026-10-09T06:32:50Z", "decision": "skip", "before_score": 0.9071, "after_score": 0.9071, "delta": 0.0, "mutation": "", "kind": "", "note": "No pending hard-tier lemma mutations (catalog exhausted or empty). Cooled/blocked skipped: ['easy_pad_abs_identity', 'easy_pad_assoc_add', 'easy_pad_commutativity', 'easy_pad_diff_squares', 'easy_pad_square_again', 'easy_pad_zero_identity', 'stem_easy_pad_units', 'vandermonde_asymmetric'].", "themes": ["Bi-FORK: Generative Modeling of High-Dimensional Bifurcating", "The Sociolinguistics of Machine Identity: LLM Personality an", "Fast Solution Methods for the Classical 0\u20131 Knapsack Problem", "Digital-Twin-Driven Predictive Maintenance and Fault-Toleran"]}
{"ts": "2026-10-09T06:33:27Z", "decision": "skip", "before_score": 0.9071, "after_score": 0.9071, "delta": 0.0, "mutation": "", "kind": "", "note": "No pending hard-tier lemma mutations (catalog exhausted or empty). Cooled/blocked skipped: ['easy_pad_abs_identity', 'easy_pad_assoc_add', 'easy_pad_commutativity', 'easy_pad_diff_squares', 'easy_pad_square_again', 'easy_pad_zero_identity', 'stem_easy_pad_units', 'vandermonde_asymmetric'].", "themes": ["Bi-FORK: Generative Modeling of High-Dimensional Bifurcating", "The Sociolinguistics of Machine Identity: LLM Personality an", "Fast Solution Methods for the Classical 0\u20131 Knapsack Problem", "Digital-Twin-Driven Predictive Maintenance and Fault-Toleran"]}
{"ts": "2026-10-09T06:55:50Z", "decision": "skip", "before_score": 0.9071, "after_score": 0.9071, "delta": 0.0, "mutation": "", "kind": "", "note": "No pending hard-tier lemma mutations (catalog exhausted or empty). Cooled/blocked skipped: ['easy_pad_abs_identity', 'easy_pad_assoc_add', 'easy_pad_commutativity', 'easy_pad_diff_squares', 'easy_pad_square_again', 'easy_pad_zero_identity', 'stem_easy_pad_units', 'vandermonde_asymmetric'].", "themes": ["Bi-FORK: Generative Modeling of High-Dimensional Bifurcating", "The Sociolinguistics of Machine Identity: LLM Personality an", "Fast Solution Methods for the Classical 0\u20131 Knapsack Problem", "Digital-Twin-Driven Predictive Maintenance and Fault-Toleran"]}
{"ts": "2026-10-09T06:56:31Z", "decision": "skip", "before_score": 0.9071, "after_score": 0.9071, "delta": 0.0, "mutation": "", "kind": "", "note": "No pending hard-tier lemma mutations (catalog exhausted or empty). Cooled/blocked skipped: ['easy_pad_abs_identity', 'easy_pad_assoc_add', 'easy_pad_commutativity', 'easy_pad_diff_squares', 'easy_pad_square_again', 'easy_pad_zero_identity', 'stem_easy_pad_units', 'vandermonde_asymmetric'].", "themes": ["Bi-FORK: Generative Modeling of High-Dimensional Bifurcating", "The Sociolinguistics of Machine Identity: LLM Personality an", "Fast Solution Methods for the Classical 0\u20131 Knapsack Problem", "Digital-Twin-Driven Predictive Maintenance and Fault-Toleran"]}
{"ts": "2026-10-09T06:57:01Z", "decision": "skip", "before_score": 0.9071, "after_score": 0.9071, "delta": 0.0, "mutation": "", "kind": "", "note": "No pending hard-tier lemma mutations (catalog exhausted or empty). Cooled/blocked skipped: ['easy_pad_abs_identity', 'easy_pad_assoc_add', 'easy_pad_commutativity', 'easy_pad_diff_squares', 'easy_pad_square_again', 'easy_pad_zero_identity', 'stem_easy_pad_units', 'vandermonde_asymmetric'].", "themes": ["Bi-FORK: Generative Modeling of High-Dimensional Bifurcating", "The Sociolinguistics of Machine Identity: LLM Personality an", "Fast Solution Methods for the Classical 0\u20131 Knapsack Problem", "Digital-Twin-Driven Predictive Maintenance and Fault-Toleran"]}
{"ts": "2026-10-09T07:53:28Z", "decision": "skip", "before_score": 0.9071, "after_score": 0.9071, "delta": 0.0, "mutation": "", "kind": "", "note": "No pending hard-tier lemma mutations (catalog exhausted or empty). Cooled/blocked skipped: ['easy_pad_abs_identity', 'easy_pad_assoc_add', 'easy_pad_commutativity', 'easy_pad_diff_squares', 'easy_pad_square_again', 'easy_pad_zero_identity', 'stem_easy_pad_units', 'vandermonde_asymmetric']. Authored new disabled checks: ['authored_pascal_identity__pythagorean_generation_w1'].", "themes": ["Bi-FORK: Generative Modeling of High-Dimensional Bifurcating", "The Sociolinguistics of Machine Identity: LLM Personality an", "Fast Solution Methods for the Classical 0\u20131 Knapsack Problem", "Digital-Twin-Driven Predictive Maintenance and Fault-Toleran"]}
{"ts": "2026-10-09T07:54:10Z", "decision": "keep", "before_score": 0.9071, "after_score": 0.9071, "delta": 0.0, "mutation": "authored_pascal_identity__pythagorean_generation_w1", "kind": "hard_enable", "note": "Kept `authored_pascal_identity__pythagorean_generation_w1` (hard_enable): lemma score 0.9071\u21920.9071 checks 67\u219268 hard_pass 57\u219258 (machine-checked + Oracle pass; not novel discovery). | oracle=PASS fitness_credit=True kills=[] | novelty_gate novel=False kills=['textbook_reuse=0.6667']", "themes": ["Bi-FORK: Generative Modeling of High-Dimensional Bifurcating", "The Sociolinguistics of Machine Identity: LLM Personality an", "Fast Solution Methods for the Classical 0\u20131 Knapsack Problem", "Digital-Twin-Driven Predictive Maintenance and Fault-Toleran"], "why_believe": {"components": ["check_pascal_identity", "check_pythagorean_generation"], "ranges_tested": {"g0": {"n": [16, 22], "k": "dependent"}, "g1": {"u": [16, 22], "v": "dependent"}}, "challenger": "Challenger not broken: 4868 probes (boundary 153, far 2178, sample 2537, edge 0; seed 132457147611423) in 0.10s", "challenger_blocked": false, "seed": 132457147611423, "text": "Believe `authored_pascal_identity__pythagorean_generation_w1`: components check_pascal_identity, check_pythagorean_generation; ranges tested {\"g0\": {\"k\": \"dependent\", \"n\": [16, 22]}, \"g1\": {\"u\": [16, 22], \"v\": \"dependent\"}}; Challenger not broken: 4868 probes (boundary 153, far 2178, sample 2537, edge 0; seed 132457147611423) in 0.10s.", "generated_by": "colony.challenger", "free_text_from_feeds": false, "before_score": 0.9071, "after_score": 0.9071, "hard_pass_delta": 1}, "self_rejected": false}
{"ts": "2026-10-09T07:54:52Z", "decision": "skip", "before_score": 0.9071, "after_score": 0.9071, "delta": 0.0, "mutation": "", "kind": "", "note": "No pending hard-tier lemma mutations (catalog exhausted or empty). Cooled/blocked skipped: ['easy_pad_abs_identity', 'easy_pad_assoc_add', 'easy_pad_commutativity', 'easy_pad_diff_squares', 'easy_pad_square_again', 'easy_pad_zero_identity', 'stem_easy_pad_units', 'vandermonde_asymmetric']. Authored new disabled checks: ['authored_sum_first_n_cubes__vandermonde_conv_w1'].", "themes": ["Bi-FORK: Generative Modeling of High-Dimensional Bifurcating", "The Sociolinguistics of Machine Identity: LLM Personality an", "Fast Solution Methods for the Classical 0\u20131 Knapsack Problem", "Digital-Twin-Driven Predictive Maintenance and Fault-Toleran"]}
