{"ts": "2026-09-28T23:26:09Z", "decision": "skip", "before_score": 0.825, "after_score": 0.825, "delta": 0.0, "mutation": "", "kind": "", "note": "No pending hard-tier lemma mutations (catalog exhausted or empty).", "themes": ["First-Order Stationarity of Reverse Diffusions", "Formal groups and $(\\varphi,\u0393)$-modules", "The Sociolinguistics of Machine Identity: LLM Personality an", "Fast Solution Methods for the Classical 0\u20131 Knapsack Problem"]}
{"ts": "2026-09-29T05:57:11Z", "decision": "skip", "before_score": 0.825, "after_score": 0.825, "delta": 0.0, "mutation": "", "kind": "", "note": "No pending hard-tier lemma mutations (catalog exhausted or empty).", "themes": ["TokenCast: Forecasting Token Consumption During LLM Agent Ex", "Statistical Learning of Contractive Dynamical Representation", "The Sociolinguistics of Machine Identity: LLM Personality an", "Fast Solution Methods for the Classical 0\u20131 Knapsack Problem"]}
{"ts": "2026-09-29T05:57:36Z", "decision": "skip", "before_score": 0.825, "after_score": 0.825, "delta": 0.0, "mutation": "", "kind": "", "note": "No pending hard-tier lemma mutations (catalog exhausted or empty).", "themes": ["TokenCast: Forecasting Token Consumption During LLM Agent Ex", "Statistical Learning of Contractive Dynamical Representation", "The Sociolinguistics of Machine Identity: LLM Personality an", "Fast Solution Methods for the Classical 0\u20131 Knapsack Problem"]}
{"ts": "2026-09-29T05:58:10Z", "decision": "skip", "before_score": 0.825, "after_score": 0.825, "delta": 0.0, "mutation": "", "kind": "", "note": "No pending hard-tier lemma mutations (catalog exhausted or empty).", "themes": ["TokenCast: Forecasting Token Consumption During LLM Agent Ex", "Statistical Learning of Contractive Dynamical Representation", "The Sociolinguistics of Machine Identity: LLM Personality an", "Fast Solution Methods for the Classical 0\u20131 Knapsack Problem"]}
{"ts": "2026-09-29T13:11:28Z", "decision": "skip", "before_score": 0.825, "after_score": 0.825, "delta": 0.0, "mutation": "", "kind": "", "note": "No pending hard-tier lemma mutations (catalog exhausted or empty).", "themes": ["Attention Is All You Need", "G\u00f6del Machines: Fully Self-Referential Optimal Universal Sel", "Reflexion: Language Agents with Verbal Reinforcement Learnin", "Darwin G\u00f6del Machine: Open-Ended Evolution of Self-Improving"]}
{"ts": "2026-09-29T13:12:08Z", "decision": "skip", "before_score": 0.825, "after_score": 0.825, "delta": 0.0, "mutation": "", "kind": "", "note": "No pending hard-tier lemma mutations (catalog exhausted or empty).", "themes": ["AI Safety via Debate", "PDMD: Projected Distribution Matching Distillation for Video", "Hamiltonicity of mildly pseudorandom regular graphs", "Unifying Distributional Training for One-Step Visual Generat"]}
{"ts": "2026-09-29T13:12:47Z", "decision": "skip", "before_score": 0.825, "after_score": 0.825, "delta": 0.0, "mutation": "", "kind": "", "note": "No pending hard-tier lemma mutations (catalog exhausted or empty).", "themes": ["AI Safety via Debate", "PDMD: Projected Distribution Matching Distillation for Video", "Hamiltonicity of mildly pseudorandom regular graphs", "Unifying Distributional Training for One-Step Visual Generat"]}
{"ts": "2026-09-29T22:28:21Z", "decision": "skip", "before_score": 0.825, "after_score": 0.825, "delta": 0.0, "mutation": "", "kind": "", "note": "No pending hard-tier lemma mutations (catalog exhausted or empty).", "themes": ["TokenCast: Forecasting Token Consumption During LLM Agent Ex", "Statistical Learning of Contractive Dynamical Representation", "The Sociolinguistics of Machine Identity: LLM Personality an", "Fast Solution Methods for the Classical 0\u20131 Knapsack Problem"]}
{"ts": "2026-09-29T22:28:45Z", "decision": "skip", "before_score": 0.825, "after_score": 0.825, "delta": 0.0, "mutation": "", "kind": "", "note": "No pending hard-tier lemma mutations (catalog exhausted or empty).", "themes": ["TokenCast: Forecasting Token Consumption During LLM Agent Ex", "Statistical Learning of Contractive Dynamical Representation", "The Sociolinguistics of Machine Identity: LLM Personality an", "Fast Solution Methods for the Classical 0\u20131 Knapsack Problem"]}
{"ts": "2026-09-29T22:29:22Z", "decision": "skip", "before_score": 0.825, "after_score": 0.825, "delta": 0.0, "mutation": "", "kind": "", "note": "No pending hard-tier lemma mutations (catalog exhausted or empty).", "themes": ["TokenCast: Forecasting Token Consumption During LLM Agent Ex", "Statistical Learning of Contractive Dynamical Representation", "The Sociolinguistics of Machine Identity: LLM Personality an", "Fast Solution Methods for the Classical 0\u20131 Knapsack Problem"]}
{"ts": "2026-09-30T05:47:22Z", "decision": "skip", "before_score": 0.825, "after_score": 0.825, "delta": 0.0, "mutation": "", "kind": "", "note": "No pending hard-tier lemma mutations (catalog exhausted or empty).", "themes": ["LeapQuant: Efficient Linear Attention with Accurate Recurren", "Cropland PAtteRNS: Parallel Dimensional Attention Networks a", "The Sociolinguistics of Machine Identity: LLM Personality an", "Fast Solution Methods for the Classical 0\u20131 Knapsack Problem"]}
{"ts": "2026-09-30T05:47:51Z", "decision": "skip", "before_score": 0.825, "after_score": 0.825, "delta": 0.0, "mutation": "", "kind": "", "note": "No pending hard-tier lemma mutations (catalog exhausted or empty).", "themes": ["LeapQuant: Efficient Linear Attention with Accurate Recurren", "Cropland PAtteRNS: Parallel Dimensional Attention Networks a", "The Sociolinguistics of Machine Identity: LLM Personality an", "Fast Solution Methods for the Classical 0\u20131 Knapsack Problem"]}
{"ts": "2026-09-30T05:48:17Z", "decision": "skip", "before_score": 0.825, "after_score": 0.825, "delta": 0.0, "mutation": "", "kind": "", "note": "No pending hard-tier lemma mutations (catalog exhausted or empty).", "themes": ["LeapQuant: Efficient Linear Attention with Accurate Recurren", "Cropland PAtteRNS: Parallel Dimensional Attention Networks a", "The Sociolinguistics of Machine Identity: LLM Personality an", "Fast Solution Methods for the Classical 0\u20131 Knapsack Problem"]}
{"ts": "2026-09-30T12:51:47Z", "decision": "skip", "before_score": 0.825, "after_score": 0.825, "delta": 0.0, "mutation": "", "kind": "", "note": "No pending hard-tier lemma mutations (catalog exhausted or empty).", "themes": ["Skill-Space Shooting for Autonomous Robot Policy Improvement", "Breakdown of Local Denoising as Semantic Speciation", "STEPQuant: When and Where Errors Matter in Delta-Rule Recurr", "LeapQuant: Efficient Linear Attention with Accurate Recurren"]}
{"ts": "2026-09-30T12:52:28Z", "decision": "skip", "before_score": 0.825, "after_score": 0.825, "delta": 0.0, "mutation": "", "kind": "", "note": "No pending hard-tier lemma mutations (catalog exhausted or empty).", "themes": ["LeapQuant: Efficient Linear Attention with Accurate Recurren", "Cropland PAtteRNS: Parallel Dimensional Attention Networks a", "The Sociolinguistics of Machine Identity: LLM Personality an", "Fast Solution Methods for the Classical 0\u20131 Knapsack Problem"]}
{"ts": "2026-09-30T12:52:54Z", "decision": "skip", "before_score": 0.825, "after_score": 0.825, "delta": 0.0, "mutation": "", "kind": "", "note": "No pending hard-tier lemma mutations (catalog exhausted or empty).", "themes": ["AI Safety via Debate", "Skill-Space Shooting for Autonomous Robot Policy Improvement", "Breakdown of Local Denoising as Semantic Speciation", "STEPQuant: When and Where Errors Matter in Delta-Rule Recurr"]}
{"ts": "2026-09-30T22:27:15Z", "decision": "skip", "before_score": 0.825, "after_score": 0.825, "delta": 0.0, "mutation": "", "kind": "", "note": "No pending hard-tier lemma mutations (catalog exhausted or empty).", "themes": ["LeapQuant: Efficient Linear Attention with Accurate Recurren", "Cropland PAtteRNS: Parallel Dimensional Attention Networks a", "The Sociolinguistics of Machine Identity: LLM Personality an", "Fast Solution Methods for the Classical 0\u20131 Knapsack Problem"]}
{"ts": "2026-09-30T22:27:39Z", "decision": "skip", "before_score": 0.825, "after_score": 0.825, "delta": 0.0, "mutation": "", "kind": "", "note": "No pending hard-tier lemma mutations (catalog exhausted or empty).", "themes": ["LeapQuant: Efficient Linear Attention with Accurate Recurren", "Cropland PAtteRNS: Parallel Dimensional Attention Networks a", "The Sociolinguistics of Machine Identity: LLM Personality an", "Fast Solution Methods for the Classical 0\u20131 Knapsack Problem"]}
{"ts": "2026-09-30T22:28:14Z", "decision": "skip", "before_score": 0.825, "after_score": 0.825, "delta": 0.0, "mutation": "", "kind": "", "note": "No pending hard-tier lemma mutations (catalog exhausted or empty).", "themes": ["LeapQuant: Efficient Linear Attention with Accurate Recurren", "Cropland PAtteRNS: Parallel Dimensional Attention Networks a", "The Sociolinguistics of Machine Identity: LLM Personality an", "Fast Solution Methods for the Classical 0\u20131 Knapsack Problem"]}
{"ts": "2026-10-01T06:15:56Z", "decision": "skip", "before_score": 0.825, "after_score": 0.825, "delta": 0.0, "mutation": "", "kind": "", "note": "No pending hard-tier lemma mutations (catalog exhausted or empty).", "themes": ["Image Classifiers are Efficient Self-Supervised Video Repres", "Gibbs Sampling in the Shattered Phase by Decoded Quantum Int", "The Sociolinguistics of Machine Identity: LLM Personality an", "Fast Solution Methods for the Classical 0\u20131 Knapsack Problem"]}
{"ts": "2026-10-01T06:16:32Z", "decision": "skip", "before_score": 0.825, "after_score": 0.825, "delta": 0.0, "mutation": "", "kind": "", "note": "No pending hard-tier lemma mutations (catalog exhausted or empty).", "themes": ["Image Classifiers are Efficient Self-Supervised Video Repres", "Gibbs Sampling in the Shattered Phase by Decoded Quantum Int", "The Sociolinguistics of Machine Identity: LLM Personality an", "Fast Solution Methods for the Classical 0\u20131 Knapsack Problem"]}
{"ts": "2026-10-01T06:16:57Z", "decision": "skip", "before_score": 0.825, "after_score": 0.825, "delta": 0.0, "mutation": "", "kind": "", "note": "No pending hard-tier lemma mutations (catalog exhausted or empty).", "themes": ["Image Classifiers are Efficient Self-Supervised Video Repres", "Gibbs Sampling in the Shattered Phase by Decoded Quantum Int", "The Sociolinguistics of Machine Identity: LLM Personality an", "Fast Solution Methods for the Classical 0\u20131 Knapsack Problem"]}
{"ts": "2026-10-01T13:38:57Z", "decision": "skip", "before_score": 0.825, "after_score": 0.825, "delta": 0.0, "mutation": "", "kind": "", "note": "No pending hard-tier lemma mutations (catalog exhausted or empty).", "themes": ["Image Classifiers are Efficient Self-Supervised Video Repres", "Gibbs Sampling in the Shattered Phase by Decoded Quantum Int", "The Sociolinguistics of Machine Identity: LLM Personality an", "Fast Solution Methods for the Classical 0\u20131 Knapsack Problem"]}
{"ts": "2026-10-01T13:39:19Z", "decision": "skip", "before_score": 0.825, "after_score": 0.825, "delta": 0.0, "mutation": "", "kind": "", "note": "No pending hard-tier lemma mutations (catalog exhausted or empty).", "themes": ["Image Classifiers are Efficient Self-Supervised Video Repres", "Gibbs Sampling in the Shattered Phase by Decoded Quantum Int", "The Sociolinguistics of Machine Identity: LLM Personality an", "Fast Solution Methods for the Classical 0\u20131 Knapsack Problem"]}
{"ts": "2026-10-01T13:39:41Z", "decision": "skip", "before_score": 0.825, "after_score": 0.825, "delta": 0.0, "mutation": "", "kind": "", "note": "No pending hard-tier lemma mutations (catalog exhausted or empty).", "themes": ["Image Classifiers are Efficient Self-Supervised Video Repres", "Gibbs Sampling in the Shattered Phase by Decoded Quantum Int", "The Sociolinguistics of Machine Identity: LLM Personality an", "Fast Solution Methods for the Classical 0\u20131 Knapsack Problem"]}
{"ts": "2026-10-01T22:48:59Z", "decision": "skip", "before_score": 0.825, "after_score": 0.825, "delta": 0.0, "mutation": "", "kind": "", "note": "No pending hard-tier lemma mutations (catalog exhausted or empty).", "themes": ["Image Classifiers are Efficient Self-Supervised Video Repres", "Gibbs Sampling in the Shattered Phase by Decoded Quantum Int", "The Sociolinguistics of Machine Identity: LLM Personality an", "Fast Solution Methods for the Classical 0\u20131 Knapsack Problem"]}
{"ts": "2026-10-01T22:49:35Z", "decision": "skip", "before_score": 0.825, "after_score": 0.825, "delta": 0.0, "mutation": "", "kind": "", "note": "No pending hard-tier lemma mutations (catalog exhausted or empty).", "themes": ["Image Classifiers are Efficient Self-Supervised Video Repres", "Gibbs Sampling in the Shattered Phase by Decoded Quantum Int", "The Sociolinguistics of Machine Identity: LLM Personality an", "Fast Solution Methods for the Classical 0\u20131 Knapsack Problem"]}
{"ts": "2026-10-01T22:49:59Z", "decision": "skip", "before_score": 0.825, "after_score": 0.825, "delta": 0.0, "mutation": "", "kind": "", "note": "No pending hard-tier lemma mutations (catalog exhausted or empty).", "themes": ["Image Classifiers are Efficient Self-Supervised Video Repres", "Gibbs Sampling in the Shattered Phase by Decoded Quantum Int", "The Sociolinguistics of Machine Identity: LLM Personality an", "Fast Solution Methods for the Classical 0\u20131 Knapsack Problem"]}
{"ts": "2026-10-02T05:57:09Z", "decision": "skip", "before_score": 0.825, "after_score": 0.825, "delta": 0.0, "mutation": "", "kind": "", "note": "No pending hard-tier lemma mutations (catalog exhausted or empty).", "themes": ["TACO: Ternary Absolute-max Column-wise One-sparse Optimizer ", "FERPO: Forward Entropy-Regularized Policy Optimization", "The Sociolinguistics of Machine Identity: LLM Personality an", "Fast Solution Methods for the Classical 0\u20131 Knapsack Problem"]}
{"ts": "2026-10-02T05:57:31Z", "decision": "skip", "before_score": 0.825, "after_score": 0.825, "delta": 0.0, "mutation": "", "kind": "", "note": "No pending hard-tier lemma mutations (catalog exhausted or empty).", "themes": ["TACO: Ternary Absolute-max Column-wise One-sparse Optimizer ", "FERPO: Forward Entropy-Regularized Policy Optimization", "The Sociolinguistics of Machine Identity: LLM Personality an", "Fast Solution Methods for the Classical 0\u20131 Knapsack Problem"]}
{"ts": "2026-10-02T05:57:52Z", "decision": "skip", "before_score": 0.825, "after_score": 0.825, "delta": 0.0, "mutation": "", "kind": "", "note": "No pending hard-tier lemma mutations (catalog exhausted or empty).", "themes": ["TACO: Ternary Absolute-max Column-wise One-sparse Optimizer ", "FERPO: Forward Entropy-Regularized Policy Optimization", "The Sociolinguistics of Machine Identity: LLM Personality an", "Fast Solution Methods for the Classical 0\u20131 Knapsack Problem"]}
{"ts": "2026-10-02T12:57:07Z", "decision": "skip", "before_score": 0.825, "after_score": 0.825, "delta": 0.0, "mutation": "", "kind": "", "note": "No pending hard-tier lemma mutations (catalog exhausted or empty).", "themes": ["TACO: Ternary Absolute-max Column-wise One-sparse Optimizer ", "FERPO: Forward Entropy-Regularized Policy Optimization", "The Sociolinguistics of Machine Identity: LLM Personality an", "Fast Solution Methods for the Classical 0\u20131 Knapsack Problem"]}
{"ts": "2026-10-02T12:57:44Z", "decision": "skip", "before_score": 0.825, "after_score": 0.825, "delta": 0.0, "mutation": "", "kind": "", "note": "No pending hard-tier lemma mutations (catalog exhausted or empty).", "themes": ["TACO: Ternary Absolute-max Column-wise One-sparse Optimizer ", "FERPO: Forward Entropy-Regularized Policy Optimization", "The Sociolinguistics of Machine Identity: LLM Personality an", "Fast Solution Methods for the Classical 0\u20131 Knapsack Problem"]}
{"ts": "2026-10-02T12:58:09Z", "decision": "skip", "before_score": 0.825, "after_score": 0.825, "delta": 0.0, "mutation": "", "kind": "", "note": "No pending hard-tier lemma mutations (catalog exhausted or empty).", "themes": ["TACO: Ternary Absolute-max Column-wise One-sparse Optimizer ", "FERPO: Forward Entropy-Regularized Policy Optimization", "The Sociolinguistics of Machine Identity: LLM Personality an", "Fast Solution Methods for the Classical 0\u20131 Knapsack Problem"]}
{"ts": "2026-10-02T22:25:02Z", "decision": "skip", "before_score": 0.825, "after_score": 0.825, "delta": 0.0, "mutation": "", "kind": "", "note": "No pending hard-tier lemma mutations (catalog exhausted or empty).", "themes": ["TACO: Ternary Absolute-max Column-wise One-sparse Optimizer ", "FERPO: Forward Entropy-Regularized Policy Optimization", "The Sociolinguistics of Machine Identity: LLM Personality an", "Fast Solution Methods for the Classical 0\u20131 Knapsack Problem"]}
{"ts": "2026-10-02T22:25:27Z", "decision": "skip", "before_score": 0.825, "after_score": 0.825, "delta": 0.0, "mutation": "", "kind": "", "note": "No pending hard-tier lemma mutations (catalog exhausted or empty).", "themes": ["TACO: Ternary Absolute-max Column-wise One-sparse Optimizer ", "FERPO: Forward Entropy-Regularized Policy Optimization", "The Sociolinguistics of Machine Identity: LLM Personality an", "Fast Solution Methods for the Classical 0\u20131 Knapsack Problem"]}
{"ts": "2026-10-02T22:25:56Z", "decision": "skip", "before_score": 0.825, "after_score": 0.825, "delta": 0.0, "mutation": "", "kind": "", "note": "No pending hard-tier lemma mutations (catalog exhausted or empty).", "themes": ["TACO: Ternary Absolute-max Column-wise One-sparse Optimizer ", "FERPO: Forward Entropy-Regularized Policy Optimization", "The Sociolinguistics of Machine Identity: LLM Personality an", "Fast Solution Methods for the Classical 0\u20131 Knapsack Problem"]}
{"ts": "2026-10-03T05:32:28Z", "decision": "skip", "before_score": 0.825, "after_score": 0.825, "delta": 0.0, "mutation": "", "kind": "", "note": "No pending hard-tier lemma mutations (catalog exhausted or empty).", "themes": ["TACO: Ternary Absolute-max Column-wise One-sparse Optimizer ", "FERPO: Forward Entropy-Regularized Policy Optimization", "The Sociolinguistics of Machine Identity: LLM Personality an", "Fast Solution Methods for the Classical 0\u20131 Knapsack Problem"]}
{"ts": "2026-10-03T05:32:57Z", "decision": "skip", "before_score": 0.825, "after_score": 0.825, "delta": 0.0, "mutation": "", "kind": "", "note": "No pending hard-tier lemma mutations (catalog exhausted or empty).", "themes": ["TACO: Ternary Absolute-max Column-wise One-sparse Optimizer ", "FERPO: Forward Entropy-Regularized Policy Optimization", "The Sociolinguistics of Machine Identity: LLM Personality an", "Fast Solution Methods for the Classical 0\u20131 Knapsack Problem"]}
{"ts": "2026-10-03T05:33:24Z", "decision": "skip", "before_score": 0.825, "after_score": 0.825, "delta": 0.0, "mutation": "", "kind": "", "note": "No pending hard-tier lemma mutations (catalog exhausted or empty).", "themes": ["TACO: Ternary Absolute-max Column-wise One-sparse Optimizer ", "FERPO: Forward Entropy-Regularized Policy Optimization", "The Sociolinguistics of Machine Identity: LLM Personality an", "Fast Solution Methods for the Classical 0\u20131 Knapsack Problem"]}
{"ts": "2026-10-03T11:52:14Z", "decision": "skip", "before_score": 0.825, "after_score": 0.825, "delta": 0.0, "mutation": "", "kind": "", "note": "No pending hard-tier lemma mutations (catalog exhausted or empty).", "themes": ["TACO: Ternary Absolute-max Column-wise One-sparse Optimizer ", "FERPO: Forward Entropy-Regularized Policy Optimization", "The Sociolinguistics of Machine Identity: LLM Personality an", "Fast Solution Methods for the Classical 0\u20131 Knapsack Problem"]}
{"ts": "2026-10-03T11:52:53Z", "decision": "skip", "before_score": 0.825, "after_score": 0.825, "delta": 0.0, "mutation": "", "kind": "", "note": "No pending hard-tier lemma mutations (catalog exhausted or empty).", "themes": ["TACO: Ternary Absolute-max Column-wise One-sparse Optimizer ", "FERPO: Forward Entropy-Regularized Policy Optimization", "The Sociolinguistics of Machine Identity: LLM Personality an", "Fast Solution Methods for the Classical 0\u20131 Knapsack Problem"]}
{"ts": "2026-10-03T11:53:20Z", "decision": "skip", "before_score": 0.825, "after_score": 0.825, "delta": 0.0, "mutation": "", "kind": "", "note": "No pending hard-tier lemma mutations (catalog exhausted or empty).", "themes": ["TACO: Ternary Absolute-max Column-wise One-sparse Optimizer ", "FERPO: Forward Entropy-Regularized Policy Optimization", "The Sociolinguistics of Machine Identity: LLM Personality an", "Fast Solution Methods for the Classical 0\u20131 Knapsack Problem"]}
{"ts": "2026-10-03T16:33:53Z", "decision": "skip", "before_score": 0.825, "after_score": 0.825, "delta": 0.0, "mutation": "", "kind": "", "note": "No pending hard-tier lemma mutations (catalog exhausted or empty).", "themes": ["TACO: Ternary Absolute-max Column-wise One-sparse Optimizer ", "FERPO: Forward Entropy-Regularized Policy Optimization", "The Sociolinguistics of Machine Identity: LLM Personality an", "Fast Solution Methods for the Classical 0\u20131 Knapsack Problem"]}
{"ts": "2026-10-03T16:34:28Z", "decision": "skip", "before_score": 0.825, "after_score": 0.825, "delta": 0.0, "mutation": "", "kind": "", "note": "No pending hard-tier lemma mutations (catalog exhausted or empty).", "themes": ["TACO: Ternary Absolute-max Column-wise One-sparse Optimizer ", "FERPO: Forward Entropy-Regularized Policy Optimization", "The Sociolinguistics of Machine Identity: LLM Personality an", "Fast Solution Methods for the Classical 0\u20131 Knapsack Problem"]}
