{"ts": "2026-10-07T11:36:00Z", "decision": "revert", "before_score": 0.9071, "after_score": 0.9071, "delta": 0.0, "mutation": "easy_pad_assoc_add", "kind": "easy_pad", "note": "Reverted `easy_pad_assoc_add` (easy_pad): score 0.9071\u21920.9229 ok=True hard_pass 29\u219229 \u2014 Oracle/hard-tier required for keep; easy pads die on Oracle. | oracle=KILL fitness_credit=False kills=['stripped:easy_pad_baseline_already_useful', 'held_out:easy_pad_dies_on_held_out', 'cas:easy_pad_fails_cas_usefulness', 'easy_pad_oracle_kill', 'collective_kill']", "themes": ["New algebraic points on covers of elliptic curves", "The Sociolinguistics of Machine Identity: LLM Personality an", "Fast Solution Methods for the Classical 0\u20131 Knapsack Problem", "Digital-Twin-Driven Predictive Maintenance and Fault-Toleran"]}
{"ts": "2026-10-07T13:40:45Z", "decision": "revert", "before_score": 0.9071, "after_score": 0.9071, "delta": 0.0, "mutation": "easy_pad_assoc_add", "kind": "easy_pad", "note": "Reverted `easy_pad_assoc_add` (easy_pad): score 0.9071\u21920.9229 ok=True hard_pass 29\u219229 \u2014 Oracle/hard-tier required for keep; easy pads die on Oracle. | oracle=KILL fitness_credit=False kills=['stripped:easy_pad_baseline_already_useful', 'held_out:easy_pad_dies_on_held_out', 'cas:easy_pad_fails_cas_usefulness', 'easy_pad_oracle_kill', 'collective_kill']", "themes": ["New algebraic points on covers of elliptic curves", "The Sociolinguistics of Machine Identity: LLM Personality an", "Fast Solution Methods for the Classical 0\u20131 Knapsack Problem", "Digital-Twin-Driven Predictive Maintenance and Fault-Toleran"]}
{"ts": "2026-10-07T13:41:22Z", "decision": "revert", "before_score": 0.9071, "after_score": 0.9071, "delta": 0.0, "mutation": "easy_pad_assoc_add", "kind": "easy_pad", "note": "Reverted `easy_pad_assoc_add` (easy_pad): score 0.9071\u21920.9229 ok=True hard_pass 29\u219229 \u2014 Oracle/hard-tier required for keep; easy pads die on Oracle. | oracle=KILL fitness_credit=False kills=['stripped:easy_pad_baseline_already_useful', 'held_out:easy_pad_dies_on_held_out', 'cas:easy_pad_fails_cas_usefulness', 'easy_pad_oracle_kill', 'collective_kill']", "themes": ["New algebraic points on covers of elliptic curves", "The Sociolinguistics of Machine Identity: LLM Personality an", "Fast Solution Methods for the Classical 0\u20131 Knapsack Problem", "Digital-Twin-Driven Predictive Maintenance and Fault-Toleran"]}
{"ts": "2026-10-07T13:41:48Z", "decision": "revert", "before_score": 0.9071, "after_score": 0.9071, "delta": 0.0, "mutation": "easy_pad_zero_identity", "kind": "easy_pad", "note": "Reverted `easy_pad_zero_identity` (easy_pad): score 0.9071\u21920.9229 ok=True hard_pass 29\u219229 \u2014 Oracle/hard-tier required for keep; easy pads die on Oracle. | oracle=KILL fitness_credit=False kills=['stripped:easy_pad_baseline_already_useful', 'held_out:easy_pad_dies_on_held_out', 'cas:easy_pad_fails_cas_usefulness', 'easy_pad_oracle_kill', 'collective_kill']", "themes": ["New algebraic points on covers of elliptic curves", "The Sociolinguistics of Machine Identity: LLM Personality an", "Fast Solution Methods for the Classical 0\u20131 Knapsack Problem", "Digital-Twin-Driven Predictive Maintenance and Fault-Toleran"]}
{"ts": "2026-10-07T13:59:50Z", "decision": "revert", "before_score": 0.9071, "after_score": 0.9071, "delta": 0.0, "mutation": "easy_pad_zero_identity", "kind": "easy_pad", "note": "Reverted `easy_pad_zero_identity` (easy_pad): score 0.9071\u21920.9229 ok=True hard_pass 29\u219229 \u2014 Oracle/hard-tier required for keep; easy pads die on Oracle. | oracle=KILL fitness_credit=False kills=['stripped:easy_pad_baseline_already_useful', 'held_out:easy_pad_dies_on_held_out', 'cas:easy_pad_fails_cas_usefulness', 'easy_pad_oracle_kill', 'collective_kill']", "themes": ["New algebraic points on covers of elliptic curves", "The Sociolinguistics of Machine Identity: LLM Personality an", "Fast Solution Methods for the Classical 0\u20131 Knapsack Problem", "Digital-Twin-Driven Predictive Maintenance and Fault-Toleran"]}
{"ts": "2026-10-07T14:00:32Z", "decision": "revert", "before_score": 0.9071, "after_score": 0.9071, "delta": 0.0, "mutation": "easy_pad_zero_identity", "kind": "easy_pad", "note": "Reverted `easy_pad_zero_identity` (easy_pad): score 0.9071\u21920.9229 ok=True hard_pass 29\u219229 \u2014 Oracle/hard-tier required for keep; easy pads die on Oracle. | oracle=KILL fitness_credit=False kills=['stripped:easy_pad_baseline_already_useful', 'held_out:easy_pad_dies_on_held_out', 'cas:easy_pad_fails_cas_usefulness', 'easy_pad_oracle_kill', 'collective_kill']", "themes": ["New algebraic points on covers of elliptic curves", "The Sociolinguistics of Machine Identity: LLM Personality an", "Fast Solution Methods for the Classical 0\u20131 Knapsack Problem", "Digital-Twin-Driven Predictive Maintenance and Fault-Toleran"]}
{"ts": "2026-10-07T14:01:15Z", "decision": "revert", "before_score": 0.9071, "after_score": 0.9071, "delta": 0.0, "mutation": "easy_pad_square_again", "kind": "easy_pad", "note": "Reverted `easy_pad_square_again` (easy_pad): score 0.9071\u21920.9229 ok=True hard_pass 29\u219229 \u2014 Oracle/hard-tier required for keep; easy pads die on Oracle. | oracle=KILL fitness_credit=False kills=['stripped:easy_pad_baseline_already_useful', 'held_out:easy_pad_dies_on_held_out', 'cas:easy_pad_fails_cas_usefulness', 'easy_pad_oracle_kill', 'collective_kill']", "themes": ["New algebraic points on covers of elliptic curves", "The Sociolinguistics of Machine Identity: LLM Personality an", "Fast Solution Methods for the Classical 0\u20131 Knapsack Problem", "Digital-Twin-Driven Predictive Maintenance and Fault-Toleran"]}
{"ts": "2026-10-07T18:01:56Z", "decision": "revert", "before_score": 0.9071, "after_score": 0.9071, "delta": 0.0, "mutation": "easy_pad_square_again", "kind": "easy_pad", "note": "Reverted `easy_pad_square_again` (easy_pad): score 0.9071\u21920.9229 ok=True hard_pass 29\u219229 \u2014 Oracle/hard-tier required for keep; easy pads die on Oracle. | oracle=KILL fitness_credit=False kills=['stripped:easy_pad_baseline_already_useful', 'held_out:easy_pad_dies_on_held_out', 'cas:easy_pad_fails_cas_usefulness', 'easy_pad_oracle_kill', 'collective_kill']", "themes": ["New algebraic points on covers of elliptic curves", "The Sociolinguistics of Machine Identity: LLM Personality an", "Fast Solution Methods for the Classical 0\u20131 Knapsack Problem", "Digital-Twin-Driven Predictive Maintenance and Fault-Toleran"]}
{"ts": "2026-10-07T18:02:37Z", "decision": "revert", "before_score": 0.9071, "after_score": 0.9071, "delta": 0.0, "mutation": "easy_pad_square_again", "kind": "easy_pad", "note": "Reverted `easy_pad_square_again` (easy_pad): score 0.9071\u21920.9229 ok=True hard_pass 29\u219229 \u2014 Oracle/hard-tier required for keep; easy pads die on Oracle. | oracle=KILL fitness_credit=False kills=['stripped:easy_pad_baseline_already_useful', 'held_out:easy_pad_dies_on_held_out', 'cas:easy_pad_fails_cas_usefulness', 'easy_pad_oracle_kill', 'collective_kill']", "themes": ["New algebraic points on covers of elliptic curves", "The Sociolinguistics of Machine Identity: LLM Personality an", "Fast Solution Methods for the Classical 0\u20131 Knapsack Problem", "Digital-Twin-Driven Predictive Maintenance and Fault-Toleran"]}
{"ts": "2026-10-07T18:03:17Z", "decision": "revert", "before_score": 0.9071, "after_score": 0.9071, "delta": 0.0, "mutation": "easy_pad_diff_squares", "kind": "easy_pad", "note": "Reverted `easy_pad_diff_squares` (easy_pad): score 0.9071\u21920.9229 ok=True hard_pass 29\u219229 \u2014 Oracle/hard-tier required for keep; easy pads die on Oracle. | oracle=KILL fitness_credit=False kills=['stripped:easy_pad_baseline_already_useful', 'held_out:easy_pad_dies_on_held_out', 'cas:easy_pad_fails_cas_usefulness', 'easy_pad_oracle_kill', 'collective_kill']", "themes": ["New algebraic points on covers of elliptic curves", "The Sociolinguistics of Machine Identity: LLM Personality an", "Fast Solution Methods for the Classical 0\u20131 Knapsack Problem", "Digital-Twin-Driven Predictive Maintenance and Fault-Toleran"]}
{"ts": "2026-10-07T19:52:29Z", "decision": "revert", "before_score": 0.9071, "after_score": 0.9071, "delta": 0.0, "mutation": "easy_pad_diff_squares", "kind": "easy_pad", "note": "Reverted `easy_pad_diff_squares` (easy_pad): score 0.9071\u21920.9229 ok=True hard_pass 29\u219229 \u2014 Oracle/hard-tier required for keep; easy pads die on Oracle. | oracle=KILL fitness_credit=False kills=['stripped:easy_pad_baseline_already_useful', 'held_out:easy_pad_dies_on_held_out', 'cas:easy_pad_fails_cas_usefulness', 'easy_pad_oracle_kill', 'collective_kill']", "themes": ["New algebraic points on covers of elliptic curves", "The Sociolinguistics of Machine Identity: LLM Personality an", "Fast Solution Methods for the Classical 0\u20131 Knapsack Problem", "Digital-Twin-Driven Predictive Maintenance and Fault-Toleran"]}
{"ts": "2026-10-07T19:53:11Z", "decision": "revert", "before_score": 0.9071, "after_score": 0.9071, "delta": 0.0, "mutation": "easy_pad_diff_squares", "kind": "easy_pad", "note": "Reverted `easy_pad_diff_squares` (easy_pad): score 0.9071\u21920.9229 ok=True hard_pass 29\u219229 \u2014 Oracle/hard-tier required for keep; easy pads die on Oracle. | oracle=KILL fitness_credit=False kills=['stripped:easy_pad_baseline_already_useful', 'held_out:easy_pad_dies_on_held_out', 'cas:easy_pad_fails_cas_usefulness', 'easy_pad_oracle_kill', 'collective_kill']", "themes": ["New algebraic points on covers of elliptic curves", "The Sociolinguistics of Machine Identity: LLM Personality an", "Fast Solution Methods for the Classical 0\u20131 Knapsack Problem", "Digital-Twin-Driven Predictive Maintenance and Fault-Toleran"]}
{"ts": "2026-10-07T19:53:51Z", "decision": "revert", "before_score": 0.9071, "after_score": 0.9071, "delta": 0.0, "mutation": "easy_pad_commutativity", "kind": "easy_pad", "note": "Reverted `easy_pad_commutativity` (easy_pad): score 0.9071\u21920.9229 ok=True hard_pass 29\u219229 \u2014 Oracle/hard-tier required for keep; easy pads die on Oracle. | oracle=KILL fitness_credit=False kills=['stripped:easy_pad_baseline_already_useful', 'held_out:easy_pad_dies_on_held_out', 'cas:easy_pad_fails_cas_usefulness', 'easy_pad_oracle_kill', 'collective_kill']", "themes": ["New algebraic points on covers of elliptic curves", "The Sociolinguistics of Machine Identity: LLM Personality an", "Fast Solution Methods for the Classical 0\u20131 Knapsack Problem", "Digital-Twin-Driven Predictive Maintenance and Fault-Toleran"]}
{"ts": "2026-10-07T20:08:21Z", "decision": "keep", "before_score": 0.9071, "after_score": 0.9071, "delta": 0.0, "mutation": "adversarial_hockey_deep", "kind": "hard_enable", "note": "Kept `adversarial_hockey_deep` (hard_enable): lemma score 0.9071\u21920.9071 checks 39\u219240 hard_pass 29\u219230 (machine-checked + Oracle pass; not novel discovery). | oracle=PASS fitness_credit=True kills=[]", "themes": ["New algebraic points on covers of elliptic curves", "The Sociolinguistics of Machine Identity: LLM Personality an", "Fast Solution Methods for the Classical 0\u20131 Knapsack Problem", "Digital-Twin-Driven Predictive Maintenance and Fault-Toleran"]}
{"ts": "2026-10-07T20:09:01Z", "decision": "keep", "before_score": 0.9071, "after_score": 0.9071, "delta": 0.0, "mutation": "adversarial_cassini_ext", "kind": "hard_enable", "note": "Kept `adversarial_cassini_ext` (hard_enable): lemma score 0.9071\u21920.9071 checks 40\u219241 hard_pass 30\u219231 (machine-checked + Oracle pass; not novel discovery). | oracle=PASS fitness_credit=True kills=[]", "themes": ["New algebraic points on covers of elliptic curves", "The Sociolinguistics of Machine Identity: LLM Personality an", "Fast Solution Methods for the Classical 0\u20131 Knapsack Problem", "Digital-Twin-Driven Predictive Maintenance and Fault-Toleran"]}
{"ts": "2026-10-07T20:09:27Z", "decision": "keep", "before_score": 0.9071, "after_score": 0.9071, "delta": 0.0, "mutation": "adversarial_catalan_convolution_stress", "kind": "hard_enable", "note": "Kept `adversarial_catalan_convolution_stress` (hard_enable): lemma score 0.9071\u21920.9071 checks 41\u219242 hard_pass 31\u219232 (machine-checked + Oracle pass; not novel discovery). | oracle=PASS fitness_credit=True kills=[]", "themes": ["New algebraic points on covers of elliptic curves", "The Sociolinguistics of Machine Identity: LLM Personality an", "Fast Solution Methods for the Classical 0\u20131 Knapsack Problem", "Digital-Twin-Driven Predictive Maintenance and Fault-Toleran"]}
{"ts": "2026-10-07T20:19:54Z", "decision": "keep", "before_score": 0.9071, "after_score": 0.9071, "delta": 0.0, "mutation": "adversarial_derived_chain_stress", "kind": "hard_enable", "note": "Kept `adversarial_derived_chain_stress` (hard_enable): lemma score 0.9071\u21920.9071 checks 42\u219243 hard_pass 32\u219233 (machine-checked + Oracle pass; not novel discovery). | oracle=PASS fitness_credit=True kills=[]", "themes": ["New algebraic points on covers of elliptic curves", "The Sociolinguistics of Machine Identity: LLM Personality an", "Fast Solution Methods for the Classical 0\u20131 Knapsack Problem", "Digital-Twin-Driven Predictive Maintenance and Fault-Toleran"]}
{"ts": "2026-10-07T20:20:35Z", "decision": "revert", "before_score": 0.9071, "after_score": 0.9071, "delta": 0.0, "mutation": "easy_pad_commutativity", "kind": "easy_pad", "note": "Reverted `easy_pad_commutativity` (easy_pad): score 0.9071\u21920.9229 ok=True hard_pass 33\u219233 \u2014 Oracle/hard-tier required for keep; easy pads die on Oracle. | oracle=KILL fitness_credit=False kills=['stripped:easy_pad_baseline_already_useful', 'held_out:easy_pad_dies_on_held_out', 'cas:easy_pad_fails_cas_usefulness', 'easy_pad_oracle_kill', 'collective_kill']", "themes": ["New algebraic points on covers of elliptic curves", "The Sociolinguistics of Machine Identity: LLM Personality an", "Fast Solution Methods for the Classical 0\u20131 Knapsack Problem", "Digital-Twin-Driven Predictive Maintenance and Fault-Toleran"]}
{"ts": "2026-10-07T20:21:15Z", "decision": "revert", "before_score": 0.9071, "after_score": 0.9071, "delta": 0.0, "mutation": "easy_pad_commutativity", "kind": "easy_pad", "note": "Reverted `easy_pad_commutativity` (easy_pad): score 0.9071\u21920.9229 ok=True hard_pass 33\u219233 \u2014 Oracle/hard-tier required for keep; easy pads die on Oracle. | oracle=KILL fitness_credit=False kills=['stripped:easy_pad_baseline_already_useful', 'held_out:easy_pad_dies_on_held_out', 'cas:easy_pad_fails_cas_usefulness', 'easy_pad_oracle_kill', 'collective_kill']", "themes": ["New algebraic points on covers of elliptic curves", "The Sociolinguistics of Machine Identity: LLM Personality an", "Fast Solution Methods for the Classical 0\u20131 Knapsack Problem", "Digital-Twin-Driven Predictive Maintenance and Fault-Toleran"]}
{"ts": "2026-10-07T20:23:27Z", "decision": "revert", "before_score": 0.9071, "after_score": 0.9071, "delta": 0.0, "mutation": "easy_pad_abs_identity", "kind": "easy_pad", "note": "Reverted `easy_pad_abs_identity` (easy_pad): score 0.9071\u21920.9229 ok=True hard_pass 33\u219233 \u2014 Oracle/hard-tier required for keep; easy pads die on Oracle. | oracle=KILL fitness_credit=False kills=['stripped:easy_pad_baseline_already_useful', 'held_out:easy_pad_dies_on_held_out', 'cas:easy_pad_fails_cas_usefulness', 'easy_pad_oracle_kill', 'collective_kill']", "themes": ["New algebraic points on covers of elliptic curves", "The Sociolinguistics of Machine Identity: LLM Personality an", "Fast Solution Methods for the Classical 0\u20131 Knapsack Problem", "Digital-Twin-Driven Predictive Maintenance and Fault-Toleran"]}
{"ts": "2026-10-07T20:24:06Z", "decision": "revert", "before_score": 0.9071, "after_score": 0.9071, "delta": 0.0, "mutation": "easy_pad_abs_identity", "kind": "easy_pad", "note": "Reverted `easy_pad_abs_identity` (easy_pad): score 0.9071\u21920.9229 ok=True hard_pass 33\u219233 \u2014 Oracle/hard-tier required for keep; easy pads die on Oracle. | oracle=KILL fitness_credit=False kills=['stripped:easy_pad_baseline_already_useful', 'held_out:easy_pad_dies_on_held_out', 'cas:easy_pad_fails_cas_usefulness', 'easy_pad_oracle_kill', 'collective_kill']", "themes": ["New algebraic points on covers of elliptic curves", "The Sociolinguistics of Machine Identity: LLM Personality an", "Fast Solution Methods for the Classical 0\u20131 Knapsack Problem", "Digital-Twin-Driven Predictive Maintenance and Fault-Toleran"]}
{"ts": "2026-10-07T20:24:35Z", "decision": "revert", "before_score": 0.9071, "after_score": 0.9071, "delta": 0.0, "mutation": "easy_pad_abs_identity", "kind": "easy_pad", "note": "Reverted `easy_pad_abs_identity` (easy_pad): score 0.9071\u21920.9229 ok=True hard_pass 33\u219233 \u2014 Oracle/hard-tier required for keep; easy pads die on Oracle. | oracle=KILL fitness_credit=False kills=['stripped:easy_pad_baseline_already_useful', 'held_out:easy_pad_dies_on_held_out', 'cas:easy_pad_fails_cas_usefulness', 'easy_pad_oracle_kill', 'collective_kill']", "themes": ["New algebraic points on covers of elliptic curves", "The Sociolinguistics of Machine Identity: LLM Personality an", "Fast Solution Methods for the Classical 0\u20131 Knapsack Problem", "Digital-Twin-Driven Predictive Maintenance and Fault-Toleran"]}
{"ts": "2026-10-07T20:33:01Z", "decision": "skip", "before_score": 0.9071, "after_score": 0.9071, "delta": 0.0, "mutation": "", "kind": "", "note": "No pending hard-tier lemma mutations (catalog exhausted or empty).", "themes": ["New algebraic points on covers of elliptic curves", "The Sociolinguistics of Machine Identity: LLM Personality an", "Fast Solution Methods for the Classical 0\u20131 Knapsack Problem", "Digital-Twin-Driven Predictive Maintenance and Fault-Toleran"]}
{"ts": "2026-10-07T20:33:41Z", "decision": "keep", "before_score": 0.9071, "after_score": 0.9071, "delta": 0.0, "mutation": "authored_bell_triangle_recurrence__binomial_inversion_small_w1", "kind": "hard_enable", "note": "Kept `authored_bell_triangle_recurrence__binomial_inversion_small_w1` (hard_enable): lemma score 0.9071\u21920.9071 checks 43\u219244 hard_pass 33\u219234 (machine-checked + Oracle pass; not novel discovery). | oracle=PASS fitness_credit=True kills=[]", "themes": ["New algebraic points on covers of elliptic curves", "The Sociolinguistics of Machine Identity: LLM Personality an", "Fast Solution Methods for the Classical 0\u20131 Knapsack Problem", "Digital-Twin-Driven Predictive Maintenance and Fault-Toleran"]}
{"ts": "2026-10-07T20:34:21Z", "decision": "skip", "before_score": 0.9071, "after_score": 0.9071, "delta": 0.0, "mutation": "", "kind": "", "note": "No pending hard-tier lemma mutations (catalog exhausted or empty).", "themes": ["New algebraic points on covers of elliptic curves", "The Sociolinguistics of Machine Identity: LLM Personality an", "Fast Solution Methods for the Classical 0\u20131 Knapsack Problem", "Digital-Twin-Driven Predictive Maintenance and Fault-Toleran"]}
{"ts": "2026-10-07T21:48:22Z", "decision": "keep", "before_score": 0.9071, "after_score": 0.9071, "delta": 0.0, "mutation": "authored_binomial_sum_row__catalan_bounded_w1", "kind": "hard_enable", "note": "Kept `authored_binomial_sum_row__catalan_bounded_w1` (hard_enable): lemma score 0.9071\u21920.9071 checks 44\u219245 hard_pass 34\u219235 (machine-checked + Oracle pass; not novel discovery). | oracle=PASS fitness_credit=True kills=[]", "themes": ["New algebraic points on covers of elliptic curves", "The Sociolinguistics of Machine Identity: LLM Personality an", "Fast Solution Methods for the Classical 0\u20131 Knapsack Problem", "Digital-Twin-Driven Predictive Maintenance and Fault-Toleran"]}
{"ts": "2026-10-07T21:48:56Z", "decision": "skip", "before_score": 0.9071, "after_score": 0.9071, "delta": 0.0, "mutation": "", "kind": "", "note": "No pending hard-tier lemma mutations (catalog exhausted or empty).", "themes": ["New algebraic points on covers of elliptic curves", "The Sociolinguistics of Machine Identity: LLM Personality an", "Fast Solution Methods for the Classical 0\u20131 Knapsack Problem", "Digital-Twin-Driven Predictive Maintenance and Fault-Toleran"]}
{"ts": "2026-10-07T21:49:16Z", "decision": "keep", "before_score": 0.9071, "after_score": 0.9071, "delta": 0.0, "mutation": "authored_oeis_a000108__catalan_bounded", "kind": "hard_enable", "note": "Kept `authored_oeis_a000108__catalan_bounded` (hard_enable): lemma score 0.9071\u21920.9071 checks 45\u219246 hard_pass 35\u219236 (machine-checked + Oracle pass; not novel discovery). | oracle=PASS fitness_credit=True kills=[]", "themes": ["New algebraic points on covers of elliptic curves", "The Sociolinguistics of Machine Identity: LLM Personality an", "Fast Solution Methods for the Classical 0\u20131 Knapsack Problem", "Digital-Twin-Driven Predictive Maintenance and Fault-Toleran"]}
{"ts": "2026-10-07T21:51:15Z", "decision": "skip", "before_score": 0.9071, "after_score": 0.9071, "delta": 0.0, "mutation": "", "kind": "", "note": "No pending hard-tier lemma mutations (catalog exhausted or empty).", "themes": ["New algebraic points on covers of elliptic curves", "The Sociolinguistics of Machine Identity: LLM Personality an", "Fast Solution Methods for the Classical 0\u20131 Knapsack Problem", "Digital-Twin-Driven Predictive Maintenance and Fault-Toleran"]}
