{"ts": "2026-10-08T07:42:55Z", "cycle_id": "20261008T074243Z_325a70", "decision": "keep", "mutation": "authored_sum_first_n_cubes__stirling_second_row_w1", "kind": "hard_enable", "before_score": 0.9071, "after_score": 0.9071, "note": "Kept `authored_sum_first_n_cubes__stirling_second_row_w1` (hard_enable): lemma score 0.9071→0.9071 checks 56→57 hard_pass 46→47 (machine-checked + Oracle pass; not novel discovery). | oracle=PASS fitness_credit=True kills=[] | novelty_gate novel=True kills=[]", "paper_cites": ["arxiv:2610.10519"], "lesson_cites": ["les_Z_cd6b48_authored_sum_first_n_cubes__stirlin"], "status": "candidate", "not_discovery": true}
{"ts": "2026-10-08T07:43:35Z", "cycle_id": "20261008T074322Z_0ae0f2", "decision": "revert", "mutation": "easy_pad_square_again", "kind": "easy_pad", "before_score": 0.9071, "after_score": 0.9071, "note": "Reverted `easy_pad_square_again` (easy_pad): score 0.9071→0.9229 ok=True hard_pass 47→47 — Oracle/hard-tier required for keep; easy pads die on Oracle. | oracle=KILL fitness_credit=False kills=['stripped:easy_pad_baseline_already_useful', 'held_out:easy_pad_dies_on_held_out', 'cas:easy_pad_fails_cas_usefulness', 'easy_pad_oracle_kill', 'collective_kill'] | novelty_gate novel=False kills=['already_in_lesson_ledger_or_history', 'textbook_reuse=1.0', 'stripped_baseline_does_not_fail_usefulness', 'h", "paper_cites": ["arxiv:2610.10519"], "lesson_cites": [], "status": "candidate", "not_discovery": true}
{"ts": "2026-10-08T07:44:14Z", "cycle_id": "20261008T074402Z_7993a3", "decision": "keep", "mutation": "authored_sum_first_n_odds__vandermonde_conv_w1", "kind": "hard_enable", "before_score": 0.9071, "after_score": 0.9071, "note": "Kept `authored_sum_first_n_odds__vandermonde_conv_w1` (hard_enable): lemma score 0.9071→0.9071 checks 57→58 hard_pass 47→48 (machine-checked + Oracle pass; not novel discovery). | oracle=PASS fitness_credit=True kills=[] | novelty_gate novel=False kills=['textbook_reuse=0.6667']", "paper_cites": ["arxiv:2610.10519"], "lesson_cites": ["les_Z_0ae0f2_authored_sum_first_n_odds__vandermo"], "status": "candidate", "not_discovery": true}
{"ts": "2026-10-08T07:46:38Z", "cycle_id": "20261008T074626Z_117d44", "decision": "revert", "mutation": "easy_pad_diff_squares", "kind": "easy_pad", "before_score": 0.9071, "after_score": 0.9071, "note": "Reverted `easy_pad_diff_squares` (easy_pad): score 0.9071→0.9229 ok=True hard_pass 48→48 — Oracle/hard-tier required for keep; easy pads die on Oracle. | oracle=KILL fitness_credit=False kills=['stripped:easy_pad_baseline_already_useful', 'held_out:easy_pad_dies_on_held_out', 'cas:easy_pad_fails_cas_usefulness', 'easy_pad_oracle_kill', 'collective_kill'] | novelty_gate novel=False kills=['already_in_lesson_ledger_or_history', 'textbook_reuse=1.0', 'stripped_baseline_does_not_fail_usefulness', 'h", "paper_cites": ["arxiv:2610.10519"], "lesson_cites": [], "status": "candidate", "not_discovery": true}
{"ts": "2026-10-08T07:47:18Z", "cycle_id": "20261008T074706Z_a30a0b", "decision": "keep", "mutation": "authored_bell_triangle_recurrence__hermite_recurrence_w1", "kind": "hard_enable", "before_score": 0.9071, "after_score": 0.9071, "note": "Kept `authored_bell_triangle_recurrence__hermite_recurrence_w1` (hard_enable): lemma score 0.9071→0.9071 checks 58→59 hard_pass 48→49 (machine-checked + Oracle pass; not novel discovery). | oracle=PASS fitness_credit=True kills=[] | novelty_gate novel=True kills=[]", "paper_cites": ["arxiv:2610.10519"], "lesson_cites": ["les_Z_117d44_authored_bell_triangle_recurrence__"], "status": "candidate", "not_discovery": true}
{"ts": "2026-10-08T07:47:59Z", "cycle_id": "20261008T074746Z_c23c2b", "decision": "revert", "mutation": "easy_pad_commutativity", "kind": "easy_pad", "before_score": 0.9071, "after_score": 0.9071, "note": "Reverted `easy_pad_commutativity` (easy_pad): score 0.9071→0.9229 ok=True hard_pass 49→49 — Oracle/hard-tier required for keep; easy pads die on Oracle. | oracle=KILL fitness_credit=False kills=['stripped:easy_pad_baseline_already_useful', 'held_out:easy_pad_dies_on_held_out', 'cas:easy_pad_fails_cas_usefulness', 'easy_pad_oracle_kill', 'collective_kill'] | novelty_gate novel=False kills=['already_in_lesson_ledger_or_history', 'textbook_reuse=1.0', 'stripped_baseline_does_not_fail_usefulness', '", "paper_cites": ["arxiv:2610.10519"], "lesson_cites": [], "status": "candidate", "not_discovery": true}
{"ts": "2026-10-08T13:53:46Z", "cycle_id": "20261008T135334Z_a7097d", "decision": "keep", "mutation": "authored_binomial_inversion_small__legendre_duplication_small_w1", "kind": "hard_enable", "before_score": 0.9071, "after_score": 0.9071, "note": "Kept `authored_binomial_inversion_small__legendre_duplication_small_w1` (hard_enable): lemma score 0.9071→0.9071 checks 59→60 hard_pass 49→50 (machine-checked + Oracle pass; not novel discovery). | oracle=PASS fitness_credit=True kills=[] | novelty_gate novel=True kills=[]", "paper_cites": ["arxiv:2610.10519"], "lesson_cites": ["les_Z_c23c2b_authored_binomial_inversion_small__"], "status": "candidate", "not_discovery": true}
{"ts": "2026-10-08T13:54:20Z", "cycle_id": "20261008T135408Z_028d68", "decision": "revert", "mutation": "easy_pad_abs_identity", "kind": "easy_pad", "before_score": 0.9071, "after_score": 0.9071, "note": "Reverted `easy_pad_abs_identity` (easy_pad): score 0.9071→0.9229 ok=True hard_pass 50→50 — Oracle/hard-tier required for keep; easy pads die on Oracle. | oracle=KILL fitness_credit=False kills=['stripped:easy_pad_baseline_already_useful', 'held_out:easy_pad_dies_on_held_out', 'cas:easy_pad_fails_cas_usefulness', 'easy_pad_oracle_kill', 'collective_kill'] | novelty_gate novel=False kills=['already_in_lesson_ledger_or_history', 'textbook_reuse=1.0', 'stripped_baseline_does_not_fail_usefulness', 'h", "paper_cites": ["arxiv:2610.10519"], "lesson_cites": [], "status": "candidate", "not_discovery": true}
{"ts": "2026-10-08T13:54:42Z", "cycle_id": "20261008T135430Z_7f846b", "decision": "keep", "mutation": "authored_oeis_a000079__binomial_sum_row", "kind": "hard_enable", "before_score": 0.9071, "after_score": 0.9071, "note": "Kept `authored_oeis_a000079__binomial_sum_row` (hard_enable): lemma score 0.9071→0.9071 checks 60→61 hard_pass 50→51 (machine-checked + Oracle pass; not novel discovery). | oracle=PASS fitness_credit=True kills=[] | novelty_gate novel=True kills=[]", "paper_cites": ["arxiv:2610.10519"], "lesson_cites": ["les_Z_028d68_authored_oeis_a000079__binomial_sum"], "status": "candidate", "not_discovery": true}
{"ts": "2026-10-08T23:29:33Z", "cycle_id": "20261008T232923Z_313183", "decision": "revert", "mutation": "easy_pad_diff_squares", "kind": "easy_pad", "before_score": 0.9071, "after_score": 0.9071, "note": "Reverted `easy_pad_diff_squares` (easy_pad): score 0.9071→0.9229 ok=True hard_pass 51→51 — Oracle/hard-tier required for keep; easy pads die on Oracle. | oracle=KILL fitness_credit=False kills=['stripped:easy_pad_baseline_already_useful', 'held_out:easy_pad_dies_on_held_out', 'cas:easy_pad_fails_cas_usefulness', 'easy_pad_oracle_kill', 'collective_kill'] | novelty_gate novel=False kills=['already_in_lesson_ledger_or_history', 'textbook_reuse=1.0', 'stripped_baseline_does_not_fail_usefulness', 'h", "paper_cites": ["arxiv:2610.10519"], "lesson_cites": [], "status": "candidate", "not_discovery": true}
{"ts": "2026-10-08T23:30:07Z", "cycle_id": "20261008T232959Z_47d89b", "decision": "keep", "mutation": "authored_binomial_symmetry__cassini_w1", "kind": "hard_enable", "before_score": 0.9071, "after_score": 0.9071, "note": "Kept `authored_binomial_symmetry__cassini_w1` (hard_enable): lemma score 0.9071→0.9071 checks 61→62 hard_pass 51→52 (machine-checked + Oracle pass; not novel discovery). | oracle=PASS fitness_credit=True kills=[] | novelty_gate novel=False kills=['textbook_reuse=0.6667']", "paper_cites": ["arxiv:2610.10519"], "lesson_cites": ["les_Z_313183_authored_binomial_symmetry__cassini"], "status": "candidate", "not_discovery": true}
{"ts": "2026-10-08T23:30:44Z", "cycle_id": "20261008T233036Z_83aa56", "decision": "revert", "mutation": "easy_pad_diff_squares", "kind": "easy_pad", "before_score": 0.9071, "after_score": 0.9071, "note": "Reverted `easy_pad_diff_squares` (easy_pad): score 0.9071→0.9229 ok=True hard_pass 52→52 — Oracle/hard-tier required for keep; easy pads die on Oracle. | oracle=KILL fitness_credit=False kills=['stripped:easy_pad_baseline_already_useful', 'held_out:easy_pad_dies_on_held_out', 'cas:easy_pad_fails_cas_usefulness', 'easy_pad_oracle_kill', 'collective_kill'] | novelty_gate novel=False kills=['already_in_lesson_ledger_or_history', 'textbook_reuse=1.0', 'stripped_baseline_does_not_fail_usefulness', 'h", "paper_cites": ["arxiv:2610.10519"], "lesson_cites": [], "status": "candidate", "not_discovery": true}
{"ts": "2026-10-09T06:15:43Z", "cycle_id": "20261009T061530Z_118ffc", "decision": "keep", "mutation": "authored_catalan_convolution__derangement_subfactorial_w1", "kind": "hard_enable", "before_score": 0.9071, "after_score": 0.9071, "note": "Kept `authored_catalan_convolution__derangement_subfactorial_w1` (hard_enable): lemma score 0.9071→0.9071 checks 62→63 hard_pass 52→53 (machine-checked + Oracle pass; not novel discovery). | oracle=PASS fitness_credit=True kills=[] | novelty_gate novel=True kills=[]", "paper_cites": ["arxiv:2610.12449"], "lesson_cites": ["les_Z_83aa56_authored_catalan_convolution__deran"], "status": "candidate", "not_discovery": true}
{"ts": "2026-10-09T06:16:52Z", "cycle_id": "20261009T061639Z_0cd410", "decision": "keep", "mutation": "authored_fibonacci_addition__euler_totient_multiplicative_w1", "kind": "hard_enable", "before_score": 0.9071, "after_score": 0.9071, "note": "Kept `authored_fibonacci_addition__euler_totient_multiplicative_w1` (hard_enable): lemma score 0.9071→0.9071 checks 63→64 hard_pass 53→54 (machine-checked + Oracle pass; not novel discovery). | oracle=PASS fitness_credit=True kills=[] | novelty_gate novel=True kills=[]", "paper_cites": ["arxiv:2610.12449"], "lesson_cites": ["les_Z_d2b424_authored_fibonacci_addition__euler_"], "status": "candidate", "not_discovery": true}
{"ts": "2026-10-09T06:26:30Z", "cycle_id": "20261009T062617Z_5224de", "decision": "keep", "mutation": "authored_gcd_fibonacci__motzkin_bounded_w1", "kind": "hard_enable", "before_score": 0.9071, "after_score": 0.9071, "note": "Kept `authored_gcd_fibonacci__motzkin_bounded_w1` (hard_enable): lemma score 0.9071→0.9071 checks 64→65 hard_pass 54→55 (machine-checked + Oracle pass; not novel discovery). | oracle=PASS fitness_credit=True kills=[] | novelty_gate novel=True kills=[]", "paper_cites": ["arxiv:2610.12449"], "lesson_cites": ["les_Z_853302_authored_gcd_fibonacci__motzkin_bou"], "status": "candidate", "not_discovery": true}
{"ts": "2026-10-09T06:28:58Z", "cycle_id": "20261009T062846Z_a2e0dc", "decision": "keep", "mutation": "authored_geometric_sum__narayana_sum_w1", "kind": "hard_enable", "before_score": 0.9071, "after_score": 0.9071, "note": "Kept `authored_geometric_sum__narayana_sum_w1` (hard_enable): lemma score 0.9071→0.9071 checks 65→66 hard_pass 55→56 (machine-checked + Oracle pass; not novel discovery). | oracle=PASS fitness_credit=True kills=[] | novelty_gate novel=True kills=[]", "paper_cites": ["arxiv:2610.12449"], "lesson_cites": ["les_Z_fb8788_authored_geometric_sum__narayana_su"], "status": "candidate", "not_discovery": true}
{"ts": "2026-10-09T06:30:15Z", "cycle_id": "20261009T063004Z_64188e", "decision": "keep", "mutation": "authored_hockey_stick__pell_companion_w1", "kind": "hard_enable", "before_score": 0.9071, "after_score": 0.9071, "note": "Kept `authored_hockey_stick__pell_companion_w1` (hard_enable): lemma score 0.9071→0.9071 checks 66→67 hard_pass 56→57 (machine-checked + Oracle pass; not novel discovery). | oracle=PASS fitness_credit=True kills=[] | novelty_gate novel=True kills=[]", "paper_cites": ["arxiv:2610.12449"], "lesson_cites": ["les_Z_edcbc9_authored_hockey_stick__pell_compani"], "status": "candidate", "not_discovery": true}
{"ts": "2026-10-09T07:54:10Z", "cycle_id": "20261009T075357Z_8a1b00", "decision": "keep", "mutation": "authored_pascal_identity__pythagorean_generation_w1", "kind": "hard_enable", "before_score": 0.9071, "after_score": 0.9071, "note": "Kept `authored_pascal_identity__pythagorean_generation_w1` (hard_enable): lemma score 0.9071→0.9071 checks 67→68 hard_pass 57→58 (machine-checked + Oracle pass; not novel discovery). | oracle=PASS fitness_credit=True kills=[] | novelty_gate novel=False kills=['textbook_reuse=0.6667']", "paper_cites": ["arxiv:2610.12449"], "lesson_cites": ["les_Z_5eae58_authored_pascal_identity__pythagore"], "status": "candidate", "not_discovery": true}
{"ts": "2026-10-09T07:56:25Z", "cycle_id": "20261009T075608Z_b98392", "decision": "keep", "mutation": "authored_sum_first_n_cubes__vandermonde_conv_w1", "kind": "hard_enable", "before_score": 0.9071, "after_score": 0.9071, "note": "Kept `authored_sum_first_n_cubes__vandermonde_conv_w1` (hard_enable): lemma score 0.9071→0.9071 checks 68→69 hard_pass 58→59 (machine-checked + Oracle pass; not novel discovery). | oracle=PASS fitness_credit=True kills=[] | novelty_gate novel=False kills=['textbook_reuse=0.6667']", "paper_cites": ["arxiv:2610.12449"], "lesson_cites": ["les_Z_dd0e2a_authored_sum_first_n_cubes__vanderm"], "status": "candidate", "not_discovery": true}
{"ts": "2026-10-09T07:57:42Z", "cycle_id": "20261009T075729Z_3b4223", "decision": "keep", "mutation": "authored_sum_first_n_odds__stirling_second_row_w1", "kind": "hard_enable", "before_score": 0.9071, "after_score": 0.9071, "note": "Kept `authored_sum_first_n_odds__stirling_second_row_w1` (hard_enable): lemma score 0.9071→0.9071 checks 69→70 hard_pass 59→60 (machine-checked + Oracle pass; not novel discovery). | oracle=PASS fitness_credit=True kills=[] | novelty_gate novel=True kills=[]", "paper_cites": ["arxiv:2610.12449"], "lesson_cites": ["les_Z_cadb2a_authored_sum_first_n_odds__stirling"], "status": "candidate", "not_discovery": true}
{"ts": "2026-10-09T13:39:29Z", "cycle_id": "20261009T133914Z_4240dc", "decision": "keep", "mutation": "authored_bell_triangle_recurrence__legendre_duplication_small_w1", "kind": "hard_enable", "before_score": 0.9071, "after_score": 0.9071, "note": "Kept `authored_bell_triangle_recurrence__legendre_duplication_small_w1` (hard_enable): lemma score 0.9071→0.9071 checks 70→71 hard_pass 60→61 (machine-checked + Oracle pass; not novel discovery). | oracle=PASS fitness_credit=True kills=[] | novelty_gate novel=True kills=[]", "paper_cites": ["arxiv:2610.12449"], "lesson_cites": ["les_Z_0c6da3_authored_bell_triangle_recurrence__"], "status": "candidate", "not_discovery": true}
{"ts": "2026-10-09T22:47:29Z", "cycle_id": "20261009T224715Z_b91552", "decision": "keep", "mutation": "authored_binomial_sum_row__binomial_inversion_small_w1", "kind": "hard_enable", "before_score": 0.9071, "after_score": 0.9071, "note": "Kept `authored_binomial_sum_row__binomial_inversion_small_w1` (hard_enable): lemma score 0.9071→0.9071 checks 71→72 hard_pass 61→62 (machine-checked + Oracle pass; not novel discovery). | oracle=PASS fitness_credit=True kills=[] | novelty_gate novel=True kills=[]", "paper_cites": ["arxiv:2610.12449"], "lesson_cites": ["les_Z_6011fc_authored_binomial_sum_row__binomial"], "status": "candidate", "not_discovery": true}
{"ts": "2026-10-09T22:48:16Z", "cycle_id": "20261009T224803Z_fa9cbb", "decision": "keep", "mutation": "authored_binomial_symmetry__catalan_bounded_w1", "kind": "hard_enable", "before_score": 0.9071, "after_score": 0.9071, "note": "Kept `authored_binomial_symmetry__catalan_bounded_w1` (hard_enable): lemma score 0.9071→0.9071 checks 72→73 hard_pass 62→63 (machine-checked + Oracle pass; not novel discovery). | oracle=PASS fitness_credit=True kills=[] | novelty_gate novel=False kills=['textbook_reuse=0.6667']", "paper_cites": ["arxiv:2610.12449"], "lesson_cites": ["les_Z_af526f_authored_binomial_symmetry__catalan"], "status": "candidate", "not_discovery": true}
{"ts": "2026-10-10T06:09:31Z", "cycle_id": "20261010T060918Z_ddd43e", "decision": "keep", "mutation": "authored_cassini__catalan_convolution_w1", "kind": "hard_enable", "before_score": 0.9071, "after_score": 0.9071, "note": "Kept `authored_cassini__catalan_convolution_w1` (hard_enable): lemma score 0.9071→0.9071 checks 73→74 hard_pass 63→64 (machine-checked + Oracle pass; not novel discovery). | oracle=PASS fitness_credit=True kills=[] | novelty_gate novel=False kills=['textbook_reuse=0.6667']", "paper_cites": ["arxiv:2610.12449"], "lesson_cites": ["les_Z_41f12d_authored_cassini__catalan_convoluti"], "status": "candidate", "not_discovery": true}
{"ts": "2026-10-10T12:49:14Z", "cycle_id": "20261010T124901Z_7ea183", "decision": "keep", "mutation": "authored_central_binom_bound__euler_totient_multiplicative_w1", "kind": "hard_enable", "before_score": 0.9071, "after_score": 0.9071, "note": "Kept `authored_central_binom_bound__euler_totient_multiplicative_w1` (hard_enable): lemma score 0.9071→0.9071 checks 74→75 hard_pass 64→65 (machine-checked + Oracle pass; not novel discovery). | oracle=PASS fitness_credit=True kills=[] | novelty_gate novel=True kills=[]", "paper_cites": ["arxiv:2610.12449"], "lesson_cites": ["les_Z_bb8c32_authored_central_binom_bound__euler"], "status": "candidate", "not_discovery": true}
{"ts": "2026-10-10T12:50:37Z", "cycle_id": "20261010T125024Z_ebe49b", "decision": "keep", "mutation": "authored_derangement_subfactorial__hermite_recurrence_w1", "kind": "hard_enable", "before_score": 0.9071, "after_score": 0.9071, "note": "Kept `authored_derangement_subfactorial__hermite_recurrence_w1` (hard_enable): lemma score 0.9071→0.9071 checks 75→76 hard_pass 65→66 (machine-checked + Oracle pass; not novel discovery). | oracle=PASS fitness_credit=True kills=[] | novelty_gate novel=True kills=[]", "paper_cites": ["arxiv:2610.12449"], "lesson_cites": ["les_Z_f5e4e1_authored_derangement_subfactorial__"], "status": "candidate", "not_discovery": true}
{"ts": "2026-10-10T21:55:22Z", "cycle_id": "20261010T215514Z_c46a69", "decision": "keep", "mutation": "authored_fibonacci_addition__motzkin_bounded_w1", "kind": "hard_enable", "before_score": 0.9071, "after_score": 0.9071, "note": "Kept `authored_fibonacci_addition__motzkin_bounded_w1` (hard_enable): lemma score 0.9071→0.9071 checks 76→77 hard_pass 66→67 (machine-checked + Oracle pass; not novel discovery). | oracle=PASS fitness_credit=True kills=[] | novelty_gate novel=True kills=[]", "paper_cites": ["arxiv:2610.12449"], "lesson_cites": ["les_Z_675d45_authored_fibonacci_addition__motzki"], "status": "candidate", "not_discovery": true}
