{"id": "les_Z_41f12d_conjecture", "ts": "2026-10-10T06:08:49Z", "cycle_id": "20261010T060836Z_41f12d", "type": "catalog_exhausted", "decision": "skip", "check": "conjecture", "mutation": "", "what": "catalog exhausted — queue next hard_enable stub from lessons/external mind", "source": "conjecture_desk", "family": "hard_tier", "before_score": null, "after_score": null, "skill_bias": {}, "genome_prior": {}, "catalog_hint": {"avoid": ["vandermonde_asymmetric", "process_spam"], "drop_theme": ["vandermonde_asymmetric"], "seek": ["papers.jsonl", "ledger", "domain_bus", "arxiv"], "prefer": ["novelty", "cite_sources", "gather_before_propose", "drop_cooled_theme"], "add_mutation": "binomial_hockey_deep"}, "proposal_fingerprint": "", "tags": ["catalog_exhausted"], "evidence": [], "author": null, "expired": false, "status": "candidate"}
{"id": "les_Z_41f12d_vandermonde", "ts": "2026-10-10T06:08:50Z", "cycle_id": "20261010T060836Z_41f12d", "type": "skip", "decision": "skip", "check": "oracle_seen_claim", "mutation": "vandermonde", "what": "skip re-oracle of vandermonde:1706.03762", "source": "claim_pipeline", "family": "novelty", "before_score": null, "after_score": null, "skill_bias": {}, "genome_prior": {}, "catalog_hint": {}, "proposal_fingerprint": "vandermonde:1706.03762", "tags": ["repeat_claim"], "evidence": [], "author": null, "expired": false, "status": "candidate"}
{"id": "les_Z_41f12d_pilot", "ts": "2026-10-10T06:08:57Z", "cycle_id": "20261010T060836Z_41f12d", "type": "skip", "decision": "skip", "check": "pilot", "mutation": "", "what": "empty rsi_bias pilot suppressed", "source": "pilot_lane", "family": "rsi", "before_score": null, "after_score": null, "skill_bias": {}, "genome_prior": {}, "catalog_hint": {}, "proposal_fingerprint": "", "tags": ["empty_rsi_bias"], "evidence": [], "author": null, "expired": false, "status": "candidate"}
{"id": "les_Z_ddd43e_authored_cassini__catalan_convoluti", "ts": "2026-10-10T06:09:31Z", "cycle_id": "20261010T060918Z_ddd43e", "type": "keep", "decision": "keep", "check": "lemma_microbench", "mutation": "authored_cassini__catalan_convolution_w1", "what": "Kept `authored_cassini__catalan_convolution_w1` (hard_enable): lemma score 0.9071→0.9071 checks 73→74 hard_pass 63→64 (machine-checked + Oracle pass; not novel discovery). | oracle=PASS fitness_credit=True kills=[] | novelty_gate novel=False kills=['textbook_reuse=0.6667']", "source": "conjecture_desk", "family": "hard_enable", "before_score": 0.9071, "after_score": 0.9071, "skill_bias": {"geometer.gather": 0.08, "improver.improve": 0.06, "spark.emergence": 0.04}, "genome_prior": {}, "catalog_hint": {}, "proposal_fingerprint": "", "tags": ["lemma", "hard_enable", "keep"], "evidence": ["society/benchmarks/lemma_microbench.py", "artifacts:lemma_impl", "lesson:les_Z_41f12d_authored_cassini__catalan_convoluti"], "author": null, "expired": false, "status": "candidate"}
{"id": "les_Z_ddd43e_vandermonde", "ts": "2026-10-10T06:09:31Z", "cycle_id": "20261010T060918Z_ddd43e", "type": "skip", "decision": "skip", "check": "oracle_seen_claim", "mutation": "vandermonde", "what": "skip re-oracle of vandermonde:1706.03762", "source": "claim_pipeline", "family": "novelty", "before_score": null, "after_score": null, "skill_bias": {}, "genome_prior": {}, "catalog_hint": {}, "proposal_fingerprint": "vandermonde:1706.03762", "tags": ["repeat_claim"], "evidence": [], "author": null, "expired": false, "status": "candidate"}
{"id": "les_Z_ddd43e_pilot", "ts": "2026-10-10T06:09:38Z", "cycle_id": "20261010T060918Z_ddd43e", "type": "skip", "decision": "skip", "check": "pilot", "mutation": "", "what": "empty rsi_bias pilot suppressed", "source": "pilot_lane", "family": "rsi", "before_score": null, "after_score": null, "skill_bias": {}, "genome_prior": {}, "catalog_hint": {}, "proposal_fingerprint": "", "tags": ["empty_rsi_bias"], "evidence": [], "author": null, "expired": false, "status": "candidate"}
{"id": "les_6:10:08Z_Chain `lemma_hard_combinatorics` ci", "ts": "2026-10-10T06:10:08Z", "cycle_id": "", "type": "oracle_kill", "decision": "revert", "check": "oracle", "mutation": "Chain `lemma_hard_combinatorics` citing On two families of generalized Stirling numbers re", "what": "Oracle FAIL kills keep. kills=['stripped:stripped_not_useful_fail', 'held_out:held_out_fail', 'collective_kill']. No fitness credit.", "source": "novelty_gate", "family": "process", "before_score": null, "after_score": null, "skill_bias": {"improver.improve": 0.02, "geometer.gather": 0.02}, "genome_prior": {"explore": 0.02, "gather": 0.0}, "catalog_hint": {}, "proposal_fingerprint": "", "tags": ["oracle_kill", "stripped:stripped_not_useful_fail", "held_out:held_out_fail", "collective_kill"], "evidence": ["kill:stripped:stripped_not_useful_fail", "kill:held_out:held_out_fail", "kill:collective_kill"], "author": null, "expired": false, "status": "candidate"}
{"id": "les_6:10:10Z_Chain `lemma_hard_combinatorics` ci", "ts": "2026-10-10T06:10:10Z", "cycle_id": "", "type": "oracle_kill", "decision": "revert", "check": "oracle", "mutation": "Chain `lemma_hard_combinatorics` citing On two families of generalized Stirling numbers re (cycle 242)", "what": "Oracle FAIL kills keep. kills=['stripped:stripped_not_useful_fail', 'held_out:held_out_fail', 'collective_kill']. No fitness credit.", "source": "novelty_gate", "family": "process", "before_score": null, "after_score": null, "skill_bias": {"improver.improve": 0.02, "geometer.gather": 0.02}, "genome_prior": {"explore": 0.02, "gather": 0.0}, "catalog_hint": {}, "proposal_fingerprint": "", "tags": ["oracle_kill", "stripped:stripped_not_useful_fail", "held_out:held_out_fail", "collective_kill"], "evidence": ["kill:stripped:stripped_not_useful_fail", "kill:held_out:held_out_fail", "kill:collective_kill"], "author": null, "expired": false, "status": "candidate"}
{"id": "les_Z_bb8c32_authored_central_binom_bound__euler", "ts": "2026-10-10T06:10:12Z", "cycle_id": "20261010T060959Z_bb8c32", "type": "authored_check", "decision": "skip", "check": "authoring", "mutation": "authored_central_binom_bound__euler_totient_multiplicative_w1", "what": "authored disabled hard check `authored_central_binom_bound__euler_totient_multiplicative_w1` from proven lemmas central_binom_bound + euler_totient_multiplicative on new windows; awaits Oracle via proposal", "source": "conjecture_desk", "family": "hard_tier", "before_score": null, "after_score": null, "skill_bias": {}, "genome_prior": {}, "catalog_hint": {}, "proposal_fingerprint": "", "tags": ["authoring", "authored_check", "central_binom_bound", "euler_totient_multiplicative"], "evidence": ["society/benchmarks/artifacts/lemma_impl.py::check_central_binom_bound", "society/benchmarks/artifacts/lemma_impl.py::check_euler_totient_multiplicative", "society/benchmarks/lemma_microbench.py", "lemma:central_binom_bound", "lemma:euler_totient_multiplicative"], "author": null, "expired": false, "status": "candidate"}
{"id": "les_Z_bb8c32_conjecture", "ts": "2026-10-10T06:10:13Z", "cycle_id": "20261010T060959Z_bb8c32", "type": "catalog_exhausted", "decision": "skip", "check": "conjecture", "mutation": "", "what": "catalog exhausted — queue next hard_enable stub from lessons/external mind", "source": "conjecture_desk", "family": "hard_tier", "before_score": null, "after_score": null, "skill_bias": {}, "genome_prior": {}, "catalog_hint": {"avoid": ["vandermonde_asymmetric", "process_spam"], "drop_theme": ["vandermonde_asymmetric"], "seek": ["papers.jsonl", "ledger", "domain_bus", "arxiv"], "prefer": ["novelty", "cite_sources", "gather_before_propose", "drop_cooled_theme"], "add_mutation": "binomial_hockey_deep"}, "proposal_fingerprint": "", "tags": ["catalog_exhausted"], "evidence": [], "author": null, "expired": false, "status": "candidate"}
{"id": "les_Z_bb8c32_vandermonde", "ts": "2026-10-10T06:10:14Z", "cycle_id": "20261010T060959Z_bb8c32", "type": "skip", "decision": "skip", "check": "oracle_seen_claim", "mutation": "vandermonde", "what": "skip re-oracle of vandermonde:1706.03762", "source": "claim_pipeline", "family": "novelty", "before_score": null, "after_score": null, "skill_bias": {}, "genome_prior": {}, "catalog_hint": {}, "proposal_fingerprint": "vandermonde:1706.03762", "tags": ["repeat_claim"], "evidence": [], "author": null, "expired": false, "status": "candidate"}
{"id": "les_Z_bb8c32_pilot", "ts": "2026-10-10T06:10:21Z", "cycle_id": "20261010T060959Z_bb8c32", "type": "skip", "decision": "skip", "check": "pilot", "mutation": "", "what": "empty rsi_bias pilot suppressed", "source": "pilot_lane", "family": "rsi", "before_score": null, "after_score": null, "skill_bias": {}, "genome_prior": {}, "catalog_hint": {}, "proposal_fingerprint": "", "tags": ["empty_rsi_bias"], "evidence": [], "author": null, "expired": false, "status": "candidate"}
{"id": "les_6:10:46Z_Chain `lemma_hard_combinatorics` ci", "ts": "2026-10-10T06:10:46Z", "cycle_id": "", "type": "oracle_kill", "decision": "revert", "check": "oracle", "mutation": "Chain `lemma_hard_combinatorics` citing On two families of generalized Stirling numbers re", "what": "Oracle FAIL kills keep. kills=['stripped:stripped_not_useful_fail', 'held_out:held_out_fail', 'collective_kill']. No fitness credit.", "source": "novelty_gate", "family": "process", "before_score": null, "after_score": null, "skill_bias": {"improver.improve": 0.02, "geometer.gather": 0.02}, "genome_prior": {"explore": 0.02, "gather": 0.0}, "catalog_hint": {}, "proposal_fingerprint": "", "tags": ["oracle_kill", "stripped:stripped_not_useful_fail", "held_out:held_out_fail", "collective_kill"], "evidence": ["kill:stripped:stripped_not_useful_fail", "kill:held_out:held_out_fail", "kill:collective_kill"], "author": null, "expired": false, "status": "candidate"}
{"id": "les_Z_7ea183_authored_central_binom_bound__euler", "ts": "2026-10-10T12:49:14Z", "cycle_id": "20261010T124901Z_7ea183", "type": "keep", "decision": "keep", "check": "lemma_microbench", "mutation": "authored_central_binom_bound__euler_totient_multiplicative_w1", "what": "Kept `authored_central_binom_bound__euler_totient_multiplicative_w1` (hard_enable): lemma score 0.9071→0.9071 checks 74→75 hard_pass 64→65 (machine-checked + Oracle pass; not novel discovery). | oracle=PASS fitness_credit=True kills=[] | novelty_gate novel=True kills=[]", "source": "conjecture_desk", "family": "hard_enable", "before_score": 0.9071, "after_score": 0.9071, "skill_bias": {"geometer.gather": 0.08, "improver.improve": 0.06, "spark.emergence": 0.04}, "genome_prior": {}, "catalog_hint": {}, "proposal_fingerprint": "", "tags": ["lemma", "hard_enable", "keep"], "evidence": ["society/benchmarks/lemma_microbench.py", "artifacts:lemma_impl", "lesson:les_Z_bb8c32_authored_central_binom_bound__euler"], "author": null, "expired": false, "status": "candidate"}
{"id": "les_Z_7ea183_vandermonde", "ts": "2026-10-10T12:49:15Z", "cycle_id": "20261010T124901Z_7ea183", "type": "skip", "decision": "skip", "check": "oracle_seen_claim", "mutation": "vandermonde", "what": "skip re-oracle of vandermonde:1706.03762", "source": "claim_pipeline", "family": "novelty", "before_score": null, "after_score": null, "skill_bias": {}, "genome_prior": {}, "catalog_hint": {}, "proposal_fingerprint": "vandermonde:1706.03762", "tags": ["repeat_claim"], "evidence": [], "author": null, "expired": false, "status": "candidate"}
{"id": "les_Z_7ea183_pilot", "ts": "2026-10-10T12:49:22Z", "cycle_id": "20261010T124901Z_7ea183", "type": "skip", "decision": "skip", "check": "pilot", "mutation": "", "what": "empty rsi_bias pilot suppressed", "source": "pilot_lane", "family": "rsi", "before_score": null, "after_score": null, "skill_bias": {}, "genome_prior": {}, "catalog_hint": {}, "proposal_fingerprint": "", "tags": ["empty_rsi_bias"], "evidence": [], "author": null, "expired": false, "status": "candidate"}
{"id": "les_Z_f5e4e1_dedupe", "ts": "2026-10-10T12:49:52Z", "cycle_id": "20261010T124943Z_f5e4e1", "type": "repeat_proposal", "decision": "block", "check": "dedupe", "mutation": "", "what": "blocked repeat: Deepen compute-useful math from accepted findings after hearing", "source": "growth_hearing", "family": "process", "before_score": null, "after_score": null, "skill_bias": {}, "genome_prior": {}, "catalog_hint": {}, "proposal_fingerprint": "810bc050d326", "tags": ["repeat_proposal"], "evidence": [], "author": null, "expired": false, "status": "candidate"}
{"id": "les_Z_f5e4e1_dedupe", "ts": "2026-10-10T12:49:53Z", "cycle_id": "20261010T124943Z_f5e4e1", "type": "repeat_proposal", "decision": "block", "check": "dedupe", "mutation": "", "what": "blocked repeat: Feed accepted/strong RSI findings into skill_router + genome bias", "source": "growth_hearing", "family": "process", "before_score": null, "after_score": null, "skill_bias": {}, "genome_prior": {}, "catalog_hint": {}, "proposal_fingerprint": "27e48156942c", "tags": ["repeat_proposal"], "evidence": [], "author": null, "expired": false, "status": "candidate"}
{"id": "les_Z_f5e4e1_authored_derangement_subfactorial__", "ts": "2026-10-10T12:49:55Z", "cycle_id": "20261010T124943Z_f5e4e1", "type": "authored_check", "decision": "skip", "check": "authoring", "mutation": "authored_derangement_subfactorial__hermite_recurrence_w1", "what": "authored disabled hard check `authored_derangement_subfactorial__hermite_recurrence_w1` from proven lemmas derangement_subfactorial + hermite_recurrence on new windows; awaits Oracle via proposal", "source": "conjecture_desk", "family": "hard_tier", "before_score": null, "after_score": null, "skill_bias": {}, "genome_prior": {}, "catalog_hint": {}, "proposal_fingerprint": "", "tags": ["authoring", "authored_check", "derangement_subfactorial", "hermite_recurrence"], "evidence": ["society/benchmarks/artifacts/lemma_impl.py::check_derangement_subfactorial", "society/benchmarks/artifacts/lemma_impl.py::check_hermite_recurrence", "society/benchmarks/lemma_microbench.py", "lemma:derangement_subfactorial", "lemma:hermite_recurrence"], "author": null, "expired": false, "status": "candidate"}
{"id": "les_Z_f5e4e1_conjecture", "ts": "2026-10-10T12:49:56Z", "cycle_id": "20261010T124943Z_f5e4e1", "type": "catalog_exhausted", "decision": "skip", "check": "conjecture", "mutation": "", "what": "catalog exhausted — queue next hard_enable stub from lessons/external mind", "source": "conjecture_desk", "family": "hard_tier", "before_score": null, "after_score": null, "skill_bias": {}, "genome_prior": {}, "catalog_hint": {"avoid": ["vandermonde_asymmetric", "process_spam"], "drop_theme": ["vandermonde_asymmetric"], "seek": ["papers.jsonl", "ledger", "domain_bus", "arxiv"], "prefer": ["novelty", "cite_sources", "gather_before_propose", "drop_cooled_theme"], "add_mutation": "binomial_hockey_deep"}, "proposal_fingerprint": "", "tags": ["catalog_exhausted"], "evidence": [], "author": null, "expired": false, "status": "candidate"}
{"id": "les_Z_f5e4e1_vandermonde", "ts": "2026-10-10T12:49:57Z", "cycle_id": "20261010T124943Z_f5e4e1", "type": "skip", "decision": "skip", "check": "oracle_seen_claim", "mutation": "vandermonde", "what": "skip re-oracle of vandermonde:1706.03762", "source": "claim_pipeline", "family": "novelty", "before_score": null, "after_score": null, "skill_bias": {}, "genome_prior": {}, "catalog_hint": {}, "proposal_fingerprint": "vandermonde:1706.03762", "tags": ["repeat_claim"], "evidence": [], "author": null, "expired": false, "status": "candidate"}
{"id": "les_Z_f5e4e1_pilot", "ts": "2026-10-10T12:50:04Z", "cycle_id": "20261010T124943Z_f5e4e1", "type": "skip", "decision": "skip", "check": "pilot", "mutation": "", "what": "empty rsi_bias pilot suppressed", "source": "pilot_lane", "family": "rsi", "before_score": null, "after_score": null, "skill_bias": {}, "genome_prior": {}, "catalog_hint": {}, "proposal_fingerprint": "", "tags": ["empty_rsi_bias"], "evidence": [], "author": null, "expired": false, "status": "candidate"}
{"id": "les_Z_ebe49b_authored_derangement_subfactorial__", "ts": "2026-10-10T12:50:37Z", "cycle_id": "20261010T125024Z_ebe49b", "type": "keep", "decision": "keep", "check": "lemma_microbench", "mutation": "authored_derangement_subfactorial__hermite_recurrence_w1", "what": "Kept `authored_derangement_subfactorial__hermite_recurrence_w1` (hard_enable): lemma score 0.9071→0.9071 checks 75→76 hard_pass 65→66 (machine-checked + Oracle pass; not novel discovery). | oracle=PASS fitness_credit=True kills=[] | novelty_gate novel=True kills=[]", "source": "conjecture_desk", "family": "hard_enable", "before_score": 0.9071, "after_score": 0.9071, "skill_bias": {"geometer.gather": 0.08, "improver.improve": 0.06, "spark.emergence": 0.04}, "genome_prior": {}, "catalog_hint": {}, "proposal_fingerprint": "", "tags": ["lemma", "hard_enable", "keep"], "evidence": ["society/benchmarks/lemma_microbench.py", "artifacts:lemma_impl", "lesson:les_Z_f5e4e1_authored_derangement_subfactorial__"], "author": null, "expired": false, "status": "candidate"}
{"id": "les_Z_ebe49b_vandermonde", "ts": "2026-10-10T12:50:38Z", "cycle_id": "20261010T125024Z_ebe49b", "type": "skip", "decision": "skip", "check": "oracle_seen_claim", "mutation": "vandermonde", "what": "skip re-oracle of vandermonde:1706.03762", "source": "claim_pipeline", "family": "novelty", "before_score": null, "after_score": null, "skill_bias": {}, "genome_prior": {}, "catalog_hint": {}, "proposal_fingerprint": "vandermonde:1706.03762", "tags": ["repeat_claim"], "evidence": [], "author": null, "expired": false, "status": "candidate"}
{"id": "les_Z_ebe49b_pilot", "ts": "2026-10-10T12:50:44Z", "cycle_id": "20261010T125024Z_ebe49b", "type": "skip", "decision": "skip", "check": "pilot", "mutation": "", "what": "empty rsi_bias pilot suppressed", "source": "pilot_lane", "family": "rsi", "before_score": null, "after_score": null, "skill_bias": {}, "genome_prior": {}, "catalog_hint": {}, "proposal_fingerprint": "", "tags": ["empty_rsi_bias"], "evidence": [], "author": null, "expired": false, "status": "candidate"}
{"id": "les_Z_675d45_dedupe", "ts": "2026-10-10T21:54:32Z", "cycle_id": "20261010T215426Z_675d45", "type": "repeat_proposal", "decision": "block", "check": "dedupe", "mutation": "", "what": "blocked repeat: Deepen compute-useful math from accepted findings after hearing", "source": "growth_hearing", "family": "process", "before_score": null, "after_score": null, "skill_bias": {}, "genome_prior": {}, "catalog_hint": {}, "proposal_fingerprint": "810bc050d326", "tags": ["repeat_proposal"], "evidence": [], "author": null, "expired": false, "status": "candidate"}
{"id": "les_Z_675d45_dedupe", "ts": "2026-10-10T21:54:33Z", "cycle_id": "20261010T215426Z_675d45", "type": "repeat_proposal", "decision": "block", "check": "dedupe", "mutation": "", "what": "blocked repeat: Feed accepted/strong RSI findings into skill_router + genome bias", "source": "growth_hearing", "family": "process", "before_score": null, "after_score": null, "skill_bias": {}, "genome_prior": {}, "catalog_hint": {}, "proposal_fingerprint": "27e48156942c", "tags": ["repeat_proposal"], "evidence": [], "author": null, "expired": false, "status": "candidate"}
{"id": "les_Z_675d45_authored_fibonacci_addition__motzki", "ts": "2026-10-10T21:54:34Z", "cycle_id": "20261010T215426Z_675d45", "type": "authored_check", "decision": "skip", "check": "authoring", "mutation": "authored_fibonacci_addition__motzkin_bounded_w1", "what": "authored disabled hard check `authored_fibonacci_addition__motzkin_bounded_w1` from proven lemmas fibonacci_addition + motzkin_bounded on new windows; awaits Oracle via proposal", "source": "conjecture_desk", "family": "hard_tier", "before_score": null, "after_score": null, "skill_bias": {}, "genome_prior": {}, "catalog_hint": {}, "proposal_fingerprint": "", "tags": ["authoring", "authored_check", "fibonacci_addition", "motzkin_bounded"], "evidence": ["society/benchmarks/artifacts/lemma_impl.py::check_fibonacci_addition", "society/benchmarks/artifacts/lemma_impl.py::check_motzkin_bounded", "society/benchmarks/lemma_microbench.py", "lemma:fibonacci_addition", "lemma:motzkin_bounded"], "author": null, "expired": false, "status": "candidate"}
{"id": "les_Z_675d45_conjecture", "ts": "2026-10-10T21:54:35Z", "cycle_id": "20261010T215426Z_675d45", "type": "catalog_exhausted", "decision": "skip", "check": "conjecture", "mutation": "", "what": "catalog exhausted — queue next hard_enable stub from lessons/external mind", "source": "conjecture_desk", "family": "hard_tier", "before_score": null, "after_score": null, "skill_bias": {}, "genome_prior": {}, "catalog_hint": {"avoid": ["vandermonde_asymmetric", "process_spam"], "drop_theme": ["vandermonde_asymmetric"], "seek": ["papers.jsonl", "ledger", "domain_bus", "arxiv"], "prefer": ["novelty", "cite_sources", "gather_before_propose", "drop_cooled_theme"], "add_mutation": "binomial_hockey_deep"}, "proposal_fingerprint": "", "tags": ["catalog_exhausted"], "evidence": [], "author": null, "expired": false, "status": "candidate"}
{"id": "les_Z_675d45_vandermonde", "ts": "2026-10-10T21:54:35Z", "cycle_id": "20261010T215426Z_675d45", "type": "skip", "decision": "skip", "check": "oracle_seen_claim", "mutation": "vandermonde", "what": "skip re-oracle of vandermonde:1706.03762", "source": "claim_pipeline", "family": "novelty", "before_score": null, "after_score": null, "skill_bias": {}, "genome_prior": {}, "catalog_hint": {}, "proposal_fingerprint": "vandermonde:1706.03762", "tags": ["repeat_claim"], "evidence": [], "author": null, "expired": false, "status": "candidate"}
