{"id": "les_Z_3b4223_vandermonde", "ts": "2026-10-09T07:57:43Z", "cycle_id": "20261009T075729Z_3b4223", "type": "skip", "decision": "skip", "check": "oracle_seen_claim", "mutation": "vandermonde", "what": "skip re-oracle of vandermonde:1706.03762", "source": "claim_pipeline", "family": "novelty", "before_score": null, "after_score": null, "skill_bias": {}, "genome_prior": {}, "catalog_hint": {}, "proposal_fingerprint": "vandermonde:1706.03762", "tags": ["repeat_claim"], "evidence": [], "author": null, "expired": false, "status": "candidate"}
{"id": "les_Z_3b4223_pilot", "ts": "2026-10-09T07:57:48Z", "cycle_id": "20261009T075729Z_3b4223", "type": "skip", "decision": "skip", "check": "pilot", "mutation": "", "what": "empty rsi_bias pilot suppressed", "source": "pilot_lane", "family": "rsi", "before_score": null, "after_score": null, "skill_bias": {}, "genome_prior": {}, "catalog_hint": {}, "proposal_fingerprint": "", "tags": ["empty_rsi_bias"], "evidence": [], "author": null, "expired": false, "status": "candidate"}
{"id": "les_Z_0c6da3_dedupe", "ts": "2026-10-09T13:38:40Z", "cycle_id": "20261009T133831Z_0c6da3", "type": "repeat_proposal", "decision": "block", "check": "dedupe", "mutation": "", "what": "blocked repeat: Deepen compute-useful math from accepted findings after hearing", "source": "growth_hearing", "family": "process", "before_score": null, "after_score": null, "skill_bias": {}, "genome_prior": {}, "catalog_hint": {}, "proposal_fingerprint": "810bc050d326", "tags": ["repeat_proposal"], "evidence": [], "author": null, "expired": false, "status": "candidate"}
{"id": "les_Z_0c6da3_dedupe", "ts": "2026-10-09T13:38:42Z", "cycle_id": "20261009T133831Z_0c6da3", "type": "repeat_proposal", "decision": "block", "check": "dedupe", "mutation": "", "what": "blocked repeat: Feed accepted/strong RSI findings into skill_router + genome bias", "source": "growth_hearing", "family": "process", "before_score": null, "after_score": null, "skill_bias": {}, "genome_prior": {}, "catalog_hint": {}, "proposal_fingerprint": "27e48156942c", "tags": ["repeat_proposal"], "evidence": [], "author": null, "expired": false, "status": "candidate"}
{"id": "les_Z_0c6da3_authored_bell_triangle_recurrence__", "ts": "2026-10-09T13:38:45Z", "cycle_id": "20261009T133831Z_0c6da3", "type": "authored_check", "decision": "skip", "check": "authoring", "mutation": "authored_bell_triangle_recurrence__legendre_duplication_small_w1", "what": "authored disabled hard check `authored_bell_triangle_recurrence__legendre_duplication_small_w1` from proven lemmas bell_triangle_recurrence + legendre_duplication_small on new windows; awaits Oracle via proposal", "source": "conjecture_desk", "family": "hard_tier", "before_score": null, "after_score": null, "skill_bias": {}, "genome_prior": {}, "catalog_hint": {}, "proposal_fingerprint": "", "tags": ["authoring", "authored_check", "bell_triangle_recurrence", "legendre_duplication_small"], "evidence": ["society/benchmarks/artifacts/lemma_impl.py::check_bell_triangle_recurrence", "society/benchmarks/artifacts/lemma_impl.py::check_legendre_duplication_small", "society/benchmarks/lemma_microbench.py", "lemma:bell_triangle_recurrence", "lemma:legendre_duplication_small"], "author": null, "expired": false, "status": "candidate"}
{"id": "les_Z_0c6da3_conjecture", "ts": "2026-10-09T13:38:46Z", "cycle_id": "20261009T133831Z_0c6da3", "type": "catalog_exhausted", "decision": "skip", "check": "conjecture", "mutation": "", "what": "catalog exhausted — queue next hard_enable stub from lessons/external mind", "source": "conjecture_desk", "family": "hard_tier", "before_score": null, "after_score": null, "skill_bias": {}, "genome_prior": {}, "catalog_hint": {"avoid": ["vandermonde_asymmetric", "process_spam"], "drop_theme": ["vandermonde_asymmetric"], "seek": ["papers.jsonl", "ledger", "domain_bus", "arxiv"], "prefer": ["novelty", "cite_sources", "gather_before_propose", "drop_cooled_theme"], "add_mutation": "binomial_hockey_deep"}, "proposal_fingerprint": "", "tags": ["catalog_exhausted"], "evidence": [], "author": null, "expired": false, "status": "candidate"}
{"id": "les_Z_0c6da3_vandermonde", "ts": "2026-10-09T13:38:46Z", "cycle_id": "20261009T133831Z_0c6da3", "type": "skip", "decision": "skip", "check": "oracle_seen_claim", "mutation": "vandermonde", "what": "skip re-oracle of vandermonde:1706.03762", "source": "claim_pipeline", "family": "novelty", "before_score": null, "after_score": null, "skill_bias": {}, "genome_prior": {}, "catalog_hint": {}, "proposal_fingerprint": "vandermonde:1706.03762", "tags": ["repeat_claim"], "evidence": [], "author": null, "expired": false, "status": "candidate"}
{"id": "les_Z_0c6da3_pilot", "ts": "2026-10-09T13:38:54Z", "cycle_id": "20261009T133831Z_0c6da3", "type": "skip", "decision": "skip", "check": "pilot", "mutation": "", "what": "empty rsi_bias pilot suppressed", "source": "pilot_lane", "family": "rsi", "before_score": null, "after_score": null, "skill_bias": {}, "genome_prior": {}, "catalog_hint": {}, "proposal_fingerprint": "", "tags": ["empty_rsi_bias"], "evidence": [], "author": null, "expired": false, "status": "candidate"}
{"id": "les_Z_4240dc_authored_bell_triangle_recurrence__", "ts": "2026-10-09T13:39:29Z", "cycle_id": "20261009T133914Z_4240dc", "type": "keep", "decision": "keep", "check": "lemma_microbench", "mutation": "authored_bell_triangle_recurrence__legendre_duplication_small_w1", "what": "Kept `authored_bell_triangle_recurrence__legendre_duplication_small_w1` (hard_enable): lemma score 0.9071→0.9071 checks 70→71 hard_pass 60→61 (machine-checked + Oracle pass; not novel discovery). | oracle=PASS fitness_credit=True kills=[] | novelty_gate novel=True kills=[]", "source": "conjecture_desk", "family": "hard_enable", "before_score": 0.9071, "after_score": 0.9071, "skill_bias": {"geometer.gather": 0.08, "improver.improve": 0.06, "spark.emergence": 0.04}, "genome_prior": {}, "catalog_hint": {}, "proposal_fingerprint": "", "tags": ["lemma", "hard_enable", "keep"], "evidence": ["society/benchmarks/lemma_microbench.py", "artifacts:lemma_impl", "lesson:les_Z_0c6da3_authored_bell_triangle_recurrence__"], "author": null, "expired": false, "status": "candidate"}
{"id": "les_Z_4240dc_vandermonde", "ts": "2026-10-09T13:39:29Z", "cycle_id": "20261009T133914Z_4240dc", "type": "skip", "decision": "skip", "check": "oracle_seen_claim", "mutation": "vandermonde", "what": "skip re-oracle of vandermonde:1706.03762", "source": "claim_pipeline", "family": "novelty", "before_score": null, "after_score": null, "skill_bias": {}, "genome_prior": {}, "catalog_hint": {}, "proposal_fingerprint": "vandermonde:1706.03762", "tags": ["repeat_claim"], "evidence": [], "author": null, "expired": false, "status": "candidate"}
{"id": "les_Z_4240dc_pilot", "ts": "2026-10-09T13:39:36Z", "cycle_id": "20261009T133914Z_4240dc", "type": "skip", "decision": "skip", "check": "pilot", "mutation": "", "what": "empty rsi_bias pilot suppressed", "source": "pilot_lane", "family": "rsi", "before_score": null, "after_score": null, "skill_bias": {}, "genome_prior": {}, "catalog_hint": {}, "proposal_fingerprint": "", "tags": ["empty_rsi_bias"], "evidence": [], "author": null, "expired": false, "status": "candidate"}
{"id": "les_Z_6011fc_dedupe", "ts": "2026-10-09T13:40:06Z", "cycle_id": "20261009T133957Z_6011fc", "type": "repeat_proposal", "decision": "block", "check": "dedupe", "mutation": "", "what": "blocked repeat: Deepen compute-useful math from accepted findings after hearing", "source": "growth_hearing", "family": "process", "before_score": null, "after_score": null, "skill_bias": {}, "genome_prior": {}, "catalog_hint": {}, "proposal_fingerprint": "810bc050d326", "tags": ["repeat_proposal"], "evidence": [], "author": null, "expired": false, "status": "candidate"}
{"id": "les_Z_6011fc_dedupe", "ts": "2026-10-09T13:40:08Z", "cycle_id": "20261009T133957Z_6011fc", "type": "repeat_proposal", "decision": "block", "check": "dedupe", "mutation": "", "what": "blocked repeat: Feed accepted/strong RSI findings into skill_router + genome bias", "source": "growth_hearing", "family": "process", "before_score": null, "after_score": null, "skill_bias": {}, "genome_prior": {}, "catalog_hint": {}, "proposal_fingerprint": "27e48156942c", "tags": ["repeat_proposal"], "evidence": [], "author": null, "expired": false, "status": "candidate"}
{"id": "les_Z_6011fc_authored_binomial_sum_row__binomial", "ts": "2026-10-09T13:40:10Z", "cycle_id": "20261009T133957Z_6011fc", "type": "authored_check", "decision": "skip", "check": "authoring", "mutation": "authored_binomial_sum_row__binomial_inversion_small_w1", "what": "authored disabled hard check `authored_binomial_sum_row__binomial_inversion_small_w1` from proven lemmas binomial_sum_row + binomial_inversion_small on new windows; awaits Oracle via proposal", "source": "conjecture_desk", "family": "hard_tier", "before_score": null, "after_score": null, "skill_bias": {}, "genome_prior": {}, "catalog_hint": {}, "proposal_fingerprint": "", "tags": ["authoring", "authored_check", "binomial_sum_row", "binomial_inversion_small"], "evidence": ["society/benchmarks/artifacts/lemma_impl.py::check_binomial_sum_row", "society/benchmarks/artifacts/lemma_impl.py::check_binomial_inversion_small", "society/benchmarks/lemma_microbench.py", "lemma:binomial_sum_row", "lemma:binomial_inversion_small"], "author": null, "expired": false, "status": "candidate"}
{"id": "les_Z_6011fc_conjecture", "ts": "2026-10-09T13:40:11Z", "cycle_id": "20261009T133957Z_6011fc", "type": "catalog_exhausted", "decision": "skip", "check": "conjecture", "mutation": "", "what": "catalog exhausted — queue next hard_enable stub from lessons/external mind", "source": "conjecture_desk", "family": "hard_tier", "before_score": null, "after_score": null, "skill_bias": {}, "genome_prior": {}, "catalog_hint": {"avoid": ["vandermonde_asymmetric", "process_spam"], "drop_theme": ["vandermonde_asymmetric"], "seek": ["papers.jsonl", "ledger", "domain_bus", "arxiv"], "prefer": ["novelty", "cite_sources", "gather_before_propose", "drop_cooled_theme"], "add_mutation": "binomial_hockey_deep"}, "proposal_fingerprint": "", "tags": ["catalog_exhausted"], "evidence": [], "author": null, "expired": false, "status": "candidate"}
{"id": "les_Z_6011fc_vandermonde", "ts": "2026-10-09T13:40:12Z", "cycle_id": "20261009T133957Z_6011fc", "type": "skip", "decision": "skip", "check": "oracle_seen_claim", "mutation": "vandermonde", "what": "skip re-oracle of vandermonde:1706.03762", "source": "claim_pipeline", "family": "novelty", "before_score": null, "after_score": null, "skill_bias": {}, "genome_prior": {}, "catalog_hint": {}, "proposal_fingerprint": "vandermonde:1706.03762", "tags": ["repeat_claim"], "evidence": [], "author": null, "expired": false, "status": "candidate"}
{"id": "les_Z_6011fc_pilot", "ts": "2026-10-09T13:40:18Z", "cycle_id": "20261009T133957Z_6011fc", "type": "skip", "decision": "skip", "check": "pilot", "mutation": "", "what": "empty rsi_bias pilot suppressed", "source": "pilot_lane", "family": "rsi", "before_score": null, "after_score": null, "skill_bias": {}, "genome_prior": {}, "catalog_hint": {}, "proposal_fingerprint": "", "tags": ["empty_rsi_bias"], "evidence": [], "author": null, "expired": false, "status": "candidate"}
{"id": "les_Z_b91552_authored_binomial_sum_row__binomial", "ts": "2026-10-09T22:47:29Z", "cycle_id": "20261009T224715Z_b91552", "type": "keep", "decision": "keep", "check": "lemma_microbench", "mutation": "authored_binomial_sum_row__binomial_inversion_small_w1", "what": "Kept `authored_binomial_sum_row__binomial_inversion_small_w1` (hard_enable): lemma score 0.9071→0.9071 checks 71→72 hard_pass 61→62 (machine-checked + Oracle pass; not novel discovery). | oracle=PASS fitness_credit=True kills=[] | novelty_gate novel=True kills=[]", "source": "conjecture_desk", "family": "hard_enable", "before_score": 0.9071, "after_score": 0.9071, "skill_bias": {"geometer.gather": 0.08, "improver.improve": 0.06, "spark.emergence": 0.04}, "genome_prior": {}, "catalog_hint": {}, "proposal_fingerprint": "", "tags": ["lemma", "hard_enable", "keep"], "evidence": ["society/benchmarks/lemma_microbench.py", "artifacts:lemma_impl", "lesson:les_Z_6011fc_authored_binomial_sum_row__binomial"], "author": null, "expired": false, "status": "candidate"}
{"id": "les_Z_b91552_vandermonde", "ts": "2026-10-09T22:47:29Z", "cycle_id": "20261009T224715Z_b91552", "type": "skip", "decision": "skip", "check": "oracle_seen_claim", "mutation": "vandermonde", "what": "skip re-oracle of vandermonde:1706.03762", "source": "claim_pipeline", "family": "novelty", "before_score": null, "after_score": null, "skill_bias": {}, "genome_prior": {}, "catalog_hint": {}, "proposal_fingerprint": "vandermonde:1706.03762", "tags": ["repeat_claim"], "evidence": [], "author": null, "expired": false, "status": "candidate"}
{"id": "les_Z_b91552_pilot", "ts": "2026-10-09T22:47:34Z", "cycle_id": "20261009T224715Z_b91552", "type": "skip", "decision": "skip", "check": "pilot", "mutation": "", "what": "empty rsi_bias pilot suppressed", "source": "pilot_lane", "family": "rsi", "before_score": null, "after_score": null, "skill_bias": {}, "genome_prior": {}, "catalog_hint": {}, "proposal_fingerprint": "", "tags": ["empty_rsi_bias"], "evidence": [], "author": null, "expired": false, "status": "candidate"}
{"id": "les_Z_af526f_dedupe", "ts": "2026-10-09T22:47:48Z", "cycle_id": "20261009T224740Z_af526f", "type": "repeat_proposal", "decision": "block", "check": "dedupe", "mutation": "", "what": "blocked repeat: Deepen compute-useful math from accepted findings after hearing", "source": "growth_hearing", "family": "process", "before_score": null, "after_score": null, "skill_bias": {}, "genome_prior": {}, "catalog_hint": {}, "proposal_fingerprint": "810bc050d326", "tags": ["repeat_proposal"], "evidence": [], "author": null, "expired": false, "status": "candidate"}
{"id": "les_Z_af526f_dedupe", "ts": "2026-10-09T22:47:50Z", "cycle_id": "20261009T224740Z_af526f", "type": "repeat_proposal", "decision": "block", "check": "dedupe", "mutation": "", "what": "blocked repeat: Feed accepted/strong RSI findings into skill_router + genome bias", "source": "growth_hearing", "family": "process", "before_score": null, "after_score": null, "skill_bias": {}, "genome_prior": {}, "catalog_hint": {}, "proposal_fingerprint": "27e48156942c", "tags": ["repeat_proposal"], "evidence": [], "author": null, "expired": false, "status": "candidate"}
{"id": "les_Z_af526f_authored_binomial_symmetry__catalan", "ts": "2026-10-09T22:47:52Z", "cycle_id": "20261009T224740Z_af526f", "type": "authored_check", "decision": "skip", "check": "authoring", "mutation": "authored_binomial_symmetry__catalan_bounded_w1", "what": "authored disabled hard check `authored_binomial_symmetry__catalan_bounded_w1` from proven lemmas binomial_symmetry + catalan_bounded on new windows; awaits Oracle via proposal", "source": "conjecture_desk", "family": "hard_tier", "before_score": null, "after_score": null, "skill_bias": {}, "genome_prior": {}, "catalog_hint": {}, "proposal_fingerprint": "", "tags": ["authoring", "authored_check", "binomial_symmetry", "catalan_bounded"], "evidence": ["society/benchmarks/artifacts/lemma_impl.py::check_binomial_symmetry", "society/benchmarks/artifacts/lemma_impl.py::check_catalan_bounded", "society/benchmarks/lemma_microbench.py", "lemma:binomial_symmetry", "lemma:catalan_bounded"], "author": null, "expired": false, "status": "candidate"}
{"id": "les_Z_af526f_conjecture", "ts": "2026-10-09T22:47:53Z", "cycle_id": "20261009T224740Z_af526f", "type": "catalog_exhausted", "decision": "skip", "check": "conjecture", "mutation": "", "what": "catalog exhausted — queue next hard_enable stub from lessons/external mind", "source": "conjecture_desk", "family": "hard_tier", "before_score": null, "after_score": null, "skill_bias": {}, "genome_prior": {}, "catalog_hint": {"avoid": ["vandermonde_asymmetric", "process_spam"], "drop_theme": ["vandermonde_asymmetric"], "seek": ["papers.jsonl", "ledger", "domain_bus", "arxiv"], "prefer": ["novelty", "cite_sources", "gather_before_propose", "drop_cooled_theme"], "add_mutation": "binomial_hockey_deep"}, "proposal_fingerprint": "", "tags": ["catalog_exhausted"], "evidence": [], "author": null, "expired": false, "status": "candidate"}
{"id": "les_Z_af526f_vandermonde", "ts": "2026-10-09T22:47:53Z", "cycle_id": "20261009T224740Z_af526f", "type": "skip", "decision": "skip", "check": "oracle_seen_claim", "mutation": "vandermonde", "what": "skip re-oracle of vandermonde:1706.03762", "source": "claim_pipeline", "family": "novelty", "before_score": null, "after_score": null, "skill_bias": {}, "genome_prior": {}, "catalog_hint": {}, "proposal_fingerprint": "vandermonde:1706.03762", "tags": ["repeat_claim"], "evidence": [], "author": null, "expired": false, "status": "candidate"}
{"id": "les_Z_af526f_pilot", "ts": "2026-10-09T22:47:57Z", "cycle_id": "20261009T224740Z_af526f", "type": "skip", "decision": "skip", "check": "pilot", "mutation": "", "what": "empty rsi_bias pilot suppressed", "source": "pilot_lane", "family": "rsi", "before_score": null, "after_score": null, "skill_bias": {}, "genome_prior": {}, "catalog_hint": {}, "proposal_fingerprint": "", "tags": ["empty_rsi_bias"], "evidence": [], "author": null, "expired": false, "status": "candidate"}
{"id": "les_Z_fa9cbb_authored_binomial_symmetry__catalan", "ts": "2026-10-09T22:48:16Z", "cycle_id": "20261009T224803Z_fa9cbb", "type": "keep", "decision": "keep", "check": "lemma_microbench", "mutation": "authored_binomial_symmetry__catalan_bounded_w1", "what": "Kept `authored_binomial_symmetry__catalan_bounded_w1` (hard_enable): lemma score 0.9071→0.9071 checks 72→73 hard_pass 62→63 (machine-checked + Oracle pass; not novel discovery). | oracle=PASS fitness_credit=True kills=[] | novelty_gate novel=False kills=['textbook_reuse=0.6667']", "source": "conjecture_desk", "family": "hard_enable", "before_score": 0.9071, "after_score": 0.9071, "skill_bias": {"geometer.gather": 0.08, "improver.improve": 0.06, "spark.emergence": 0.04}, "genome_prior": {}, "catalog_hint": {}, "proposal_fingerprint": "", "tags": ["lemma", "hard_enable", "keep"], "evidence": ["society/benchmarks/lemma_microbench.py", "artifacts:lemma_impl", "lesson:les_Z_af526f_authored_binomial_symmetry__catalan"], "author": null, "expired": false, "status": "candidate"}
{"id": "les_Z_fa9cbb_vandermonde", "ts": "2026-10-09T22:48:16Z", "cycle_id": "20261009T224803Z_fa9cbb", "type": "skip", "decision": "skip", "check": "oracle_seen_claim", "mutation": "vandermonde", "what": "skip re-oracle of vandermonde:1706.03762", "source": "claim_pipeline", "family": "novelty", "before_score": null, "after_score": null, "skill_bias": {}, "genome_prior": {}, "catalog_hint": {}, "proposal_fingerprint": "vandermonde:1706.03762", "tags": ["repeat_claim"], "evidence": [], "author": null, "expired": false, "status": "candidate"}
{"id": "les_Z_fa9cbb_pilot", "ts": "2026-10-09T22:48:21Z", "cycle_id": "20261009T224803Z_fa9cbb", "type": "skip", "decision": "skip", "check": "pilot", "mutation": "", "what": "empty rsi_bias pilot suppressed", "source": "pilot_lane", "family": "rsi", "before_score": null, "after_score": null, "skill_bias": {}, "genome_prior": {}, "catalog_hint": {}, "proposal_fingerprint": "", "tags": ["empty_rsi_bias"], "evidence": [], "author": null, "expired": false, "status": "candidate"}
{"id": "les_Z_41f12d_dedupe", "ts": "2026-10-10T06:08:45Z", "cycle_id": "20261010T060836Z_41f12d", "type": "repeat_proposal", "decision": "block", "check": "dedupe", "mutation": "", "what": "blocked repeat: Deepen compute-useful math from accepted findings after hearing", "source": "growth_hearing", "family": "process", "before_score": null, "after_score": null, "skill_bias": {}, "genome_prior": {}, "catalog_hint": {}, "proposal_fingerprint": "810bc050d326", "tags": ["repeat_proposal"], "evidence": [], "author": null, "expired": false, "status": "candidate"}
{"id": "les_Z_41f12d_dedupe", "ts": "2026-10-10T06:08:47Z", "cycle_id": "20261010T060836Z_41f12d", "type": "repeat_proposal", "decision": "block", "check": "dedupe", "mutation": "", "what": "blocked repeat: Feed accepted/strong RSI findings into skill_router + genome bias", "source": "growth_hearing", "family": "process", "before_score": null, "after_score": null, "skill_bias": {}, "genome_prior": {}, "catalog_hint": {}, "proposal_fingerprint": "27e48156942c", "tags": ["repeat_proposal"], "evidence": [], "author": null, "expired": false, "status": "candidate"}
{"id": "les_Z_41f12d_authored_cassini__catalan_convoluti", "ts": "2026-10-10T06:08:48Z", "cycle_id": "20261010T060836Z_41f12d", "type": "authored_check", "decision": "skip", "check": "authoring", "mutation": "authored_cassini__catalan_convolution_w1", "what": "authored disabled hard check `authored_cassini__catalan_convolution_w1` from proven lemmas cassini + catalan_convolution on new windows; awaits Oracle via proposal", "source": "conjecture_desk", "family": "hard_tier", "before_score": null, "after_score": null, "skill_bias": {}, "genome_prior": {}, "catalog_hint": {}, "proposal_fingerprint": "", "tags": ["authoring", "authored_check", "cassini", "catalan_convolution"], "evidence": ["society/benchmarks/artifacts/lemma_impl.py::check_cassini_identity", "society/benchmarks/artifacts/lemma_impl.py::check_catalan_convolution", "society/benchmarks/lemma_microbench.py", "lemma:cassini", "lemma:catalan_convolution"], "author": null, "expired": false, "status": "candidate"}
