{"id": "les_1:29:54Z_fft_add_slow_loops", "ts": "2026-09-27T21:29:54Z", "cycle_id": "", "decision": "revert", "check": "bench_harness", "mutation": "fft_add_slow_loops", "what": "aggregate did not rise or Oracle killed keep (trial=0.8652, delta=-0.0074); reverted (Increase SLOW_EXTRA_LOOPS — deliberate regression); restored_agg=0.8839", "source": "bench_improve", "family": "outcome", "before_score": 0.8726, "after_score": 0.8652, "skill_bias": {"improver.improve": -0.05, "builder.build": -0.03}, "tags": ["bench", "revert", "fft_add_slow_loops"], "evidence": ["society/benchmarks/artifacts/fft_impl.py", "society/benchmarks/run_benchmarks.py"], "expired": false, "status": "candidate"}
{"id": "les_Z_5b5a6e_fft_add_slow_loops", "ts": "2026-09-27T21:29:57Z", "cycle_id": "20260927T212954Z_5b5a6e", "decision": "revert", "check": "bench_harness", "mutation": "fft_add_slow_loops", "what": "aggregate did not rise or Oracle killed keep (trial=0.8686, delta=-0.0122); reverted (Increase SLOW_EXTRA_LOOPS — deliberate regression); restored_agg=0.8834", "source": "bench_improve", "family": "outcome", "before_score": 0.8808, "after_score": 0.8686, "skill_bias": {"improver.improve": -0.05, "builder.build": -0.03}, "tags": ["bench", "revert", "fft_add_slow_loops"], "evidence": ["society/benchmarks/artifacts/fft_impl.py", "society/benchmarks/run_benchmarks.py"], "expired": false, "status": "candidate"}
{"id": "les_Z_cd1c7c_fft_add_slow_loops", "ts": "2026-09-27T21:30:40Z", "cycle_id": "20260927T213039Z_cd1c7c", "decision": "revert", "check": "bench_harness", "mutation": "fft_add_slow_loops", "what": "aggregate did not rise or Oracle killed keep (trial=0.8693, delta=-0.0148); reverted (Increase SLOW_EXTRA_LOOPS — deliberate regression); restored_agg=0.8834", "source": "bench_improve", "family": "outcome", "before_score": 0.8841, "after_score": 0.8693, "skill_bias": {"improver.improve": -0.05, "builder.build": -0.03}, "tags": ["bench", "revert", "fft_add_slow_loops"], "evidence": ["society/benchmarks/artifacts/fft_impl.py", "society/benchmarks/run_benchmarks.py"], "expired": false, "status": "candidate"}
{"id": "les_4:33:04Z_Deepen compute-useful math from acc", "ts": "2026-10-06T14:33:04Z", "cycle_id": "", "type": "oracle_kill", "decision": "revert", "check": "oracle", "mutation": "Deepen compute-useful math from accepted findings after hearing", "what": "Oracle FAIL kills keep. kills=['stripped:stripped_not_useful_fail', 'held_out:held_out_fail', 'collective_kill']. No fitness credit.", "source": "novelty_gate", "family": "process", "before_score": null, "after_score": null, "skill_bias": {"improver.improve": 0.02, "geometer.gather": 0.02}, "genome_prior": {"explore": 0.02, "gather": 0.0}, "catalog_hint": {}, "proposal_fingerprint": "", "tags": ["oracle_kill", "stripped:stripped_not_useful_fail", "held_out:held_out_fail", "collective_kill"], "evidence": ["kill:stripped:stripped_not_useful_fail", "kill:held_out:held_out_fail", "kill:collective_kill"], "author": null, "expired": false, "status": "candidate"}
{"id": "les_Z_295c03_Deepen compute-useful math from acc", "ts": "2026-10-06T14:33:04Z", "cycle_id": "20261006T143302Z_295c03", "type": "hearing_reject", "decision": "block", "check": "hearing", "mutation": "Deepen compute-useful math from accepted findings after hearing", "what": "hearing_reject: duplicate proposal without new evidence or citations — rejected", "source": "growth_hearing", "family": "process", "before_score": null, "after_score": null, "skill_bias": {}, "genome_prior": {}, "catalog_hint": {}, "proposal_fingerprint": "810bc050d326", "tags": ["hearing", "reject"], "evidence": ["proposal:imp_295c03_50"], "author": null, "expired": false, "status": "candidate"}
{"id": "les_4:33:04Z_Feed accepted/strong RSI findings i", "ts": "2026-10-06T14:33:04Z", "cycle_id": "", "type": "oracle_kill", "decision": "revert", "check": "oracle", "mutation": "Feed accepted/strong RSI findings into skill_router + genome bias", "what": "Oracle FAIL kills keep. kills=['stripped:stripped_not_useful_fail', 'held_out:held_out_fail', 'collective_kill']. No fitness credit.", "source": "novelty_gate", "family": "process", "before_score": null, "after_score": null, "skill_bias": {"improver.improve": 0.02, "geometer.gather": 0.02}, "genome_prior": {"explore": 0.02, "gather": 0.0}, "catalog_hint": {}, "proposal_fingerprint": "", "tags": ["oracle_kill", "stripped:stripped_not_useful_fail", "held_out:held_out_fail", "collective_kill"], "evidence": ["kill:stripped:stripped_not_useful_fail", "kill:held_out:held_out_fail", "kill:collective_kill"], "author": null, "expired": false, "status": "candidate"}
{"id": "les_Z_295c03_vandermonde", "ts": "2026-10-06T14:33:04Z", "cycle_id": "20261006T143302Z_295c03", "type": "skip", "decision": "skip", "check": "oracle_seen_claim", "mutation": "vandermonde", "what": "skip re-oracle of vandermonde:1706.03762", "source": "claim_pipeline", "family": "novelty", "before_score": null, "after_score": null, "skill_bias": {}, "genome_prior": {}, "catalog_hint": {}, "proposal_fingerprint": "vandermonde:1706.03762", "tags": ["repeat_claim"], "evidence": [], "author": null, "expired": false, "status": "candidate"}
{"id": "les_Z_295c03_pilot", "ts": "2026-10-06T14:33:24Z", "cycle_id": "20261006T143302Z_295c03", "type": "skip", "decision": "skip", "check": "pilot", "mutation": "", "what": "empty rsi_bias pilot suppressed", "source": "pilot_lane", "family": "rsi", "before_score": null, "after_score": null, "skill_bias": {}, "genome_prior": {}, "catalog_hint": {}, "proposal_fingerprint": "", "tags": ["empty_rsi_bias"], "evidence": [], "author": null, "expired": false, "status": "candidate"}
{"id": "les_4:33:44Z_Deepen compute-useful math from acc", "ts": "2026-10-06T14:33:44Z", "cycle_id": "", "type": "oracle_kill", "decision": "revert", "check": "oracle", "mutation": "Deepen compute-useful math from accepted findings after hearing", "what": "Oracle FAIL kills keep. kills=['stripped:stripped_not_useful_fail', 'held_out:held_out_fail', 'collective_kill']. No fitness credit.", "source": "novelty_gate", "family": "process", "before_score": null, "after_score": null, "skill_bias": {"improver.improve": 0.02, "geometer.gather": 0.02}, "genome_prior": {"explore": 0.02, "gather": 0.0}, "catalog_hint": {}, "proposal_fingerprint": "", "tags": ["oracle_kill", "stripped:stripped_not_useful_fail", "held_out:held_out_fail", "collective_kill"], "evidence": ["kill:stripped:stripped_not_useful_fail", "kill:held_out:held_out_fail", "kill:collective_kill"], "author": null, "expired": false, "status": "candidate"}
{"id": "les_4:33:44Z_Feed accepted/strong RSI findings i", "ts": "2026-10-06T14:33:44Z", "cycle_id": "", "type": "oracle_kill", "decision": "revert", "check": "oracle", "mutation": "Feed accepted/strong RSI findings into skill_router + genome bias", "what": "Oracle FAIL kills keep. kills=['stripped:stripped_not_useful_fail', 'held_out:held_out_fail', 'collective_kill']. No fitness credit.", "source": "novelty_gate", "family": "process", "before_score": null, "after_score": null, "skill_bias": {"improver.improve": 0.02, "geometer.gather": 0.02}, "genome_prior": {"explore": 0.02, "gather": 0.0}, "catalog_hint": {}, "proposal_fingerprint": "", "tags": ["oracle_kill", "stripped:stripped_not_useful_fail", "held_out:held_out_fail", "collective_kill"], "evidence": ["kill:stripped:stripped_not_useful_fail", "kill:held_out:held_out_fail", "kill:collective_kill"], "author": null, "expired": false, "status": "candidate"}
{"id": "les_4:33:44Z_Deepen compute-useful math from acc", "ts": "2026-10-06T14:33:44Z", "cycle_id": "", "type": "oracle_kill", "decision": "revert", "check": "oracle", "mutation": "Deepen compute-useful math from accepted findings after hearing", "what": "Oracle FAIL kills keep. kills=['stripped:stripped_not_useful_fail', 'held_out:held_out_fail', 'collective_kill']. No fitness credit.", "source": "novelty_gate", "family": "process", "before_score": null, "after_score": null, "skill_bias": {"improver.improve": 0.02, "geometer.gather": 0.02}, "genome_prior": {"explore": 0.02, "gather": 0.0}, "catalog_hint": {}, "proposal_fingerprint": "", "tags": ["oracle_kill", "stripped:stripped_not_useful_fail", "held_out:held_out_fail", "collective_kill"], "evidence": ["kill:stripped:stripped_not_useful_fail", "kill:held_out:held_out_fail", "kill:collective_kill"], "author": null, "expired": false, "status": "candidate"}
{"id": "les_4:33:44Z_Feed accepted/strong RSI findings i", "ts": "2026-10-06T14:33:44Z", "cycle_id": "", "type": "oracle_kill", "decision": "revert", "check": "oracle", "mutation": "Feed accepted/strong RSI findings into skill_router + genome bias (cycle 111)", "what": "Oracle FAIL kills keep. kills=['stripped:stripped_not_useful_fail', 'held_out:held_out_fail', 'collective_kill']. No fitness credit.", "source": "novelty_gate", "family": "process", "before_score": null, "after_score": null, "skill_bias": {"improver.improve": 0.02, "geometer.gather": 0.02}, "genome_prior": {"explore": 0.02, "gather": 0.0}, "catalog_hint": {}, "proposal_fingerprint": "", "tags": ["oracle_kill", "stripped:stripped_not_useful_fail", "held_out:held_out_fail", "collective_kill"], "evidence": ["kill:stripped:stripped_not_useful_fail", "kill:held_out:held_out_fail", "kill:collective_kill"], "author": null, "expired": false, "status": "candidate"}
{"id": "les_4:33:44Z_Deepen compute-useful math from acc", "ts": "2026-10-06T14:33:44Z", "cycle_id": "", "type": "oracle_kill", "decision": "revert", "check": "oracle", "mutation": "Deepen compute-useful math from accepted findings after hearing", "what": "Oracle FAIL kills keep. kills=['stripped:stripped_not_useful_fail', 'held_out:held_out_fail', 'collective_kill']. No fitness credit.", "source": "novelty_gate", "family": "process", "before_score": null, "after_score": null, "skill_bias": {"improver.improve": 0.02, "geometer.gather": 0.02}, "genome_prior": {"explore": 0.02, "gather": 0.0}, "catalog_hint": {}, "proposal_fingerprint": "", "tags": ["oracle_kill", "stripped:stripped_not_useful_fail", "held_out:held_out_fail", "collective_kill"], "evidence": ["kill:stripped:stripped_not_useful_fail", "kill:held_out:held_out_fail", "kill:collective_kill"], "author": null, "expired": false, "status": "candidate"}
{"id": "les_4:33:44Z_Feed accepted/strong RSI findings i", "ts": "2026-10-06T14:33:44Z", "cycle_id": "", "type": "oracle_kill", "decision": "revert", "check": "oracle", "mutation": "Feed accepted/strong RSI findings into skill_router + genome bias", "what": "Oracle FAIL kills keep. kills=['stripped:stripped_not_useful_fail', 'held_out:held_out_fail', 'collective_kill']. No fitness credit.", "source": "novelty_gate", "family": "process", "before_score": null, "after_score": null, "skill_bias": {"improver.improve": 0.02, "geometer.gather": 0.02}, "genome_prior": {"explore": 0.02, "gather": 0.0}, "catalog_hint": {}, "proposal_fingerprint": "", "tags": ["oracle_kill", "stripped:stripped_not_useful_fail", "held_out:held_out_fail", "collective_kill"], "evidence": ["kill:stripped:stripped_not_useful_fail", "kill:held_out:held_out_fail", "kill:collective_kill"], "author": null, "expired": false, "status": "candidate"}
{"id": "les_4:33:44Z_Deepen compute-useful math from acc", "ts": "2026-10-06T14:33:44Z", "cycle_id": "", "type": "oracle_kill", "decision": "revert", "check": "oracle", "mutation": "Deepen compute-useful math from accepted findings after hearing", "what": "Oracle FAIL kills keep. kills=['stripped:stripped_not_useful_fail', 'held_out:held_out_fail', 'collective_kill']. No fitness credit.", "source": "novelty_gate", "family": "process", "before_score": null, "after_score": null, "skill_bias": {"improver.improve": 0.02, "geometer.gather": 0.02}, "genome_prior": {"explore": 0.02, "gather": 0.0}, "catalog_hint": {}, "proposal_fingerprint": "", "tags": ["oracle_kill", "stripped:stripped_not_useful_fail", "held_out:held_out_fail", "collective_kill"], "evidence": ["kill:stripped:stripped_not_useful_fail", "kill:held_out:held_out_fail", "kill:collective_kill"], "author": null, "expired": false, "status": "candidate"}
{"id": "les_4:33:44Z_Feed accepted/strong RSI findings i", "ts": "2026-10-06T14:33:44Z", "cycle_id": "", "type": "oracle_kill", "decision": "revert", "check": "oracle", "mutation": "Feed accepted/strong RSI findings into skill_router + genome bias (cycle 113)", "what": "Oracle FAIL kills keep. kills=['stripped:stripped_not_useful_fail', 'held_out:held_out_fail', 'collective_kill']. No fitness credit.", "source": "novelty_gate", "family": "process", "before_score": null, "after_score": null, "skill_bias": {"improver.improve": 0.02, "geometer.gather": 0.02}, "genome_prior": {"explore": 0.02, "gather": 0.0}, "catalog_hint": {}, "proposal_fingerprint": "", "tags": ["oracle_kill", "stripped:stripped_not_useful_fail", "held_out:held_out_fail", "collective_kill"], "evidence": ["kill:stripped:stripped_not_useful_fail", "kill:held_out:held_out_fail", "kill:collective_kill"], "author": null, "expired": false, "status": "candidate"}
{"id": "les_4:33:44Z_Deepen compute-useful math from acc", "ts": "2026-10-06T14:33:44Z", "cycle_id": "", "type": "oracle_kill", "decision": "revert", "check": "oracle", "mutation": "Deepen compute-useful math from accepted findings after hearing", "what": "Oracle FAIL kills keep. kills=['stripped:stripped_not_useful_fail', 'held_out:held_out_fail', 'collective_kill']. No fitness credit.", "source": "novelty_gate", "family": "process", "before_score": null, "after_score": null, "skill_bias": {"improver.improve": 0.02, "geometer.gather": 0.02}, "genome_prior": {"explore": 0.02, "gather": 0.0}, "catalog_hint": {}, "proposal_fingerprint": "", "tags": ["oracle_kill", "stripped:stripped_not_useful_fail", "held_out:held_out_fail", "collective_kill"], "evidence": ["kill:stripped:stripped_not_useful_fail", "kill:held_out:held_out_fail", "kill:collective_kill"], "author": null, "expired": false, "status": "candidate"}
{"id": "les_4:33:44Z_Feed accepted/strong RSI findings i", "ts": "2026-10-06T14:33:44Z", "cycle_id": "", "type": "oracle_kill", "decision": "revert", "check": "oracle", "mutation": "Feed accepted/strong RSI findings into skill_router + genome bias", "what": "Oracle FAIL kills keep. kills=['stripped:stripped_not_useful_fail', 'held_out:held_out_fail', 'collective_kill']. No fitness credit.", "source": "novelty_gate", "family": "process", "before_score": null, "after_score": null, "skill_bias": {"improver.improve": 0.02, "geometer.gather": 0.02}, "genome_prior": {"explore": 0.02, "gather": 0.0}, "catalog_hint": {}, "proposal_fingerprint": "", "tags": ["oracle_kill", "stripped:stripped_not_useful_fail", "held_out:held_out_fail", "collective_kill"], "evidence": ["kill:stripped:stripped_not_useful_fail", "kill:held_out:held_out_fail", "kill:collective_kill"], "author": null, "expired": false, "status": "candidate"}
{"id": "les_4:33:44Z_Deepen compute-useful math from acc", "ts": "2026-10-06T14:33:44Z", "cycle_id": "", "type": "oracle_kill", "decision": "revert", "check": "oracle", "mutation": "Deepen compute-useful math from accepted findings after hearing", "what": "Oracle FAIL kills keep. kills=['stripped:stripped_not_useful_fail', 'held_out:held_out_fail', 'collective_kill']. No fitness credit.", "source": "novelty_gate", "family": "process", "before_score": null, "after_score": null, "skill_bias": {"improver.improve": 0.02, "geometer.gather": 0.02}, "genome_prior": {"explore": 0.02, "gather": 0.0}, "catalog_hint": {}, "proposal_fingerprint": "", "tags": ["oracle_kill", "stripped:stripped_not_useful_fail", "held_out:held_out_fail", "collective_kill"], "evidence": ["kill:stripped:stripped_not_useful_fail", "kill:held_out:held_out_fail", "kill:collective_kill"], "author": null, "expired": false, "status": "candidate"}
{"id": "les_4:33:44Z_Feed accepted/strong RSI findings i", "ts": "2026-10-06T14:33:44Z", "cycle_id": "", "type": "oracle_kill", "decision": "revert", "check": "oracle", "mutation": "Feed accepted/strong RSI findings into skill_router + genome bias (cycle 115)", "what": "Oracle FAIL kills keep. kills=['stripped:stripped_not_useful_fail', 'held_out:held_out_fail', 'collective_kill']. No fitness credit.", "source": "novelty_gate", "family": "process", "before_score": null, "after_score": null, "skill_bias": {"improver.improve": 0.02, "geometer.gather": 0.02}, "genome_prior": {"explore": 0.02, "gather": 0.0}, "catalog_hint": {}, "proposal_fingerprint": "", "tags": ["oracle_kill", "stripped:stripped_not_useful_fail", "held_out:held_out_fail", "collective_kill"], "evidence": ["kill:stripped:stripped_not_useful_fail", "kill:held_out:held_out_fail", "kill:collective_kill"], "author": null, "expired": false, "status": "candidate"}
{"id": "les_4:33:44Z_Deepen compute-useful math from acc", "ts": "2026-10-06T14:33:44Z", "cycle_id": "", "type": "oracle_kill", "decision": "revert", "check": "oracle", "mutation": "Deepen compute-useful math from accepted findings after hearing", "what": "Oracle FAIL kills keep. kills=['stripped:stripped_not_useful_fail', 'held_out:held_out_fail', 'collective_kill']. No fitness credit.", "source": "novelty_gate", "family": "process", "before_score": null, "after_score": null, "skill_bias": {"improver.improve": 0.02, "geometer.gather": 0.02}, "genome_prior": {"explore": 0.02, "gather": 0.0}, "catalog_hint": {}, "proposal_fingerprint": "", "tags": ["oracle_kill", "stripped:stripped_not_useful_fail", "held_out:held_out_fail", "collective_kill"], "evidence": ["kill:stripped:stripped_not_useful_fail", "kill:held_out:held_out_fail", "kill:collective_kill"], "author": null, "expired": false, "status": "candidate"}
{"id": "les_4:33:44Z_Feed accepted/strong RSI findings i", "ts": "2026-10-06T14:33:44Z", "cycle_id": "", "type": "oracle_kill", "decision": "revert", "check": "oracle", "mutation": "Feed accepted/strong RSI findings into skill_router + genome bias", "what": "Oracle FAIL kills keep. kills=['stripped:stripped_not_useful_fail', 'held_out:held_out_fail', 'collective_kill']. No fitness credit.", "source": "novelty_gate", "family": "process", "before_score": null, "after_score": null, "skill_bias": {"improver.improve": 0.02, "geometer.gather": 0.02}, "genome_prior": {"explore": 0.02, "gather": 0.0}, "catalog_hint": {}, "proposal_fingerprint": "", "tags": ["oracle_kill", "stripped:stripped_not_useful_fail", "held_out:held_out_fail", "collective_kill"], "evidence": ["kill:stripped:stripped_not_useful_fail", "kill:held_out:held_out_fail", "kill:collective_kill"], "author": null, "expired": false, "status": "candidate"}
{"id": "les_4:33:45Z_Deepen compute-useful math from acc", "ts": "2026-10-06T14:33:45Z", "cycle_id": "", "type": "oracle_kill", "decision": "revert", "check": "oracle", "mutation": "Deepen compute-useful math from accepted findings after hearing", "what": "Oracle FAIL kills keep. kills=['stripped:stripped_not_useful_fail', 'held_out:held_out_fail', 'collective_kill']. No fitness credit.", "source": "novelty_gate", "family": "process", "before_score": null, "after_score": null, "skill_bias": {"improver.improve": 0.02, "geometer.gather": 0.02}, "genome_prior": {"explore": 0.02, "gather": 0.0}, "catalog_hint": {}, "proposal_fingerprint": "", "tags": ["oracle_kill", "stripped:stripped_not_useful_fail", "held_out:held_out_fail", "collective_kill"], "evidence": ["kill:stripped:stripped_not_useful_fail", "kill:held_out:held_out_fail", "kill:collective_kill"], "author": null, "expired": false, "status": "candidate"}
{"id": "les_4:33:45Z_Feed accepted/strong RSI findings i", "ts": "2026-10-06T14:33:45Z", "cycle_id": "", "type": "oracle_kill", "decision": "revert", "check": "oracle", "mutation": "Feed accepted/strong RSI findings into skill_router + genome bias (cycle 117)", "what": "Oracle FAIL kills keep. kills=['stripped:stripped_not_useful_fail', 'held_out:held_out_fail', 'collective_kill']. No fitness credit.", "source": "novelty_gate", "family": "process", "before_score": null, "after_score": null, "skill_bias": {"improver.improve": 0.02, "geometer.gather": 0.02}, "genome_prior": {"explore": 0.02, "gather": 0.0}, "catalog_hint": {}, "proposal_fingerprint": "", "tags": ["oracle_kill", "stripped:stripped_not_useful_fail", "held_out:held_out_fail", "collective_kill"], "evidence": ["kill:stripped:stripped_not_useful_fail", "kill:held_out:held_out_fail", "kill:collective_kill"], "author": null, "expired": false, "status": "candidate"}
{"id": "les_4:33:45Z_Deepen compute-useful math from acc", "ts": "2026-10-06T14:33:45Z", "cycle_id": "", "type": "oracle_kill", "decision": "revert", "check": "oracle", "mutation": "Deepen compute-useful math from accepted findings after hearing", "what": "Oracle FAIL kills keep. kills=['stripped:stripped_not_useful_fail', 'held_out:held_out_fail', 'collective_kill']. No fitness credit.", "source": "novelty_gate", "family": "process", "before_score": null, "after_score": null, "skill_bias": {"improver.improve": 0.02, "geometer.gather": 0.02}, "genome_prior": {"explore": 0.02, "gather": 0.0}, "catalog_hint": {}, "proposal_fingerprint": "", "tags": ["oracle_kill", "stripped:stripped_not_useful_fail", "held_out:held_out_fail", "collective_kill"], "evidence": ["kill:stripped:stripped_not_useful_fail", "kill:held_out:held_out_fail", "kill:collective_kill"], "author": null, "expired": false, "status": "candidate"}
