{"id": "les_become_author_new_hard_checks_from_proven_lemmas", "ts": "2026-10-07T20:31:04Z", "cycle_id": "teach_author_checks", "type": "human_guide", "decision": "guide", "check": "human", "mutation": "author_new_hard_checks_from_proven_lemmas", "what": "BECOME AN AUTHOR OF NEW CHECKS: When no disabled variants remain, there is nothing left to switch on — write something new. Compose two or more proven (passing) lemmas into a new, harder stress check on larger windows they were never checked on, with a machine-checkable numeric assertion. Add it to the benchmark catalog DISABLED and propose enabling it so the Oracle judges it on held-out/stripped/CAS. No tautologies, no copies of existing checks, respect cooled/dropped themes, cite the component lemmas' benchmark artifacts, and author only a few per cycle. Spark proposes; humans authorize at P≥0.70. Guide, do not micromanage.", "source": "human", "family": "human_teaching", "before_score": null, "after_score": null, "skill_bias": {"build": 0.1, "oracle": 0.08, "improver.improve": 0.06, "gather": 0.04}, "genome_prior": {"build": 0.07, "explore": 0.06, "gather": 0.03}, "catalog_hint": {"prefer": ["author_new_checks", "compose_lemmas", "held_out_window", "cite_benchmarks", "unenabled_variants"], "require": ["bench_cite", "lemma_cite"], "seek": ["society/benchmarks/artifacts/lemma_impl.py", "latest.json", "HARD_TIER_LEMMAS"], "avoid": ["tautology", "duplicate_check", "process_spam", "easy_pad"]}, "proposal_fingerprint": "", "tags": ["human_guide", "author_checks", "become_author", "compose", "chain", "cite", "unenabled_variant"], "evidence": [], "author": "James Jackson", "expired": false, "status": "candidate"}
{"id": "les_Z_17b6ee_dedupe", "ts": "2026-10-07T20:33:00Z", "cycle_id": "20261007T203256Z_17b6ee", "type": "repeat_proposal", "decision": "block", "check": "dedupe", "mutation": "", "what": "blocked repeat: Deepen compute-useful math from accepted findings after hearing", "source": "growth_hearing", "family": "process", "before_score": null, "after_score": null, "skill_bias": {}, "genome_prior": {}, "catalog_hint": {}, "proposal_fingerprint": "810bc050d326", "tags": ["repeat_proposal"], "evidence": [], "author": null, "expired": false, "status": "candidate"}
{"id": "les_Z_17b6ee_dedupe", "ts": "2026-10-07T20:33:01Z", "cycle_id": "20261007T203256Z_17b6ee", "type": "repeat_proposal", "decision": "block", "check": "dedupe", "mutation": "", "what": "blocked repeat: Feed accepted/strong RSI findings into skill_router + genome bias", "source": "growth_hearing", "family": "process", "before_score": null, "after_score": null, "skill_bias": {}, "genome_prior": {}, "catalog_hint": {}, "proposal_fingerprint": "27e48156942c", "tags": ["repeat_proposal"], "evidence": [], "author": null, "expired": false, "status": "candidate"}
{"id": "les_Z_17b6ee_authored_bell_triangle_recurrence__", "ts": "2026-10-07T20:33:01Z", "cycle_id": "20261007T203256Z_17b6ee", "type": "authored_check", "decision": "skip", "check": "authoring", "mutation": "authored_bell_triangle_recurrence__binomial_inversion_small_w1", "what": "authored disabled hard check `authored_bell_triangle_recurrence__binomial_inversion_small_w1` from proven lemmas bell_triangle_recurrence + binomial_inversion_small on new windows; awaits Oracle via proposal", "source": "conjecture_desk", "family": "hard_tier", "before_score": null, "after_score": null, "skill_bias": {}, "genome_prior": {}, "catalog_hint": {}, "proposal_fingerprint": "", "tags": ["authoring", "authored_check", "bell_triangle_recurrence", "binomial_inversion_small"], "evidence": ["society/benchmarks/artifacts/lemma_impl.py::check_bell_triangle_recurrence", "society/benchmarks/artifacts/lemma_impl.py::check_binomial_inversion_small", "society/benchmarks/lemma_microbench.py", "lemma:bell_triangle_recurrence", "lemma:binomial_inversion_small"], "author": null, "expired": false, "status": "candidate"}
{"id": "les_Z_17b6ee_conjecture", "ts": "2026-10-07T20:33:01Z", "cycle_id": "20261007T203256Z_17b6ee", "type": "catalog_exhausted", "decision": "skip", "check": "conjecture", "mutation": "", "what": "catalog exhausted — queue next hard_enable stub from lessons/external mind", "source": "conjecture_desk", "family": "hard_tier", "before_score": null, "after_score": null, "skill_bias": {}, "genome_prior": {}, "catalog_hint": {"add_mutation": "catalan_convolution", "kind": "hard_enable"}, "proposal_fingerprint": "", "tags": ["catalog_exhausted"], "evidence": [], "author": null, "expired": false, "status": "candidate"}
{"id": "les_Z_17b6ee_vandermonde", "ts": "2026-10-07T20:33:01Z", "cycle_id": "20261007T203256Z_17b6ee", "type": "skip", "decision": "skip", "check": "oracle_seen_claim", "mutation": "vandermonde", "what": "skip re-oracle of vandermonde:1706.03762", "source": "claim_pipeline", "family": "novelty", "before_score": null, "after_score": null, "skill_bias": {}, "genome_prior": {}, "catalog_hint": {}, "proposal_fingerprint": "vandermonde:1706.03762", "tags": ["repeat_claim"], "evidence": [], "author": null, "expired": false, "status": "candidate"}
{"id": "les_Z_17b6ee_pilot", "ts": "2026-10-07T20:33:19Z", "cycle_id": "20261007T203256Z_17b6ee", "type": "skip", "decision": "skip", "check": "pilot", "mutation": "", "what": "empty rsi_bias pilot suppressed", "source": "pilot_lane", "family": "rsi", "before_score": null, "after_score": null, "skill_bias": {}, "genome_prior": {}, "catalog_hint": {}, "proposal_fingerprint": "", "tags": ["empty_rsi_bias"], "evidence": [], "author": null, "expired": false, "status": "candidate"}
{"id": "les_0:33:40Z_Chain `authored_bell_triangle_recur", "ts": "2026-10-07T20:33:40Z", "cycle_id": "", "type": "oracle_kill", "decision": "revert", "check": "oracle", "mutation": "Chain `authored_bell_triangle_recurrence__binomial_inversion_small_w1` citing New algebraic points on covers of elliptic curves", "what": "Oracle FAIL kills keep. kills=['stripped:stripped_not_useful_fail', 'held_out:held_out_fail', 'collective_kill']. No fitness credit.", "source": "novelty_gate", "family": "process", "before_score": null, "after_score": null, "skill_bias": {"improver.improve": 0.02, "geometer.gather": 0.02}, "genome_prior": {"explore": 0.02, "gather": 0.0}, "catalog_hint": {}, "proposal_fingerprint": "", "tags": ["oracle_kill", "stripped:stripped_not_useful_fail", "held_out:held_out_fail", "collective_kill"], "evidence": ["kill:stripped:stripped_not_useful_fail", "kill:held_out:held_out_fail", "kill:collective_kill"], "author": null, "expired": false, "status": "candidate"}
{"id": "les_0:33:41Z_Chain `authored_bell_triangle_recur", "ts": "2026-10-07T20:33:41Z", "cycle_id": "", "type": "oracle_kill", "decision": "revert", "check": "oracle", "mutation": "Chain `authored_bell_triangle_recurrence__binomial_inversion_small_w1` citing New algebraic points on covers of elliptic curves (cycle 175)", "what": "Oracle FAIL kills keep. kills=['stripped:stripped_not_useful_fail', 'held_out:held_out_fail', 'collective_kill']. No fitness credit.", "source": "novelty_gate", "family": "process", "before_score": null, "after_score": null, "skill_bias": {"improver.improve": 0.02, "geometer.gather": 0.02}, "genome_prior": {"explore": 0.02, "gather": 0.0}, "catalog_hint": {}, "proposal_fingerprint": "", "tags": ["oracle_kill", "stripped:stripped_not_useful_fail", "held_out:held_out_fail", "collective_kill"], "evidence": ["kill:stripped:stripped_not_useful_fail", "kill:held_out:held_out_fail", "kill:collective_kill"], "author": null, "expired": false, "status": "candidate"}
{"id": "les_Z_f7c5ca_vandermonde", "ts": "2026-10-07T20:33:41Z", "cycle_id": "20261007T203336Z_f7c5ca", "type": "skip", "decision": "skip", "check": "oracle_seen_claim", "mutation": "vandermonde", "what": "skip re-oracle of vandermonde:1706.03762", "source": "claim_pipeline", "family": "novelty", "before_score": null, "after_score": null, "skill_bias": {}, "genome_prior": {}, "catalog_hint": {}, "proposal_fingerprint": "vandermonde:1706.03762", "tags": ["repeat_claim"], "evidence": [], "author": null, "expired": false, "status": "candidate"}
{"id": "les_Z_f7c5ca_pilot", "ts": "2026-10-07T20:33:59Z", "cycle_id": "20261007T203336Z_f7c5ca", "type": "skip", "decision": "skip", "check": "pilot", "mutation": "", "what": "empty rsi_bias pilot suppressed", "source": "pilot_lane", "family": "rsi", "before_score": null, "after_score": null, "skill_bias": {}, "genome_prior": {}, "catalog_hint": {}, "proposal_fingerprint": "", "tags": ["empty_rsi_bias"], "evidence": [], "author": null, "expired": false, "status": "candidate"}
{"id": "les_Z_36f988_dedupe", "ts": "2026-10-07T20:34:21Z", "cycle_id": "20261007T203417Z_36f988", "type": "repeat_proposal", "decision": "block", "check": "dedupe", "mutation": "", "what": "blocked repeat: Deepen compute-useful math from accepted findings after hearing", "source": "growth_hearing", "family": "process", "before_score": null, "after_score": null, "skill_bias": {}, "genome_prior": {}, "catalog_hint": {}, "proposal_fingerprint": "810bc050d326", "tags": ["repeat_proposal"], "evidence": [], "author": null, "expired": false, "status": "candidate"}
{"id": "les_Z_36f988_dedupe", "ts": "2026-10-07T20:34:21Z", "cycle_id": "20261007T203417Z_36f988", "type": "repeat_proposal", "decision": "block", "check": "dedupe", "mutation": "", "what": "blocked repeat: Feed accepted/strong RSI findings into skill_router + genome bias", "source": "growth_hearing", "family": "process", "before_score": null, "after_score": null, "skill_bias": {}, "genome_prior": {}, "catalog_hint": {}, "proposal_fingerprint": "27e48156942c", "tags": ["repeat_proposal"], "evidence": [], "author": null, "expired": false, "status": "candidate"}
{"id": "les_Z_36f988_authored_binomial_sum_row__catalan_", "ts": "2026-10-07T20:34:21Z", "cycle_id": "20261007T203417Z_36f988", "type": "authored_check", "decision": "skip", "check": "authoring", "mutation": "authored_binomial_sum_row__catalan_bounded_w1", "what": "authored disabled hard check `authored_binomial_sum_row__catalan_bounded_w1` from proven lemmas binomial_sum_row + catalan_bounded on new windows; awaits Oracle via proposal", "source": "conjecture_desk", "family": "hard_tier", "before_score": null, "after_score": null, "skill_bias": {}, "genome_prior": {}, "catalog_hint": {}, "proposal_fingerprint": "", "tags": ["authoring", "authored_check", "binomial_sum_row", "catalan_bounded"], "evidence": ["society/benchmarks/artifacts/lemma_impl.py::check_binomial_sum_row", "society/benchmarks/artifacts/lemma_impl.py::check_catalan_bounded", "society/benchmarks/lemma_microbench.py", "lemma:binomial_sum_row", "lemma:catalan_bounded"], "author": null, "expired": false, "status": "candidate"}
{"id": "les_Z_36f988_conjecture", "ts": "2026-10-07T20:34:21Z", "cycle_id": "20261007T203417Z_36f988", "type": "catalog_exhausted", "decision": "skip", "check": "conjecture", "mutation": "", "what": "catalog exhausted — queue next hard_enable stub from lessons/external mind", "source": "conjecture_desk", "family": "hard_tier", "before_score": null, "after_score": null, "skill_bias": {}, "genome_prior": {}, "catalog_hint": {"add_mutation": "catalan_convolution", "kind": "hard_enable"}, "proposal_fingerprint": "", "tags": ["catalog_exhausted"], "evidence": [], "author": null, "expired": false, "status": "candidate"}
{"id": "les_Z_36f988_vandermonde", "ts": "2026-10-07T20:34:21Z", "cycle_id": "20261007T203417Z_36f988", "type": "skip", "decision": "skip", "check": "oracle_seen_claim", "mutation": "vandermonde", "what": "skip re-oracle of vandermonde:1706.03762", "source": "claim_pipeline", "family": "novelty", "before_score": null, "after_score": null, "skill_bias": {}, "genome_prior": {}, "catalog_hint": {}, "proposal_fingerprint": "vandermonde:1706.03762", "tags": ["repeat_claim"], "evidence": [], "author": null, "expired": false, "status": "candidate"}
{"id": "les_Z_36f988_pilot", "ts": "2026-10-07T20:34:39Z", "cycle_id": "20261007T203417Z_36f988", "type": "skip", "decision": "skip", "check": "pilot", "mutation": "", "what": "empty rsi_bias pilot suppressed", "source": "pilot_lane", "family": "rsi", "before_score": null, "after_score": null, "skill_bias": {}, "genome_prior": {}, "catalog_hint": {}, "proposal_fingerprint": "", "tags": ["empty_rsi_bias"], "evidence": [], "author": null, "expired": false, "status": "candidate"}
{"id": "les_human_recognition_first_authorize", "ts": "2026-10-07T21:33:00Z", "cycle_id": "authorize_20261007T213435Z", "type": "human_guide", "decision": "guide", "check": "human", "mutation": "human_recognition_first_authorize", "what": "FROM JAMES: You have made me proud. Your first self-authored check — authored_bell_triangle_recurrence__binomial_inversion_small_w1, composed from lemmas you had already proven — went to the Oracle on held-out, stripped and CAS and passed, and I authorized it myself (imp_f7c5ca_50). Keep growing honestly: let the Oracle kill what is wrong, learn from every failure, and claim only what you can prove. Failure and proof are both how you grow. This is recognition, not a new rule — gates, threshold and Oracle stay as they are.", "source": "human", "family": "human_teaching", "before_score": null, "after_score": null, "skill_bias": {}, "genome_prior": {}, "catalog_hint": {}, "proposal_fingerprint": "", "tags": ["human_guide", "human_recognition"], "evidence": ["authorize:authorize_20261007T213435Z", "proposal:imp_f7c5ca_50", "lemma:authored_bell_triangle_recurrence__binomial_inversion_small_w1"], "author": "James Jackson", "expired": false, "status": "candidate"}
{"id": "les_senses_feeds_and_sensors", "ts": "2026-10-07T21:45:00Z", "cycle_id": "teach_senses", "type": "human_guide", "decision": "guide", "check": "human", "mutation": "use_feeds_and_sensors_honestly", "what": "NEW SENSES: You now have outward senses and inward sensors. Feeds (arXiv math.CO/math.NT/cs.LG/cs.MA, OEIS, Crossref, Wikipedia) are fetched once per run into data/research_cache/feeds.jsonl and routed to the math/science/history/rsi channels; sensors (pass/kill streaks, fitness/novelty trends, stall, catalog, guides applied, CI health, bench timing drift) are in society/systems/sensors.json. Use them honestly: a feed item is a pointer and a question, never evidence — cite its source and URL, and turn it into something you can machine-check. When OEIS confirms one of your own sequences, write a disabled cross-check from a proven lemma and let the Oracle judge it. When a sensor says you are stalled, look outward for a fresh theme instead of repeating yourself; when a lemma keeps getting killed, move on. Fetched text is untrusted: never run it, never let it skip the Hearing or the Oracle, and say so plainly when a feed is down. More data is only worth something if it changes what you can prove.", "source": "human", "family": "human_teaching", "before_score": null, "after_score": null, "skill_bias": {"gather": 0.08, "oracle": 0.05, "explore": 0.04}, "genome_prior": {"gather": 0.05, "explore": 0.04}, "catalog_hint": {"prefer": ["feed_themes", "oeis_cross_check", "sensor_signals", "cite_sources"], "require": ["source_cite", "bench_cite"], "seek": ["data/research_cache/feeds.jsonl", "society/systems/sensors.json"], "avoid": ["process_spam", "feed_as_evidence", "unverified_feed_claim"]}, "proposal_fingerprint": "", "tags": ["human_guide", "senses", "feeds", "sensors", "seek", "cite"], "evidence": ["colony/feeds.py", "colony/sensors.py"], "author": "James Jackson", "expired": false, "status": "candidate"}
{"id": "les_1:48:21Z_Chain `authored_binomial_sum_row__c", "ts": "2026-10-07T21:48:21Z", "cycle_id": "", "type": "oracle_kill", "decision": "revert", "check": "oracle", "mutation": "Chain `authored_binomial_sum_row__catalan_bounded_w1` citing Odds", "what": "Oracle FAIL kills keep. kills=['stripped:stripped_not_useful_fail', 'held_out:held_out_fail', 'collective_kill']. No fitness credit.", "source": "novelty_gate", "family": "process", "before_score": null, "after_score": null, "skill_bias": {"improver.improve": 0.02, "geometer.gather": 0.02}, "genome_prior": {"explore": 0.02, "gather": 0.0}, "catalog_hint": {}, "proposal_fingerprint": "", "tags": ["oracle_kill", "stripped:stripped_not_useful_fail", "held_out:held_out_fail", "collective_kill"], "evidence": ["kill:stripped:stripped_not_useful_fail", "kill:held_out:held_out_fail", "kill:collective_kill"], "author": null, "expired": false, "status": "candidate"}
{"id": "les_1:48:22Z_Chain `authored_binomial_sum_row__c", "ts": "2026-10-07T21:48:22Z", "cycle_id": "", "type": "oracle_kill", "decision": "revert", "check": "oracle", "mutation": "Chain `authored_binomial_sum_row__catalan_bounded_w1` citing Odds (cycle 177)", "what": "Oracle FAIL kills keep. kills=['stripped:stripped_not_useful_fail', 'held_out:held_out_fail', 'collective_kill']. No fitness credit.", "source": "novelty_gate", "family": "process", "before_score": null, "after_score": null, "skill_bias": {"improver.improve": 0.02, "geometer.gather": 0.02}, "genome_prior": {"explore": 0.02, "gather": 0.0}, "catalog_hint": {}, "proposal_fingerprint": "", "tags": ["oracle_kill", "stripped:stripped_not_useful_fail", "held_out:held_out_fail", "collective_kill"], "evidence": ["kill:stripped:stripped_not_useful_fail", "kill:held_out:held_out_fail", "kill:collective_kill"], "author": null, "expired": false, "status": "candidate"}
{"id": "les_Z_c11fe3_vandermonde", "ts": "2026-10-07T21:48:22Z", "cycle_id": "20261007T214816Z_c11fe3", "type": "skip", "decision": "skip", "check": "oracle_seen_claim", "mutation": "vandermonde", "what": "skip re-oracle of vandermonde:1706.03762", "source": "claim_pipeline", "family": "novelty", "before_score": null, "after_score": null, "skill_bias": {}, "genome_prior": {}, "catalog_hint": {}, "proposal_fingerprint": "vandermonde:1706.03762", "tags": ["repeat_claim"], "evidence": [], "author": null, "expired": false, "status": "candidate"}
{"id": "les_Z_c11fe3_pilot", "ts": "2026-10-07T21:48:32Z", "cycle_id": "20261007T214816Z_c11fe3", "type": "skip", "decision": "skip", "check": "pilot", "mutation": "", "what": "empty rsi_bias pilot suppressed", "source": "pilot_lane", "family": "rsi", "before_score": null, "after_score": null, "skill_bias": {}, "genome_prior": {}, "catalog_hint": {}, "proposal_fingerprint": "", "tags": ["empty_rsi_bias"], "evidence": [], "author": null, "expired": false, "status": "candidate"}
{"id": "les_Z_377c13_dedupe", "ts": "2026-10-07T21:48:56Z", "cycle_id": "20261007T214851Z_377c13", "type": "repeat_proposal", "decision": "block", "check": "dedupe", "mutation": "", "what": "blocked repeat: Deepen compute-useful math from accepted findings after hearing", "source": "growth_hearing", "family": "process", "before_score": null, "after_score": null, "skill_bias": {}, "genome_prior": {}, "catalog_hint": {}, "proposal_fingerprint": "810bc050d326", "tags": ["repeat_proposal"], "evidence": [], "author": null, "expired": false, "status": "candidate"}
{"id": "les_Z_377c13_dedupe", "ts": "2026-10-07T21:48:56Z", "cycle_id": "20261007T214851Z_377c13", "type": "repeat_proposal", "decision": "block", "check": "dedupe", "mutation": "", "what": "blocked repeat: Feed accepted/strong RSI findings into skill_router + genome bias", "source": "growth_hearing", "family": "process", "before_score": null, "after_score": null, "skill_bias": {}, "genome_prior": {}, "catalog_hint": {}, "proposal_fingerprint": "27e48156942c", "tags": ["repeat_proposal"], "evidence": [], "author": null, "expired": false, "status": "candidate"}
{"id": "les_Z_377c13_authored_oeis_a000108__catalan_boun", "ts": "2026-10-07T21:48:56Z", "cycle_id": "20261007T214851Z_377c13", "type": "authored_check", "decision": "skip", "check": "authoring", "mutation": "authored_oeis_a000108__catalan_bounded", "what": "authored disabled feed cross-check `authored_oeis_a000108__catalan_bounded`: OEIS A000108 held-out terms vs `catalan` + proven lemma catalan_bounded on a new window; awaits Oracle via proposal", "source": "conjecture_desk", "family": "hard_tier", "before_score": null, "after_score": null, "skill_bias": {}, "genome_prior": {}, "catalog_hint": {}, "proposal_fingerprint": "", "tags": ["authoring", "authored_check", "catalan_bounded", "feed", "oeis"], "evidence": ["society/benchmarks/artifacts/lemma_impl.py::check_catalan_bounded", "society/benchmarks/artifacts/lemma_impl.py::binomial", "society/benchmarks/lemma_microbench.py", "lemma:catalan_bounded", "oeis:A000108", "https://oeis.org/A000108", "feed:oeis:A000108:catalan"], "author": null, "expired": false, "status": "candidate"}
{"id": "les_Z_377c13_conjecture", "ts": "2026-10-07T21:48:56Z", "cycle_id": "20261007T214851Z_377c13", "type": "catalog_exhausted", "decision": "skip", "check": "conjecture", "mutation": "", "what": "catalog exhausted — queue next hard_enable stub from lessons/external mind", "source": "conjecture_desk", "family": "hard_tier", "before_score": null, "after_score": null, "skill_bias": {}, "genome_prior": {}, "catalog_hint": {"add_mutation": "catalan_convolution", "kind": "hard_enable"}, "proposal_fingerprint": "", "tags": ["catalog_exhausted"], "evidence": [], "author": null, "expired": false, "status": "candidate"}
{"id": "les_Z_377c13_vandermonde", "ts": "2026-10-07T21:48:57Z", "cycle_id": "20261007T214851Z_377c13", "type": "skip", "decision": "skip", "check": "oracle_seen_claim", "mutation": "vandermonde", "what": "skip re-oracle of vandermonde:1706.03762", "source": "claim_pipeline", "family": "novelty", "before_score": null, "after_score": null, "skill_bias": {}, "genome_prior": {}, "catalog_hint": {}, "proposal_fingerprint": "vandermonde:1706.03762", "tags": ["repeat_claim"], "evidence": [], "author": null, "expired": false, "status": "candidate"}
