{"id": "les_9:53:11Z_Chain `fibonacci_cassini_ext` citin", "ts": "2026-10-07T19:53:11Z", "cycle_id": "", "type": "oracle_kill", "decision": "revert", "check": "oracle", "mutation": "Chain `fibonacci_cassini_ext` citing New algebraic points on covers of elliptic curves", "what": "Oracle FAIL kills keep. kills=['stripped:stripped_not_useful_fail', 'held_out:held_out_fail', 'collective_kill']. No fitness credit.", "source": "novelty_gate", "family": "process", "before_score": null, "after_score": null, "skill_bias": {"improver.improve": 0.02, "geometer.gather": 0.02}, "genome_prior": {"explore": 0.02, "gather": 0.0}, "catalog_hint": {}, "proposal_fingerprint": "", "tags": ["oracle_kill", "stripped:stripped_not_useful_fail", "held_out:held_out_fail", "collective_kill"], "evidence": ["kill:stripped:stripped_not_useful_fail", "kill:held_out:held_out_fail", "kill:collective_kill"], "author": null, "expired": false, "status": "candidate"}
{"id": "les_Z_175ec3_easy_pad_diff_squares", "ts": "2026-10-07T19:53:11Z", "cycle_id": "20261007T195306Z_175ec3", "type": "oracle_kill", "decision": "revert", "check": "oracle", "mutation": "easy_pad_diff_squares", "what": "Oracle FAIL kills keep. kills=['stripped:easy_pad_baseline_already_useful', 'held_out:easy_pad_dies_on_held_out', 'cas:easy_pad_fails_cas_usefulness', 'easy_pad_oracle_kill', 'collective_kill']. No fitness credit.", "source": "conjecture_desk", "family": "easy_pad", "before_score": null, "after_score": null, "skill_bias": {"improver.improve": 0.02, "geometer.gather": 0.02}, "genome_prior": {"explore": 0.02, "gather": 0.0}, "catalog_hint": {}, "proposal_fingerprint": "", "tags": ["oracle_kill", "stripped:easy_pad_baseline_already_useful", "held_out:easy_pad_dies_on_held_out", "cas:easy_pad_fails_cas_usefulness", "easy_pad_oracle_kill"], "evidence": ["kill:stripped:easy_pad_baseline_already_useful", "kill:held_out:easy_pad_dies_on_held_out", "kill:cas:easy_pad_fails_cas_usefulness", "kill:easy_pad_oracle_kill", "kill:collective_kill"], "author": null, "expired": false, "status": "candidate"}
{"id": "les_Z_175ec3_vandermonde", "ts": "2026-10-07T19:53:11Z", "cycle_id": "20261007T195306Z_175ec3", "type": "skip", "decision": "skip", "check": "oracle_seen_claim", "mutation": "vandermonde", "what": "skip re-oracle of vandermonde:1706.03762", "source": "claim_pipeline", "family": "novelty", "before_score": null, "after_score": null, "skill_bias": {}, "genome_prior": {}, "catalog_hint": {}, "proposal_fingerprint": "vandermonde:1706.03762", "tags": ["repeat_claim"], "evidence": [], "author": null, "expired": false, "status": "candidate"}
{"id": "les_Z_175ec3_pilot", "ts": "2026-10-07T19:53:28Z", "cycle_id": "20261007T195306Z_175ec3", "type": "skip", "decision": "skip", "check": "pilot", "mutation": "", "what": "empty rsi_bias pilot suppressed", "source": "pilot_lane", "family": "rsi", "before_score": null, "after_score": null, "skill_bias": {}, "genome_prior": {}, "catalog_hint": {}, "proposal_fingerprint": "", "tags": ["empty_rsi_bias"], "evidence": [], "author": null, "expired": false, "status": "candidate"}
{"id": "les_9:53:51Z_Chain `fibonacci_cassini_ext` citin", "ts": "2026-10-07T19:53:51Z", "cycle_id": "", "type": "oracle_kill", "decision": "revert", "check": "oracle", "mutation": "Chain `fibonacci_cassini_ext` citing New algebraic points on covers of elliptic curves", "what": "Oracle FAIL kills keep. kills=['stripped:stripped_not_useful_fail', 'held_out:held_out_fail', 'collective_kill']. No fitness credit.", "source": "novelty_gate", "family": "process", "before_score": null, "after_score": null, "skill_bias": {"improver.improve": 0.02, "geometer.gather": 0.02}, "genome_prior": {"explore": 0.02, "gather": 0.0}, "catalog_hint": {}, "proposal_fingerprint": "", "tags": ["oracle_kill", "stripped:stripped_not_useful_fail", "held_out:held_out_fail", "collective_kill"], "evidence": ["kill:stripped:stripped_not_useful_fail", "kill:held_out:held_out_fail", "kill:collective_kill"], "author": null, "expired": false, "status": "candidate"}
{"id": "les_9:53:51Z_Chain `fibonacci_cassini_ext` citin", "ts": "2026-10-07T19:53:51Z", "cycle_id": "", "type": "oracle_kill", "decision": "revert", "check": "oracle", "mutation": "Chain `fibonacci_cassini_ext` citing New algebraic points on covers of elliptic curves (cycle 164)", "what": "Oracle FAIL kills keep. kills=['stripped:stripped_not_useful_fail', 'held_out:held_out_fail', 'collective_kill']. No fitness credit.", "source": "novelty_gate", "family": "process", "before_score": null, "after_score": null, "skill_bias": {"improver.improve": 0.02, "geometer.gather": 0.02}, "genome_prior": {"explore": 0.02, "gather": 0.0}, "catalog_hint": {}, "proposal_fingerprint": "", "tags": ["oracle_kill", "stripped:stripped_not_useful_fail", "held_out:held_out_fail", "collective_kill"], "evidence": ["kill:stripped:stripped_not_useful_fail", "kill:held_out:held_out_fail", "kill:collective_kill"], "author": null, "expired": false, "status": "candidate"}
{"id": "les_Z_24305d_easy_pad_commutativity", "ts": "2026-10-07T19:53:51Z", "cycle_id": "20261007T195347Z_24305d", "type": "oracle_kill", "decision": "revert", "check": "oracle", "mutation": "easy_pad_commutativity", "what": "Oracle FAIL kills keep. kills=['stripped:easy_pad_baseline_already_useful', 'held_out:easy_pad_dies_on_held_out', 'cas:easy_pad_fails_cas_usefulness', 'easy_pad_oracle_kill', 'collective_kill']. No fitness credit.", "source": "conjecture_desk", "family": "easy_pad", "before_score": null, "after_score": null, "skill_bias": {"improver.improve": 0.02, "geometer.gather": 0.02}, "genome_prior": {"explore": 0.02, "gather": 0.0}, "catalog_hint": {}, "proposal_fingerprint": "", "tags": ["oracle_kill", "stripped:easy_pad_baseline_already_useful", "held_out:easy_pad_dies_on_held_out", "cas:easy_pad_fails_cas_usefulness", "easy_pad_oracle_kill"], "evidence": ["kill:stripped:easy_pad_baseline_already_useful", "kill:held_out:easy_pad_dies_on_held_out", "kill:cas:easy_pad_fails_cas_usefulness", "kill:easy_pad_oracle_kill", "kill:collective_kill"], "author": null, "expired": false, "status": "candidate"}
{"id": "les_Z_24305d_vandermonde", "ts": "2026-10-07T19:53:51Z", "cycle_id": "20261007T195347Z_24305d", "type": "skip", "decision": "skip", "check": "oracle_seen_claim", "mutation": "vandermonde", "what": "skip re-oracle of vandermonde:1706.03762", "source": "claim_pipeline", "family": "novelty", "before_score": null, "after_score": null, "skill_bias": {}, "genome_prior": {}, "catalog_hint": {}, "proposal_fingerprint": "vandermonde:1706.03762", "tags": ["repeat_claim"], "evidence": [], "author": null, "expired": false, "status": "candidate"}
{"id": "les_Z_24305d_pilot", "ts": "2026-10-07T19:53:57Z", "cycle_id": "20261007T195347Z_24305d", "type": "skip", "decision": "skip", "check": "pilot", "mutation": "", "what": "empty rsi_bias pilot suppressed", "source": "pilot_lane", "family": "rsi", "before_score": null, "after_score": null, "skill_bias": {}, "genome_prior": {}, "catalog_hint": {}, "proposal_fingerprint": "", "tags": ["empty_rsi_bias"], "evidence": [], "author": null, "expired": false, "status": "candidate"}
{"id": "les_9:54:17Z_Chain `energy_work` citing New alge", "ts": "2026-10-07T19:54:17Z", "cycle_id": "", "type": "oracle_kill", "decision": "revert", "check": "oracle", "mutation": "Chain `energy_work` citing New algebraic points on covers of elliptic curves", "what": "Oracle FAIL kills keep. kills=['stripped:stripped_not_useful_fail', 'held_out:held_out_fail', 'collective_kill']. No fitness credit.", "source": "novelty_gate", "family": "process", "before_score": null, "after_score": null, "skill_bias": {"improver.improve": 0.02, "geometer.gather": 0.02}, "genome_prior": {"explore": 0.02, "gather": 0.0}, "catalog_hint": {}, "proposal_fingerprint": "", "tags": ["oracle_kill", "stripped:stripped_not_useful_fail", "held_out:held_out_fail", "collective_kill"], "evidence": ["kill:stripped:stripped_not_useful_fail", "kill:held_out:held_out_fail", "kill:collective_kill"], "author": null, "expired": false, "status": "candidate"}
{"id": "les_chain_seek_unproven_variants_from_proven_lemmas", "ts": "2026-10-07T20:06:47Z", "cycle_id": "teach_unenabled_variants", "type": "human_guide", "decision": "guide", "check": "human", "mutation": "seek_unenabled_variants_from_proven_lemmas", "what": "SEEK HARDER UNENABLED VARIANTS OF PROVEN LEMMAS: When the citable chain targets are already enabled, re-enabling them adds nothing — the Oracle kills it (stripped_not_useful / held_out). Look in the society/benchmarks/artifacts catalogs for harder variants that are not yet enabled and are built only from proven lemmas (e.g. adversarial held-out windows), and try those. Still cite the artifact and microbench that check the component lemmas. Enable only if the Oracle passes; skip already-enabled targets. Spark proposes; humans authorize at P≥0.70. Guide, do not micromanage.", "source": "human", "family": "human_teaching", "before_score": null, "after_score": null, "skill_bias": {"gather": 0.08, "oracle": 0.08, "improver.improve": 0.06, "build": 0.06}, "genome_prior": {"explore": 0.06, "build": 0.05, "gather": 0.04}, "catalog_hint": {"prefer": ["unenabled_variants", "harder_variant", "held_out_window", "cite_benchmarks", "compose_lemmas"], "seek": ["society/benchmarks/artifacts", "lemma_impl", "latest.json", "HARD_TIER_LEMMAS"], "require": ["bench_cite", "lemma_cite"], "avoid": ["reenable_enabled_target", "process_spam", "isolated_rename", "easy_pad"]}, "proposal_fingerprint": "", "tags": ["human_guide", "seek_unproven", "unenabled_variant", "harder_variant", "chain", "cite", "seek"], "evidence": [], "author": "James Jackson", "expired": false, "status": "candidate"}
{"id": "les_0:08:20Z_Chain `adversarial_hockey_deep` cit", "ts": "2026-10-07T20:08:20Z", "cycle_id": "", "type": "oracle_kill", "decision": "revert", "check": "oracle", "mutation": "Chain `adversarial_hockey_deep` citing New algebraic points on covers of elliptic curves", "what": "Oracle FAIL kills keep. kills=['stripped:stripped_not_useful_fail', 'held_out:held_out_fail', 'collective_kill']. No fitness credit.", "source": "novelty_gate", "family": "process", "before_score": null, "after_score": null, "skill_bias": {"improver.improve": 0.02, "geometer.gather": 0.02}, "genome_prior": {"explore": 0.02, "gather": 0.0}, "catalog_hint": {}, "proposal_fingerprint": "", "tags": ["oracle_kill", "stripped:stripped_not_useful_fail", "held_out:held_out_fail", "collective_kill"], "evidence": ["kill:stripped:stripped_not_useful_fail", "kill:held_out:held_out_fail", "kill:collective_kill"], "author": null, "expired": false, "status": "candidate"}
{"id": "les_0:08:21Z_Chain `adversarial_hockey_deep` cit", "ts": "2026-10-07T20:08:21Z", "cycle_id": "", "type": "oracle_kill", "decision": "revert", "check": "oracle", "mutation": "Chain `adversarial_hockey_deep` citing New algebraic points on covers of elliptic curves (cycle 165)", "what": "Oracle FAIL kills keep. kills=['stripped:stripped_not_useful_fail', 'held_out:held_out_fail', 'collective_kill']. No fitness credit.", "source": "novelty_gate", "family": "process", "before_score": null, "after_score": null, "skill_bias": {"improver.improve": 0.02, "geometer.gather": 0.02}, "genome_prior": {"explore": 0.02, "gather": 0.0}, "catalog_hint": {}, "proposal_fingerprint": "", "tags": ["oracle_kill", "stripped:stripped_not_useful_fail", "held_out:held_out_fail", "collective_kill"], "evidence": ["kill:stripped:stripped_not_useful_fail", "kill:held_out:held_out_fail", "kill:collective_kill"], "author": null, "expired": false, "status": "candidate"}
{"id": "les_Z_09233f_vandermonde", "ts": "2026-10-07T20:08:21Z", "cycle_id": "20261007T200815Z_09233f", "type": "skip", "decision": "skip", "check": "oracle_seen_claim", "mutation": "vandermonde", "what": "skip re-oracle of vandermonde:1706.03762", "source": "claim_pipeline", "family": "novelty", "before_score": null, "after_score": null, "skill_bias": {}, "genome_prior": {}, "catalog_hint": {}, "proposal_fingerprint": "vandermonde:1706.03762", "tags": ["repeat_claim"], "evidence": [], "author": null, "expired": false, "status": "candidate"}
{"id": "les_Z_09233f_pilot", "ts": "2026-10-07T20:08:39Z", "cycle_id": "20261007T200815Z_09233f", "type": "skip", "decision": "skip", "check": "pilot", "mutation": "", "what": "empty rsi_bias pilot suppressed", "source": "pilot_lane", "family": "rsi", "before_score": null, "after_score": null, "skill_bias": {}, "genome_prior": {}, "catalog_hint": {}, "proposal_fingerprint": "", "tags": ["empty_rsi_bias"], "evidence": [], "author": null, "expired": false, "status": "candidate"}
{"id": "les_0:09:00Z_Chain `adversarial_cassini_ext` cit", "ts": "2026-10-07T20:09:00Z", "cycle_id": "", "type": "oracle_kill", "decision": "revert", "check": "oracle", "mutation": "Chain `adversarial_cassini_ext` citing New algebraic points on covers of elliptic curves", "what": "Oracle FAIL kills keep. kills=['stripped:stripped_not_useful_fail', 'held_out:held_out_fail', 'collective_kill']. No fitness credit.", "source": "novelty_gate", "family": "process", "before_score": null, "after_score": null, "skill_bias": {"improver.improve": 0.02, "geometer.gather": 0.02}, "genome_prior": {"explore": 0.02, "gather": 0.0}, "catalog_hint": {}, "proposal_fingerprint": "", "tags": ["oracle_kill", "stripped:stripped_not_useful_fail", "held_out:held_out_fail", "collective_kill"], "evidence": ["kill:stripped:stripped_not_useful_fail", "kill:held_out:held_out_fail", "kill:collective_kill"], "author": null, "expired": false, "status": "candidate"}
{"id": "les_0:09:01Z_Chain `adversarial_cassini_ext` cit", "ts": "2026-10-07T20:09:01Z", "cycle_id": "", "type": "oracle_kill", "decision": "revert", "check": "oracle", "mutation": "Chain `adversarial_cassini_ext` citing New algebraic points on covers of elliptic curves (cycle 166)", "what": "Oracle FAIL kills keep. kills=['stripped:stripped_not_useful_fail', 'held_out:held_out_fail', 'collective_kill']. No fitness credit.", "source": "novelty_gate", "family": "process", "before_score": null, "after_score": null, "skill_bias": {"improver.improve": 0.02, "geometer.gather": 0.02}, "genome_prior": {"explore": 0.02, "gather": 0.0}, "catalog_hint": {}, "proposal_fingerprint": "", "tags": ["oracle_kill", "stripped:stripped_not_useful_fail", "held_out:held_out_fail", "collective_kill"], "evidence": ["kill:stripped:stripped_not_useful_fail", "kill:held_out:held_out_fail", "kill:collective_kill"], "author": null, "expired": false, "status": "candidate"}
{"id": "les_Z_9b8906_vandermonde", "ts": "2026-10-07T20:09:01Z", "cycle_id": "20261007T200855Z_9b8906", "type": "skip", "decision": "skip", "check": "oracle_seen_claim", "mutation": "vandermonde", "what": "skip re-oracle of vandermonde:1706.03762", "source": "claim_pipeline", "family": "novelty", "before_score": null, "after_score": null, "skill_bias": {}, "genome_prior": {}, "catalog_hint": {}, "proposal_fingerprint": "vandermonde:1706.03762", "tags": ["repeat_claim"], "evidence": [], "author": null, "expired": false, "status": "candidate"}
{"id": "les_Z_9b8906_pilot", "ts": "2026-10-07T20:09:17Z", "cycle_id": "20261007T200855Z_9b8906", "type": "skip", "decision": "skip", "check": "pilot", "mutation": "", "what": "empty rsi_bias pilot suppressed", "source": "pilot_lane", "family": "rsi", "before_score": null, "after_score": null, "skill_bias": {}, "genome_prior": {}, "catalog_hint": {}, "proposal_fingerprint": "", "tags": ["empty_rsi_bias"], "evidence": [], "author": null, "expired": false, "status": "candidate"}
{"id": "les_0:09:27Z_Chain `adversarial_catalan_convolut", "ts": "2026-10-07T20:09:27Z", "cycle_id": "", "type": "oracle_kill", "decision": "revert", "check": "oracle", "mutation": "Chain `adversarial_catalan_convolution_stress` citing New algebraic points on covers of elliptic curves", "what": "Oracle FAIL kills keep. kills=['stripped:stripped_not_useful_fail', 'held_out:held_out_fail', 'collective_kill']. No fitness credit.", "source": "novelty_gate", "family": "process", "before_score": null, "after_score": null, "skill_bias": {"improver.improve": 0.02, "geometer.gather": 0.02}, "genome_prior": {"explore": 0.02, "gather": 0.0}, "catalog_hint": {}, "proposal_fingerprint": "", "tags": ["oracle_kill", "stripped:stripped_not_useful_fail", "held_out:held_out_fail", "collective_kill"], "evidence": ["kill:stripped:stripped_not_useful_fail", "kill:held_out:held_out_fail", "kill:collective_kill"], "author": null, "expired": false, "status": "candidate"}
{"id": "les_0:09:27Z_Chain `adversarial_catalan_convolut", "ts": "2026-10-07T20:09:27Z", "cycle_id": "", "type": "oracle_kill", "decision": "revert", "check": "oracle", "mutation": "Chain `adversarial_catalan_convolution_stress` citing New algebraic points on covers of elliptic curves (cycle 167)", "what": "Oracle FAIL kills keep. kills=['stripped:stripped_not_useful_fail', 'held_out:held_out_fail', 'collective_kill']. No fitness credit.", "source": "novelty_gate", "family": "process", "before_score": null, "after_score": null, "skill_bias": {"improver.improve": 0.02, "geometer.gather": 0.02}, "genome_prior": {"explore": 0.02, "gather": 0.0}, "catalog_hint": {}, "proposal_fingerprint": "", "tags": ["oracle_kill", "stripped:stripped_not_useful_fail", "held_out:held_out_fail", "collective_kill"], "evidence": ["kill:stripped:stripped_not_useful_fail", "kill:held_out:held_out_fail", "kill:collective_kill"], "author": null, "expired": false, "status": "candidate"}
{"id": "les_Z_d8a478_vandermonde", "ts": "2026-10-07T20:09:27Z", "cycle_id": "20261007T200922Z_d8a478", "type": "skip", "decision": "skip", "check": "oracle_seen_claim", "mutation": "vandermonde", "what": "skip re-oracle of vandermonde:1706.03762", "source": "claim_pipeline", "family": "novelty", "before_score": null, "after_score": null, "skill_bias": {}, "genome_prior": {}, "catalog_hint": {}, "proposal_fingerprint": "vandermonde:1706.03762", "tags": ["repeat_claim"], "evidence": [], "author": null, "expired": false, "status": "candidate"}
{"id": "les_Z_d8a478_pilot", "ts": "2026-10-07T20:09:33Z", "cycle_id": "20261007T200922Z_d8a478", "type": "skip", "decision": "skip", "check": "pilot", "mutation": "", "what": "empty rsi_bias pilot suppressed", "source": "pilot_lane", "family": "rsi", "before_score": null, "after_score": null, "skill_bias": {}, "genome_prior": {}, "catalog_hint": {}, "proposal_fingerprint": "", "tags": ["empty_rsi_bias"], "evidence": [], "author": null, "expired": false, "status": "candidate"}
{"id": "les_0:09:52Z_Chain `adversarial_hockey_deep` cit", "ts": "2026-10-07T20:09:52Z", "cycle_id": "", "type": "oracle_kill", "decision": "revert", "check": "oracle", "mutation": "Chain `adversarial_hockey_deep` citing New algebraic points on covers of elliptic curves", "what": "Oracle FAIL kills keep. kills=['stripped:stripped_not_useful_fail', 'held_out:held_out_fail', 'collective_kill']. No fitness credit.", "source": "novelty_gate", "family": "process", "before_score": null, "after_score": null, "skill_bias": {"improver.improve": 0.02, "geometer.gather": 0.02}, "genome_prior": {"explore": 0.02, "gather": 0.0}, "catalog_hint": {}, "proposal_fingerprint": "", "tags": ["oracle_kill", "stripped:stripped_not_useful_fail", "held_out:held_out_fail", "collective_kill"], "evidence": ["kill:stripped:stripped_not_useful_fail", "kill:held_out:held_out_fail", "kill:collective_kill"], "author": null, "expired": false, "status": "candidate"}
{"id": "les_0:09:53Z_Chain `adversarial_cassini_ext` cit", "ts": "2026-10-07T20:09:53Z", "cycle_id": "", "type": "oracle_kill", "decision": "revert", "check": "oracle", "mutation": "Chain `adversarial_cassini_ext` citing New algebraic points on covers of elliptic curves", "what": "Oracle FAIL kills keep. kills=['stripped:stripped_not_useful_fail', 'held_out:held_out_fail', 'collective_kill']. No fitness credit.", "source": "novelty_gate", "family": "process", "before_score": null, "after_score": null, "skill_bias": {"improver.improve": 0.02, "geometer.gather": 0.02}, "genome_prior": {"explore": 0.02, "gather": 0.0}, "catalog_hint": {}, "proposal_fingerprint": "", "tags": ["oracle_kill", "stripped:stripped_not_useful_fail", "held_out:held_out_fail", "collective_kill"], "evidence": ["kill:stripped:stripped_not_useful_fail", "kill:held_out:held_out_fail", "kill:collective_kill"], "author": null, "expired": false, "status": "candidate"}
{"id": "les_0:09:53Z_Chain `adversarial_catalan_convolut", "ts": "2026-10-07T20:09:53Z", "cycle_id": "", "type": "oracle_kill", "decision": "revert", "check": "oracle", "mutation": "Chain `adversarial_catalan_convolution_stress` citing New algebraic points on covers of elliptic curves", "what": "Oracle FAIL kills keep. kills=['stripped:stripped_not_useful_fail', 'held_out:held_out_fail', 'collective_kill']. No fitness credit.", "source": "novelty_gate", "family": "process", "before_score": null, "after_score": null, "skill_bias": {"improver.improve": 0.02, "geometer.gather": 0.02}, "genome_prior": {"explore": 0.02, "gather": 0.0}, "catalog_hint": {}, "proposal_fingerprint": "", "tags": ["oracle_kill", "stripped:stripped_not_useful_fail", "held_out:held_out_fail", "collective_kill"], "evidence": ["kill:stripped:stripped_not_useful_fail", "kill:held_out:held_out_fail", "kill:collective_kill"], "author": null, "expired": false, "status": "candidate"}
