{"id": "les_ep_lucas_lucas_addition", "ts": "2026-09-26T14:53:28Z", "cycle_id": "five_lift_keep_lucas", "decision": "keep", "check": "lemma_microbench", "mutation": "lucas_addition", "what": "Kept `lucas_addition` (hard_enable): lemma score 0.9071→0.9071 checks 19→20 hard_pass 9→10 (machine-checked; not novel discovery).", "source": "conjecture_desk", "family": "hard_enable", "before_score": 0.9071, "after_score": 0.9071, "skill_bias": {"geometer.gather": 0.08, "improver.improve": 0.06, "spark.emergence": 0.04}, "tags": ["lemma", "hard_enable", "keep"], "evidence": ["society/benchmarks/lemma_microbench.py", "artifacts:lemma_impl"], "expired": false, "status": "candidate"}
{"id": "les_ep_binom_central_binom_bound", "ts": "2026-09-26T14:53:28Z", "cycle_id": "five_lift_keep_binom", "decision": "keep", "check": "lemma_microbench", "mutation": "central_binom_bound", "what": "Kept `central_binom_bound` (hard_enable): lemma score 0.9071→0.9071 checks 20→21 hard_pass 10→11 (machine-checked; not novel discovery).", "source": "conjecture_desk", "family": "hard_enable", "before_score": 0.9071, "after_score": 0.9071, "skill_bias": {"geometer.gather": 0.08, "improver.improve": 0.06, "spark.emergence": 0.04}, "tags": ["lemma", "hard_enable", "keep"], "evidence": ["society/benchmarks/lemma_microbench.py", "artifacts:lemma_impl"], "expired": false, "status": "candidate"}
{"id": "les_eep_pell_pell_companion", "ts": "2026-09-26T14:53:28Z", "cycle_id": "five_lift_keep_pell", "decision": "keep", "check": "lemma_microbench", "mutation": "pell_companion", "what": "Kept `pell_companion` (hard_enable): lemma score 0.9071→0.9071 checks 21→22 hard_pass 11→12 (machine-checked; not novel discovery).", "source": "conjecture_desk", "family": "hard_enable", "before_score": 0.9071, "after_score": 0.9071, "skill_bias": {"geometer.gather": 0.08, "improver.improve": 0.06, "spark.emergence": 0.04}, "tags": ["lemma", "hard_enable", "keep"], "evidence": ["society/benchmarks/lemma_microbench.py", "artifacts:lemma_impl"], "expired": false, "status": "candidate"}
{"id": "les_y_revert_easy_pad_diff_squares", "ts": "2026-09-26T14:53:28Z", "cycle_id": "five_lift_easy_revert", "decision": "revert", "check": "lemma_microbench", "mutation": "easy_pad_diff_squares", "what": "Reverted `easy_pad_diff_squares` (easy_pad): score 0.9071→0.9229 ok=True hard_pass 12→12 — hard-tier lift required for keep; easy pads fail.", "source": "conjecture_desk", "family": "easy_pad", "before_score": 0.9071, "after_score": 0.9071, "skill_bias": {"geometer.gather": -0.04, "improver.improve": -0.03, "spark.emergence": -0.02}, "tags": ["lemma", "easy_pad", "revert"], "evidence": ["society/benchmarks/lemma_microbench.py", "artifacts:lemma_impl"], "expired": false, "status": "candidate"}
{"id": "les_Z_8a63ad_easy_pad_diff_squares", "ts": "2026-09-26T14:53:38Z", "cycle_id": "20260926T145337Z_8a63ad", "decision": "revert", "check": "lemma_microbench", "mutation": "easy_pad_diff_squares", "what": "Reverted `easy_pad_diff_squares` (easy_pad): score 0.9071→0.9229 ok=True hard_pass 12→12 — hard-tier lift required for keep; easy pads fail.", "source": "conjecture_desk", "family": "easy_pad", "before_score": 0.9071, "after_score": 0.9071, "skill_bias": {"geometer.gather": -0.04, "improver.improve": -0.03, "spark.emergence": -0.02}, "tags": ["lemma", "easy_pad", "revert"], "evidence": ["society/benchmarks/lemma_microbench.py", "artifacts:lemma_impl"], "expired": false, "status": "candidate"}
{"id": "les_Z_07e699_easy_pad_square_again", "ts": "2026-09-26T14:53:43Z", "cycle_id": "20260926T145341Z_07e699", "decision": "revert", "check": "lemma_microbench", "mutation": "easy_pad_square_again", "what": "Reverted `easy_pad_square_again` (easy_pad): score 0.9071→0.9229 ok=True hard_pass 12→12 — hard-tier lift required for keep; easy pads fail.", "source": "conjecture_desk", "family": "easy_pad", "before_score": 0.9071, "after_score": 0.9071, "skill_bias": {"geometer.gather": -0.04, "improver.improve": -0.03, "spark.emergence": -0.02}, "tags": ["lemma", "easy_pad", "revert"], "evidence": ["society/benchmarks/lemma_microbench.py", "artifacts:lemma_impl"], "expired": false, "status": "candidate"}
{"id": "les_my_probe_gcd_fibonacci", "ts": "2026-09-26T15:08:05Z", "cycle_id": "autonomy_probe", "decision": "keep", "check": "lemma_microbench", "mutation": "gcd_fibonacci", "what": "Kept `gcd_fibonacci` (hard_enable): lemma score 0.9071→0.9071 checks 22→23 hard_pass 12→13 (machine-checked; not novel discovery).", "source": "conjecture_desk", "family": "hard_enable", "before_score": 0.9071, "after_score": 0.9071, "skill_bias": {"geometer.gather": 0.08, "improver.improve": 0.06, "spark.emergence": 0.04}, "tags": ["lemma", "hard_enable", "keep"], "evidence": ["society/benchmarks/lemma_microbench.py", "artifacts:lemma_impl"], "expired": false, "status": "candidate"}
{"id": "les_tativity_easy_pad_commutativity", "ts": "2026-09-26T15:08:09Z", "cycle_id": "autonomy_easy_easy_pad_commutativity", "decision": "revert", "check": "lemma_microbench", "mutation": "easy_pad_commutativity", "what": "Reverted `easy_pad_commutativity` (easy_pad): score 0.9071→0.9229 ok=True hard_pass 13→13 — hard-tier lift required for keep; easy pads fail.", "source": "conjecture_desk", "family": "easy_pad", "before_score": 0.9071, "after_score": 0.9071, "skill_bias": {"geometer.gather": -0.04, "improver.improve": -0.03, "spark.emergence": -0.02}, "tags": ["lemma", "easy_pad", "revert"], "evidence": ["society/benchmarks/lemma_microbench.py", "artifacts:lemma_impl"], "expired": false, "status": "candidate"}
{"id": "les_identity_easy_pad_abs_identity", "ts": "2026-09-26T15:08:09Z", "cycle_id": "autonomy_easy_easy_pad_abs_identity", "decision": "revert", "check": "lemma_microbench", "mutation": "easy_pad_abs_identity", "what": "Reverted `easy_pad_abs_identity` (easy_pad): score 0.9071→0.9229 ok=True hard_pass 13→13 — hard-tier lift required for keep; easy pads fail.", "source": "conjecture_desk", "family": "easy_pad", "before_score": 0.9071, "after_score": 0.9071, "skill_bias": {"geometer.gather": -0.04, "improver.improve": -0.03, "spark.emergence": -0.02}, "tags": ["lemma", "easy_pad", "revert"], "evidence": ["society/benchmarks/lemma_microbench.py", "artifacts:lemma_impl"], "expired": false, "status": "candidate"}
{"id": "les_re_again_easy_pad_square_again", "ts": "2026-09-26T15:08:10Z", "cycle_id": "autonomy_easy_easy_pad_square_again", "decision": "revert", "check": "lemma_microbench", "mutation": "easy_pad_square_again", "what": "Reverted `easy_pad_square_again` (easy_pad): score 0.9071→0.9229 ok=True hard_pass 13→13 — hard-tier lift required for keep; easy pads fail.", "source": "conjecture_desk", "family": "easy_pad", "before_score": 0.9071, "after_score": 0.9071, "skill_bias": {"geometer.gather": -0.04, "improver.improve": -0.03, "spark.emergence": -0.02}, "tags": ["lemma", "easy_pad", "revert"], "evidence": ["society/benchmarks/lemma_microbench.py", "artifacts:lemma_impl"], "expired": false, "status": "candidate"}
{"id": "les_Z_5e87d5_stirling_second_row", "ts": "2026-09-26T15:08:14Z", "cycle_id": "20260926T150813Z_5e87d5", "decision": "keep", "check": "lemma_microbench", "mutation": "stirling_second_row", "what": "Kept `stirling_second_row` (hard_enable): lemma score 0.9071→0.9071 checks 23→24 hard_pass 13→14 (machine-checked; not novel discovery).", "source": "conjecture_desk", "family": "hard_enable", "before_score": 0.9071, "after_score": 0.9071, "skill_bias": {"geometer.gather": 0.08, "improver.improve": 0.06, "spark.emergence": 0.04}, "tags": ["lemma", "hard_enable", "keep"], "evidence": ["society/benchmarks/lemma_microbench.py", "artifacts:lemma_impl"], "expired": false, "status": "candidate"}
{"id": "les_Z_0bac51_pythagorean_generation", "ts": "2026-09-26T15:08:15Z", "cycle_id": "20260926T150814Z_0bac51", "decision": "keep", "check": "lemma_microbench", "mutation": "pythagorean_generation", "what": "Kept `pythagorean_generation` (hard_enable): lemma score 0.9071→0.9071 checks 24→25 hard_pass 14→15 (machine-checked; not novel discovery).", "source": "conjecture_desk", "family": "hard_enable", "before_score": 0.9071, "after_score": 0.9071, "skill_bias": {"geometer.gather": 0.08, "improver.improve": 0.06, "spark.emergence": 0.04}, "tags": ["lemma", "hard_enable", "keep"], "evidence": ["society/benchmarks/lemma_microbench.py", "artifacts:lemma_impl"], "expired": false, "status": "candidate"}
{"id": "les_Z_db57fa_motzkin_bounded", "ts": "2026-09-26T15:08:16Z", "cycle_id": "20260926T150815Z_db57fa", "decision": "keep", "check": "lemma_microbench", "mutation": "motzkin_bounded", "what": "Kept `motzkin_bounded` (hard_enable): lemma score 0.9071→0.9071 checks 25→26 hard_pass 15→16 (machine-checked; not novel discovery).", "source": "conjecture_desk", "family": "hard_enable", "before_score": 0.9071, "after_score": 0.9071, "skill_bias": {"geometer.gather": 0.08, "improver.improve": 0.06, "spark.emergence": 0.04}, "tags": ["lemma", "hard_enable", "keep"], "evidence": ["society/benchmarks/lemma_microbench.py", "artifacts:lemma_impl"], "expired": false, "status": "candidate"}
{"id": "les_Z_9dfb26_easy_pad_diff_squares", "ts": "2026-09-26T15:08:17Z", "cycle_id": "20260926T150817Z_9dfb26", "decision": "revert", "check": "lemma_microbench", "mutation": "easy_pad_diff_squares", "what": "Reverted `easy_pad_diff_squares` (easy_pad): score 0.9071→0.9229 ok=True hard_pass 16→16 — hard-tier lift required for keep; easy pads fail.", "source": "conjecture_desk", "family": "easy_pad", "before_score": 0.9071, "after_score": 0.9071, "skill_bias": {"geometer.gather": -0.04, "improver.improve": -0.03, "spark.emergence": -0.02}, "tags": ["lemma", "easy_pad", "revert"], "evidence": ["society/benchmarks/lemma_microbench.py", "artifacts:lemma_impl"], "expired": false, "status": "candidate"}
{"id": "les_Z_c1b6b6_easy_pad_commutativity", "ts": "2026-09-26T15:08:19Z", "cycle_id": "20260926T150818Z_c1b6b6", "decision": "revert", "check": "lemma_microbench", "mutation": "easy_pad_commutativity", "what": "Reverted `easy_pad_commutativity` (easy_pad): score 0.9071→0.9229 ok=True hard_pass 16→16 — hard-tier lift required for keep; easy pads fail.", "source": "conjecture_desk", "family": "easy_pad", "before_score": 0.9071, "after_score": 0.9071, "skill_bias": {"geometer.gather": -0.04, "improver.improve": -0.03, "spark.emergence": -0.02}, "tags": ["lemma", "easy_pad", "revert"], "evidence": ["society/benchmarks/lemma_microbench.py", "artifacts:lemma_impl"], "expired": false, "status": "candidate"}
{"id": "les_Z_34486c_easy_pad_square_again", "ts": "2026-09-26T15:08:20Z", "cycle_id": "20260926T150819Z_34486c", "decision": "revert", "check": "lemma_microbench", "mutation": "easy_pad_square_again", "what": "Reverted `easy_pad_square_again` (easy_pad): score 0.9071→0.9229 ok=True hard_pass 16→16 — hard-tier lift required for keep; easy pads fail.", "source": "conjecture_desk", "family": "easy_pad", "before_score": 0.9071, "after_score": 0.9071, "skill_bias": {"geometer.gather": -0.04, "improver.improve": -0.03, "spark.emergence": -0.02}, "tags": ["lemma", "easy_pad", "revert"], "evidence": ["society/benchmarks/lemma_microbench.py", "artifacts:lemma_impl"], "expired": false, "status": "candidate"}
{"id": "les_Z_d6036f_easy_pad_commutativity", "ts": "2026-09-26T15:08:21Z", "cycle_id": "20260926T150820Z_d6036f", "decision": "revert", "check": "lemma_microbench", "mutation": "easy_pad_commutativity", "what": "Reverted `easy_pad_commutativity` (easy_pad): score 0.9071→0.9229 ok=True hard_pass 16→16 — hard-tier lift required for keep; easy pads fail.", "source": "conjecture_desk", "family": "easy_pad", "before_score": 0.9071, "after_score": 0.9071, "skill_bias": {"geometer.gather": -0.04, "improver.improve": -0.03, "spark.emergence": -0.02}, "tags": ["lemma", "easy_pad", "revert"], "evidence": ["society/benchmarks/lemma_microbench.py", "artifacts:lemma_impl"], "expired": false, "status": "candidate"}
{"id": "les_Z_0edfdf_easy_pad_abs_identity", "ts": "2026-09-26T15:08:23Z", "cycle_id": "20260926T150822Z_0edfdf", "decision": "revert", "check": "lemma_microbench", "mutation": "easy_pad_abs_identity", "what": "Reverted `easy_pad_abs_identity` (easy_pad): score 0.9071→0.9229 ok=True hard_pass 16→16 — hard-tier lift required for keep; easy pads fail.", "source": "conjecture_desk", "family": "easy_pad", "before_score": 0.9071, "after_score": 0.9071, "skill_bias": {"geometer.gather": -0.04, "improver.improve": -0.03, "spark.emergence": -0.02}, "tags": ["lemma", "easy_pad", "revert"], "evidence": ["society/benchmarks/lemma_microbench.py", "artifacts:lemma_impl"], "expired": false, "status": "candidate"}
{"id": "les_my_extra_easy_pad_abs_identity", "ts": "2026-09-26T15:08:29Z", "cycle_id": "autonomy_extra", "decision": "revert", "check": "lemma_microbench", "mutation": "easy_pad_abs_identity", "what": "Reverted `easy_pad_abs_identity` (easy_pad): score 0.9071→0.9229 ok=True hard_pass 16→16 — hard-tier lift required for keep; easy pads fail.", "source": "conjecture_desk", "family": "easy_pad", "before_score": 0.9071, "after_score": 0.9071, "skill_bias": {"geometer.gather": -0.04, "improver.improve": -0.03, "spark.emergence": -0.02}, "tags": ["lemma", "easy_pad", "revert"], "evidence": ["society/benchmarks/lemma_microbench.py", "artifacts:lemma_impl"], "expired": false, "status": "candidate"}
{"id": "les_5:29:55Z_fft_add_slow_loops", "ts": "2026-09-27T05:29:55Z", "cycle_id": "", "decision": "revert", "check": "bench_harness", "mutation": "fft_add_slow_loops", "what": "aggregate did not rise or Oracle killed keep (trial=0.8656, delta=-0.003); reverted (Increase SLOW_EXTRA_LOOPS — deliberate regression); restored_agg=0.8786", "source": "bench_improve", "family": "outcome", "before_score": 0.8686, "after_score": 0.8656, "skill_bias": {"improver.improve": -0.05, "builder.build": -0.03}, "tags": ["bench", "revert", "fft_add_slow_loops"], "evidence": ["society/benchmarks/artifacts/fft_impl.py", "society/benchmarks/run_benchmarks.py"], "expired": false, "status": "candidate"}
{"id": "les_Z_626d8e_fft_add_slow_loops", "ts": "2026-09-27T05:29:57Z", "cycle_id": "20260927T052955Z_626d8e", "decision": "revert", "check": "bench_harness", "mutation": "fft_add_slow_loops", "what": "aggregate did not rise or Oracle killed keep (trial=0.8657, delta=-0.0134); reverted (Increase SLOW_EXTRA_LOOPS — deliberate regression); restored_agg=0.8792", "source": "bench_improve", "family": "outcome", "before_score": 0.8791, "after_score": 0.8657, "skill_bias": {"improver.improve": -0.05, "builder.build": -0.03}, "tags": ["bench", "revert", "fft_add_slow_loops"], "evidence": ["society/benchmarks/artifacts/fft_impl.py", "society/benchmarks/run_benchmarks.py"], "expired": false, "status": "candidate"}
{"id": "les_Z_be5cbc_autodiff_busy_loop", "ts": "2026-09-27T05:30:17Z", "cycle_id": "20260927T053016Z_be5cbc", "decision": "revert", "check": "bench_harness", "mutation": "autodiff_busy_loop", "what": "aggregate did not rise or Oracle killed keep (trial=0.8792, delta=-0.0004); reverted (Add busy loop in autodiff grads — should revert); restored_agg=0.8796", "source": "bench_improve", "family": "outcome", "before_score": 0.8796, "after_score": 0.8792, "skill_bias": {"improver.improve": -0.05, "builder.build": -0.03}, "tags": ["bench", "revert", "autodiff_busy_loop"], "evidence": ["society/benchmarks/artifacts/autodiff_impl.py", "society/benchmarks/run_benchmarks.py"], "expired": false, "status": "candidate"}
{"id": "les_Z_cc82d2_autodiff_busy_loop", "ts": "2026-09-27T05:30:37Z", "cycle_id": "20260927T053036Z_cc82d2", "decision": "revert", "check": "bench_harness", "mutation": "autodiff_busy_loop", "what": "aggregate did not rise or Oracle killed keep (trial=0.8791, delta=0.0); reverted (Add busy loop in autodiff grads — should revert); restored_agg=0.8782", "source": "bench_improve", "family": "outcome", "before_score": 0.8791, "after_score": 0.8791, "skill_bias": {"improver.improve": -0.05, "builder.build": -0.03}, "tags": ["bench", "revert", "autodiff_busy_loop"], "evidence": ["society/benchmarks/artifacts/autodiff_impl.py", "society/benchmarks/run_benchmarks.py"], "expired": false, "status": "candidate"}
{"id": "les_2:16:21Z_fft_add_slow_loops", "ts": "2026-09-27T12:16:21Z", "cycle_id": "", "decision": "revert", "check": "bench_harness", "mutation": "fft_add_slow_loops", "what": "aggregate did not rise or Oracle killed keep (trial=0.8688, delta=-0.0193); reverted (Increase SLOW_EXTRA_LOOPS — deliberate regression); restored_agg=0.8801", "source": "bench_improve", "family": "outcome", "before_score": 0.8881, "after_score": 0.8688, "skill_bias": {"improver.improve": -0.05, "builder.build": -0.03}, "tags": ["bench", "revert", "fft_add_slow_loops"], "evidence": ["society/benchmarks/artifacts/fft_impl.py", "society/benchmarks/run_benchmarks.py"], "expired": false, "status": "candidate"}
{"id": "les_Z_ec35bc_autodiff_busy_loop", "ts": "2026-09-27T12:16:23Z", "cycle_id": "20260927T121621Z_ec35bc", "decision": "revert", "check": "bench_harness", "mutation": "autodiff_busy_loop", "what": "aggregate did not rise or Oracle killed keep (trial=0.8938, delta=0.0056); reverted (Add busy loop in autodiff grads — should revert); restored_agg=0.8955", "source": "bench_improve", "family": "outcome", "before_score": 0.8882, "after_score": 0.8938, "skill_bias": {"improver.improve": -0.05, "builder.build": -0.03}, "tags": ["bench", "revert", "autodiff_busy_loop"], "evidence": ["society/benchmarks/artifacts/autodiff_impl.py", "society/benchmarks/run_benchmarks.py"], "expired": false, "status": "candidate"}
{"id": "les_Z_ac5e4c_fft_add_slow_loops", "ts": "2026-09-27T12:16:45Z", "cycle_id": "20260927T121644Z_ac5e4c", "decision": "revert", "check": "bench_harness", "mutation": "fft_add_slow_loops", "what": "aggregate did not rise or Oracle killed keep (trial=0.8758, delta=-0.0207); reverted (Increase SLOW_EXTRA_LOOPS — deliberate regression); restored_agg=0.8963", "source": "bench_improve", "family": "outcome", "before_score": 0.8965, "after_score": 0.8758, "skill_bias": {"improver.improve": -0.05, "builder.build": -0.03}, "tags": ["bench", "revert", "fft_add_slow_loops"], "evidence": ["society/benchmarks/artifacts/fft_impl.py", "society/benchmarks/run_benchmarks.py"], "expired": false, "status": "candidate"}
{"id": "les_Z_58f03a_fft_add_slow_loops", "ts": "2026-09-27T12:17:07Z", "cycle_id": "20260927T121706Z_58f03a", "decision": "revert", "check": "bench_harness", "mutation": "fft_add_slow_loops", "what": "aggregate did not rise or Oracle killed keep (trial=0.8755, delta=-0.0203); reverted (Increase SLOW_EXTRA_LOOPS — deliberate regression); restored_agg=0.8957", "source": "bench_improve", "family": "outcome", "before_score": 0.8958, "after_score": 0.8755, "skill_bias": {"improver.improve": -0.05, "builder.build": -0.03}, "tags": ["bench", "revert", "fft_add_slow_loops"], "evidence": ["society/benchmarks/artifacts/fft_impl.py", "society/benchmarks/run_benchmarks.py"], "expired": false, "status": "candidate"}
{"id": "les_7:07:03Z_fft_add_slow_loops", "ts": "2026-09-27T17:07:03Z", "cycle_id": "", "decision": "revert", "check": "bench_harness", "mutation": "fft_add_slow_loops", "what": "aggregate did not rise or Oracle killed keep (trial=0.8687, delta=-0.0147); reverted (Increase SLOW_EXTRA_LOOPS — deliberate regression); restored_agg=0.9004", "source": "bench_improve", "family": "outcome", "before_score": 0.8834, "after_score": 0.8687, "skill_bias": {"improver.improve": -0.05, "builder.build": -0.03}, "tags": ["bench", "revert", "fft_add_slow_loops"], "evidence": ["society/benchmarks/artifacts/fft_impl.py", "society/benchmarks/run_benchmarks.py"], "expired": false, "status": "candidate"}
{"id": "les_Z_6863d4_fft_add_slow_loops", "ts": "2026-09-27T17:07:05Z", "cycle_id": "20260927T170703Z_6863d4", "decision": "revert", "check": "bench_harness", "mutation": "fft_add_slow_loops", "what": "aggregate did not rise or Oracle killed keep (trial=0.8788, delta=-0.0051); reverted (Increase SLOW_EXTRA_LOOPS — deliberate regression); restored_agg=0.9025", "source": "bench_improve", "family": "outcome", "before_score": 0.8839, "after_score": 0.8788, "skill_bias": {"improver.improve": -0.05, "builder.build": -0.03}, "tags": ["bench", "revert", "fft_add_slow_loops"], "evidence": ["society/benchmarks/artifacts/fft_impl.py", "society/benchmarks/run_benchmarks.py"], "expired": false, "status": "candidate"}
{"id": "les_Z_77bc0f_fft_add_slow_loops", "ts": "2026-09-27T17:07:43Z", "cycle_id": "20260927T170742Z_77bc0f", "decision": "revert", "check": "bench_harness", "mutation": "fft_add_slow_loops", "what": "aggregate did not rise or Oracle killed keep (trial=0.8792, delta=-0.0237); reverted (Increase SLOW_EXTRA_LOOPS — deliberate regression); restored_agg=0.9022", "source": "bench_improve", "family": "outcome", "before_score": 0.9029, "after_score": 0.8792, "skill_bias": {"improver.improve": -0.05, "builder.build": -0.03}, "tags": ["bench", "revert", "fft_add_slow_loops"], "evidence": ["society/benchmarks/artifacts/fft_impl.py", "society/benchmarks/run_benchmarks.py"], "expired": false, "status": "candidate"}
{"id": "les_Z_86a51f_fft_add_slow_loops", "ts": "2026-09-27T17:08:12Z", "cycle_id": "20260927T170811Z_86a51f", "decision": "revert", "check": "bench_harness", "mutation": "fft_add_slow_loops", "what": "aggregate did not rise or Oracle killed keep (trial=0.8794, delta=-0.0235); reverted (Increase SLOW_EXTRA_LOOPS — deliberate regression); restored_agg=0.903", "source": "bench_improve", "family": "outcome", "before_score": 0.9029, "after_score": 0.8794, "skill_bias": {"improver.improve": -0.05, "builder.build": -0.03}, "tags": ["bench", "revert", "fft_add_slow_loops"], "evidence": ["society/benchmarks/artifacts/fft_impl.py", "society/benchmarks/run_benchmarks.py"], "expired": false, "status": "candidate"}
