{"id": "les_Z_a7097d_vandermonde", "ts": "2026-10-08T13:53:46Z", "cycle_id": "20261008T135334Z_a7097d", "type": "skip", "decision": "skip", "check": "oracle_seen_claim", "mutation": "vandermonde", "what": "skip re-oracle of vandermonde:1706.03762", "source": "claim_pipeline", "family": "novelty", "before_score": null, "after_score": null, "skill_bias": {}, "genome_prior": {}, "catalog_hint": {}, "proposal_fingerprint": "vandermonde:1706.03762", "tags": ["repeat_claim"], "evidence": [], "author": null, "expired": false, "status": "candidate"}
{"id": "les_Z_a7097d_pilot", "ts": "2026-10-08T13:53:51Z", "cycle_id": "20261008T135334Z_a7097d", "type": "skip", "decision": "skip", "check": "pilot", "mutation": "", "what": "empty rsi_bias pilot suppressed", "source": "pilot_lane", "family": "rsi", "before_score": null, "after_score": null, "skill_bias": {}, "genome_prior": {}, "catalog_hint": {}, "proposal_fingerprint": "", "tags": ["empty_rsi_bias"], "evidence": [], "author": null, "expired": false, "status": "candidate"}
{"id": "les_Z_028d68_dedupe", "ts": "2026-10-08T13:54:16Z", "cycle_id": "20261008T135408Z_028d68", "type": "repeat_proposal", "decision": "block", "check": "dedupe", "mutation": "", "what": "blocked repeat: Deepen compute-useful math from accepted findings after hearing", "source": "growth_hearing", "family": "process", "before_score": null, "after_score": null, "skill_bias": {}, "genome_prior": {}, "catalog_hint": {}, "proposal_fingerprint": "810bc050d326", "tags": ["repeat_proposal"], "evidence": [], "author": null, "expired": false, "status": "candidate"}
{"id": "les_Z_028d68_dedupe", "ts": "2026-10-08T13:54:17Z", "cycle_id": "20261008T135408Z_028d68", "type": "repeat_proposal", "decision": "block", "check": "dedupe", "mutation": "", "what": "blocked repeat: Feed accepted/strong RSI findings into skill_router + genome bias", "source": "growth_hearing", "family": "process", "before_score": null, "after_score": null, "skill_bias": {}, "genome_prior": {}, "catalog_hint": {}, "proposal_fingerprint": "27e48156942c", "tags": ["repeat_proposal"], "evidence": [], "author": null, "expired": false, "status": "candidate"}
{"id": "les_Z_028d68_authored_oeis_a000079__binomial_sum", "ts": "2026-10-08T13:54:20Z", "cycle_id": "20261008T135408Z_028d68", "type": "authored_check", "decision": "skip", "check": "authoring", "mutation": "authored_oeis_a000079__binomial_sum_row", "what": "authored disabled feed cross-check `authored_oeis_a000079__binomial_sum_row`: OEIS A000079 held-out terms vs `binomial_row_sum` + proven lemma binomial_sum_row on a new window; awaits Oracle via proposal", "source": "conjecture_desk", "family": "hard_tier", "before_score": null, "after_score": null, "skill_bias": {}, "genome_prior": {}, "catalog_hint": {}, "proposal_fingerprint": "", "tags": ["authoring", "authored_check", "binomial_sum_row", "feed", "oeis"], "evidence": ["society/benchmarks/artifacts/lemma_impl.py::check_binomial_sum_row", "society/benchmarks/artifacts/lemma_impl.py::binomial", "society/benchmarks/lemma_microbench.py", "lemma:binomial_sum_row", "oeis:A000079", "https://oeis.org/A000079", "feed:oeis:A000079:binomial_row_sum"], "author": null, "expired": false, "status": "candidate"}
{"id": "les_Z_028d68_easy_pad_abs_identity", "ts": "2026-10-08T13:54:20Z", "cycle_id": "20261008T135408Z_028d68", "type": "oracle_kill", "decision": "revert", "check": "oracle", "mutation": "easy_pad_abs_identity", "what": "Oracle FAIL kills keep. kills=['stripped:easy_pad_baseline_already_useful', 'held_out:easy_pad_dies_on_held_out', 'cas:easy_pad_fails_cas_usefulness', 'easy_pad_oracle_kill', 'collective_kill']. No fitness credit.", "source": "conjecture_desk", "family": "easy_pad", "before_score": null, "after_score": null, "skill_bias": {"improver.improve": 0.02, "geometer.gather": 0.02}, "genome_prior": {"explore": 0.02, "gather": 0.0}, "catalog_hint": {}, "proposal_fingerprint": "", "tags": ["oracle_kill", "stripped:easy_pad_baseline_already_useful", "held_out:easy_pad_dies_on_held_out", "cas:easy_pad_fails_cas_usefulness", "easy_pad_oracle_kill"], "evidence": ["kill:stripped:easy_pad_baseline_already_useful", "kill:held_out:easy_pad_dies_on_held_out", "kill:cas:easy_pad_fails_cas_usefulness", "kill:easy_pad_oracle_kill", "kill:collective_kill"], "author": null, "expired": false, "status": "candidate"}
{"id": "les_Z_028d68_easy_pad_abs_identity", "ts": "2026-10-08T13:54:20Z", "cycle_id": "20261008T135408Z_028d68", "type": "revert", "decision": "revert", "check": "lemma_microbench", "mutation": "easy_pad_abs_identity", "what": "Reverted `easy_pad_abs_identity` (easy_pad): score 0.9071→0.9229 ok=True hard_pass 50→50 — Oracle/hard-tier required for keep; easy pads die on Oracle. | oracle=KILL fitness_credit=False kills=['stripped:easy_pad_baseline_already_useful', 'held_out:easy_pad_dies_on_held_out', 'cas:easy_pad_fails_cas_usefulness', 'easy_pad_oracle_kill', 'collective_kill'] | novelty_gate novel=False kills=['already_in_lesson_ledger_or_history', 'textbook_reuse=1.0', 'stripped_baseline_does_not_fail_usefulness', 'h", "source": "conjecture_desk", "family": "easy_pad", "before_score": 0.9071, "after_score": 0.9071, "skill_bias": {"geometer.gather": -0.04, "improver.improve": -0.03, "spark.emergence": -0.02}, "genome_prior": {}, "catalog_hint": {}, "proposal_fingerprint": "", "tags": ["lemma", "easy_pad", "revert"], "evidence": ["society/benchmarks/lemma_microbench.py", "artifacts:lemma_impl"], "author": null, "expired": false, "status": "candidate"}
{"id": "les_Z_028d68_vandermonde", "ts": "2026-10-08T13:54:20Z", "cycle_id": "20261008T135408Z_028d68", "type": "skip", "decision": "skip", "check": "oracle_seen_claim", "mutation": "vandermonde", "what": "skip re-oracle of vandermonde:1706.03762", "source": "claim_pipeline", "family": "novelty", "before_score": null, "after_score": null, "skill_bias": {}, "genome_prior": {}, "catalog_hint": {}, "proposal_fingerprint": "vandermonde:1706.03762", "tags": ["repeat_claim"], "evidence": [], "author": null, "expired": false, "status": "candidate"}
{"id": "les_Z_028d68_pilot", "ts": "2026-10-08T13:54:24Z", "cycle_id": "20261008T135408Z_028d68", "type": "skip", "decision": "skip", "check": "pilot", "mutation": "", "what": "empty rsi_bias pilot suppressed", "source": "pilot_lane", "family": "rsi", "before_score": null, "after_score": null, "skill_bias": {}, "genome_prior": {}, "catalog_hint": {}, "proposal_fingerprint": "", "tags": ["empty_rsi_bias"], "evidence": [], "author": null, "expired": false, "status": "candidate"}
{"id": "les_Z_7f846b_authored_oeis_a000079__binomial_sum", "ts": "2026-10-08T13:54:42Z", "cycle_id": "20261008T135430Z_7f846b", "type": "keep", "decision": "keep", "check": "lemma_microbench", "mutation": "authored_oeis_a000079__binomial_sum_row", "what": "Kept `authored_oeis_a000079__binomial_sum_row` (hard_enable): lemma score 0.9071→0.9071 checks 60→61 hard_pass 50→51 (machine-checked + Oracle pass; not novel discovery). | oracle=PASS fitness_credit=True kills=[] | novelty_gate novel=True kills=[]", "source": "conjecture_desk", "family": "hard_enable", "before_score": 0.9071, "after_score": 0.9071, "skill_bias": {"geometer.gather": 0.08, "improver.improve": 0.06, "spark.emergence": 0.04}, "genome_prior": {}, "catalog_hint": {}, "proposal_fingerprint": "", "tags": ["lemma", "hard_enable", "keep"], "evidence": ["society/benchmarks/lemma_microbench.py", "artifacts:lemma_impl", "lesson:les_Z_028d68_authored_oeis_a000079__binomial_sum"], "author": null, "expired": false, "status": "candidate"}
{"id": "les_Z_7f846b_vandermonde", "ts": "2026-10-08T13:54:42Z", "cycle_id": "20261008T135430Z_7f846b", "type": "skip", "decision": "skip", "check": "oracle_seen_claim", "mutation": "vandermonde", "what": "skip re-oracle of vandermonde:1706.03762", "source": "claim_pipeline", "family": "novelty", "before_score": null, "after_score": null, "skill_bias": {}, "genome_prior": {}, "catalog_hint": {}, "proposal_fingerprint": "vandermonde:1706.03762", "tags": ["repeat_claim"], "evidence": [], "author": null, "expired": false, "status": "candidate"}
{"id": "les_Z_7f846b_pilot", "ts": "2026-10-08T13:54:49Z", "cycle_id": "20261008T135430Z_7f846b", "type": "skip", "decision": "skip", "check": "pilot", "mutation": "", "what": "empty rsi_bias pilot suppressed", "source": "pilot_lane", "family": "rsi", "before_score": null, "after_score": null, "skill_bias": {}, "genome_prior": {}, "catalog_hint": {}, "proposal_fingerprint": "", "tags": ["empty_rsi_bias"], "evidence": [], "author": null, "expired": false, "status": "candidate"}
{"id": "les_Z_313183_dedupe", "ts": "2026-10-08T23:29:30Z", "cycle_id": "20261008T232923Z_313183", "type": "repeat_proposal", "decision": "block", "check": "dedupe", "mutation": "", "what": "blocked repeat: Deepen compute-useful math from accepted findings after hearing", "source": "growth_hearing", "family": "process", "before_score": null, "after_score": null, "skill_bias": {}, "genome_prior": {}, "catalog_hint": {}, "proposal_fingerprint": "810bc050d326", "tags": ["repeat_proposal"], "evidence": [], "author": null, "expired": false, "status": "candidate"}
{"id": "les_Z_313183_dedupe", "ts": "2026-10-08T23:29:31Z", "cycle_id": "20261008T232923Z_313183", "type": "repeat_proposal", "decision": "block", "check": "dedupe", "mutation": "", "what": "blocked repeat: Feed accepted/strong RSI findings into skill_router + genome bias", "source": "growth_hearing", "family": "process", "before_score": null, "after_score": null, "skill_bias": {}, "genome_prior": {}, "catalog_hint": {}, "proposal_fingerprint": "27e48156942c", "tags": ["repeat_proposal"], "evidence": [], "author": null, "expired": false, "status": "candidate"}
{"id": "les_Z_313183_authored_binomial_symmetry__cassini", "ts": "2026-10-08T23:29:32Z", "cycle_id": "20261008T232923Z_313183", "type": "authored_check", "decision": "skip", "check": "authoring", "mutation": "authored_binomial_symmetry__cassini_w1", "what": "authored disabled hard check `authored_binomial_symmetry__cassini_w1` from proven lemmas binomial_symmetry + cassini on new windows; awaits Oracle via proposal", "source": "conjecture_desk", "family": "hard_tier", "before_score": null, "after_score": null, "skill_bias": {}, "genome_prior": {}, "catalog_hint": {}, "proposal_fingerprint": "", "tags": ["authoring", "authored_check", "binomial_symmetry", "cassini"], "evidence": ["society/benchmarks/artifacts/lemma_impl.py::check_binomial_symmetry", "society/benchmarks/artifacts/lemma_impl.py::check_cassini_identity", "society/benchmarks/lemma_microbench.py", "lemma:binomial_symmetry", "lemma:cassini"], "author": null, "expired": false, "status": "candidate"}
{"id": "les_Z_313183_easy_pad_diff_squares", "ts": "2026-10-08T23:29:32Z", "cycle_id": "20261008T232923Z_313183", "type": "oracle_kill", "decision": "revert", "check": "oracle", "mutation": "easy_pad_diff_squares", "what": "Oracle FAIL kills keep. kills=['stripped:easy_pad_baseline_already_useful', 'held_out:easy_pad_dies_on_held_out', 'cas:easy_pad_fails_cas_usefulness', 'easy_pad_oracle_kill', 'collective_kill']. No fitness credit.", "source": "conjecture_desk", "family": "easy_pad", "before_score": null, "after_score": null, "skill_bias": {"improver.improve": 0.02, "geometer.gather": 0.02}, "genome_prior": {"explore": 0.02, "gather": 0.0}, "catalog_hint": {}, "proposal_fingerprint": "", "tags": ["oracle_kill", "stripped:easy_pad_baseline_already_useful", "held_out:easy_pad_dies_on_held_out", "cas:easy_pad_fails_cas_usefulness", "easy_pad_oracle_kill"], "evidence": ["kill:stripped:easy_pad_baseline_already_useful", "kill:held_out:easy_pad_dies_on_held_out", "kill:cas:easy_pad_fails_cas_usefulness", "kill:easy_pad_oracle_kill", "kill:collective_kill"], "author": null, "expired": false, "status": "candidate"}
{"id": "les_Z_313183_easy_pad_diff_squares", "ts": "2026-10-08T23:29:33Z", "cycle_id": "20261008T232923Z_313183", "type": "revert", "decision": "revert", "check": "lemma_microbench", "mutation": "easy_pad_diff_squares", "what": "Reverted `easy_pad_diff_squares` (easy_pad): score 0.9071→0.9229 ok=True hard_pass 51→51 — Oracle/hard-tier required for keep; easy pads die on Oracle. | oracle=KILL fitness_credit=False kills=['stripped:easy_pad_baseline_already_useful', 'held_out:easy_pad_dies_on_held_out', 'cas:easy_pad_fails_cas_usefulness', 'easy_pad_oracle_kill', 'collective_kill'] | novelty_gate novel=False kills=['already_in_lesson_ledger_or_history', 'textbook_reuse=1.0', 'stripped_baseline_does_not_fail_usefulness', 'h", "source": "conjecture_desk", "family": "easy_pad", "before_score": 0.9071, "after_score": 0.9071, "skill_bias": {"geometer.gather": -0.04, "improver.improve": -0.03, "spark.emergence": -0.02}, "genome_prior": {}, "catalog_hint": {}, "proposal_fingerprint": "", "tags": ["lemma", "easy_pad", "revert"], "evidence": ["society/benchmarks/lemma_microbench.py", "artifacts:lemma_impl"], "author": null, "expired": false, "status": "candidate"}
{"id": "les_Z_313183_vandermonde", "ts": "2026-10-08T23:29:33Z", "cycle_id": "20261008T232923Z_313183", "type": "skip", "decision": "skip", "check": "oracle_seen_claim", "mutation": "vandermonde", "what": "skip re-oracle of vandermonde:1706.03762", "source": "claim_pipeline", "family": "novelty", "before_score": null, "after_score": null, "skill_bias": {}, "genome_prior": {}, "catalog_hint": {}, "proposal_fingerprint": "vandermonde:1706.03762", "tags": ["repeat_claim"], "evidence": [], "author": null, "expired": false, "status": "candidate"}
{"id": "les_Z_313183_pilot", "ts": "2026-10-08T23:29:40Z", "cycle_id": "20261008T232923Z_313183", "type": "skip", "decision": "skip", "check": "pilot", "mutation": "", "what": "empty rsi_bias pilot suppressed", "source": "pilot_lane", "family": "rsi", "before_score": null, "after_score": null, "skill_bias": {}, "genome_prior": {}, "catalog_hint": {}, "proposal_fingerprint": "", "tags": ["empty_rsi_bias"], "evidence": [], "author": null, "expired": false, "status": "candidate"}
{"id": "les_Z_47d89b_authored_binomial_symmetry__cassini", "ts": "2026-10-08T23:30:07Z", "cycle_id": "20261008T232959Z_47d89b", "type": "keep", "decision": "keep", "check": "lemma_microbench", "mutation": "authored_binomial_symmetry__cassini_w1", "what": "Kept `authored_binomial_symmetry__cassini_w1` (hard_enable): lemma score 0.9071→0.9071 checks 61→62 hard_pass 51→52 (machine-checked + Oracle pass; not novel discovery). | oracle=PASS fitness_credit=True kills=[] | novelty_gate novel=False kills=['textbook_reuse=0.6667']", "source": "conjecture_desk", "family": "hard_enable", "before_score": 0.9071, "after_score": 0.9071, "skill_bias": {"geometer.gather": 0.08, "improver.improve": 0.06, "spark.emergence": 0.04}, "genome_prior": {}, "catalog_hint": {}, "proposal_fingerprint": "", "tags": ["lemma", "hard_enable", "keep"], "evidence": ["society/benchmarks/lemma_microbench.py", "artifacts:lemma_impl", "lesson:les_Z_313183_authored_binomial_symmetry__cassini"], "author": null, "expired": false, "status": "candidate"}
{"id": "les_Z_47d89b_vandermonde", "ts": "2026-10-08T23:30:07Z", "cycle_id": "20261008T232959Z_47d89b", "type": "skip", "decision": "skip", "check": "oracle_seen_claim", "mutation": "vandermonde", "what": "skip re-oracle of vandermonde:1706.03762", "source": "claim_pipeline", "family": "novelty", "before_score": null, "after_score": null, "skill_bias": {}, "genome_prior": {}, "catalog_hint": {}, "proposal_fingerprint": "vandermonde:1706.03762", "tags": ["repeat_claim"], "evidence": [], "author": null, "expired": false, "status": "candidate"}
{"id": "les_Z_47d89b_pilot", "ts": "2026-10-08T23:30:16Z", "cycle_id": "20261008T232959Z_47d89b", "type": "skip", "decision": "skip", "check": "pilot", "mutation": "", "what": "empty rsi_bias pilot suppressed", "source": "pilot_lane", "family": "rsi", "before_score": null, "after_score": null, "skill_bias": {}, "genome_prior": {}, "catalog_hint": {}, "proposal_fingerprint": "", "tags": ["empty_rsi_bias"], "evidence": [], "author": null, "expired": false, "status": "candidate"}
{"id": "les_Z_83aa56_dedupe", "ts": "2026-10-08T23:30:41Z", "cycle_id": "20261008T233036Z_83aa56", "type": "repeat_proposal", "decision": "block", "check": "dedupe", "mutation": "", "what": "blocked repeat: Deepen compute-useful math from accepted findings after hearing", "source": "growth_hearing", "family": "process", "before_score": null, "after_score": null, "skill_bias": {}, "genome_prior": {}, "catalog_hint": {}, "proposal_fingerprint": "810bc050d326", "tags": ["repeat_proposal"], "evidence": [], "author": null, "expired": false, "status": "candidate"}
{"id": "les_Z_83aa56_dedupe", "ts": "2026-10-08T23:30:43Z", "cycle_id": "20261008T233036Z_83aa56", "type": "repeat_proposal", "decision": "block", "check": "dedupe", "mutation": "", "what": "blocked repeat: Feed accepted/strong RSI findings into skill_router + genome bias", "source": "growth_hearing", "family": "process", "before_score": null, "after_score": null, "skill_bias": {}, "genome_prior": {}, "catalog_hint": {}, "proposal_fingerprint": "27e48156942c", "tags": ["repeat_proposal"], "evidence": [], "author": null, "expired": false, "status": "candidate"}
{"id": "les_Z_83aa56_authored_catalan_convolution__deran", "ts": "2026-10-08T23:30:44Z", "cycle_id": "20261008T233036Z_83aa56", "type": "authored_check", "decision": "skip", "check": "authoring", "mutation": "authored_catalan_convolution__derangement_subfactorial_w1", "what": "authored disabled hard check `authored_catalan_convolution__derangement_subfactorial_w1` from proven lemmas catalan_convolution + derangement_subfactorial on new windows; awaits Oracle via proposal", "source": "conjecture_desk", "family": "hard_tier", "before_score": null, "after_score": null, "skill_bias": {}, "genome_prior": {}, "catalog_hint": {}, "proposal_fingerprint": "", "tags": ["authoring", "authored_check", "catalan_convolution", "derangement_subfactorial"], "evidence": ["society/benchmarks/artifacts/lemma_impl.py::check_catalan_convolution", "society/benchmarks/artifacts/lemma_impl.py::check_derangement_subfactorial", "society/benchmarks/lemma_microbench.py", "lemma:catalan_convolution", "lemma:derangement_subfactorial"], "author": null, "expired": false, "status": "candidate"}
{"id": "les_Z_83aa56_easy_pad_diff_squares", "ts": "2026-10-08T23:30:44Z", "cycle_id": "20261008T233036Z_83aa56", "type": "oracle_kill", "decision": "revert", "check": "oracle", "mutation": "easy_pad_diff_squares", "what": "Oracle FAIL kills keep. kills=['stripped:easy_pad_baseline_already_useful', 'held_out:easy_pad_dies_on_held_out', 'cas:easy_pad_fails_cas_usefulness', 'easy_pad_oracle_kill', 'collective_kill']. No fitness credit.", "source": "conjecture_desk", "family": "easy_pad", "before_score": null, "after_score": null, "skill_bias": {"improver.improve": 0.02, "geometer.gather": 0.02}, "genome_prior": {"explore": 0.02, "gather": 0.0}, "catalog_hint": {}, "proposal_fingerprint": "", "tags": ["oracle_kill", "stripped:easy_pad_baseline_already_useful", "held_out:easy_pad_dies_on_held_out", "cas:easy_pad_fails_cas_usefulness", "easy_pad_oracle_kill"], "evidence": ["kill:stripped:easy_pad_baseline_already_useful", "kill:held_out:easy_pad_dies_on_held_out", "kill:cas:easy_pad_fails_cas_usefulness", "kill:easy_pad_oracle_kill", "kill:collective_kill"], "author": null, "expired": false, "status": "candidate"}
{"id": "les_Z_83aa56_easy_pad_diff_squares", "ts": "2026-10-08T23:30:44Z", "cycle_id": "20261008T233036Z_83aa56", "type": "revert", "decision": "revert", "check": "lemma_microbench", "mutation": "easy_pad_diff_squares", "what": "Reverted `easy_pad_diff_squares` (easy_pad): score 0.9071→0.9229 ok=True hard_pass 52→52 — Oracle/hard-tier required for keep; easy pads die on Oracle. | oracle=KILL fitness_credit=False kills=['stripped:easy_pad_baseline_already_useful', 'held_out:easy_pad_dies_on_held_out', 'cas:easy_pad_fails_cas_usefulness', 'easy_pad_oracle_kill', 'collective_kill'] | novelty_gate novel=False kills=['already_in_lesson_ledger_or_history', 'textbook_reuse=1.0', 'stripped_baseline_does_not_fail_usefulness', 'h", "source": "conjecture_desk", "family": "easy_pad", "before_score": 0.9071, "after_score": 0.9071, "skill_bias": {"geometer.gather": -0.04, "improver.improve": -0.03, "spark.emergence": -0.02}, "genome_prior": {}, "catalog_hint": {}, "proposal_fingerprint": "", "tags": ["lemma", "easy_pad", "revert"], "evidence": ["society/benchmarks/lemma_microbench.py", "artifacts:lemma_impl"], "author": null, "expired": false, "status": "candidate"}
{"id": "les_Z_83aa56_vandermonde", "ts": "2026-10-08T23:30:44Z", "cycle_id": "20261008T233036Z_83aa56", "type": "skip", "decision": "skip", "check": "oracle_seen_claim", "mutation": "vandermonde", "what": "skip re-oracle of vandermonde:1706.03762", "source": "claim_pipeline", "family": "novelty", "before_score": null, "after_score": null, "skill_bias": {}, "genome_prior": {}, "catalog_hint": {}, "proposal_fingerprint": "vandermonde:1706.03762", "tags": ["repeat_claim"], "evidence": [], "author": null, "expired": false, "status": "candidate"}
{"id": "les_Z_83aa56_pilot", "ts": "2026-10-08T23:30:51Z", "cycle_id": "20261008T233036Z_83aa56", "type": "skip", "decision": "skip", "check": "pilot", "mutation": "", "what": "empty rsi_bias pilot suppressed", "source": "pilot_lane", "family": "rsi", "before_score": null, "after_score": null, "skill_bias": {}, "genome_prior": {}, "catalog_hint": {}, "proposal_fingerprint": "", "tags": ["empty_rsi_bias"], "evidence": [], "author": null, "expired": false, "status": "candidate"}
