{"id": "les_Z_1f43f1_conjecture", "ts": "2026-10-07T11:25:59Z", "cycle_id": "20261007T112556Z_1f43f1", "type": "catalog_exhausted", "decision": "skip", "check": "conjecture", "mutation": "", "what": "catalog exhausted — queue next hard_enable stub from lessons/external mind", "source": "conjecture_desk", "family": "hard_tier", "before_score": null, "after_score": null, "skill_bias": {}, "genome_prior": {}, "catalog_hint": {"add_mutation": "vandermonde_asymmetric", "kind": "hard_enable"}, "proposal_fingerprint": "", "tags": ["catalog_exhausted"], "evidence": [], "author": null, "expired": false, "status": "candidate"}
{"id": "les_Z_1f43f1_vandermonde", "ts": "2026-10-07T11:25:59Z", "cycle_id": "20261007T112556Z_1f43f1", "type": "skip", "decision": "skip", "check": "oracle_seen_claim", "mutation": "vandermonde", "what": "skip re-oracle of vandermonde:1706.03762", "source": "claim_pipeline", "family": "novelty", "before_score": null, "after_score": null, "skill_bias": {}, "genome_prior": {}, "catalog_hint": {}, "proposal_fingerprint": "vandermonde:1706.03762", "tags": ["repeat_claim"], "evidence": [], "author": null, "expired": false, "status": "candidate"}
{"id": "les_Z_1f43f1_pilot", "ts": "2026-10-07T11:26:15Z", "cycle_id": "20261007T112556Z_1f43f1", "type": "skip", "decision": "skip", "check": "pilot", "mutation": "", "what": "empty rsi_bias pilot suppressed", "source": "pilot_lane", "family": "rsi", "before_score": null, "after_score": null, "skill_bias": {}, "genome_prior": {}, "catalog_hint": {}, "proposal_fingerprint": "", "tags": ["empty_rsi_bias"], "evidence": [], "author": null, "expired": false, "status": "candidate"}
{"id": "les_Z_6f0ef3_dedupe", "ts": "2026-10-07T11:26:23Z", "cycle_id": "20261007T112620Z_6f0ef3", "type": "repeat_proposal", "decision": "block", "check": "dedupe", "mutation": "", "what": "blocked repeat: Deepen compute-useful math from accepted findings after hearing", "source": "growth_hearing", "family": "process", "before_score": null, "after_score": null, "skill_bias": {}, "genome_prior": {}, "catalog_hint": {}, "proposal_fingerprint": "810bc050d326", "tags": ["repeat_proposal"], "evidence": [], "author": null, "expired": false, "status": "candidate"}
{"id": "les_1:26:23Z_Feed accepted/strong RSI findings i", "ts": "2026-10-07T11:26:23Z", "cycle_id": "", "type": "oracle_kill", "decision": "revert", "check": "oracle", "mutation": "Feed accepted/strong RSI findings into skill_router + genome bias (cycle 143)", "what": "Oracle FAIL kills keep. kills=['stripped:stripped_not_useful_fail', 'held_out:held_out_fail', 'collective_kill']. No fitness credit.", "source": "novelty_gate", "family": "process", "before_score": null, "after_score": null, "skill_bias": {"improver.improve": 0.02, "geometer.gather": 0.02}, "genome_prior": {"explore": 0.02, "gather": 0.0}, "catalog_hint": {}, "proposal_fingerprint": "", "tags": ["oracle_kill", "stripped:stripped_not_useful_fail", "held_out:held_out_fail", "collective_kill"], "evidence": ["kill:stripped:stripped_not_useful_fail", "kill:held_out:held_out_fail", "kill:collective_kill"], "author": null, "expired": false, "status": "candidate"}
{"id": "les_Z_6f0ef3_conjecture", "ts": "2026-10-07T11:26:23Z", "cycle_id": "20261007T112620Z_6f0ef3", "type": "catalog_exhausted", "decision": "skip", "check": "conjecture", "mutation": "", "what": "catalog exhausted — queue next hard_enable stub from lessons/external mind", "source": "conjecture_desk", "family": "hard_tier", "before_score": null, "after_score": null, "skill_bias": {}, "genome_prior": {}, "catalog_hint": {"add_mutation": "vandermonde_asymmetric", "kind": "hard_enable"}, "proposal_fingerprint": "", "tags": ["catalog_exhausted"], "evidence": [], "author": null, "expired": false, "status": "candidate"}
{"id": "les_Z_6f0ef3_vandermonde", "ts": "2026-10-07T11:26:23Z", "cycle_id": "20261007T112620Z_6f0ef3", "type": "skip", "decision": "skip", "check": "oracle_seen_claim", "mutation": "vandermonde", "what": "skip re-oracle of vandermonde:1706.03762", "source": "claim_pipeline", "family": "novelty", "before_score": null, "after_score": null, "skill_bias": {}, "genome_prior": {}, "catalog_hint": {}, "proposal_fingerprint": "vandermonde:1706.03762", "tags": ["repeat_claim"], "evidence": [], "author": null, "expired": false, "status": "candidate"}
{"id": "les_Z_6f0ef3_pilot", "ts": "2026-10-07T11:26:27Z", "cycle_id": "20261007T112620Z_6f0ef3", "type": "skip", "decision": "skip", "check": "pilot", "mutation": "", "what": "empty rsi_bias pilot suppressed", "source": "pilot_lane", "family": "rsi", "before_score": null, "after_score": null, "skill_bias": {}, "genome_prior": {}, "catalog_hint": {}, "proposal_fingerprint": "", "tags": ["empty_rsi_bias"], "evidence": [], "author": null, "expired": false, "status": "candidate"}
{"id": "les_Z_ec1185_dedupe", "ts": "2026-10-07T11:27:22Z", "cycle_id": "20261007T112718Z_ec1185", "type": "repeat_proposal", "decision": "block", "check": "dedupe", "mutation": "", "what": "blocked repeat: Deepen compute-useful math from accepted findings after hearing", "source": "growth_hearing", "family": "process", "before_score": null, "after_score": null, "skill_bias": {}, "genome_prior": {}, "catalog_hint": {}, "proposal_fingerprint": "810bc050d326", "tags": ["repeat_proposal"], "evidence": [], "author": null, "expired": false, "status": "candidate"}
{"id": "les_Z_ec1185_dedupe", "ts": "2026-10-07T11:27:22Z", "cycle_id": "20261007T112718Z_ec1185", "type": "repeat_proposal", "decision": "block", "check": "dedupe", "mutation": "", "what": "blocked repeat: Feed accepted/strong RSI findings into skill_router + genome bias", "source": "growth_hearing", "family": "process", "before_score": null, "after_score": null, "skill_bias": {}, "genome_prior": {}, "catalog_hint": {}, "proposal_fingerprint": "27e48156942c", "tags": ["repeat_proposal"], "evidence": [], "author": null, "expired": false, "status": "candidate"}
{"id": "les_Z_ec1185_conjecture", "ts": "2026-10-07T11:27:22Z", "cycle_id": "20261007T112718Z_ec1185", "type": "catalog_exhausted", "decision": "skip", "check": "conjecture", "mutation": "", "what": "catalog exhausted — queue next hard_enable stub from lessons/external mind", "source": "conjecture_desk", "family": "hard_tier", "before_score": null, "after_score": null, "skill_bias": {}, "genome_prior": {}, "catalog_hint": {"prefer": ["novelty", "citation_reuse", "lesson_uptake", "bench_delta"], "avoid": ["process_spam", "multihop_debate_patch"]}, "proposal_fingerprint": "", "tags": ["catalog_exhausted"], "evidence": [], "author": null, "expired": false, "status": "candidate"}
{"id": "les_Z_ec1185_vandermonde", "ts": "2026-10-07T11:27:22Z", "cycle_id": "20261007T112718Z_ec1185", "type": "skip", "decision": "skip", "check": "oracle_seen_claim", "mutation": "vandermonde", "what": "skip re-oracle of vandermonde:1706.03762", "source": "claim_pipeline", "family": "novelty", "before_score": null, "after_score": null, "skill_bias": {}, "genome_prior": {}, "catalog_hint": {}, "proposal_fingerprint": "vandermonde:1706.03762", "tags": ["repeat_claim"], "evidence": [], "author": null, "expired": false, "status": "candidate"}
{"id": "les_Z_ec1185_pilot", "ts": "2026-10-07T11:27:41Z", "cycle_id": "20261007T112718Z_ec1185", "type": "skip", "decision": "skip", "check": "pilot", "mutation": "", "what": "empty rsi_bias pilot suppressed", "source": "pilot_lane", "family": "rsi", "before_score": null, "after_score": null, "skill_bias": {}, "genome_prior": {}, "catalog_hint": {}, "proposal_fingerprint": "", "tags": ["empty_rsi_bias"], "evidence": [], "author": null, "expired": false, "status": "candidate"}
{"id": "les_Z_b37fb6_dedupe", "ts": "2026-10-07T11:28:03Z", "cycle_id": "20261007T112800Z_b37fb6", "type": "repeat_proposal", "decision": "block", "check": "dedupe", "mutation": "", "what": "blocked repeat: Deepen compute-useful math from accepted findings after hearing", "source": "growth_hearing", "family": "process", "before_score": null, "after_score": null, "skill_bias": {}, "genome_prior": {}, "catalog_hint": {}, "proposal_fingerprint": "810bc050d326", "tags": ["repeat_proposal"], "evidence": [], "author": null, "expired": false, "status": "candidate"}
{"id": "les_1:28:04Z_Feed accepted/strong RSI findings i", "ts": "2026-10-07T11:28:04Z", "cycle_id": "", "type": "oracle_kill", "decision": "revert", "check": "oracle", "mutation": "Feed accepted/strong RSI findings into skill_router + genome bias (cycle 145)", "what": "Oracle FAIL kills keep. kills=['stripped:stripped_not_useful_fail', 'held_out:held_out_fail', 'collective_kill']. No fitness credit.", "source": "novelty_gate", "family": "process", "before_score": null, "after_score": null, "skill_bias": {"improver.improve": 0.02, "geometer.gather": 0.02}, "genome_prior": {"explore": 0.02, "gather": 0.0}, "catalog_hint": {}, "proposal_fingerprint": "", "tags": ["oracle_kill", "stripped:stripped_not_useful_fail", "held_out:held_out_fail", "collective_kill"], "evidence": ["kill:stripped:stripped_not_useful_fail", "kill:held_out:held_out_fail", "kill:collective_kill"], "author": null, "expired": false, "status": "candidate"}
{"id": "les_Z_b37fb6_conjecture", "ts": "2026-10-07T11:28:04Z", "cycle_id": "20261007T112800Z_b37fb6", "type": "catalog_exhausted", "decision": "skip", "check": "conjecture", "mutation": "", "what": "catalog exhausted — queue next hard_enable stub from lessons/external mind", "source": "conjecture_desk", "family": "hard_tier", "before_score": null, "after_score": null, "skill_bias": {}, "genome_prior": {}, "catalog_hint": {"add_mutation": "vandermonde_asymmetric", "kind": "hard_enable"}, "proposal_fingerprint": "", "tags": ["catalog_exhausted"], "evidence": [], "author": null, "expired": false, "status": "candidate"}
{"id": "les_Z_b37fb6_vandermonde", "ts": "2026-10-07T11:28:04Z", "cycle_id": "20261007T112800Z_b37fb6", "type": "skip", "decision": "skip", "check": "oracle_seen_claim", "mutation": "vandermonde", "what": "skip re-oracle of vandermonde:1706.03762", "source": "claim_pipeline", "family": "novelty", "before_score": null, "after_score": null, "skill_bias": {}, "genome_prior": {}, "catalog_hint": {}, "proposal_fingerprint": "vandermonde:1706.03762", "tags": ["repeat_claim"], "evidence": [], "author": null, "expired": false, "status": "candidate"}
{"id": "les_Z_b37fb6_pilot", "ts": "2026-10-07T11:28:23Z", "cycle_id": "20261007T112800Z_b37fb6", "type": "skip", "decision": "skip", "check": "pilot", "mutation": "", "what": "empty rsi_bias pilot suppressed", "source": "pilot_lane", "family": "rsi", "before_score": null, "after_score": null, "skill_bias": {}, "genome_prior": {}, "catalog_hint": {}, "proposal_fingerprint": "", "tags": ["empty_rsi_bias"], "evidence": [], "author": null, "expired": false, "status": "candidate"}
{"id": "les_Z_f24b06_dedupe", "ts": "2026-10-07T11:28:46Z", "cycle_id": "20261007T112842Z_f24b06", "type": "repeat_proposal", "decision": "block", "check": "dedupe", "mutation": "", "what": "blocked repeat: Deepen compute-useful math from accepted findings after hearing", "source": "growth_hearing", "family": "process", "before_score": null, "after_score": null, "skill_bias": {}, "genome_prior": {}, "catalog_hint": {}, "proposal_fingerprint": "810bc050d326", "tags": ["repeat_proposal"], "evidence": [], "author": null, "expired": false, "status": "candidate"}
{"id": "les_1:28:46Z_Feed accepted/strong RSI findings i", "ts": "2026-10-07T11:28:46Z", "cycle_id": "", "type": "oracle_kill", "decision": "revert", "check": "oracle", "mutation": "Feed accepted/strong RSI findings into skill_router + genome bias", "what": "Oracle FAIL kills keep. kills=['stripped:stripped_not_useful_fail', 'held_out:held_out_fail', 'collective_kill']. No fitness credit.", "source": "novelty_gate", "family": "process", "before_score": null, "after_score": null, "skill_bias": {"improver.improve": 0.02, "geometer.gather": 0.02}, "genome_prior": {"explore": 0.02, "gather": 0.0}, "catalog_hint": {}, "proposal_fingerprint": "", "tags": ["oracle_kill", "stripped:stripped_not_useful_fail", "held_out:held_out_fail", "collective_kill"], "evidence": ["kill:stripped:stripped_not_useful_fail", "kill:held_out:held_out_fail", "kill:collective_kill"], "author": null, "expired": false, "status": "candidate"}
{"id": "les_Z_f24b06_conjecture", "ts": "2026-10-07T11:28:46Z", "cycle_id": "20261007T112842Z_f24b06", "type": "catalog_exhausted", "decision": "skip", "check": "conjecture", "mutation": "", "what": "catalog exhausted — queue next hard_enable stub from lessons/external mind", "source": "conjecture_desk", "family": "hard_tier", "before_score": null, "after_score": null, "skill_bias": {}, "genome_prior": {}, "catalog_hint": {"add_mutation": "vandermonde_asymmetric", "kind": "hard_enable"}, "proposal_fingerprint": "", "tags": ["catalog_exhausted"], "evidence": [], "author": null, "expired": false, "status": "candidate"}
{"id": "les_Z_f24b06_vandermonde", "ts": "2026-10-07T11:28:46Z", "cycle_id": "20261007T112842Z_f24b06", "type": "skip", "decision": "skip", "check": "oracle_seen_claim", "mutation": "vandermonde", "what": "skip re-oracle of vandermonde:1706.03762", "source": "claim_pipeline", "family": "novelty", "before_score": null, "after_score": null, "skill_bias": {}, "genome_prior": {}, "catalog_hint": {}, "proposal_fingerprint": "vandermonde:1706.03762", "tags": ["repeat_claim"], "evidence": [], "author": null, "expired": false, "status": "candidate"}
{"id": "les_Z_f24b06_pilot", "ts": "2026-10-07T11:29:04Z", "cycle_id": "20261007T112842Z_f24b06", "type": "skip", "decision": "skip", "check": "pilot", "mutation": "", "what": "empty rsi_bias pilot suppressed", "source": "pilot_lane", "family": "rsi", "before_score": null, "after_score": null, "skill_bias": {}, "genome_prior": {}, "catalog_hint": {}, "proposal_fingerprint": "", "tags": ["empty_rsi_bias"], "evidence": [], "author": null, "expired": false, "status": "candidate"}
{"id": "les_Z_da24a3_dedupe", "ts": "2026-10-07T11:30:19Z", "cycle_id": "20261007T113015Z_da24a3", "type": "repeat_proposal", "decision": "block", "check": "dedupe", "mutation": "", "what": "blocked repeat: Deepen compute-useful math from accepted findings after hearing", "source": "growth_hearing", "family": "process", "before_score": null, "after_score": null, "skill_bias": {}, "genome_prior": {}, "catalog_hint": {}, "proposal_fingerprint": "810bc050d326", "tags": ["repeat_proposal"], "evidence": [], "author": null, "expired": false, "status": "candidate"}
{"id": "les_1:30:19Z_Feed accepted/strong RSI findings i", "ts": "2026-10-07T11:30:19Z", "cycle_id": "", "type": "oracle_kill", "decision": "revert", "check": "oracle", "mutation": "Feed accepted/strong RSI findings into skill_router + genome bias (cycle 147)", "what": "Oracle FAIL kills keep. kills=['stripped:stripped_not_useful_fail', 'held_out:held_out_fail', 'collective_kill']. No fitness credit.", "source": "novelty_gate", "family": "process", "before_score": null, "after_score": null, "skill_bias": {"improver.improve": 0.02, "geometer.gather": 0.02}, "genome_prior": {"explore": 0.02, "gather": 0.0}, "catalog_hint": {}, "proposal_fingerprint": "", "tags": ["oracle_kill", "stripped:stripped_not_useful_fail", "held_out:held_out_fail", "collective_kill"], "evidence": ["kill:stripped:stripped_not_useful_fail", "kill:held_out:held_out_fail", "kill:collective_kill"], "author": null, "expired": false, "status": "candidate"}
{"id": "les_Z_da24a3_conjecture", "ts": "2026-10-07T11:30:19Z", "cycle_id": "20261007T113015Z_da24a3", "type": "catalog_exhausted", "decision": "skip", "check": "conjecture", "mutation": "", "what": "catalog exhausted — queue next hard_enable stub from lessons/external mind", "source": "conjecture_desk", "family": "hard_tier", "before_score": null, "after_score": null, "skill_bias": {}, "genome_prior": {}, "catalog_hint": {"add_mutation": "vandermonde_asymmetric", "kind": "hard_enable"}, "proposal_fingerprint": "", "tags": ["catalog_exhausted"], "evidence": [], "author": null, "expired": false, "status": "candidate"}
{"id": "les_Z_da24a3_vandermonde", "ts": "2026-10-07T11:30:19Z", "cycle_id": "20261007T113015Z_da24a3", "type": "skip", "decision": "skip", "check": "oracle_seen_claim", "mutation": "vandermonde", "what": "skip re-oracle of vandermonde:1706.03762", "source": "claim_pipeline", "family": "novelty", "before_score": null, "after_score": null, "skill_bias": {}, "genome_prior": {}, "catalog_hint": {}, "proposal_fingerprint": "vandermonde:1706.03762", "tags": ["repeat_claim"], "evidence": [], "author": null, "expired": false, "status": "candidate"}
{"id": "les_Z_da24a3_pilot", "ts": "2026-10-07T11:30:39Z", "cycle_id": "20261007T113015Z_da24a3", "type": "skip", "decision": "skip", "check": "pilot", "mutation": "", "what": "empty rsi_bias pilot suppressed", "source": "pilot_lane", "family": "rsi", "before_score": null, "after_score": null, "skill_bias": {}, "genome_prior": {}, "catalog_hint": {}, "proposal_fingerprint": "", "tags": ["empty_rsi_bias"], "evidence": [], "author": null, "expired": false, "status": "candidate"}
{"id": "les_Z_7fdb0b_dedupe", "ts": "2026-10-07T11:31:01Z", "cycle_id": "20261007T113058Z_7fdb0b", "type": "repeat_proposal", "decision": "block", "check": "dedupe", "mutation": "", "what": "blocked repeat: Deepen compute-useful math from accepted findings after hearing", "source": "growth_hearing", "family": "process", "before_score": null, "after_score": null, "skill_bias": {}, "genome_prior": {}, "catalog_hint": {}, "proposal_fingerprint": "810bc050d326", "tags": ["repeat_proposal"], "evidence": [], "author": null, "expired": false, "status": "candidate"}
{"id": "les_Z_7fdb0b_dedupe", "ts": "2026-10-07T11:31:01Z", "cycle_id": "20261007T113058Z_7fdb0b", "type": "repeat_proposal", "decision": "block", "check": "dedupe", "mutation": "", "what": "blocked repeat: Feed accepted/strong RSI findings into skill_router + genome bias", "source": "growth_hearing", "family": "process", "before_score": null, "after_score": null, "skill_bias": {}, "genome_prior": {}, "catalog_hint": {}, "proposal_fingerprint": "27e48156942c", "tags": ["repeat_proposal"], "evidence": [], "author": null, "expired": false, "status": "candidate"}
{"id": "les_Z_7fdb0b_conjecture", "ts": "2026-10-07T11:31:01Z", "cycle_id": "20261007T113058Z_7fdb0b", "type": "catalog_exhausted", "decision": "skip", "check": "conjecture", "mutation": "", "what": "catalog exhausted — queue next hard_enable stub from lessons/external mind", "source": "conjecture_desk", "family": "hard_tier", "before_score": null, "after_score": null, "skill_bias": {}, "genome_prior": {}, "catalog_hint": {"prefer": ["novelty", "citation_reuse", "lesson_uptake", "bench_delta"], "avoid": ["process_spam", "multihop_debate_patch"]}, "proposal_fingerprint": "", "tags": ["catalog_exhausted"], "evidence": [], "author": null, "expired": false, "status": "candidate"}
{"id": "les_Z_7fdb0b_vandermonde", "ts": "2026-10-07T11:31:01Z", "cycle_id": "20261007T113058Z_7fdb0b", "type": "skip", "decision": "skip", "check": "oracle_seen_claim", "mutation": "vandermonde", "what": "skip re-oracle of vandermonde:1706.03762", "source": "claim_pipeline", "family": "novelty", "before_score": null, "after_score": null, "skill_bias": {}, "genome_prior": {}, "catalog_hint": {}, "proposal_fingerprint": "vandermonde:1706.03762", "tags": ["repeat_claim"], "evidence": [], "author": null, "expired": false, "status": "candidate"}
{"id": "les_Z_7fdb0b_pilot", "ts": "2026-10-07T11:31:20Z", "cycle_id": "20261007T113058Z_7fdb0b", "type": "skip", "decision": "skip", "check": "pilot", "mutation": "", "what": "empty rsi_bias pilot suppressed", "source": "pilot_lane", "family": "rsi", "before_score": null, "after_score": null, "skill_bias": {}, "genome_prior": {}, "catalog_hint": {}, "proposal_fingerprint": "", "tags": ["empty_rsi_bias"], "evidence": [], "author": null, "expired": false, "status": "candidate"}
{"id": "les_Z_11da6f_dedupe", "ts": "2026-10-07T11:31:43Z", "cycle_id": "20261007T113140Z_11da6f", "type": "repeat_proposal", "decision": "block", "check": "dedupe", "mutation": "", "what": "blocked repeat: Deepen compute-useful math from accepted findings after hearing", "source": "growth_hearing", "family": "process", "before_score": null, "after_score": null, "skill_bias": {}, "genome_prior": {}, "catalog_hint": {}, "proposal_fingerprint": "810bc050d326", "tags": ["repeat_proposal"], "evidence": [], "author": null, "expired": false, "status": "candidate"}
{"id": "les_1:31:43Z_Feed accepted/strong RSI findings i", "ts": "2026-10-07T11:31:43Z", "cycle_id": "", "type": "oracle_kill", "decision": "revert", "check": "oracle", "mutation": "Feed accepted/strong RSI findings into skill_router + genome bias (cycle 149)", "what": "Oracle FAIL kills keep. kills=['stripped:stripped_not_useful_fail', 'held_out:held_out_fail', 'collective_kill']. No fitness credit.", "source": "novelty_gate", "family": "process", "before_score": null, "after_score": null, "skill_bias": {"improver.improve": 0.02, "geometer.gather": 0.02}, "genome_prior": {"explore": 0.02, "gather": 0.0}, "catalog_hint": {}, "proposal_fingerprint": "", "tags": ["oracle_kill", "stripped:stripped_not_useful_fail", "held_out:held_out_fail", "collective_kill"], "evidence": ["kill:stripped:stripped_not_useful_fail", "kill:held_out:held_out_fail", "kill:collective_kill"], "author": null, "expired": false, "status": "candidate"}
