{"id": "les_Z_9f2da2_vandermonde", "ts": "2026-10-08T01:17:40Z", "cycle_id": "20261008T011728Z_9f2da2", "type": "skip", "decision": "skip", "check": "oracle_seen_claim", "mutation": "vandermonde", "what": "skip re-oracle of vandermonde:1706.03762", "source": "claim_pipeline", "family": "novelty", "before_score": null, "after_score": null, "skill_bias": {}, "genome_prior": {}, "catalog_hint": {}, "proposal_fingerprint": "vandermonde:1706.03762", "tags": ["repeat_claim"], "evidence": [], "author": null, "expired": false, "status": "candidate"}
{"id": "les_Z_9f2da2_binomial_identities", "ts": "2026-10-08T01:17:40Z", "cycle_id": "20261008T011728Z_9f2da2", "type": "oracle_kill", "decision": "revert", "check": "oracle", "mutation": "binomial_identities", "what": "Oracle FAIL: no bus for claim path (fail-closed). No fitness credit.", "source": "novelty_gate", "family": "claim_theme", "before_score": null, "after_score": null, "skill_bias": {"improver.improve": 0.02, "geometer.gather": 0.02}, "genome_prior": {"explore": 0.02, "gather": 0.0}, "catalog_hint": {}, "proposal_fingerprint": "", "tags": ["oracle_kill", "oracle_blocked_no_bus"], "evidence": ["kill:oracle_blocked_no_bus"], "author": null, "expired": false, "status": "candidate"}
{"id": "les_Z_9f2da2_pilot", "ts": "2026-10-08T01:17:46Z", "cycle_id": "20261008T011728Z_9f2da2", "type": "skip", "decision": "skip", "check": "pilot", "mutation": "", "what": "empty rsi_bias pilot suppressed", "source": "pilot_lane", "family": "rsi", "before_score": null, "after_score": null, "skill_bias": {}, "genome_prior": {}, "catalog_hint": {}, "proposal_fingerprint": "", "tags": ["empty_rsi_bias"], "evidence": [], "author": null, "expired": false, "status": "candidate"}
{"id": "les_Z_02e53a_vandermonde", "ts": "2026-10-08T06:24:52Z", "cycle_id": "20261008T062440Z_02e53a", "type": "skip", "decision": "skip", "check": "oracle_seen_claim", "mutation": "vandermonde", "what": "skip re-oracle of vandermonde:1706.03762", "source": "claim_pipeline", "family": "novelty", "before_score": null, "after_score": null, "skill_bias": {}, "genome_prior": {}, "catalog_hint": {}, "proposal_fingerprint": "vandermonde:1706.03762", "tags": ["repeat_claim"], "evidence": [], "author": null, "expired": false, "status": "candidate"}
{"id": "les_Z_02e53a_pilot", "ts": "2026-10-08T06:24:58Z", "cycle_id": "20261008T062440Z_02e53a", "type": "skip", "decision": "skip", "check": "pilot", "mutation": "", "what": "empty rsi_bias pilot suppressed", "source": "pilot_lane", "family": "rsi", "before_score": null, "after_score": null, "skill_bias": {}, "genome_prior": {}, "catalog_hint": {}, "proposal_fingerprint": "", "tags": ["empty_rsi_bias"], "evidence": [], "author": null, "expired": false, "status": "candidate"}
{"id": "les_6:25:16Z_Chain `stem_easy_pad_units` citing ", "ts": "2026-10-08T06:25:16Z", "cycle_id": "", "type": "oracle_kill", "decision": "revert", "check": "oracle", "mutation": "Chain `stem_easy_pad_units` citing Optimal bound for the polynomial Littlewood-Offord", "what": "Oracle FAIL kills keep. kills=['stripped:stripped_not_useful_fail', 'held_out:held_out_fail', 'collective_kill']. No fitness credit.", "source": "novelty_gate_deferred_title", "family": "process", "before_score": null, "after_score": null, "skill_bias": {"improver.improve": 0.02, "geometer.gather": 0.02}, "genome_prior": {"explore": 0.02, "gather": 0.0}, "catalog_hint": {}, "proposal_fingerprint": "", "tags": ["oracle_kill", "stripped:stripped_not_useful_fail", "held_out:held_out_fail", "collective_kill"], "evidence": ["kill:stripped:stripped_not_useful_fail", "kill:held_out:held_out_fail", "kill:collective_kill"], "author": null, "expired": false, "status": "candidate"}
{"id": "les_6:25:16Z_Chain `stem_easy_pad_units` citing ", "ts": "2026-10-08T06:25:16Z", "cycle_id": "", "type": "oracle_kill", "decision": "revert", "check": "oracle", "mutation": "Chain `stem_easy_pad_units` citing Optimal bound for the polynomial Littlewood-Offord (cycle 194)", "what": "Oracle FAIL kills keep. kills=['stripped:stripped_not_useful_fail', 'held_out:held_out_fail', 'collective_kill']. No fitness credit.", "source": "novelty_gate_deferred_title", "family": "process", "before_score": null, "after_score": null, "skill_bias": {"improver.improve": 0.02, "geometer.gather": 0.02}, "genome_prior": {"explore": 0.02, "gather": 0.0}, "catalog_hint": {}, "proposal_fingerprint": "", "tags": ["oracle_kill", "stripped:stripped_not_useful_fail", "held_out:held_out_fail", "collective_kill"], "evidence": ["kill:stripped:stripped_not_useful_fail", "kill:held_out:held_out_fail", "kill:collective_kill"], "author": null, "expired": false, "status": "candidate"}
{"id": "les_Z_43ed50_dedupe", "ts": "2026-10-08T06:25:24Z", "cycle_id": "20261008T062517Z_43ed50", "type": "repeat_proposal", "decision": "block", "check": "dedupe", "mutation": "", "what": "blocked repeat: Deepen compute-useful math from accepted findings after hearing", "source": "growth_hearing", "family": "process", "before_score": null, "after_score": null, "skill_bias": {}, "genome_prior": {}, "catalog_hint": {}, "proposal_fingerprint": "810bc050d326", "tags": ["repeat_proposal"], "evidence": [], "author": null, "expired": false, "status": "candidate"}
{"id": "les_Z_43ed50_dedupe", "ts": "2026-10-08T06:25:26Z", "cycle_id": "20261008T062517Z_43ed50", "type": "repeat_proposal", "decision": "block", "check": "dedupe", "mutation": "", "what": "blocked repeat: Feed accepted/strong RSI findings into skill_router + genome bias", "source": "growth_hearing", "family": "process", "before_score": null, "after_score": null, "skill_bias": {}, "genome_prior": {}, "catalog_hint": {}, "proposal_fingerprint": "27e48156942c", "tags": ["repeat_proposal"], "evidence": [], "author": null, "expired": false, "status": "candidate"}
{"id": "les_Z_43ed50_authored_oeis_a000984__central_bino", "ts": "2026-10-08T06:25:28Z", "cycle_id": "20261008T062517Z_43ed50", "type": "authored_check", "decision": "skip", "check": "authoring", "mutation": "authored_oeis_a000984__central_binom_bound", "what": "authored disabled feed cross-check `authored_oeis_a000984__central_binom_bound`: OEIS A000984 held-out terms vs `central_binomial` + proven lemma central_binom_bound on a new window; awaits Oracle via proposal", "source": "conjecture_desk", "family": "hard_tier", "before_score": null, "after_score": null, "skill_bias": {}, "genome_prior": {}, "catalog_hint": {}, "proposal_fingerprint": "", "tags": ["authoring", "authored_check", "central_binom_bound", "feed", "oeis"], "evidence": ["society/benchmarks/artifacts/lemma_impl.py::check_central_binom_bound", "society/benchmarks/artifacts/lemma_impl.py::binomial", "society/benchmarks/lemma_microbench.py", "lemma:central_binom_bound", "oeis:A000984", "https://oeis.org/A000984", "feed:oeis:A000984:central_binomial"], "author": null, "expired": false, "status": "candidate"}
{"id": "les_Z_43ed50_easy_pad_zero_identity", "ts": "2026-10-08T06:25:29Z", "cycle_id": "20261008T062517Z_43ed50", "type": "oracle_kill", "decision": "revert", "check": "oracle", "mutation": "easy_pad_zero_identity", "what": "Oracle FAIL kills keep. kills=['stripped:easy_pad_baseline_already_useful', 'held_out:easy_pad_dies_on_held_out', 'cas:easy_pad_fails_cas_usefulness', 'easy_pad_oracle_kill', 'collective_kill']. No fitness credit.", "source": "conjecture_desk", "family": "easy_pad", "before_score": null, "after_score": null, "skill_bias": {"improver.improve": 0.02, "geometer.gather": 0.02}, "genome_prior": {"explore": 0.02, "gather": 0.0}, "catalog_hint": {}, "proposal_fingerprint": "", "tags": ["oracle_kill", "stripped:easy_pad_baseline_already_useful", "held_out:easy_pad_dies_on_held_out", "cas:easy_pad_fails_cas_usefulness", "easy_pad_oracle_kill"], "evidence": ["kill:stripped:easy_pad_baseline_already_useful", "kill:held_out:easy_pad_dies_on_held_out", "kill:cas:easy_pad_fails_cas_usefulness", "kill:easy_pad_oracle_kill", "kill:collective_kill"], "author": null, "expired": false, "status": "candidate"}
{"id": "les_Z_43ed50_vandermonde", "ts": "2026-10-08T06:25:29Z", "cycle_id": "20261008T062517Z_43ed50", "type": "skip", "decision": "skip", "check": "oracle_seen_claim", "mutation": "vandermonde", "what": "skip re-oracle of vandermonde:1706.03762", "source": "claim_pipeline", "family": "novelty", "before_score": null, "after_score": null, "skill_bias": {}, "genome_prior": {}, "catalog_hint": {}, "proposal_fingerprint": "vandermonde:1706.03762", "tags": ["repeat_claim"], "evidence": [], "author": null, "expired": false, "status": "candidate"}
{"id": "les_Z_43ed50_pilot", "ts": "2026-10-08T06:25:36Z", "cycle_id": "20261008T062517Z_43ed50", "type": "skip", "decision": "skip", "check": "pilot", "mutation": "", "what": "empty rsi_bias pilot suppressed", "source": "pilot_lane", "family": "rsi", "before_score": null, "after_score": null, "skill_bias": {}, "genome_prior": {}, "catalog_hint": {}, "proposal_fingerprint": "", "tags": ["empty_rsi_bias"], "evidence": [], "author": null, "expired": false, "status": "candidate"}
{"id": "les_Z_19076a_vandermonde", "ts": "2026-10-08T06:26:06Z", "cycle_id": "20261008T062555Z_19076a", "type": "skip", "decision": "skip", "check": "oracle_seen_claim", "mutation": "vandermonde", "what": "skip re-oracle of vandermonde:1706.03762", "source": "claim_pipeline", "family": "novelty", "before_score": null, "after_score": null, "skill_bias": {}, "genome_prior": {}, "catalog_hint": {}, "proposal_fingerprint": "vandermonde:1706.03762", "tags": ["repeat_claim"], "evidence": [], "author": null, "expired": false, "status": "candidate"}
{"id": "les_Z_19076a_pilot", "ts": "2026-10-08T06:26:11Z", "cycle_id": "20261008T062555Z_19076a", "type": "skip", "decision": "skip", "check": "pilot", "mutation": "", "what": "empty rsi_bias pilot suppressed", "source": "pilot_lane", "family": "rsi", "before_score": null, "after_score": null, "skill_bias": {}, "genome_prior": {}, "catalog_hint": {}, "proposal_fingerprint": "", "tags": ["empty_rsi_bias"], "evidence": [], "author": null, "expired": false, "status": "candidate"}
{"id": "les_Z_538f59_dedupe", "ts": "2026-10-08T07:26:39Z", "cycle_id": "20261008T072632Z_538f59", "type": "repeat_proposal", "decision": "block", "check": "dedupe", "mutation": "", "what": "blocked repeat: Deepen compute-useful math from accepted findings after hearing", "source": "growth_hearing", "family": "process", "before_score": null, "after_score": null, "skill_bias": {}, "genome_prior": {}, "catalog_hint": {}, "proposal_fingerprint": "810bc050d326", "tags": ["repeat_proposal"], "evidence": [], "author": null, "expired": false, "status": "candidate"}
{"id": "les_Z_538f59_dedupe", "ts": "2026-10-08T07:26:40Z", "cycle_id": "20261008T072632Z_538f59", "type": "repeat_proposal", "decision": "block", "check": "dedupe", "mutation": "", "what": "blocked repeat: Feed accepted/strong RSI findings into skill_router + genome bias", "source": "growth_hearing", "family": "process", "before_score": null, "after_score": null, "skill_bias": {}, "genome_prior": {}, "catalog_hint": {}, "proposal_fingerprint": "27e48156942c", "tags": ["repeat_proposal"], "evidence": [], "author": null, "expired": false, "status": "candidate"}
{"id": "les_Z_538f59_authored_pell_companion__pythagorea", "ts": "2026-10-08T07:26:42Z", "cycle_id": "20261008T072632Z_538f59", "type": "authored_check", "decision": "skip", "check": "authoring", "mutation": "authored_pell_companion__pythagorean_generation_w1", "what": "authored disabled hard check `authored_pell_companion__pythagorean_generation_w1` from proven lemmas pell_companion + pythagorean_generation on new windows; awaits Oracle via proposal", "source": "conjecture_desk", "family": "hard_tier", "before_score": null, "after_score": null, "skill_bias": {}, "genome_prior": {}, "catalog_hint": {}, "proposal_fingerprint": "", "tags": ["authoring", "authored_check", "pell_companion", "pythagorean_generation"], "evidence": ["society/benchmarks/artifacts/lemma_impl.py::check_pell_companion", "society/benchmarks/artifacts/lemma_impl.py::check_pythagorean_generation", "society/benchmarks/lemma_microbench.py", "lemma:pell_companion", "lemma:pythagorean_generation"], "author": null, "expired": false, "status": "candidate"}
{"id": "les_Z_538f59_easy_pad_square_again", "ts": "2026-10-08T07:26:42Z", "cycle_id": "20261008T072632Z_538f59", "type": "oracle_kill", "decision": "revert", "check": "oracle", "mutation": "easy_pad_square_again", "what": "Oracle FAIL kills keep. kills=['stripped:easy_pad_baseline_already_useful', 'held_out:easy_pad_dies_on_held_out', 'cas:easy_pad_fails_cas_usefulness', 'easy_pad_oracle_kill', 'collective_kill']. No fitness credit.", "source": "conjecture_desk", "family": "easy_pad", "before_score": null, "after_score": null, "skill_bias": {"improver.improve": 0.02, "geometer.gather": 0.02}, "genome_prior": {"explore": 0.02, "gather": 0.0}, "catalog_hint": {}, "proposal_fingerprint": "", "tags": ["oracle_kill", "stripped:easy_pad_baseline_already_useful", "held_out:easy_pad_dies_on_held_out", "cas:easy_pad_fails_cas_usefulness", "easy_pad_oracle_kill"], "evidence": ["kill:stripped:easy_pad_baseline_already_useful", "kill:held_out:easy_pad_dies_on_held_out", "kill:cas:easy_pad_fails_cas_usefulness", "kill:easy_pad_oracle_kill", "kill:collective_kill"], "author": null, "expired": false, "status": "candidate"}
{"id": "les_Z_538f59_vandermonde", "ts": "2026-10-08T07:26:42Z", "cycle_id": "20261008T072632Z_538f59", "type": "skip", "decision": "skip", "check": "oracle_seen_claim", "mutation": "vandermonde", "what": "skip re-oracle of vandermonde:1706.03762", "source": "claim_pipeline", "family": "novelty", "before_score": null, "after_score": null, "skill_bias": {}, "genome_prior": {}, "catalog_hint": {}, "proposal_fingerprint": "vandermonde:1706.03762", "tags": ["repeat_claim"], "evidence": [], "author": null, "expired": false, "status": "candidate"}
{"id": "les_Z_538f59_pilot", "ts": "2026-10-08T07:26:48Z", "cycle_id": "20261008T072632Z_538f59", "type": "skip", "decision": "skip", "check": "pilot", "mutation": "", "what": "empty rsi_bias pilot suppressed", "source": "pilot_lane", "family": "rsi", "before_score": null, "after_score": null, "skill_bias": {}, "genome_prior": {}, "catalog_hint": {}, "proposal_fingerprint": "", "tags": ["empty_rsi_bias"], "evidence": [], "author": null, "expired": false, "status": "candidate"}
{"id": "les_Z_66cada_vandermonde", "ts": "2026-10-08T07:27:15Z", "cycle_id": "20261008T072706Z_66cada", "type": "skip", "decision": "skip", "check": "oracle_seen_claim", "mutation": "vandermonde", "what": "skip re-oracle of vandermonde:1706.03762", "source": "claim_pipeline", "family": "novelty", "before_score": null, "after_score": null, "skill_bias": {}, "genome_prior": {}, "catalog_hint": {}, "proposal_fingerprint": "vandermonde:1706.03762", "tags": ["repeat_claim"], "evidence": [], "author": null, "expired": false, "status": "candidate"}
{"id": "les_Z_66cada_pilot", "ts": "2026-10-08T07:27:20Z", "cycle_id": "20261008T072706Z_66cada", "type": "skip", "decision": "skip", "check": "pilot", "mutation": "", "what": "empty rsi_bias pilot suppressed", "source": "pilot_lane", "family": "rsi", "before_score": null, "after_score": null, "skill_bias": {}, "genome_prior": {}, "catalog_hint": {}, "proposal_fingerprint": "", "tags": ["empty_rsi_bias"], "evidence": [], "author": null, "expired": false, "status": "candidate"}
{"id": "les_Z_cd6b48_dedupe", "ts": "2026-10-08T07:27:44Z", "cycle_id": "20261008T072738Z_cd6b48", "type": "repeat_proposal", "decision": "block", "check": "dedupe", "mutation": "", "what": "blocked repeat: Deepen compute-useful math from accepted findings after hearing", "source": "growth_hearing", "family": "process", "before_score": null, "after_score": null, "skill_bias": {}, "genome_prior": {}, "catalog_hint": {}, "proposal_fingerprint": "810bc050d326", "tags": ["repeat_proposal"], "evidence": [], "author": null, "expired": false, "status": "candidate"}
{"id": "les_Z_cd6b48_dedupe", "ts": "2026-10-08T07:27:45Z", "cycle_id": "20261008T072738Z_cd6b48", "type": "repeat_proposal", "decision": "block", "check": "dedupe", "mutation": "", "what": "blocked repeat: Feed accepted/strong RSI findings into skill_router + genome bias", "source": "growth_hearing", "family": "process", "before_score": null, "after_score": null, "skill_bias": {}, "genome_prior": {}, "catalog_hint": {}, "proposal_fingerprint": "27e48156942c", "tags": ["repeat_proposal"], "evidence": [], "author": null, "expired": false, "status": "candidate"}
{"id": "les_Z_cd6b48_authored_sum_first_n_cubes__stirlin", "ts": "2026-10-08T07:27:47Z", "cycle_id": "20261008T072738Z_cd6b48", "type": "authored_check", "decision": "skip", "check": "authoring", "mutation": "authored_sum_first_n_cubes__stirling_second_row_w1", "what": "authored disabled hard check `authored_sum_first_n_cubes__stirling_second_row_w1` from proven lemmas sum_first_n_cubes + stirling_second_row on new windows; awaits Oracle via proposal", "source": "conjecture_desk", "family": "hard_tier", "before_score": null, "after_score": null, "skill_bias": {}, "genome_prior": {}, "catalog_hint": {}, "proposal_fingerprint": "", "tags": ["authoring", "authored_check", "sum_first_n_cubes", "stirling_second_row"], "evidence": ["society/benchmarks/artifacts/lemma_impl.py::check_sum_first_n_cubes", "society/benchmarks/artifacts/lemma_impl.py::check_stirling_second_row", "society/benchmarks/lemma_microbench.py", "lemma:sum_first_n_cubes", "lemma:stirling_second_row"], "author": null, "expired": false, "status": "candidate"}
{"id": "les_Z_cd6b48_easy_pad_square_again", "ts": "2026-10-08T07:27:47Z", "cycle_id": "20261008T072738Z_cd6b48", "type": "oracle_kill", "decision": "revert", "check": "oracle", "mutation": "easy_pad_square_again", "what": "Oracle FAIL kills keep. kills=['stripped:easy_pad_baseline_already_useful', 'held_out:easy_pad_dies_on_held_out', 'cas:easy_pad_fails_cas_usefulness', 'easy_pad_oracle_kill', 'collective_kill']. No fitness credit.", "source": "conjecture_desk", "family": "easy_pad", "before_score": null, "after_score": null, "skill_bias": {"improver.improve": 0.02, "geometer.gather": 0.02}, "genome_prior": {"explore": 0.02, "gather": 0.0}, "catalog_hint": {}, "proposal_fingerprint": "", "tags": ["oracle_kill", "stripped:easy_pad_baseline_already_useful", "held_out:easy_pad_dies_on_held_out", "cas:easy_pad_fails_cas_usefulness", "easy_pad_oracle_kill"], "evidence": ["kill:stripped:easy_pad_baseline_already_useful", "kill:held_out:easy_pad_dies_on_held_out", "kill:cas:easy_pad_fails_cas_usefulness", "kill:easy_pad_oracle_kill", "kill:collective_kill"], "author": null, "expired": false, "status": "candidate"}
{"id": "les_Z_cd6b48_vandermonde", "ts": "2026-10-08T07:27:47Z", "cycle_id": "20261008T072738Z_cd6b48", "type": "skip", "decision": "skip", "check": "oracle_seen_claim", "mutation": "vandermonde", "what": "skip re-oracle of vandermonde:1706.03762", "source": "claim_pipeline", "family": "novelty", "before_score": null, "after_score": null, "skill_bias": {}, "genome_prior": {}, "catalog_hint": {}, "proposal_fingerprint": "vandermonde:1706.03762", "tags": ["repeat_claim"], "evidence": [], "author": null, "expired": false, "status": "candidate"}
{"id": "les_Z_cd6b48_pilot", "ts": "2026-10-08T07:27:52Z", "cycle_id": "20261008T072738Z_cd6b48", "type": "skip", "decision": "skip", "check": "pilot", "mutation": "", "what": "empty rsi_bias pilot suppressed", "source": "pilot_lane", "family": "rsi", "before_score": null, "after_score": null, "skill_bias": {}, "genome_prior": {}, "catalog_hint": {}, "proposal_fingerprint": "", "tags": ["empty_rsi_bias"], "evidence": [], "author": null, "expired": false, "status": "candidate"}
{"id": "les_Z_325a70_authored_sum_first_n_cubes__stirlin", "ts": "2026-10-08T07:42:55Z", "cycle_id": "20261008T074243Z_325a70", "type": "keep", "decision": "keep", "check": "lemma_microbench", "mutation": "authored_sum_first_n_cubes__stirling_second_row_w1", "what": "Kept `authored_sum_first_n_cubes__stirling_second_row_w1` (hard_enable): lemma score 0.9071→0.9071 checks 56→57 hard_pass 46→47 (machine-checked + Oracle pass; not novel discovery). | oracle=PASS fitness_credit=True kills=[] | novelty_gate novel=True kills=[]", "source": "conjecture_desk", "family": "hard_enable", "before_score": 0.9071, "after_score": 0.9071, "skill_bias": {"geometer.gather": 0.08, "improver.improve": 0.06, "spark.emergence": 0.04}, "genome_prior": {}, "catalog_hint": {}, "proposal_fingerprint": "", "tags": ["lemma", "hard_enable", "keep"], "evidence": ["society/benchmarks/lemma_microbench.py", "artifacts:lemma_impl", "lesson:les_Z_cd6b48_authored_sum_first_n_cubes__stirlin"], "author": null, "expired": false, "status": "candidate"}
{"id": "les_Z_325a70_vandermonde", "ts": "2026-10-08T07:42:55Z", "cycle_id": "20261008T074243Z_325a70", "type": "skip", "decision": "skip", "check": "oracle_seen_claim", "mutation": "vandermonde", "what": "skip re-oracle of vandermonde:1706.03762", "source": "claim_pipeline", "family": "novelty", "before_score": null, "after_score": null, "skill_bias": {}, "genome_prior": {}, "catalog_hint": {}, "proposal_fingerprint": "vandermonde:1706.03762", "tags": ["repeat_claim"], "evidence": [], "author": null, "expired": false, "status": "candidate"}
{"id": "les_Z_325a70_pilot", "ts": "2026-10-08T07:43:02Z", "cycle_id": "20261008T074243Z_325a70", "type": "skip", "decision": "skip", "check": "pilot", "mutation": "", "what": "empty rsi_bias pilot suppressed", "source": "pilot_lane", "family": "rsi", "before_score": null, "after_score": null, "skill_bias": {}, "genome_prior": {}, "catalog_hint": {}, "proposal_fingerprint": "", "tags": ["empty_rsi_bias"], "evidence": [], "author": null, "expired": false, "status": "candidate"}
