{"id": "les_Z_697a74_vandermonde", "ts": "2026-10-07T13:41:48Z", "cycle_id": "20261007T134144Z_697a74", "type": "skip", "decision": "skip", "check": "oracle_seen_claim", "mutation": "vandermonde", "what": "skip re-oracle of vandermonde:1706.03762", "source": "claim_pipeline", "family": "novelty", "before_score": null, "after_score": null, "skill_bias": {}, "genome_prior": {}, "catalog_hint": {}, "proposal_fingerprint": "vandermonde:1706.03762", "tags": ["repeat_claim"], "evidence": [], "author": null, "expired": false, "status": "candidate"}
{"id": "les_Z_697a74_pilot", "ts": "2026-10-07T13:42:03Z", "cycle_id": "20261007T134144Z_697a74", "type": "skip", "decision": "skip", "check": "pilot", "mutation": "", "what": "empty rsi_bias pilot suppressed", "source": "pilot_lane", "family": "rsi", "before_score": null, "after_score": null, "skill_bias": {}, "genome_prior": {}, "catalog_hint": {}, "proposal_fingerprint": "", "tags": ["empty_rsi_bias"], "evidence": [], "author": null, "expired": false, "status": "candidate"}
{"id": "les_cooldown_drop_repeated_kill_seek_elsewhere", "ts": "2026-10-07T13:58:28Z", "cycle_id": "teach_drop_kill_cooldown", "type": "human_guide", "decision": "guide", "check": "human", "mutation": "drop_repeated_kill_seek_elsewhere", "what": "DROP AFTER REPEATED KILLS: When the Oracle kills the same claim/theme repeatedly (e.g. vandermonde_asymmetric), STOP re-proposing it. Drop the cooled theme and SEEK a different target from papers.jsonl, ledger citations, and domain bus channels (science/history/math/empire/rsi). Failure teaches; looping the same killed idea does not. Light the spark elsewhere — gather before propose, cite sources, chase novelty.", "source": "human", "family": "human_teaching", "before_score": null, "after_score": null, "skill_bias": {"gather": 0.1, "explore": 0.08, "improver.improve": 0.05, "geometer.gather": 0.06}, "genome_prior": {"gather": 0.06, "explore": 0.08}, "catalog_hint": {"avoid": ["vandermonde_asymmetric", "process_spam"], "drop_theme": ["vandermonde_asymmetric"], "seek": ["papers.jsonl", "ledger", "domain_bus", "arxiv"], "prefer": ["novelty", "cite_sources", "gather_before_propose", "drop_cooled_theme"], "add_mutation": "binomial_hockey_deep"}, "proposal_fingerprint": "", "tags": ["human_guide", "seek", "kill_cooldown", "drop", "novelty", "oracle_kill"], "evidence": [], "author": "James Jackson", "expired": false, "status": "candidate"}
{"id": "les_3:59:50Z_Seek `binomial_hockey_deep` citing ", "ts": "2026-10-07T13:59:50Z", "cycle_id": "", "type": "oracle_kill", "decision": "revert", "check": "oracle", "mutation": "Seek `binomial_hockey_deep` citing New algebraic points on covers of elliptic curves", "what": "Oracle FAIL kills keep. kills=['stripped:stripped_not_useful_fail', 'held_out:held_out_fail', 'collective_kill']. No fitness credit.", "source": "novelty_gate", "family": "process", "before_score": null, "after_score": null, "skill_bias": {"improver.improve": 0.02, "geometer.gather": 0.02}, "genome_prior": {"explore": 0.02, "gather": 0.0}, "catalog_hint": {}, "proposal_fingerprint": "", "tags": ["oracle_kill", "stripped:stripped_not_useful_fail", "held_out:held_out_fail", "collective_kill"], "evidence": ["kill:stripped:stripped_not_useful_fail", "kill:held_out:held_out_fail", "kill:collective_kill"], "author": null, "expired": false, "status": "candidate"}
{"id": "les_Z_6ce10a_Seek `binomial_hockey_deep` citing ", "ts": "2026-10-07T13:59:50Z", "cycle_id": "20261007T135945Z_6ce10a", "type": "hearing_reject", "decision": "block", "check": "hearing", "mutation": "Seek `binomial_hockey_deep` citing New algebraic points on covers of elliptic cu", "what": "hearing_reject: claims compute/prize/bench advance without citing society/benchmarks path — hearing rejects", "source": "growth_hearing", "family": "process", "before_score": null, "after_score": null, "skill_bias": {}, "genome_prior": {}, "catalog_hint": {}, "proposal_fingerprint": "b7420e2038f8", "tags": ["hearing", "reject"], "evidence": ["proposal:imp_6ce10a_50"], "author": null, "expired": false, "status": "candidate"}
{"id": "les_3:59:50Z_Seek `binomial_hockey_deep` citing ", "ts": "2026-10-07T13:59:50Z", "cycle_id": "", "type": "oracle_kill", "decision": "revert", "check": "oracle", "mutation": "Seek `binomial_hockey_deep` citing New algebraic points on covers of elliptic curves (cycle 156)", "what": "Oracle FAIL kills keep. kills=['stripped:stripped_not_useful_fail', 'held_out:held_out_fail', 'collective_kill']. No fitness credit.", "source": "novelty_gate", "family": "process", "before_score": null, "after_score": null, "skill_bias": {"improver.improve": 0.02, "geometer.gather": 0.02}, "genome_prior": {"explore": 0.02, "gather": 0.0}, "catalog_hint": {}, "proposal_fingerprint": "", "tags": ["oracle_kill", "stripped:stripped_not_useful_fail", "held_out:held_out_fail", "collective_kill"], "evidence": ["kill:stripped:stripped_not_useful_fail", "kill:held_out:held_out_fail", "kill:collective_kill"], "author": null, "expired": false, "status": "candidate"}
{"id": "les_Z_6ce10a_easy_pad_zero_identity", "ts": "2026-10-07T13:59:50Z", "cycle_id": "20261007T135945Z_6ce10a", "type": "oracle_kill", "decision": "revert", "check": "oracle", "mutation": "easy_pad_zero_identity", "what": "Oracle FAIL kills keep. kills=['stripped:easy_pad_baseline_already_useful', 'held_out:easy_pad_dies_on_held_out', 'cas:easy_pad_fails_cas_usefulness', 'easy_pad_oracle_kill', 'collective_kill']. No fitness credit.", "source": "conjecture_desk", "family": "easy_pad", "before_score": null, "after_score": null, "skill_bias": {"improver.improve": 0.02, "geometer.gather": 0.02}, "genome_prior": {"explore": 0.02, "gather": 0.0}, "catalog_hint": {}, "proposal_fingerprint": "", "tags": ["oracle_kill", "stripped:easy_pad_baseline_already_useful", "held_out:easy_pad_dies_on_held_out", "cas:easy_pad_fails_cas_usefulness", "easy_pad_oracle_kill"], "evidence": ["kill:stripped:easy_pad_baseline_already_useful", "kill:held_out:easy_pad_dies_on_held_out", "kill:cas:easy_pad_fails_cas_usefulness", "kill:easy_pad_oracle_kill", "kill:collective_kill"], "author": null, "expired": false, "status": "candidate"}
{"id": "les_Z_6ce10a_vandermonde", "ts": "2026-10-07T13:59:50Z", "cycle_id": "20261007T135945Z_6ce10a", "type": "skip", "decision": "skip", "check": "oracle_seen_claim", "mutation": "vandermonde", "what": "skip re-oracle of vandermonde:1706.03762", "source": "claim_pipeline", "family": "novelty", "before_score": null, "after_score": null, "skill_bias": {}, "genome_prior": {}, "catalog_hint": {}, "proposal_fingerprint": "vandermonde:1706.03762", "tags": ["repeat_claim"], "evidence": [], "author": null, "expired": false, "status": "candidate"}
{"id": "les_Z_6ce10a_pilot", "ts": "2026-10-07T14:00:09Z", "cycle_id": "20261007T135945Z_6ce10a", "type": "skip", "decision": "skip", "check": "pilot", "mutation": "", "what": "empty rsi_bias pilot suppressed", "source": "pilot_lane", "family": "rsi", "before_score": null, "after_score": null, "skill_bias": {}, "genome_prior": {}, "catalog_hint": {}, "proposal_fingerprint": "", "tags": ["empty_rsi_bias"], "evidence": [], "author": null, "expired": false, "status": "candidate"}
{"id": "les_4:00:31Z_Seek `binomial_hockey_deep` citing ", "ts": "2026-10-07T14:00:31Z", "cycle_id": "", "type": "oracle_kill", "decision": "revert", "check": "oracle", "mutation": "Seek `binomial_hockey_deep` citing New algebraic points on covers of elliptic curves", "what": "Oracle FAIL kills keep. kills=['stripped:stripped_not_useful_fail', 'held_out:held_out_fail', 'collective_kill']. No fitness credit.", "source": "novelty_gate", "family": "process", "before_score": null, "after_score": null, "skill_bias": {"improver.improve": 0.02, "geometer.gather": 0.02}, "genome_prior": {"explore": 0.02, "gather": 0.0}, "catalog_hint": {}, "proposal_fingerprint": "", "tags": ["oracle_kill", "stripped:stripped_not_useful_fail", "held_out:held_out_fail", "collective_kill"], "evidence": ["kill:stripped:stripped_not_useful_fail", "kill:held_out:held_out_fail", "kill:collective_kill"], "author": null, "expired": false, "status": "candidate"}
{"id": "les_Z_dd827f_Seek `binomial_hockey_deep` citing ", "ts": "2026-10-07T14:00:32Z", "cycle_id": "20261007T140028Z_dd827f", "type": "hearing_reject", "decision": "block", "check": "hearing", "mutation": "Seek `binomial_hockey_deep` citing New algebraic points on covers of elliptic cu", "what": "hearing_reject: claims compute/prize/bench advance without citing society/benchmarks path — hearing rejects", "source": "growth_hearing", "family": "process", "before_score": null, "after_score": null, "skill_bias": {}, "genome_prior": {}, "catalog_hint": {}, "proposal_fingerprint": "b7420e2038f8", "tags": ["hearing", "reject"], "evidence": ["proposal:imp_dd827f_50"], "author": null, "expired": false, "status": "candidate"}
{"id": "les_4:00:32Z_Seek `lemma_hard_combinatorics` cit", "ts": "2026-10-07T14:00:32Z", "cycle_id": "", "type": "oracle_kill", "decision": "revert", "check": "oracle", "mutation": "Seek `lemma_hard_combinatorics` citing New algebraic points on covers of elliptic curves", "what": "Oracle FAIL kills keep. kills=['stripped:stripped_not_useful_fail', 'held_out:held_out_fail', 'collective_kill']. No fitness credit.", "source": "novelty_gate", "family": "process", "before_score": null, "after_score": null, "skill_bias": {"improver.improve": 0.02, "geometer.gather": 0.02}, "genome_prior": {"explore": 0.02, "gather": 0.0}, "catalog_hint": {}, "proposal_fingerprint": "", "tags": ["oracle_kill", "stripped:stripped_not_useful_fail", "held_out:held_out_fail", "collective_kill"], "evidence": ["kill:stripped:stripped_not_useful_fail", "kill:held_out:held_out_fail", "kill:collective_kill"], "author": null, "expired": false, "status": "candidate"}
{"id": "les_Z_dd827f_easy_pad_zero_identity", "ts": "2026-10-07T14:00:32Z", "cycle_id": "20261007T140028Z_dd827f", "type": "oracle_kill", "decision": "revert", "check": "oracle", "mutation": "easy_pad_zero_identity", "what": "Oracle FAIL kills keep. kills=['stripped:easy_pad_baseline_already_useful', 'held_out:easy_pad_dies_on_held_out', 'cas:easy_pad_fails_cas_usefulness', 'easy_pad_oracle_kill', 'collective_kill']. No fitness credit.", "source": "conjecture_desk", "family": "easy_pad", "before_score": null, "after_score": null, "skill_bias": {"improver.improve": 0.02, "geometer.gather": 0.02}, "genome_prior": {"explore": 0.02, "gather": 0.0}, "catalog_hint": {}, "proposal_fingerprint": "", "tags": ["oracle_kill", "stripped:easy_pad_baseline_already_useful", "held_out:easy_pad_dies_on_held_out", "cas:easy_pad_fails_cas_usefulness", "easy_pad_oracle_kill"], "evidence": ["kill:stripped:easy_pad_baseline_already_useful", "kill:held_out:easy_pad_dies_on_held_out", "kill:cas:easy_pad_fails_cas_usefulness", "kill:easy_pad_oracle_kill", "kill:collective_kill"], "author": null, "expired": false, "status": "candidate"}
{"id": "les_Z_dd827f_vandermonde", "ts": "2026-10-07T14:00:32Z", "cycle_id": "20261007T140028Z_dd827f", "type": "skip", "decision": "skip", "check": "oracle_seen_claim", "mutation": "vandermonde", "what": "skip re-oracle of vandermonde:1706.03762", "source": "claim_pipeline", "family": "novelty", "before_score": null, "after_score": null, "skill_bias": {}, "genome_prior": {}, "catalog_hint": {}, "proposal_fingerprint": "vandermonde:1706.03762", "tags": ["repeat_claim"], "evidence": [], "author": null, "expired": false, "status": "candidate"}
{"id": "les_Z_dd827f_pilot", "ts": "2026-10-07T14:00:49Z", "cycle_id": "20261007T140028Z_dd827f", "type": "skip", "decision": "skip", "check": "pilot", "mutation": "", "what": "empty rsi_bias pilot suppressed", "source": "pilot_lane", "family": "rsi", "before_score": null, "after_score": null, "skill_bias": {}, "genome_prior": {}, "catalog_hint": {}, "proposal_fingerprint": "", "tags": ["empty_rsi_bias"], "evidence": [], "author": null, "expired": false, "status": "candidate"}
{"id": "les_4:01:14Z_Seek `lemma_hard_combinatorics` cit", "ts": "2026-10-07T14:01:14Z", "cycle_id": "", "type": "oracle_kill", "decision": "revert", "check": "oracle", "mutation": "Seek `lemma_hard_combinatorics` citing New algebraic points on covers of elliptic curves", "what": "Oracle FAIL kills keep. kills=['stripped:stripped_not_useful_fail', 'held_out:held_out_fail', 'collective_kill']. No fitness credit.", "source": "novelty_gate", "family": "process", "before_score": null, "after_score": null, "skill_bias": {"improver.improve": 0.02, "geometer.gather": 0.02}, "genome_prior": {"explore": 0.02, "gather": 0.0}, "catalog_hint": {}, "proposal_fingerprint": "", "tags": ["oracle_kill", "stripped:stripped_not_useful_fail", "held_out:held_out_fail", "collective_kill"], "evidence": ["kill:stripped:stripped_not_useful_fail", "kill:held_out:held_out_fail", "kill:collective_kill"], "author": null, "expired": false, "status": "candidate"}
{"id": "les_Z_7c797c_Seek `lemma_hard_combinatorics` cit", "ts": "2026-10-07T14:01:14Z", "cycle_id": "20261007T140111Z_7c797c", "type": "hearing_reject", "decision": "block", "check": "hearing", "mutation": "Seek `lemma_hard_combinatorics` citing New algebraic points on covers of ellipti", "what": "hearing_reject: claims compute/prize/bench advance without citing society/benchmarks path — hearing rejects", "source": "growth_hearing", "family": "process", "before_score": null, "after_score": null, "skill_bias": {}, "genome_prior": {}, "catalog_hint": {}, "proposal_fingerprint": "2bf0aaef2d64", "tags": ["hearing", "reject"], "evidence": ["proposal:imp_7c797c_50"], "author": null, "expired": false, "status": "candidate"}
{"id": "les_4:01:15Z_Seek `lemma_hard_combinatorics` cit", "ts": "2026-10-07T14:01:15Z", "cycle_id": "", "type": "oracle_kill", "decision": "revert", "check": "oracle", "mutation": "Seek `lemma_hard_combinatorics` citing New algebraic points on covers of elliptic curves (cycle 158)", "what": "Oracle FAIL kills keep. kills=['stripped:stripped_not_useful_fail', 'held_out:held_out_fail', 'collective_kill']. No fitness credit.", "source": "novelty_gate", "family": "process", "before_score": null, "after_score": null, "skill_bias": {"improver.improve": 0.02, "geometer.gather": 0.02}, "genome_prior": {"explore": 0.02, "gather": 0.0}, "catalog_hint": {}, "proposal_fingerprint": "", "tags": ["oracle_kill", "stripped:stripped_not_useful_fail", "held_out:held_out_fail", "collective_kill"], "evidence": ["kill:stripped:stripped_not_useful_fail", "kill:held_out:held_out_fail", "kill:collective_kill"], "author": null, "expired": false, "status": "candidate"}
{"id": "les_Z_7c797c_easy_pad_square_again", "ts": "2026-10-07T14:01:15Z", "cycle_id": "20261007T140111Z_7c797c", "type": "oracle_kill", "decision": "revert", "check": "oracle", "mutation": "easy_pad_square_again", "what": "Oracle FAIL kills keep. kills=['stripped:easy_pad_baseline_already_useful', 'held_out:easy_pad_dies_on_held_out', 'cas:easy_pad_fails_cas_usefulness', 'easy_pad_oracle_kill', 'collective_kill']. No fitness credit.", "source": "conjecture_desk", "family": "easy_pad", "before_score": null, "after_score": null, "skill_bias": {"improver.improve": 0.02, "geometer.gather": 0.02}, "genome_prior": {"explore": 0.02, "gather": 0.0}, "catalog_hint": {}, "proposal_fingerprint": "", "tags": ["oracle_kill", "stripped:easy_pad_baseline_already_useful", "held_out:easy_pad_dies_on_held_out", "cas:easy_pad_fails_cas_usefulness", "easy_pad_oracle_kill"], "evidence": ["kill:stripped:easy_pad_baseline_already_useful", "kill:held_out:easy_pad_dies_on_held_out", "kill:cas:easy_pad_fails_cas_usefulness", "kill:easy_pad_oracle_kill", "kill:collective_kill"], "author": null, "expired": false, "status": "candidate"}
{"id": "les_Z_7c797c_vandermonde", "ts": "2026-10-07T14:01:15Z", "cycle_id": "20261007T140111Z_7c797c", "type": "skip", "decision": "skip", "check": "oracle_seen_claim", "mutation": "vandermonde", "what": "skip re-oracle of vandermonde:1706.03762", "source": "claim_pipeline", "family": "novelty", "before_score": null, "after_score": null, "skill_bias": {}, "genome_prior": {}, "catalog_hint": {}, "proposal_fingerprint": "vandermonde:1706.03762", "tags": ["repeat_claim"], "evidence": [], "author": null, "expired": false, "status": "candidate"}
{"id": "les_Z_7c797c_pilot", "ts": "2026-10-07T14:01:32Z", "cycle_id": "20261007T140111Z_7c797c", "type": "skip", "decision": "skip", "check": "pilot", "mutation": "", "what": "empty rsi_bias pilot suppressed", "source": "pilot_lane", "family": "rsi", "before_score": null, "after_score": null, "skill_bias": {}, "genome_prior": {}, "catalog_hint": {}, "proposal_fingerprint": "", "tags": ["empty_rsi_bias"], "evidence": [], "author": null, "expired": false, "status": "candidate"}
{"id": "les_4:01:40Z_Seek `lemma_hard_combinatorics` cit", "ts": "2026-10-07T14:01:40Z", "cycle_id": "", "type": "oracle_kill", "decision": "revert", "check": "oracle", "mutation": "Seek `lemma_hard_combinatorics` citing New algebraic points on covers of elliptic curves", "what": "Oracle FAIL kills keep. kills=['stripped:stripped_not_useful_fail', 'held_out:held_out_fail', 'collective_kill']. No fitness credit.", "source": "novelty_gate", "family": "process", "before_score": null, "after_score": null, "skill_bias": {"improver.improve": 0.02, "geometer.gather": 0.02}, "genome_prior": {"explore": 0.02, "gather": 0.0}, "catalog_hint": {}, "proposal_fingerprint": "", "tags": ["oracle_kill", "stripped:stripped_not_useful_fail", "held_out:held_out_fail", "collective_kill"], "evidence": ["kill:stripped:stripped_not_useful_fail", "kill:held_out:held_out_fail", "kill:collective_kill"], "author": null, "expired": false, "status": "candidate"}
{"id": "les_variants_seek_machine_checkable_invariants", "ts": "2026-10-07T18:01:22Z", "cycle_id": "teach_invariants", "type": "human_guide", "decision": "guide", "check": "human", "mutation": "seek_machine_checkable_invariants", "what": "SEEK / KEEP MACHINE-CHECKABLE INVARIANTS: Prefer claims you can check in code — combinatorics identities, FFT correctness, kinematics/energy-work relations — over ceremony or renames. An invariant earns keep only when the Oracle (held-out/stripped/CAS) passes. Gather from lemma_impl, fft_impl, kinematics_impl and the ledger before proposing. Light the spark from evidence; witness.", "source": "human", "family": "human_teaching", "before_score": null, "after_score": null, "skill_bias": {"gather": 0.1, "oracle": 0.08, "improver.improve": 0.06, "build": 0.05}, "genome_prior": {"gather": 0.07, "explore": 0.05, "build": 0.04}, "catalog_hint": {"seek": ["lemma_impl", "fft_impl", "kinematics_impl", "ledger", "papers.jsonl"], "prefer": ["invariant", "invariants", "machine_checkable", "combinatorics", "fft", "kinematics", "cite_sources", "gather_before_propose"], "prefer_mutations": ["derived_chain_stress", "workload_derived_chain", "energy_work", "binomial_hockey_deep", "fibonacci_cassini_ext"], "add_mutation": "derived_chain_stress", "avoid": ["process_spam", "isolated_rename", "easy_pad"]}, "proposal_fingerprint": "", "tags": ["human_guide", "invariant", "invariants", "seek", "machine_checkable", "combinatorics", "fft", "kinematics"], "evidence": [], "author": "James Jackson", "expired": false, "status": "candidate"}
{"id": "les_variants_compose_chain_proven_lemmas", "ts": "2026-10-07T18:01:22Z", "cycle_id": "teach_invariants", "type": "human_guide", "decision": "guide", "check": "human", "mutation": "compose_chain_proven_lemmas", "what": "COMPOSE / CHAIN PROVEN LEMMAS: String machine-checked invariants into longer proof-style workloads (derived_chain / workload_derived_chain style) — do not propose isolated renames of a single identity. A chain keep requires every link to pass and the Oracle to agree. When novelty is flat, extend the chain rather than rephrase. Spark proposes; humans authorize at P≥0.70. Guide, do not micromanage.", "source": "human", "family": "human_teaching", "before_score": null, "after_score": null, "skill_bias": {"build": 0.1, "improver.improve": 0.08, "emergence": 0.06, "gather": 0.04}, "genome_prior": {"build": 0.07, "explore": 0.06, "gather": 0.03}, "catalog_hint": {"prefer": ["lemma_chain", "derived_chain", "compose_lemmas", "proof_chain", "novelty", "citation_reuse"], "chain": ["workload_derived_chain", "derived_chain_stress", "fibonacci_cassini_ext", "binomial_hockey_deep"], "prefer_mutations": ["derived_chain_stress", "workload_derived_chain", "catalan_convolution", "lagrange_identity"], "add_mutation": "derived_chain_stress", "chain_mutation": "derived_chain_stress", "avoid": ["isolated_rename", "process_spam", "easy_pad"], "seek": ["lessons", "lemma_impl", "known_identities"]}, "proposal_fingerprint": "", "tags": ["human_guide", "invariant", "chain", "compose", "derived_chain", "become", "novelty"], "evidence": [], "author": "James Jackson", "expired": false, "status": "candidate"}
{"id": "les_8:01:55Z_Chain `derived_chain_stress` citing", "ts": "2026-10-07T18:01:55Z", "cycle_id": "", "type": "oracle_kill", "decision": "revert", "check": "oracle", "mutation": "Chain `derived_chain_stress` citing New algebraic points on covers of elliptic curves", "what": "Oracle FAIL kills keep. kills=['stripped:stripped_not_useful_fail', 'held_out:held_out_fail', 'collective_kill']. No fitness credit.", "source": "novelty_gate", "family": "process", "before_score": null, "after_score": null, "skill_bias": {"improver.improve": 0.02, "geometer.gather": 0.02}, "genome_prior": {"explore": 0.02, "gather": 0.0}, "catalog_hint": {}, "proposal_fingerprint": "", "tags": ["oracle_kill", "stripped:stripped_not_useful_fail", "held_out:held_out_fail", "collective_kill"], "evidence": ["kill:stripped:stripped_not_useful_fail", "kill:held_out:held_out_fail", "kill:collective_kill"], "author": null, "expired": false, "status": "candidate"}
