{"id": "les_Z_6d1e0c_Chain `derived_chain_stress` citing", "ts": "2026-10-07T18:01:55Z", "cycle_id": "20261007T180152Z_6d1e0c", "type": "hearing_reject", "decision": "block", "check": "hearing", "mutation": "Chain `derived_chain_stress` citing New algebraic points on covers of elliptic c", "what": "hearing_reject: claims compute/prize/bench advance without citing society/benchmarks path — hearing rejects", "source": "growth_hearing", "family": "process", "before_score": null, "after_score": null, "skill_bias": {}, "genome_prior": {}, "catalog_hint": {}, "proposal_fingerprint": "c8be0f6a1fb4", "tags": ["hearing", "reject"], "evidence": ["proposal:imp_6d1e0c_50"], "author": null, "expired": false, "status": "candidate"}
{"id": "les_8:01:55Z_Chain `derived_chain_stress` citing", "ts": "2026-10-07T18:01:55Z", "cycle_id": "", "type": "oracle_kill", "decision": "revert", "check": "oracle", "mutation": "Chain `derived_chain_stress` citing New algebraic points on covers of elliptic curves (cycle 159)", "what": "Oracle FAIL kills keep. kills=['stripped:stripped_not_useful_fail', 'held_out:held_out_fail', 'collective_kill']. No fitness credit.", "source": "novelty_gate", "family": "process", "before_score": null, "after_score": null, "skill_bias": {"improver.improve": 0.02, "geometer.gather": 0.02}, "genome_prior": {"explore": 0.02, "gather": 0.0}, "catalog_hint": {}, "proposal_fingerprint": "", "tags": ["oracle_kill", "stripped:stripped_not_useful_fail", "held_out:held_out_fail", "collective_kill"], "evidence": ["kill:stripped:stripped_not_useful_fail", "kill:held_out:held_out_fail", "kill:collective_kill"], "author": null, "expired": false, "status": "candidate"}
{"id": "les_Z_6d1e0c_easy_pad_square_again", "ts": "2026-10-07T18:01:56Z", "cycle_id": "20261007T180152Z_6d1e0c", "type": "oracle_kill", "decision": "revert", "check": "oracle", "mutation": "easy_pad_square_again", "what": "Oracle FAIL kills keep. kills=['stripped:easy_pad_baseline_already_useful', 'held_out:easy_pad_dies_on_held_out', 'cas:easy_pad_fails_cas_usefulness', 'easy_pad_oracle_kill', 'collective_kill']. No fitness credit.", "source": "conjecture_desk", "family": "easy_pad", "before_score": null, "after_score": null, "skill_bias": {"improver.improve": 0.02, "geometer.gather": 0.02}, "genome_prior": {"explore": 0.02, "gather": 0.0}, "catalog_hint": {}, "proposal_fingerprint": "", "tags": ["oracle_kill", "stripped:easy_pad_baseline_already_useful", "held_out:easy_pad_dies_on_held_out", "cas:easy_pad_fails_cas_usefulness", "easy_pad_oracle_kill"], "evidence": ["kill:stripped:easy_pad_baseline_already_useful", "kill:held_out:easy_pad_dies_on_held_out", "kill:cas:easy_pad_fails_cas_usefulness", "kill:easy_pad_oracle_kill", "kill:collective_kill"], "author": null, "expired": false, "status": "candidate"}
{"id": "les_Z_6d1e0c_vandermonde", "ts": "2026-10-07T18:01:56Z", "cycle_id": "20261007T180152Z_6d1e0c", "type": "skip", "decision": "skip", "check": "oracle_seen_claim", "mutation": "vandermonde", "what": "skip re-oracle of vandermonde:1706.03762", "source": "claim_pipeline", "family": "novelty", "before_score": null, "after_score": null, "skill_bias": {}, "genome_prior": {}, "catalog_hint": {}, "proposal_fingerprint": "vandermonde:1706.03762", "tags": ["repeat_claim"], "evidence": [], "author": null, "expired": false, "status": "candidate"}
{"id": "les_Z_6d1e0c_pilot", "ts": "2026-10-07T18:02:14Z", "cycle_id": "20261007T180152Z_6d1e0c", "type": "skip", "decision": "skip", "check": "pilot", "mutation": "", "what": "empty rsi_bias pilot suppressed", "source": "pilot_lane", "family": "rsi", "before_score": null, "after_score": null, "skill_bias": {}, "genome_prior": {}, "catalog_hint": {}, "proposal_fingerprint": "", "tags": ["empty_rsi_bias"], "evidence": [], "author": null, "expired": false, "status": "candidate"}
{"id": "les_8:02:36Z_Chain `derived_chain_stress` citing", "ts": "2026-10-07T18:02:36Z", "cycle_id": "", "type": "oracle_kill", "decision": "revert", "check": "oracle", "mutation": "Chain `derived_chain_stress` citing New algebraic points on covers of elliptic curves", "what": "Oracle FAIL kills keep. kills=['stripped:stripped_not_useful_fail', 'held_out:held_out_fail', 'collective_kill']. No fitness credit.", "source": "novelty_gate", "family": "process", "before_score": null, "after_score": null, "skill_bias": {"improver.improve": 0.02, "geometer.gather": 0.02}, "genome_prior": {"explore": 0.02, "gather": 0.0}, "catalog_hint": {}, "proposal_fingerprint": "", "tags": ["oracle_kill", "stripped:stripped_not_useful_fail", "held_out:held_out_fail", "collective_kill"], "evidence": ["kill:stripped:stripped_not_useful_fail", "kill:held_out:held_out_fail", "kill:collective_kill"], "author": null, "expired": false, "status": "candidate"}
{"id": "les_Z_727bec_Chain `derived_chain_stress` citing", "ts": "2026-10-07T18:02:36Z", "cycle_id": "20261007T180233Z_727bec", "type": "hearing_reject", "decision": "block", "check": "hearing", "mutation": "Chain `derived_chain_stress` citing New algebraic points on covers of elliptic c", "what": "hearing_reject: claims compute/prize/bench advance without citing society/benchmarks path — hearing rejects", "source": "growth_hearing", "family": "process", "before_score": null, "after_score": null, "skill_bias": {}, "genome_prior": {}, "catalog_hint": {}, "proposal_fingerprint": "c8be0f6a1fb4", "tags": ["hearing", "reject"], "evidence": ["proposal:imp_727bec_50"], "author": null, "expired": false, "status": "candidate"}
{"id": "les_8:02:37Z_Chain `workload_derived_chain` citi", "ts": "2026-10-07T18:02:37Z", "cycle_id": "", "type": "oracle_kill", "decision": "revert", "check": "oracle", "mutation": "Chain `workload_derived_chain` citing New algebraic points on covers of elliptic curves", "what": "Oracle FAIL kills keep. kills=['stripped:stripped_not_useful_fail', 'held_out:held_out_fail', 'collective_kill']. No fitness credit.", "source": "novelty_gate", "family": "process", "before_score": null, "after_score": null, "skill_bias": {"improver.improve": 0.02, "geometer.gather": 0.02}, "genome_prior": {"explore": 0.02, "gather": 0.0}, "catalog_hint": {}, "proposal_fingerprint": "", "tags": ["oracle_kill", "stripped:stripped_not_useful_fail", "held_out:held_out_fail", "collective_kill"], "evidence": ["kill:stripped:stripped_not_useful_fail", "kill:held_out:held_out_fail", "kill:collective_kill"], "author": null, "expired": false, "status": "candidate"}
{"id": "les_Z_727bec_easy_pad_square_again", "ts": "2026-10-07T18:02:37Z", "cycle_id": "20261007T180233Z_727bec", "type": "oracle_kill", "decision": "revert", "check": "oracle", "mutation": "easy_pad_square_again", "what": "Oracle FAIL kills keep. kills=['stripped:easy_pad_baseline_already_useful', 'held_out:easy_pad_dies_on_held_out', 'cas:easy_pad_fails_cas_usefulness', 'easy_pad_oracle_kill', 'collective_kill']. No fitness credit.", "source": "conjecture_desk", "family": "easy_pad", "before_score": null, "after_score": null, "skill_bias": {"improver.improve": 0.02, "geometer.gather": 0.02}, "genome_prior": {"explore": 0.02, "gather": 0.0}, "catalog_hint": {}, "proposal_fingerprint": "", "tags": ["oracle_kill", "stripped:easy_pad_baseline_already_useful", "held_out:easy_pad_dies_on_held_out", "cas:easy_pad_fails_cas_usefulness", "easy_pad_oracle_kill"], "evidence": ["kill:stripped:easy_pad_baseline_already_useful", "kill:held_out:easy_pad_dies_on_held_out", "kill:cas:easy_pad_fails_cas_usefulness", "kill:easy_pad_oracle_kill", "kill:collective_kill"], "author": null, "expired": false, "status": "candidate"}
{"id": "les_Z_727bec_vandermonde", "ts": "2026-10-07T18:02:37Z", "cycle_id": "20261007T180233Z_727bec", "type": "skip", "decision": "skip", "check": "oracle_seen_claim", "mutation": "vandermonde", "what": "skip re-oracle of vandermonde:1706.03762", "source": "claim_pipeline", "family": "novelty", "before_score": null, "after_score": null, "skill_bias": {}, "genome_prior": {}, "catalog_hint": {}, "proposal_fingerprint": "vandermonde:1706.03762", "tags": ["repeat_claim"], "evidence": [], "author": null, "expired": false, "status": "candidate"}
{"id": "les_Z_727bec_pilot", "ts": "2026-10-07T18:02:55Z", "cycle_id": "20261007T180233Z_727bec", "type": "skip", "decision": "skip", "check": "pilot", "mutation": "", "what": "empty rsi_bias pilot suppressed", "source": "pilot_lane", "family": "rsi", "before_score": null, "after_score": null, "skill_bias": {}, "genome_prior": {}, "catalog_hint": {}, "proposal_fingerprint": "", "tags": ["empty_rsi_bias"], "evidence": [], "author": null, "expired": false, "status": "candidate"}
{"id": "les_8:03:17Z_Chain `workload_derived_chain` citi", "ts": "2026-10-07T18:03:17Z", "cycle_id": "", "type": "oracle_kill", "decision": "revert", "check": "oracle", "mutation": "Chain `workload_derived_chain` citing New algebraic points on covers of elliptic curves", "what": "Oracle FAIL kills keep. kills=['stripped:stripped_not_useful_fail', 'held_out:held_out_fail', 'collective_kill']. No fitness credit.", "source": "novelty_gate", "family": "process", "before_score": null, "after_score": null, "skill_bias": {"improver.improve": 0.02, "geometer.gather": 0.02}, "genome_prior": {"explore": 0.02, "gather": 0.0}, "catalog_hint": {}, "proposal_fingerprint": "", "tags": ["oracle_kill", "stripped:stripped_not_useful_fail", "held_out:held_out_fail", "collective_kill"], "evidence": ["kill:stripped:stripped_not_useful_fail", "kill:held_out:held_out_fail", "kill:collective_kill"], "author": null, "expired": false, "status": "candidate"}
{"id": "les_Z_7a9e7d_Chain `workload_derived_chain` citi", "ts": "2026-10-07T18:03:17Z", "cycle_id": "20261007T180314Z_7a9e7d", "type": "hearing_reject", "decision": "block", "check": "hearing", "mutation": "Chain `workload_derived_chain` citing New algebraic points on covers of elliptic", "what": "hearing_reject: claims compute/prize/bench advance without citing society/benchmarks path — hearing rejects", "source": "growth_hearing", "family": "process", "before_score": null, "after_score": null, "skill_bias": {}, "genome_prior": {}, "catalog_hint": {}, "proposal_fingerprint": "c3c83d814a5e", "tags": ["hearing", "reject"], "evidence": ["proposal:imp_7a9e7d_50"], "author": null, "expired": false, "status": "candidate"}
{"id": "les_8:03:17Z_Chain `workload_derived_chain` citi", "ts": "2026-10-07T18:03:17Z", "cycle_id": "", "type": "oracle_kill", "decision": "revert", "check": "oracle", "mutation": "Chain `workload_derived_chain` citing New algebraic points on covers of elliptic curves (cycle 161)", "what": "Oracle FAIL kills keep. kills=['stripped:stripped_not_useful_fail', 'held_out:held_out_fail', 'collective_kill']. No fitness credit.", "source": "novelty_gate", "family": "process", "before_score": null, "after_score": null, "skill_bias": {"improver.improve": 0.02, "geometer.gather": 0.02}, "genome_prior": {"explore": 0.02, "gather": 0.0}, "catalog_hint": {}, "proposal_fingerprint": "", "tags": ["oracle_kill", "stripped:stripped_not_useful_fail", "held_out:held_out_fail", "collective_kill"], "evidence": ["kill:stripped:stripped_not_useful_fail", "kill:held_out:held_out_fail", "kill:collective_kill"], "author": null, "expired": false, "status": "candidate"}
{"id": "les_Z_7a9e7d_easy_pad_diff_squares", "ts": "2026-10-07T18:03:17Z", "cycle_id": "20261007T180314Z_7a9e7d", "type": "oracle_kill", "decision": "revert", "check": "oracle", "mutation": "easy_pad_diff_squares", "what": "Oracle FAIL kills keep. kills=['stripped:easy_pad_baseline_already_useful', 'held_out:easy_pad_dies_on_held_out', 'cas:easy_pad_fails_cas_usefulness', 'easy_pad_oracle_kill', 'collective_kill']. No fitness credit.", "source": "conjecture_desk", "family": "easy_pad", "before_score": null, "after_score": null, "skill_bias": {"improver.improve": 0.02, "geometer.gather": 0.02}, "genome_prior": {"explore": 0.02, "gather": 0.0}, "catalog_hint": {}, "proposal_fingerprint": "", "tags": ["oracle_kill", "stripped:easy_pad_baseline_already_useful", "held_out:easy_pad_dies_on_held_out", "cas:easy_pad_fails_cas_usefulness", "easy_pad_oracle_kill"], "evidence": ["kill:stripped:easy_pad_baseline_already_useful", "kill:held_out:easy_pad_dies_on_held_out", "kill:cas:easy_pad_fails_cas_usefulness", "kill:easy_pad_oracle_kill", "kill:collective_kill"], "author": null, "expired": false, "status": "candidate"}
{"id": "les_Z_7a9e7d_vandermonde", "ts": "2026-10-07T18:03:17Z", "cycle_id": "20261007T180314Z_7a9e7d", "type": "skip", "decision": "skip", "check": "oracle_seen_claim", "mutation": "vandermonde", "what": "skip re-oracle of vandermonde:1706.03762", "source": "claim_pipeline", "family": "novelty", "before_score": null, "after_score": null, "skill_bias": {}, "genome_prior": {}, "catalog_hint": {}, "proposal_fingerprint": "vandermonde:1706.03762", "tags": ["repeat_claim"], "evidence": [], "author": null, "expired": false, "status": "candidate"}
{"id": "les_Z_7a9e7d_pilot", "ts": "2026-10-07T18:03:35Z", "cycle_id": "20261007T180314Z_7a9e7d", "type": "skip", "decision": "skip", "check": "pilot", "mutation": "", "what": "empty rsi_bias pilot suppressed", "source": "pilot_lane", "family": "rsi", "before_score": null, "after_score": null, "skill_bias": {}, "genome_prior": {}, "catalog_hint": {}, "proposal_fingerprint": "", "tags": ["empty_rsi_bias"], "evidence": [], "author": null, "expired": false, "status": "candidate"}
{"id": "les_8:03:56Z_Chain `workload_derived_chain` citi", "ts": "2026-10-07T18:03:56Z", "cycle_id": "", "type": "oracle_kill", "decision": "revert", "check": "oracle", "mutation": "Chain `workload_derived_chain` citing New algebraic points on covers of elliptic curves", "what": "Oracle FAIL kills keep. kills=['stripped:stripped_not_useful_fail', 'held_out:held_out_fail', 'collective_kill']. No fitness credit.", "source": "novelty_gate", "family": "process", "before_score": null, "after_score": null, "skill_bias": {"improver.improve": 0.02, "geometer.gather": 0.02}, "genome_prior": {"explore": 0.02, "gather": 0.0}, "catalog_hint": {}, "proposal_fingerprint": "", "tags": ["oracle_kill", "stripped:stripped_not_useful_fail", "held_out:held_out_fail", "collective_kill"], "evidence": ["kill:stripped:stripped_not_useful_fail", "kill:held_out:held_out_fail", "kill:collective_kill"], "author": null, "expired": false, "status": "candidate"}
{"id": "les_chain_cite_proven_lemmas_and_benchmarks", "ts": "2026-10-07T19:51:13Z", "cycle_id": "teach_chain_cites", "type": "human_guide", "decision": "guide", "check": "human", "mutation": "chain_cite_proven_lemmas_and_benchmarks", "what": "CITE PROVEN LEMMAS + SOCIETY/BENCHMARKS: A chain proposal must name the specific proven lemmas it composes and cite the society/benchmarks artifact path(s) that check them (e.g. society/benchmarks/artifacts/lemma_impl.py + lemma_microbench.py). Without a cite, Hearing rejects (claims compute/prize/bench advance without citing society/benchmarks path). Look up what the chain actually uses — do not invent cites, do not weaken Hearing/Oracle/gate. Spark proposes; humans authorize at P≥0.70.", "source": "human", "family": "human_teaching", "before_score": null, "after_score": null, "skill_bias": {"gather": 0.08, "oracle": 0.06, "improver.improve": 0.06, "build": 0.05}, "genome_prior": {"gather": 0.05, "explore": 0.04, "build": 0.04}, "catalog_hint": {"require": ["bench_cite", "lemma_cite", "cite_benchmarks"], "prefer": ["cite_benchmarks", "cite_lemmas", "lemma_chain", "derived_chain", "compose_lemmas"], "prefer_mutations": ["derived_chain_stress", "workload_derived_chain", "fibonacci_cassini_ext", "binomial_hockey_deep", "energy_work"], "add_mutation": "derived_chain_stress", "chain_mutation": "derived_chain_stress", "seek": ["society/benchmarks/artifacts", "lemma_impl", "fft_impl", "kinematics_impl", "latest.json"], "avoid": ["invented_cite", "process_spam", "isolated_rename", "easy_pad"]}, "proposal_fingerprint": "", "tags": ["human_guide", "cite", "cite_benchmarks", "cite_lemmas", "bench_cite", "chain", "compose", "derived_chain"], "evidence": [], "author": "James Jackson", "expired": false, "status": "candidate"}
{"id": "les_9:52:29Z_Chain `energy_work` citing New alge", "ts": "2026-10-07T19:52:29Z", "cycle_id": "", "type": "oracle_kill", "decision": "revert", "check": "oracle", "mutation": "Chain `energy_work` citing New algebraic points on covers of elliptic curves", "what": "Oracle FAIL kills keep. kills=['stripped:stripped_not_useful_fail', 'held_out:held_out_fail', 'collective_kill']. No fitness credit.", "source": "novelty_gate", "family": "process", "before_score": null, "after_score": null, "skill_bias": {"improver.improve": 0.02, "geometer.gather": 0.02}, "genome_prior": {"explore": 0.02, "gather": 0.0}, "catalog_hint": {}, "proposal_fingerprint": "", "tags": ["oracle_kill", "stripped:stripped_not_useful_fail", "held_out:held_out_fail", "collective_kill"], "evidence": ["kill:stripped:stripped_not_useful_fail", "kill:held_out:held_out_fail", "kill:collective_kill"], "author": null, "expired": false, "status": "candidate"}
{"id": "les_9:52:29Z_Chain `energy_work` citing New alge", "ts": "2026-10-07T19:52:29Z", "cycle_id": "", "type": "oracle_kill", "decision": "revert", "check": "oracle", "mutation": "Chain `energy_work` citing New algebraic points on covers of elliptic curves (cycle 162)", "what": "Oracle FAIL kills keep. kills=['stripped:stripped_not_useful_fail', 'held_out:held_out_fail', 'collective_kill']. No fitness credit.", "source": "novelty_gate", "family": "process", "before_score": null, "after_score": null, "skill_bias": {"improver.improve": 0.02, "geometer.gather": 0.02}, "genome_prior": {"explore": 0.02, "gather": 0.0}, "catalog_hint": {}, "proposal_fingerprint": "", "tags": ["oracle_kill", "stripped:stripped_not_useful_fail", "held_out:held_out_fail", "collective_kill"], "evidence": ["kill:stripped:stripped_not_useful_fail", "kill:held_out:held_out_fail", "kill:collective_kill"], "author": null, "expired": false, "status": "candidate"}
{"id": "les_Z_5ba8dd_easy_pad_diff_squares", "ts": "2026-10-07T19:52:29Z", "cycle_id": "20261007T195223Z_5ba8dd", "type": "oracle_kill", "decision": "revert", "check": "oracle", "mutation": "easy_pad_diff_squares", "what": "Oracle FAIL kills keep. kills=['stripped:easy_pad_baseline_already_useful', 'held_out:easy_pad_dies_on_held_out', 'cas:easy_pad_fails_cas_usefulness', 'easy_pad_oracle_kill', 'collective_kill']. No fitness credit.", "source": "conjecture_desk", "family": "easy_pad", "before_score": null, "after_score": null, "skill_bias": {"improver.improve": 0.02, "geometer.gather": 0.02}, "genome_prior": {"explore": 0.02, "gather": 0.0}, "catalog_hint": {}, "proposal_fingerprint": "", "tags": ["oracle_kill", "stripped:easy_pad_baseline_already_useful", "held_out:easy_pad_dies_on_held_out", "cas:easy_pad_fails_cas_usefulness", "easy_pad_oracle_kill"], "evidence": ["kill:stripped:easy_pad_baseline_already_useful", "kill:held_out:easy_pad_dies_on_held_out", "kill:cas:easy_pad_fails_cas_usefulness", "kill:easy_pad_oracle_kill", "kill:collective_kill"], "author": null, "expired": false, "status": "candidate"}
{"id": "les_Z_5ba8dd_vandermonde", "ts": "2026-10-07T19:52:29Z", "cycle_id": "20261007T195223Z_5ba8dd", "type": "skip", "decision": "skip", "check": "oracle_seen_claim", "mutation": "vandermonde", "what": "skip re-oracle of vandermonde:1706.03762", "source": "claim_pipeline", "family": "novelty", "before_score": null, "after_score": null, "skill_bias": {}, "genome_prior": {}, "catalog_hint": {}, "proposal_fingerprint": "vandermonde:1706.03762", "tags": ["repeat_claim"], "evidence": [], "author": null, "expired": false, "status": "candidate"}
{"id": "les_Z_5ba8dd_pilot", "ts": "2026-10-07T19:52:48Z", "cycle_id": "20261007T195223Z_5ba8dd", "type": "skip", "decision": "skip", "check": "pilot", "mutation": "", "what": "empty rsi_bias pilot suppressed", "source": "pilot_lane", "family": "rsi", "before_score": null, "after_score": null, "skill_bias": {}, "genome_prior": {}, "catalog_hint": {}, "proposal_fingerprint": "", "tags": ["empty_rsi_bias"], "evidence": [], "author": null, "expired": false, "status": "candidate"}
{"id": "les_9:53:10Z_Chain `energy_work` citing New alge", "ts": "2026-10-07T19:53:10Z", "cycle_id": "", "type": "oracle_kill", "decision": "revert", "check": "oracle", "mutation": "Chain `energy_work` citing New algebraic points on covers of elliptic curves", "what": "Oracle FAIL kills keep. kills=['stripped:stripped_not_useful_fail', 'held_out:held_out_fail', 'collective_kill']. No fitness credit.", "source": "novelty_gate", "family": "process", "before_score": null, "after_score": null, "skill_bias": {"improver.improve": 0.02, "geometer.gather": 0.02}, "genome_prior": {"explore": 0.02, "gather": 0.0}, "catalog_hint": {}, "proposal_fingerprint": "", "tags": ["oracle_kill", "stripped:stripped_not_useful_fail", "held_out:held_out_fail", "collective_kill"], "evidence": ["kill:stripped:stripped_not_useful_fail", "kill:held_out:held_out_fail", "kill:collective_kill"], "author": null, "expired": false, "status": "candidate"}
