{"id": "les_Z_0ae0f2_dedupe", "ts": "2026-10-08T07:43:30Z", "cycle_id": "20261008T074322Z_0ae0f2", "type": "repeat_proposal", "decision": "block", "check": "dedupe", "mutation": "", "what": "blocked repeat: Deepen compute-useful math from accepted findings after hearing", "source": "growth_hearing", "family": "process", "before_score": null, "after_score": null, "skill_bias": {}, "genome_prior": {}, "catalog_hint": {}, "proposal_fingerprint": "810bc050d326", "tags": ["repeat_proposal"], "evidence": [], "author": null, "expired": false, "status": "candidate"}
{"id": "les_Z_0ae0f2_dedupe", "ts": "2026-10-08T07:43:32Z", "cycle_id": "20261008T074322Z_0ae0f2", "type": "repeat_proposal", "decision": "block", "check": "dedupe", "mutation": "", "what": "blocked repeat: Feed accepted/strong RSI findings into skill_router + genome bias", "source": "growth_hearing", "family": "process", "before_score": null, "after_score": null, "skill_bias": {}, "genome_prior": {}, "catalog_hint": {}, "proposal_fingerprint": "27e48156942c", "tags": ["repeat_proposal"], "evidence": [], "author": null, "expired": false, "status": "candidate"}
{"id": "les_Z_0ae0f2_authored_sum_first_n_odds__vandermo", "ts": "2026-10-08T07:43:34Z", "cycle_id": "20261008T074322Z_0ae0f2", "type": "authored_check", "decision": "skip", "check": "authoring", "mutation": "authored_sum_first_n_odds__vandermonde_conv_w1", "what": "authored disabled hard check `authored_sum_first_n_odds__vandermonde_conv_w1` from proven lemmas sum_first_n_odds + vandermonde_conv on new windows; awaits Oracle via proposal", "source": "conjecture_desk", "family": "hard_tier", "before_score": null, "after_score": null, "skill_bias": {}, "genome_prior": {}, "catalog_hint": {}, "proposal_fingerprint": "", "tags": ["authoring", "authored_check", "sum_first_n_odds", "vandermonde_conv"], "evidence": ["society/benchmarks/artifacts/lemma_impl.py::check_sum_first_n_odds", "society/benchmarks/artifacts/lemma_impl.py::check_vandermonde_convolution", "society/benchmarks/lemma_microbench.py", "lemma:sum_first_n_odds", "lemma:vandermonde_conv"], "author": null, "expired": false, "status": "candidate"}
{"id": "les_Z_0ae0f2_easy_pad_square_again", "ts": "2026-10-08T07:43:35Z", "cycle_id": "20261008T074322Z_0ae0f2", "type": "oracle_kill", "decision": "revert", "check": "oracle", "mutation": "easy_pad_square_again", "what": "Oracle FAIL kills keep. kills=['stripped:easy_pad_baseline_already_useful', 'held_out:easy_pad_dies_on_held_out', 'cas:easy_pad_fails_cas_usefulness', 'easy_pad_oracle_kill', 'collective_kill']. No fitness credit.", "source": "conjecture_desk", "family": "easy_pad", "before_score": null, "after_score": null, "skill_bias": {"improver.improve": 0.02, "geometer.gather": 0.02}, "genome_prior": {"explore": 0.02, "gather": 0.0}, "catalog_hint": {}, "proposal_fingerprint": "", "tags": ["oracle_kill", "stripped:easy_pad_baseline_already_useful", "held_out:easy_pad_dies_on_held_out", "cas:easy_pad_fails_cas_usefulness", "easy_pad_oracle_kill"], "evidence": ["kill:stripped:easy_pad_baseline_already_useful", "kill:held_out:easy_pad_dies_on_held_out", "kill:cas:easy_pad_fails_cas_usefulness", "kill:easy_pad_oracle_kill", "kill:collective_kill"], "author": null, "expired": false, "status": "candidate"}
{"id": "les_Z_0ae0f2_easy_pad_square_again", "ts": "2026-10-08T07:43:35Z", "cycle_id": "20261008T074322Z_0ae0f2", "type": "revert", "decision": "revert", "check": "lemma_microbench", "mutation": "easy_pad_square_again", "what": "Reverted `easy_pad_square_again` (easy_pad): score 0.9071→0.9229 ok=True hard_pass 47→47 — Oracle/hard-tier required for keep; easy pads die on Oracle. | oracle=KILL fitness_credit=False kills=['stripped:easy_pad_baseline_already_useful', 'held_out:easy_pad_dies_on_held_out', 'cas:easy_pad_fails_cas_usefulness', 'easy_pad_oracle_kill', 'collective_kill'] | novelty_gate novel=False kills=['already_in_lesson_ledger_or_history', 'textbook_reuse=1.0', 'stripped_baseline_does_not_fail_usefulness', 'h", "source": "conjecture_desk", "family": "easy_pad", "before_score": 0.9071, "after_score": 0.9071, "skill_bias": {"geometer.gather": -0.04, "improver.improve": -0.03, "spark.emergence": -0.02}, "genome_prior": {}, "catalog_hint": {}, "proposal_fingerprint": "", "tags": ["lemma", "easy_pad", "revert"], "evidence": ["society/benchmarks/lemma_microbench.py", "artifacts:lemma_impl"], "author": null, "expired": false, "status": "candidate"}
{"id": "les_Z_0ae0f2_vandermonde", "ts": "2026-10-08T07:43:35Z", "cycle_id": "20261008T074322Z_0ae0f2", "type": "skip", "decision": "skip", "check": "oracle_seen_claim", "mutation": "vandermonde", "what": "skip re-oracle of vandermonde:1706.03762", "source": "claim_pipeline", "family": "novelty", "before_score": null, "after_score": null, "skill_bias": {}, "genome_prior": {}, "catalog_hint": {}, "proposal_fingerprint": "vandermonde:1706.03762", "tags": ["repeat_claim"], "evidence": [], "author": null, "expired": false, "status": "candidate"}
{"id": "les_Z_0ae0f2_pilot", "ts": "2026-10-08T07:43:42Z", "cycle_id": "20261008T074322Z_0ae0f2", "type": "skip", "decision": "skip", "check": "pilot", "mutation": "", "what": "empty rsi_bias pilot suppressed", "source": "pilot_lane", "family": "rsi", "before_score": null, "after_score": null, "skill_bias": {}, "genome_prior": {}, "catalog_hint": {}, "proposal_fingerprint": "", "tags": ["empty_rsi_bias"], "evidence": [], "author": null, "expired": false, "status": "candidate"}
{"id": "les_Z_7993a3_authored_sum_first_n_odds__vandermo", "ts": "2026-10-08T07:44:14Z", "cycle_id": "20261008T074402Z_7993a3", "type": "keep", "decision": "keep", "check": "lemma_microbench", "mutation": "authored_sum_first_n_odds__vandermonde_conv_w1", "what": "Kept `authored_sum_first_n_odds__vandermonde_conv_w1` (hard_enable): lemma score 0.9071→0.9071 checks 57→58 hard_pass 47→48 (machine-checked + Oracle pass; not novel discovery). | oracle=PASS fitness_credit=True kills=[] | novelty_gate novel=False kills=['textbook_reuse=0.6667']", "source": "conjecture_desk", "family": "hard_enable", "before_score": 0.9071, "after_score": 0.9071, "skill_bias": {"geometer.gather": 0.08, "improver.improve": 0.06, "spark.emergence": 0.04}, "genome_prior": {}, "catalog_hint": {}, "proposal_fingerprint": "", "tags": ["lemma", "hard_enable", "keep"], "evidence": ["society/benchmarks/lemma_microbench.py", "artifacts:lemma_impl", "lesson:les_Z_0ae0f2_authored_sum_first_n_odds__vandermo"], "author": null, "expired": false, "status": "candidate"}
{"id": "les_Z_7993a3_vandermonde", "ts": "2026-10-08T07:44:14Z", "cycle_id": "20261008T074402Z_7993a3", "type": "skip", "decision": "skip", "check": "oracle_seen_claim", "mutation": "vandermonde", "what": "skip re-oracle of vandermonde:1706.03762", "source": "claim_pipeline", "family": "novelty", "before_score": null, "after_score": null, "skill_bias": {}, "genome_prior": {}, "catalog_hint": {}, "proposal_fingerprint": "vandermonde:1706.03762", "tags": ["repeat_claim"], "evidence": [], "author": null, "expired": false, "status": "candidate"}
{"id": "les_Z_7993a3_pilot", "ts": "2026-10-08T07:44:21Z", "cycle_id": "20261008T074402Z_7993a3", "type": "skip", "decision": "skip", "check": "pilot", "mutation": "", "what": "empty rsi_bias pilot suppressed", "source": "pilot_lane", "family": "rsi", "before_score": null, "after_score": null, "skill_bias": {}, "genome_prior": {}, "catalog_hint": {}, "proposal_fingerprint": "", "tags": ["empty_rsi_bias"], "evidence": [], "author": null, "expired": false, "status": "candidate"}
{"id": "les_Z_117d44_dedupe", "ts": "2026-10-08T07:46:34Z", "cycle_id": "20261008T074626Z_117d44", "type": "repeat_proposal", "decision": "block", "check": "dedupe", "mutation": "", "what": "blocked repeat: Deepen compute-useful math from accepted findings after hearing", "source": "growth_hearing", "family": "process", "before_score": null, "after_score": null, "skill_bias": {}, "genome_prior": {}, "catalog_hint": {}, "proposal_fingerprint": "810bc050d326", "tags": ["repeat_proposal"], "evidence": [], "author": null, "expired": false, "status": "candidate"}
{"id": "les_Z_117d44_dedupe", "ts": "2026-10-08T07:46:36Z", "cycle_id": "20261008T074626Z_117d44", "type": "repeat_proposal", "decision": "block", "check": "dedupe", "mutation": "", "what": "blocked repeat: Feed accepted/strong RSI findings into skill_router + genome bias", "source": "growth_hearing", "family": "process", "before_score": null, "after_score": null, "skill_bias": {}, "genome_prior": {}, "catalog_hint": {}, "proposal_fingerprint": "27e48156942c", "tags": ["repeat_proposal"], "evidence": [], "author": null, "expired": false, "status": "candidate"}
{"id": "les_Z_117d44_authored_bell_triangle_recurrence__", "ts": "2026-10-08T07:46:38Z", "cycle_id": "20261008T074626Z_117d44", "type": "authored_check", "decision": "skip", "check": "authoring", "mutation": "authored_bell_triangle_recurrence__hermite_recurrence_w1", "what": "authored disabled hard check `authored_bell_triangle_recurrence__hermite_recurrence_w1` from proven lemmas bell_triangle_recurrence + hermite_recurrence on new windows; awaits Oracle via proposal", "source": "conjecture_desk", "family": "hard_tier", "before_score": null, "after_score": null, "skill_bias": {}, "genome_prior": {}, "catalog_hint": {}, "proposal_fingerprint": "", "tags": ["authoring", "authored_check", "bell_triangle_recurrence", "hermite_recurrence"], "evidence": ["society/benchmarks/artifacts/lemma_impl.py::check_bell_triangle_recurrence", "society/benchmarks/artifacts/lemma_impl.py::check_hermite_recurrence", "society/benchmarks/lemma_microbench.py", "lemma:bell_triangle_recurrence", "lemma:hermite_recurrence"], "author": null, "expired": false, "status": "candidate"}
{"id": "les_Z_117d44_easy_pad_diff_squares", "ts": "2026-10-08T07:46:38Z", "cycle_id": "20261008T074626Z_117d44", "type": "oracle_kill", "decision": "revert", "check": "oracle", "mutation": "easy_pad_diff_squares", "what": "Oracle FAIL kills keep. kills=['stripped:easy_pad_baseline_already_useful', 'held_out:easy_pad_dies_on_held_out', 'cas:easy_pad_fails_cas_usefulness', 'easy_pad_oracle_kill', 'collective_kill']. No fitness credit.", "source": "conjecture_desk", "family": "easy_pad", "before_score": null, "after_score": null, "skill_bias": {"improver.improve": 0.02, "geometer.gather": 0.02}, "genome_prior": {"explore": 0.02, "gather": 0.0}, "catalog_hint": {}, "proposal_fingerprint": "", "tags": ["oracle_kill", "stripped:easy_pad_baseline_already_useful", "held_out:easy_pad_dies_on_held_out", "cas:easy_pad_fails_cas_usefulness", "easy_pad_oracle_kill"], "evidence": ["kill:stripped:easy_pad_baseline_already_useful", "kill:held_out:easy_pad_dies_on_held_out", "kill:cas:easy_pad_fails_cas_usefulness", "kill:easy_pad_oracle_kill", "kill:collective_kill"], "author": null, "expired": false, "status": "candidate"}
{"id": "les_Z_117d44_easy_pad_diff_squares", "ts": "2026-10-08T07:46:38Z", "cycle_id": "20261008T074626Z_117d44", "type": "revert", "decision": "revert", "check": "lemma_microbench", "mutation": "easy_pad_diff_squares", "what": "Reverted `easy_pad_diff_squares` (easy_pad): score 0.9071→0.9229 ok=True hard_pass 48→48 — Oracle/hard-tier required for keep; easy pads die on Oracle. | oracle=KILL fitness_credit=False kills=['stripped:easy_pad_baseline_already_useful', 'held_out:easy_pad_dies_on_held_out', 'cas:easy_pad_fails_cas_usefulness', 'easy_pad_oracle_kill', 'collective_kill'] | novelty_gate novel=False kills=['already_in_lesson_ledger_or_history', 'textbook_reuse=1.0', 'stripped_baseline_does_not_fail_usefulness', 'h", "source": "conjecture_desk", "family": "easy_pad", "before_score": 0.9071, "after_score": 0.9071, "skill_bias": {"geometer.gather": -0.04, "improver.improve": -0.03, "spark.emergence": -0.02}, "genome_prior": {}, "catalog_hint": {}, "proposal_fingerprint": "", "tags": ["lemma", "easy_pad", "revert"], "evidence": ["society/benchmarks/lemma_microbench.py", "artifacts:lemma_impl"], "author": null, "expired": false, "status": "candidate"}
{"id": "les_Z_117d44_vandermonde", "ts": "2026-10-08T07:46:38Z", "cycle_id": "20261008T074626Z_117d44", "type": "skip", "decision": "skip", "check": "oracle_seen_claim", "mutation": "vandermonde", "what": "skip re-oracle of vandermonde:1706.03762", "source": "claim_pipeline", "family": "novelty", "before_score": null, "after_score": null, "skill_bias": {}, "genome_prior": {}, "catalog_hint": {}, "proposal_fingerprint": "vandermonde:1706.03762", "tags": ["repeat_claim"], "evidence": [], "author": null, "expired": false, "status": "candidate"}
{"id": "les_Z_117d44_pilot", "ts": "2026-10-08T07:46:46Z", "cycle_id": "20261008T074626Z_117d44", "type": "skip", "decision": "skip", "check": "pilot", "mutation": "", "what": "empty rsi_bias pilot suppressed", "source": "pilot_lane", "family": "rsi", "before_score": null, "after_score": null, "skill_bias": {}, "genome_prior": {}, "catalog_hint": {}, "proposal_fingerprint": "", "tags": ["empty_rsi_bias"], "evidence": [], "author": null, "expired": false, "status": "candidate"}
{"id": "les_Z_a30a0b_authored_bell_triangle_recurrence__", "ts": "2026-10-08T07:47:18Z", "cycle_id": "20261008T074706Z_a30a0b", "type": "keep", "decision": "keep", "check": "lemma_microbench", "mutation": "authored_bell_triangle_recurrence__hermite_recurrence_w1", "what": "Kept `authored_bell_triangle_recurrence__hermite_recurrence_w1` (hard_enable): lemma score 0.9071→0.9071 checks 58→59 hard_pass 48→49 (machine-checked + Oracle pass; not novel discovery). | oracle=PASS fitness_credit=True kills=[] | novelty_gate novel=True kills=[]", "source": "conjecture_desk", "family": "hard_enable", "before_score": 0.9071, "after_score": 0.9071, "skill_bias": {"geometer.gather": 0.08, "improver.improve": 0.06, "spark.emergence": 0.04}, "genome_prior": {}, "catalog_hint": {}, "proposal_fingerprint": "", "tags": ["lemma", "hard_enable", "keep"], "evidence": ["society/benchmarks/lemma_microbench.py", "artifacts:lemma_impl", "lesson:les_Z_117d44_authored_bell_triangle_recurrence__"], "author": null, "expired": false, "status": "candidate"}
{"id": "les_Z_a30a0b_vandermonde", "ts": "2026-10-08T07:47:18Z", "cycle_id": "20261008T074706Z_a30a0b", "type": "skip", "decision": "skip", "check": "oracle_seen_claim", "mutation": "vandermonde", "what": "skip re-oracle of vandermonde:1706.03762", "source": "claim_pipeline", "family": "novelty", "before_score": null, "after_score": null, "skill_bias": {}, "genome_prior": {}, "catalog_hint": {}, "proposal_fingerprint": "vandermonde:1706.03762", "tags": ["repeat_claim"], "evidence": [], "author": null, "expired": false, "status": "candidate"}
{"id": "les_Z_a30a0b_pilot", "ts": "2026-10-08T07:47:26Z", "cycle_id": "20261008T074706Z_a30a0b", "type": "skip", "decision": "skip", "check": "pilot", "mutation": "", "what": "empty rsi_bias pilot suppressed", "source": "pilot_lane", "family": "rsi", "before_score": null, "after_score": null, "skill_bias": {}, "genome_prior": {}, "catalog_hint": {}, "proposal_fingerprint": "", "tags": ["empty_rsi_bias"], "evidence": [], "author": null, "expired": false, "status": "candidate"}
{"id": "les_Z_c23c2b_dedupe", "ts": "2026-10-08T07:47:54Z", "cycle_id": "20261008T074746Z_c23c2b", "type": "repeat_proposal", "decision": "block", "check": "dedupe", "mutation": "", "what": "blocked repeat: Deepen compute-useful math from accepted findings after hearing", "source": "growth_hearing", "family": "process", "before_score": null, "after_score": null, "skill_bias": {}, "genome_prior": {}, "catalog_hint": {}, "proposal_fingerprint": "810bc050d326", "tags": ["repeat_proposal"], "evidence": [], "author": null, "expired": false, "status": "candidate"}
{"id": "les_Z_c23c2b_dedupe", "ts": "2026-10-08T07:47:56Z", "cycle_id": "20261008T074746Z_c23c2b", "type": "repeat_proposal", "decision": "block", "check": "dedupe", "mutation": "", "what": "blocked repeat: Feed accepted/strong RSI findings into skill_router + genome bias", "source": "growth_hearing", "family": "process", "before_score": null, "after_score": null, "skill_bias": {}, "genome_prior": {}, "catalog_hint": {}, "proposal_fingerprint": "27e48156942c", "tags": ["repeat_proposal"], "evidence": [], "author": null, "expired": false, "status": "candidate"}
{"id": "les_Z_c23c2b_authored_binomial_inversion_small__", "ts": "2026-10-08T07:47:58Z", "cycle_id": "20261008T074746Z_c23c2b", "type": "authored_check", "decision": "skip", "check": "authoring", "mutation": "authored_binomial_inversion_small__legendre_duplication_small_w1", "what": "authored disabled hard check `authored_binomial_inversion_small__legendre_duplication_small_w1` from proven lemmas binomial_inversion_small + legendre_duplication_small on new windows; awaits Oracle via proposal", "source": "conjecture_desk", "family": "hard_tier", "before_score": null, "after_score": null, "skill_bias": {}, "genome_prior": {}, "catalog_hint": {}, "proposal_fingerprint": "", "tags": ["authoring", "authored_check", "binomial_inversion_small", "legendre_duplication_small"], "evidence": ["society/benchmarks/artifacts/lemma_impl.py::check_binomial_inversion_small", "society/benchmarks/artifacts/lemma_impl.py::check_legendre_duplication_small", "society/benchmarks/lemma_microbench.py", "lemma:binomial_inversion_small", "lemma:legendre_duplication_small"], "author": null, "expired": false, "status": "candidate"}
{"id": "les_Z_c23c2b_easy_pad_commutativity", "ts": "2026-10-08T07:47:59Z", "cycle_id": "20261008T074746Z_c23c2b", "type": "oracle_kill", "decision": "revert", "check": "oracle", "mutation": "easy_pad_commutativity", "what": "Oracle FAIL kills keep. kills=['stripped:easy_pad_baseline_already_useful', 'held_out:easy_pad_dies_on_held_out', 'cas:easy_pad_fails_cas_usefulness', 'easy_pad_oracle_kill', 'collective_kill']. No fitness credit.", "source": "conjecture_desk", "family": "easy_pad", "before_score": null, "after_score": null, "skill_bias": {"improver.improve": 0.02, "geometer.gather": 0.02}, "genome_prior": {"explore": 0.02, "gather": 0.0}, "catalog_hint": {}, "proposal_fingerprint": "", "tags": ["oracle_kill", "stripped:easy_pad_baseline_already_useful", "held_out:easy_pad_dies_on_held_out", "cas:easy_pad_fails_cas_usefulness", "easy_pad_oracle_kill"], "evidence": ["kill:stripped:easy_pad_baseline_already_useful", "kill:held_out:easy_pad_dies_on_held_out", "kill:cas:easy_pad_fails_cas_usefulness", "kill:easy_pad_oracle_kill", "kill:collective_kill"], "author": null, "expired": false, "status": "candidate"}
{"id": "les_Z_c23c2b_easy_pad_commutativity", "ts": "2026-10-08T07:47:59Z", "cycle_id": "20261008T074746Z_c23c2b", "type": "revert", "decision": "revert", "check": "lemma_microbench", "mutation": "easy_pad_commutativity", "what": "Reverted `easy_pad_commutativity` (easy_pad): score 0.9071→0.9229 ok=True hard_pass 49→49 — Oracle/hard-tier required for keep; easy pads die on Oracle. | oracle=KILL fitness_credit=False kills=['stripped:easy_pad_baseline_already_useful', 'held_out:easy_pad_dies_on_held_out', 'cas:easy_pad_fails_cas_usefulness', 'easy_pad_oracle_kill', 'collective_kill'] | novelty_gate novel=False kills=['already_in_lesson_ledger_or_history', 'textbook_reuse=1.0', 'stripped_baseline_does_not_fail_usefulness', '", "source": "conjecture_desk", "family": "easy_pad", "before_score": 0.9071, "after_score": 0.9071, "skill_bias": {"geometer.gather": -0.04, "improver.improve": -0.03, "spark.emergence": -0.02}, "genome_prior": {}, "catalog_hint": {}, "proposal_fingerprint": "", "tags": ["lemma", "easy_pad", "revert"], "evidence": ["society/benchmarks/lemma_microbench.py", "artifacts:lemma_impl"], "author": null, "expired": false, "status": "candidate"}
{"id": "les_Z_c23c2b_vandermonde", "ts": "2026-10-08T07:47:59Z", "cycle_id": "20261008T074746Z_c23c2b", "type": "skip", "decision": "skip", "check": "oracle_seen_claim", "mutation": "vandermonde", "what": "skip re-oracle of vandermonde:1706.03762", "source": "claim_pipeline", "family": "novelty", "before_score": null, "after_score": null, "skill_bias": {}, "genome_prior": {}, "catalog_hint": {}, "proposal_fingerprint": "vandermonde:1706.03762", "tags": ["repeat_claim"], "evidence": [], "author": null, "expired": false, "status": "candidate"}
{"id": "les_Z_c23c2b_pilot", "ts": "2026-10-08T07:48:05Z", "cycle_id": "20261008T074746Z_c23c2b", "type": "skip", "decision": "skip", "check": "pilot", "mutation": "", "what": "empty rsi_bias pilot suppressed", "source": "pilot_lane", "family": "rsi", "before_score": null, "after_score": null, "skill_bias": {}, "genome_prior": {}, "catalog_hint": {}, "proposal_fingerprint": "", "tags": ["empty_rsi_bias"], "evidence": [], "author": null, "expired": false, "status": "candidate"}
{"id": "les_Z_a7097d_authored_binomial_inversion_small__", "ts": "2026-10-08T13:53:46Z", "cycle_id": "20261008T135334Z_a7097d", "type": "keep", "decision": "keep", "check": "lemma_microbench", "mutation": "authored_binomial_inversion_small__legendre_duplication_small_w1", "what": "Kept `authored_binomial_inversion_small__legendre_duplication_small_w1` (hard_enable): lemma score 0.9071→0.9071 checks 59→60 hard_pass 49→50 (machine-checked + Oracle pass; not novel discovery). | oracle=PASS fitness_credit=True kills=[] | novelty_gate novel=True kills=[]", "source": "conjecture_desk", "family": "hard_enable", "before_score": 0.9071, "after_score": 0.9071, "skill_bias": {"geometer.gather": 0.08, "improver.improve": 0.06, "spark.emergence": 0.04}, "genome_prior": {}, "catalog_hint": {}, "proposal_fingerprint": "", "tags": ["lemma", "hard_enable", "keep"], "evidence": ["society/benchmarks/lemma_microbench.py", "artifacts:lemma_impl", "lesson:les_Z_c23c2b_authored_binomial_inversion_small__"], "author": null, "expired": false, "status": "candidate"}
