{"id": "les_Z_675d45_pilot", "ts": "2026-10-10T21:54:54Z", "cycle_id": "20261010T215426Z_675d45", "type": "skip", "decision": "skip", "check": "pilot", "mutation": "", "what": "empty rsi_bias pilot suppressed", "source": "pilot_lane", "family": "rsi", "before_score": null, "after_score": null, "skill_bias": {}, "genome_prior": {}, "catalog_hint": {}, "proposal_fingerprint": "", "tags": ["empty_rsi_bias"], "evidence": [], "author": null, "expired": false, "status": "candidate"}
{"id": "les_Z_c46a69_authored_fibonacci_addition__motzki", "ts": "2026-10-10T21:55:22Z", "cycle_id": "20261010T215514Z_c46a69", "type": "keep", "decision": "keep", "check": "lemma_microbench", "mutation": "authored_fibonacci_addition__motzkin_bounded_w1", "what": "Kept `authored_fibonacci_addition__motzkin_bounded_w1` (hard_enable): lemma score 0.9071→0.9071 checks 76→77 hard_pass 66→67 (machine-checked + Oracle pass; not novel discovery). | oracle=PASS fitness_credit=True kills=[] | novelty_gate novel=True kills=[]", "source": "conjecture_desk", "family": "hard_enable", "before_score": 0.9071, "after_score": 0.9071, "skill_bias": {"geometer.gather": 0.08, "improver.improve": 0.06, "spark.emergence": 0.04}, "genome_prior": {}, "catalog_hint": {}, "proposal_fingerprint": "", "tags": ["lemma", "hard_enable", "keep"], "evidence": ["society/benchmarks/lemma_microbench.py", "artifacts:lemma_impl", "lesson:les_Z_675d45_authored_fibonacci_addition__motzki"], "author": null, "expired": false, "status": "candidate"}
{"id": "les_Z_c46a69_vandermonde", "ts": "2026-10-10T21:55:22Z", "cycle_id": "20261010T215514Z_c46a69", "type": "skip", "decision": "skip", "check": "oracle_seen_claim", "mutation": "vandermonde", "what": "skip re-oracle of vandermonde:1706.03762", "source": "claim_pipeline", "family": "novelty", "before_score": null, "after_score": null, "skill_bias": {}, "genome_prior": {}, "catalog_hint": {}, "proposal_fingerprint": "vandermonde:1706.03762", "tags": ["repeat_claim"], "evidence": [], "author": null, "expired": false, "status": "candidate"}
{"id": "les_Z_c46a69_pilot", "ts": "2026-10-10T21:55:28Z", "cycle_id": "20261010T215514Z_c46a69", "type": "skip", "decision": "skip", "check": "pilot", "mutation": "", "what": "empty rsi_bias pilot suppressed", "source": "pilot_lane", "family": "rsi", "before_score": null, "after_score": null, "skill_bias": {}, "genome_prior": {}, "catalog_hint": {}, "proposal_fingerprint": "", "tags": ["empty_rsi_bias"], "evidence": [], "author": null, "expired": false, "status": "candidate"}
{"id": "les_Z_01b3a2_dedupe", "ts": "2026-10-10T21:55:53Z", "cycle_id": "20261010T215547Z_01b3a2", "type": "repeat_proposal", "decision": "block", "check": "dedupe", "mutation": "", "what": "blocked repeat: Deepen compute-useful math from accepted findings after hearing", "source": "growth_hearing", "family": "process", "before_score": null, "after_score": null, "skill_bias": {}, "genome_prior": {}, "catalog_hint": {}, "proposal_fingerprint": "810bc050d326", "tags": ["repeat_proposal"], "evidence": [], "author": null, "expired": false, "status": "candidate"}
{"id": "les_Z_01b3a2_dedupe", "ts": "2026-10-10T21:55:53Z", "cycle_id": "20261010T215547Z_01b3a2", "type": "repeat_proposal", "decision": "block", "check": "dedupe", "mutation": "", "what": "blocked repeat: Feed accepted/strong RSI findings into skill_router + genome bias", "source": "growth_hearing", "family": "process", "before_score": null, "after_score": null, "skill_bias": {}, "genome_prior": {}, "catalog_hint": {}, "proposal_fingerprint": "27e48156942c", "tags": ["repeat_proposal"], "evidence": [], "author": null, "expired": false, "status": "candidate"}
{"id": "les_Z_01b3a2_authored_gcd_fibonacci__narayana_su", "ts": "2026-10-10T21:55:54Z", "cycle_id": "20261010T215547Z_01b3a2", "type": "authored_check", "decision": "skip", "check": "authoring", "mutation": "authored_gcd_fibonacci__narayana_sum_w1", "what": "authored disabled hard check `authored_gcd_fibonacci__narayana_sum_w1` from proven lemmas gcd_fibonacci + narayana_sum on new windows; awaits Oracle via proposal", "source": "conjecture_desk", "family": "hard_tier", "before_score": null, "after_score": null, "skill_bias": {}, "genome_prior": {}, "catalog_hint": {}, "proposal_fingerprint": "", "tags": ["authoring", "authored_check", "gcd_fibonacci", "narayana_sum"], "evidence": ["society/benchmarks/artifacts/lemma_impl.py::check_gcd_fibonacci", "society/benchmarks/artifacts/lemma_impl.py::check_narayana_sum", "society/benchmarks/lemma_microbench.py", "lemma:gcd_fibonacci", "lemma:narayana_sum"], "author": null, "expired": false, "status": "candidate"}
{"id": "les_Z_01b3a2_conjecture", "ts": "2026-10-10T21:55:55Z", "cycle_id": "20261010T215547Z_01b3a2", "type": "catalog_exhausted", "decision": "skip", "check": "conjecture", "mutation": "", "what": "catalog exhausted — queue next hard_enable stub from lessons/external mind", "source": "conjecture_desk", "family": "hard_tier", "before_score": null, "after_score": null, "skill_bias": {}, "genome_prior": {}, "catalog_hint": {"avoid": ["vandermonde_asymmetric", "process_spam"], "drop_theme": ["vandermonde_asymmetric"], "seek": ["papers.jsonl", "ledger", "domain_bus", "arxiv"], "prefer": ["novelty", "cite_sources", "gather_before_propose", "drop_cooled_theme"], "add_mutation": "binomial_hockey_deep"}, "proposal_fingerprint": "", "tags": ["catalog_exhausted"], "evidence": [], "author": null, "expired": false, "status": "candidate"}
{"id": "les_Z_01b3a2_vandermonde", "ts": "2026-10-10T21:55:55Z", "cycle_id": "20261010T215547Z_01b3a2", "type": "skip", "decision": "skip", "check": "oracle_seen_claim", "mutation": "vandermonde", "what": "skip re-oracle of vandermonde:1706.03762", "source": "claim_pipeline", "family": "novelty", "before_score": null, "after_score": null, "skill_bias": {}, "genome_prior": {}, "catalog_hint": {}, "proposal_fingerprint": "vandermonde:1706.03762", "tags": ["repeat_claim"], "evidence": [], "author": null, "expired": false, "status": "candidate"}
{"id": "les_Z_01b3a2_pilot", "ts": "2026-10-10T21:56:01Z", "cycle_id": "20261010T215547Z_01b3a2", "type": "skip", "decision": "skip", "check": "pilot", "mutation": "", "what": "empty rsi_bias pilot suppressed", "source": "pilot_lane", "family": "rsi", "before_score": null, "after_score": null, "skill_bias": {}, "genome_prior": {}, "catalog_hint": {}, "proposal_fingerprint": "", "tags": ["empty_rsi_bias"], "evidence": [], "author": null, "expired": false, "status": "candidate"}
