{"id": "les_Z_8483fa_vandermonde", "ts": "2026-10-09T06:56:32Z", "cycle_id": "20261009T065619Z_8483fa", "type": "skip", "decision": "skip", "check": "oracle_seen_claim", "mutation": "vandermonde", "what": "skip re-oracle of vandermonde:1706.03762", "source": "claim_pipeline", "family": "novelty", "before_score": null, "after_score": null, "skill_bias": {}, "genome_prior": {}, "catalog_hint": {}, "proposal_fingerprint": "vandermonde:1706.03762", "tags": ["repeat_claim"], "evidence": [], "author": null, "expired": false, "status": "candidate"}
{"id": "les_Z_8483fa_pilot", "ts": "2026-10-09T06:56:39Z", "cycle_id": "20261009T065619Z_8483fa", "type": "skip", "decision": "skip", "check": "pilot", "mutation": "", "what": "empty rsi_bias pilot suppressed", "source": "pilot_lane", "family": "rsi", "before_score": null, "after_score": null, "skill_bias": {}, "genome_prior": {}, "catalog_hint": {}, "proposal_fingerprint": "", "tags": ["empty_rsi_bias"], "evidence": [], "author": null, "expired": false, "status": "candidate"}
{"id": "les_Z_2b8a87_dedupe", "ts": "2026-10-09T06:56:56Z", "cycle_id": "20261009T065648Z_2b8a87", "type": "repeat_proposal", "decision": "block", "check": "dedupe", "mutation": "", "what": "blocked repeat: Deepen compute-useful math from accepted findings after hearing", "source": "growth_hearing", "family": "process", "before_score": null, "after_score": null, "skill_bias": {}, "genome_prior": {}, "catalog_hint": {}, "proposal_fingerprint": "810bc050d326", "tags": ["repeat_proposal"], "evidence": [], "author": null, "expired": false, "status": "candidate"}
{"id": "les_6:56:59Z_Feed accepted/strong RSI findings i", "ts": "2026-10-09T06:56:59Z", "cycle_id": "", "type": "oracle_kill", "decision": "revert", "check": "oracle", "mutation": "Feed accepted/strong RSI findings into skill_router + genome bias (cycle 227)", "what": "Oracle FAIL kills keep. kills=['stripped:stripped_not_useful_fail', 'held_out:held_out_fail', 'collective_kill']. No fitness credit.", "source": "novelty_gate", "family": "process", "before_score": null, "after_score": null, "skill_bias": {"improver.improve": 0.02, "geometer.gather": 0.02}, "genome_prior": {"explore": 0.02, "gather": 0.0}, "catalog_hint": {}, "proposal_fingerprint": "", "tags": ["oracle_kill", "stripped:stripped_not_useful_fail", "held_out:held_out_fail", "collective_kill"], "evidence": ["kill:stripped:stripped_not_useful_fail", "kill:held_out:held_out_fail", "kill:collective_kill"], "author": null, "expired": false, "status": "candidate"}
{"id": "les_Z_2b8a87_conjecture", "ts": "2026-10-09T06:57:01Z", "cycle_id": "20261009T065648Z_2b8a87", "type": "catalog_exhausted", "decision": "skip", "check": "conjecture", "mutation": "", "what": "catalog exhausted — queue next hard_enable stub from lessons/external mind", "source": "conjecture_desk", "family": "hard_tier", "before_score": null, "after_score": null, "skill_bias": {}, "genome_prior": {}, "catalog_hint": {"avoid": ["vandermonde_asymmetric", "process_spam"], "drop_theme": ["vandermonde_asymmetric"], "seek": ["papers.jsonl", "ledger", "domain_bus", "arxiv"], "prefer": ["novelty", "cite_sources", "gather_before_propose", "drop_cooled_theme"], "add_mutation": "binomial_hockey_deep"}, "proposal_fingerprint": "", "tags": ["catalog_exhausted"], "evidence": [], "author": null, "expired": false, "status": "candidate"}
{"id": "les_Z_2b8a87_vandermonde", "ts": "2026-10-09T06:57:01Z", "cycle_id": "20261009T065648Z_2b8a87", "type": "skip", "decision": "skip", "check": "oracle_seen_claim", "mutation": "vandermonde", "what": "skip re-oracle of vandermonde:1706.03762", "source": "claim_pipeline", "family": "novelty", "before_score": null, "after_score": null, "skill_bias": {}, "genome_prior": {}, "catalog_hint": {}, "proposal_fingerprint": "vandermonde:1706.03762", "tags": ["repeat_claim"], "evidence": [], "author": null, "expired": false, "status": "candidate"}
{"id": "les_Z_2b8a87_pilot", "ts": "2026-10-09T06:57:08Z", "cycle_id": "20261009T065648Z_2b8a87", "type": "skip", "decision": "skip", "check": "pilot", "mutation": "", "what": "empty rsi_bias pilot suppressed", "source": "pilot_lane", "family": "rsi", "before_score": null, "after_score": null, "skill_bias": {}, "genome_prior": {}, "catalog_hint": {}, "proposal_fingerprint": "", "tags": ["empty_rsi_bias"], "evidence": [], "author": null, "expired": false, "status": "candidate"}
{"id": "les_Z_5eae58_dedupe", "ts": "2026-10-09T07:53:23Z", "cycle_id": "20261009T075313Z_5eae58", "type": "repeat_proposal", "decision": "block", "check": "dedupe", "mutation": "", "what": "blocked repeat: Deepen compute-useful math from accepted findings after hearing", "source": "growth_hearing", "family": "process", "before_score": null, "after_score": null, "skill_bias": {}, "genome_prior": {}, "catalog_hint": {}, "proposal_fingerprint": "810bc050d326", "tags": ["repeat_proposal"], "evidence": [], "author": null, "expired": false, "status": "candidate"}
{"id": "les_Z_5eae58_dedupe", "ts": "2026-10-09T07:53:24Z", "cycle_id": "20261009T075313Z_5eae58", "type": "repeat_proposal", "decision": "block", "check": "dedupe", "mutation": "", "what": "blocked repeat: Feed accepted/strong RSI findings into skill_router + genome bias", "source": "growth_hearing", "family": "process", "before_score": null, "after_score": null, "skill_bias": {}, "genome_prior": {}, "catalog_hint": {}, "proposal_fingerprint": "27e48156942c", "tags": ["repeat_proposal"], "evidence": [], "author": null, "expired": false, "status": "candidate"}
{"id": "les_Z_5eae58_authored_pascal_identity__pythagore", "ts": "2026-10-09T07:53:27Z", "cycle_id": "20261009T075313Z_5eae58", "type": "authored_check", "decision": "skip", "check": "authoring", "mutation": "authored_pascal_identity__pythagorean_generation_w1", "what": "authored disabled hard check `authored_pascal_identity__pythagorean_generation_w1` from proven lemmas pascal_identity + pythagorean_generation on new windows; awaits Oracle via proposal", "source": "conjecture_desk", "family": "hard_tier", "before_score": null, "after_score": null, "skill_bias": {}, "genome_prior": {}, "catalog_hint": {}, "proposal_fingerprint": "", "tags": ["authoring", "authored_check", "pascal_identity", "pythagorean_generation"], "evidence": ["society/benchmarks/artifacts/lemma_impl.py::check_pascal_identity", "society/benchmarks/artifacts/lemma_impl.py::check_pythagorean_generation", "society/benchmarks/lemma_microbench.py", "lemma:pascal_identity", "lemma:pythagorean_generation"], "author": null, "expired": false, "status": "candidate"}
{"id": "les_Z_5eae58_conjecture", "ts": "2026-10-09T07:53:28Z", "cycle_id": "20261009T075313Z_5eae58", "type": "catalog_exhausted", "decision": "skip", "check": "conjecture", "mutation": "", "what": "catalog exhausted — queue next hard_enable stub from lessons/external mind", "source": "conjecture_desk", "family": "hard_tier", "before_score": null, "after_score": null, "skill_bias": {}, "genome_prior": {}, "catalog_hint": {"avoid": ["vandermonde_asymmetric", "process_spam"], "drop_theme": ["vandermonde_asymmetric"], "seek": ["papers.jsonl", "ledger", "domain_bus", "arxiv"], "prefer": ["novelty", "cite_sources", "gather_before_propose", "drop_cooled_theme"], "add_mutation": "binomial_hockey_deep"}, "proposal_fingerprint": "", "tags": ["catalog_exhausted"], "evidence": [], "author": null, "expired": false, "status": "candidate"}
{"id": "les_Z_5eae58_vandermonde", "ts": "2026-10-09T07:53:28Z", "cycle_id": "20261009T075313Z_5eae58", "type": "skip", "decision": "skip", "check": "oracle_seen_claim", "mutation": "vandermonde", "what": "skip re-oracle of vandermonde:1706.03762", "source": "claim_pipeline", "family": "novelty", "before_score": null, "after_score": null, "skill_bias": {}, "genome_prior": {}, "catalog_hint": {}, "proposal_fingerprint": "vandermonde:1706.03762", "tags": ["repeat_claim"], "evidence": [], "author": null, "expired": false, "status": "candidate"}
{"id": "les_Z_5eae58_pilot", "ts": "2026-10-09T07:53:36Z", "cycle_id": "20261009T075313Z_5eae58", "type": "skip", "decision": "skip", "check": "pilot", "mutation": "", "what": "empty rsi_bias pilot suppressed", "source": "pilot_lane", "family": "rsi", "before_score": null, "after_score": null, "skill_bias": {}, "genome_prior": {}, "catalog_hint": {}, "proposal_fingerprint": "", "tags": ["empty_rsi_bias"], "evidence": [], "author": null, "expired": false, "status": "candidate"}
{"id": "les_Z_8a1b00_authored_pascal_identity__pythagore", "ts": "2026-10-09T07:54:10Z", "cycle_id": "20261009T075357Z_8a1b00", "type": "keep", "decision": "keep", "check": "lemma_microbench", "mutation": "authored_pascal_identity__pythagorean_generation_w1", "what": "Kept `authored_pascal_identity__pythagorean_generation_w1` (hard_enable): lemma score 0.9071→0.9071 checks 67→68 hard_pass 57→58 (machine-checked + Oracle pass; not novel discovery). | oracle=PASS fitness_credit=True kills=[] | novelty_gate novel=False kills=['textbook_reuse=0.6667']", "source": "conjecture_desk", "family": "hard_enable", "before_score": 0.9071, "after_score": 0.9071, "skill_bias": {"geometer.gather": 0.08, "improver.improve": 0.06, "spark.emergence": 0.04}, "genome_prior": {}, "catalog_hint": {}, "proposal_fingerprint": "", "tags": ["lemma", "hard_enable", "keep"], "evidence": ["society/benchmarks/lemma_microbench.py", "artifacts:lemma_impl", "lesson:les_Z_5eae58_authored_pascal_identity__pythagore"], "author": null, "expired": false, "status": "candidate"}
{"id": "les_Z_8a1b00_vandermonde", "ts": "2026-10-09T07:54:11Z", "cycle_id": "20261009T075357Z_8a1b00", "type": "skip", "decision": "skip", "check": "oracle_seen_claim", "mutation": "vandermonde", "what": "skip re-oracle of vandermonde:1706.03762", "source": "claim_pipeline", "family": "novelty", "before_score": null, "after_score": null, "skill_bias": {}, "genome_prior": {}, "catalog_hint": {}, "proposal_fingerprint": "vandermonde:1706.03762", "tags": ["repeat_claim"], "evidence": [], "author": null, "expired": false, "status": "candidate"}
{"id": "les_Z_8a1b00_pilot", "ts": "2026-10-09T07:54:18Z", "cycle_id": "20261009T075357Z_8a1b00", "type": "skip", "decision": "skip", "check": "pilot", "mutation": "", "what": "empty rsi_bias pilot suppressed", "source": "pilot_lane", "family": "rsi", "before_score": null, "after_score": null, "skill_bias": {}, "genome_prior": {}, "catalog_hint": {}, "proposal_fingerprint": "", "tags": ["empty_rsi_bias"], "evidence": [], "author": null, "expired": false, "status": "candidate"}
{"id": "les_Z_dd0e2a_dedupe", "ts": "2026-10-09T07:54:47Z", "cycle_id": "20261009T075438Z_dd0e2a", "type": "repeat_proposal", "decision": "block", "check": "dedupe", "mutation": "", "what": "blocked repeat: Deepen compute-useful math from accepted findings after hearing", "source": "growth_hearing", "family": "process", "before_score": null, "after_score": null, "skill_bias": {}, "genome_prior": {}, "catalog_hint": {}, "proposal_fingerprint": "810bc050d326", "tags": ["repeat_proposal"], "evidence": [], "author": null, "expired": false, "status": "candidate"}
{"id": "les_Z_dd0e2a_dedupe", "ts": "2026-10-09T07:54:49Z", "cycle_id": "20261009T075438Z_dd0e2a", "type": "repeat_proposal", "decision": "block", "check": "dedupe", "mutation": "", "what": "blocked repeat: Feed accepted/strong RSI findings into skill_router + genome bias", "source": "growth_hearing", "family": "process", "before_score": null, "after_score": null, "skill_bias": {}, "genome_prior": {}, "catalog_hint": {}, "proposal_fingerprint": "27e48156942c", "tags": ["repeat_proposal"], "evidence": [], "author": null, "expired": false, "status": "candidate"}
{"id": "les_Z_dd0e2a_authored_sum_first_n_cubes__vanderm", "ts": "2026-10-09T07:54:51Z", "cycle_id": "20261009T075438Z_dd0e2a", "type": "authored_check", "decision": "skip", "check": "authoring", "mutation": "authored_sum_first_n_cubes__vandermonde_conv_w1", "what": "authored disabled hard check `authored_sum_first_n_cubes__vandermonde_conv_w1` from proven lemmas sum_first_n_cubes + vandermonde_conv on new windows; awaits Oracle via proposal", "source": "conjecture_desk", "family": "hard_tier", "before_score": null, "after_score": null, "skill_bias": {}, "genome_prior": {}, "catalog_hint": {}, "proposal_fingerprint": "", "tags": ["authoring", "authored_check", "sum_first_n_cubes", "vandermonde_conv"], "evidence": ["society/benchmarks/artifacts/lemma_impl.py::check_sum_first_n_cubes", "society/benchmarks/artifacts/lemma_impl.py::check_vandermonde_convolution", "society/benchmarks/lemma_microbench.py", "lemma:sum_first_n_cubes", "lemma:vandermonde_conv"], "author": null, "expired": false, "status": "candidate"}
{"id": "les_Z_dd0e2a_conjecture", "ts": "2026-10-09T07:54:52Z", "cycle_id": "20261009T075438Z_dd0e2a", "type": "catalog_exhausted", "decision": "skip", "check": "conjecture", "mutation": "", "what": "catalog exhausted — queue next hard_enable stub from lessons/external mind", "source": "conjecture_desk", "family": "hard_tier", "before_score": null, "after_score": null, "skill_bias": {}, "genome_prior": {}, "catalog_hint": {"avoid": ["vandermonde_asymmetric", "process_spam"], "drop_theme": ["vandermonde_asymmetric"], "seek": ["papers.jsonl", "ledger", "domain_bus", "arxiv"], "prefer": ["novelty", "cite_sources", "gather_before_propose", "drop_cooled_theme"], "add_mutation": "binomial_hockey_deep"}, "proposal_fingerprint": "", "tags": ["catalog_exhausted"], "evidence": [], "author": null, "expired": false, "status": "candidate"}
{"id": "les_Z_dd0e2a_vandermonde", "ts": "2026-10-09T07:54:53Z", "cycle_id": "20261009T075438Z_dd0e2a", "type": "skip", "decision": "skip", "check": "oracle_seen_claim", "mutation": "vandermonde", "what": "skip re-oracle of vandermonde:1706.03762", "source": "claim_pipeline", "family": "novelty", "before_score": null, "after_score": null, "skill_bias": {}, "genome_prior": {}, "catalog_hint": {}, "proposal_fingerprint": "vandermonde:1706.03762", "tags": ["repeat_claim"], "evidence": [], "author": null, "expired": false, "status": "candidate"}
{"id": "les_Z_dd0e2a_pilot", "ts": "2026-10-09T07:55:00Z", "cycle_id": "20261009T075438Z_dd0e2a", "type": "skip", "decision": "skip", "check": "pilot", "mutation": "", "what": "empty rsi_bias pilot suppressed", "source": "pilot_lane", "family": "rsi", "before_score": null, "after_score": null, "skill_bias": {}, "genome_prior": {}, "catalog_hint": {}, "proposal_fingerprint": "", "tags": ["empty_rsi_bias"], "evidence": [], "author": null, "expired": false, "status": "candidate"}
{"id": "les_Z_b98392_authored_sum_first_n_cubes__vanderm", "ts": "2026-10-09T07:56:25Z", "cycle_id": "20261009T075608Z_b98392", "type": "keep", "decision": "keep", "check": "lemma_microbench", "mutation": "authored_sum_first_n_cubes__vandermonde_conv_w1", "what": "Kept `authored_sum_first_n_cubes__vandermonde_conv_w1` (hard_enable): lemma score 0.9071→0.9071 checks 68→69 hard_pass 58→59 (machine-checked + Oracle pass; not novel discovery). | oracle=PASS fitness_credit=True kills=[] | novelty_gate novel=False kills=['textbook_reuse=0.6667']", "source": "conjecture_desk", "family": "hard_enable", "before_score": 0.9071, "after_score": 0.9071, "skill_bias": {"geometer.gather": 0.08, "improver.improve": 0.06, "spark.emergence": 0.04}, "genome_prior": {}, "catalog_hint": {}, "proposal_fingerprint": "", "tags": ["lemma", "hard_enable", "keep"], "evidence": ["society/benchmarks/lemma_microbench.py", "artifacts:lemma_impl", "lesson:les_Z_dd0e2a_authored_sum_first_n_cubes__vanderm"], "author": null, "expired": false, "status": "candidate"}
{"id": "les_Z_b98392_vandermonde", "ts": "2026-10-09T07:56:26Z", "cycle_id": "20261009T075608Z_b98392", "type": "skip", "decision": "skip", "check": "oracle_seen_claim", "mutation": "vandermonde", "what": "skip re-oracle of vandermonde:1706.03762", "source": "claim_pipeline", "family": "novelty", "before_score": null, "after_score": null, "skill_bias": {}, "genome_prior": {}, "catalog_hint": {}, "proposal_fingerprint": "vandermonde:1706.03762", "tags": ["repeat_claim"], "evidence": [], "author": null, "expired": false, "status": "candidate"}
{"id": "les_Z_b98392_pilot", "ts": "2026-10-09T07:56:32Z", "cycle_id": "20261009T075608Z_b98392", "type": "skip", "decision": "skip", "check": "pilot", "mutation": "", "what": "empty rsi_bias pilot suppressed", "source": "pilot_lane", "family": "rsi", "before_score": null, "after_score": null, "skill_bias": {}, "genome_prior": {}, "catalog_hint": {}, "proposal_fingerprint": "", "tags": ["empty_rsi_bias"], "evidence": [], "author": null, "expired": false, "status": "candidate"}
{"id": "les_Z_cadb2a_dedupe", "ts": "2026-10-09T07:56:59Z", "cycle_id": "20261009T075650Z_cadb2a", "type": "repeat_proposal", "decision": "block", "check": "dedupe", "mutation": "", "what": "blocked repeat: Deepen compute-useful math from accepted findings after hearing", "source": "growth_hearing", "family": "process", "before_score": null, "after_score": null, "skill_bias": {}, "genome_prior": {}, "catalog_hint": {}, "proposal_fingerprint": "810bc050d326", "tags": ["repeat_proposal"], "evidence": [], "author": null, "expired": false, "status": "candidate"}
{"id": "les_Z_cadb2a_dedupe", "ts": "2026-10-09T07:57:01Z", "cycle_id": "20261009T075650Z_cadb2a", "type": "repeat_proposal", "decision": "block", "check": "dedupe", "mutation": "", "what": "blocked repeat: Feed accepted/strong RSI findings into skill_router + genome bias", "source": "growth_hearing", "family": "process", "before_score": null, "after_score": null, "skill_bias": {}, "genome_prior": {}, "catalog_hint": {}, "proposal_fingerprint": "27e48156942c", "tags": ["repeat_proposal"], "evidence": [], "author": null, "expired": false, "status": "candidate"}
{"id": "les_Z_cadb2a_authored_sum_first_n_odds__stirling", "ts": "2026-10-09T07:57:03Z", "cycle_id": "20261009T075650Z_cadb2a", "type": "authored_check", "decision": "skip", "check": "authoring", "mutation": "authored_sum_first_n_odds__stirling_second_row_w1", "what": "authored disabled hard check `authored_sum_first_n_odds__stirling_second_row_w1` from proven lemmas sum_first_n_odds + stirling_second_row on new windows; awaits Oracle via proposal", "source": "conjecture_desk", "family": "hard_tier", "before_score": null, "after_score": null, "skill_bias": {}, "genome_prior": {}, "catalog_hint": {}, "proposal_fingerprint": "", "tags": ["authoring", "authored_check", "sum_first_n_odds", "stirling_second_row"], "evidence": ["society/benchmarks/artifacts/lemma_impl.py::check_sum_first_n_odds", "society/benchmarks/artifacts/lemma_impl.py::check_stirling_second_row", "society/benchmarks/lemma_microbench.py", "lemma:sum_first_n_odds", "lemma:stirling_second_row"], "author": null, "expired": false, "status": "candidate"}
{"id": "les_Z_cadb2a_conjecture", "ts": "2026-10-09T07:57:04Z", "cycle_id": "20261009T075650Z_cadb2a", "type": "catalog_exhausted", "decision": "skip", "check": "conjecture", "mutation": "", "what": "catalog exhausted — queue next hard_enable stub from lessons/external mind", "source": "conjecture_desk", "family": "hard_tier", "before_score": null, "after_score": null, "skill_bias": {}, "genome_prior": {}, "catalog_hint": {"avoid": ["vandermonde_asymmetric", "process_spam"], "drop_theme": ["vandermonde_asymmetric"], "seek": ["papers.jsonl", "ledger", "domain_bus", "arxiv"], "prefer": ["novelty", "cite_sources", "gather_before_propose", "drop_cooled_theme"], "add_mutation": "binomial_hockey_deep"}, "proposal_fingerprint": "", "tags": ["catalog_exhausted"], "evidence": [], "author": null, "expired": false, "status": "candidate"}
{"id": "les_Z_cadb2a_vandermonde", "ts": "2026-10-09T07:57:05Z", "cycle_id": "20261009T075650Z_cadb2a", "type": "skip", "decision": "skip", "check": "oracle_seen_claim", "mutation": "vandermonde", "what": "skip re-oracle of vandermonde:1706.03762", "source": "claim_pipeline", "family": "novelty", "before_score": null, "after_score": null, "skill_bias": {}, "genome_prior": {}, "catalog_hint": {}, "proposal_fingerprint": "vandermonde:1706.03762", "tags": ["repeat_claim"], "evidence": [], "author": null, "expired": false, "status": "candidate"}
{"id": "les_Z_cadb2a_pilot", "ts": "2026-10-09T07:57:10Z", "cycle_id": "20261009T075650Z_cadb2a", "type": "skip", "decision": "skip", "check": "pilot", "mutation": "", "what": "empty rsi_bias pilot suppressed", "source": "pilot_lane", "family": "rsi", "before_score": null, "after_score": null, "skill_bias": {}, "genome_prior": {}, "catalog_hint": {}, "proposal_fingerprint": "", "tags": ["empty_rsi_bias"], "evidence": [], "author": null, "expired": false, "status": "candidate"}
{"id": "les_Z_3b4223_authored_sum_first_n_odds__stirling", "ts": "2026-10-09T07:57:42Z", "cycle_id": "20261009T075729Z_3b4223", "type": "keep", "decision": "keep", "check": "lemma_microbench", "mutation": "authored_sum_first_n_odds__stirling_second_row_w1", "what": "Kept `authored_sum_first_n_odds__stirling_second_row_w1` (hard_enable): lemma score 0.9071→0.9071 checks 69→70 hard_pass 59→60 (machine-checked + Oracle pass; not novel discovery). | oracle=PASS fitness_credit=True kills=[] | novelty_gate novel=True kills=[]", "source": "conjecture_desk", "family": "hard_enable", "before_score": 0.9071, "after_score": 0.9071, "skill_bias": {"geometer.gather": 0.08, "improver.improve": 0.06, "spark.emergence": 0.04}, "genome_prior": {}, "catalog_hint": {}, "proposal_fingerprint": "", "tags": ["lemma", "hard_enable", "keep"], "evidence": ["society/benchmarks/lemma_microbench.py", "artifacts:lemma_impl", "lesson:les_Z_cadb2a_authored_sum_first_n_odds__stirling"], "author": null, "expired": false, "status": "candidate"}
