{"id": "les_Z_377c13_pilot", "ts": "2026-10-07T21:49:02Z", "cycle_id": "20261007T214851Z_377c13", "type": "skip", "decision": "skip", "check": "pilot", "mutation": "", "what": "empty rsi_bias pilot suppressed", "source": "pilot_lane", "family": "rsi", "before_score": null, "after_score": null, "skill_bias": {}, "genome_prior": {}, "catalog_hint": {}, "proposal_fingerprint": "", "tags": ["empty_rsi_bias"], "evidence": [], "author": null, "expired": false, "status": "candidate"}
{"id": "les_1:49:15Z_Chain `authored_oeis_a000108__catal", "ts": "2026-10-07T21:49:15Z", "cycle_id": "", "type": "oracle_kill", "decision": "revert", "check": "oracle", "mutation": "Chain `authored_oeis_a000108__catalan_bounded` citing Odds", "what": "Oracle FAIL kills keep. kills=['stripped:stripped_not_useful_fail', 'held_out:held_out_fail', 'collective_kill']. No fitness credit.", "source": "novelty_gate", "family": "process", "before_score": null, "after_score": null, "skill_bias": {"improver.improve": 0.02, "geometer.gather": 0.02}, "genome_prior": {"explore": 0.02, "gather": 0.0}, "catalog_hint": {}, "proposal_fingerprint": "", "tags": ["oracle_kill", "stripped:stripped_not_useful_fail", "held_out:held_out_fail", "collective_kill"], "evidence": ["kill:stripped:stripped_not_useful_fail", "kill:held_out:held_out_fail", "kill:collective_kill"], "author": null, "expired": false, "status": "candidate"}
{"id": "les_1:49:15Z_Chain `authored_oeis_a000108__catal", "ts": "2026-10-07T21:49:15Z", "cycle_id": "", "type": "oracle_kill", "decision": "revert", "check": "oracle", "mutation": "Chain `authored_oeis_a000108__catalan_bounded` citing Odds (cycle 179)", "what": "Oracle FAIL kills keep. kills=['stripped:stripped_not_useful_fail', 'held_out:held_out_fail', 'collective_kill']. No fitness credit.", "source": "novelty_gate", "family": "process", "before_score": null, "after_score": null, "skill_bias": {"improver.improve": 0.02, "geometer.gather": 0.02}, "genome_prior": {"explore": 0.02, "gather": 0.0}, "catalog_hint": {}, "proposal_fingerprint": "", "tags": ["oracle_kill", "stripped:stripped_not_useful_fail", "held_out:held_out_fail", "collective_kill"], "evidence": ["kill:stripped:stripped_not_useful_fail", "kill:held_out:held_out_fail", "kill:collective_kill"], "author": null, "expired": false, "status": "candidate"}
{"id": "les_Z_60b63d_vandermonde", "ts": "2026-10-07T21:49:16Z", "cycle_id": "20261007T214910Z_60b63d", "type": "skip", "decision": "skip", "check": "oracle_seen_claim", "mutation": "vandermonde", "what": "skip re-oracle of vandermonde:1706.03762", "source": "claim_pipeline", "family": "novelty", "before_score": null, "after_score": null, "skill_bias": {}, "genome_prior": {}, "catalog_hint": {}, "proposal_fingerprint": "vandermonde:1706.03762", "tags": ["repeat_claim"], "evidence": [], "author": null, "expired": false, "status": "candidate"}
{"id": "les_Z_60b63d_pilot", "ts": "2026-10-07T21:49:22Z", "cycle_id": "20261007T214910Z_60b63d", "type": "skip", "decision": "skip", "check": "pilot", "mutation": "", "what": "empty rsi_bias pilot suppressed", "source": "pilot_lane", "family": "rsi", "before_score": null, "after_score": null, "skill_bias": {}, "genome_prior": {}, "catalog_hint": {}, "proposal_fingerprint": "", "tags": ["empty_rsi_bias"], "evidence": [], "author": null, "expired": false, "status": "candidate"}
{"id": "les_Z_3206f0_dedupe", "ts": "2026-10-07T21:51:15Z", "cycle_id": "20261007T215110Z_3206f0", "type": "repeat_proposal", "decision": "block", "check": "dedupe", "mutation": "", "what": "blocked repeat: Deepen compute-useful math from accepted findings after hearing", "source": "growth_hearing", "family": "process", "before_score": null, "after_score": null, "skill_bias": {}, "genome_prior": {}, "catalog_hint": {}, "proposal_fingerprint": "810bc050d326", "tags": ["repeat_proposal"], "evidence": [], "author": null, "expired": false, "status": "candidate"}
{"id": "les_Z_3206f0_dedupe", "ts": "2026-10-07T21:51:15Z", "cycle_id": "20261007T215110Z_3206f0", "type": "repeat_proposal", "decision": "block", "check": "dedupe", "mutation": "", "what": "blocked repeat: Feed accepted/strong RSI findings into skill_router + genome bias", "source": "growth_hearing", "family": "process", "before_score": null, "after_score": null, "skill_bias": {}, "genome_prior": {}, "catalog_hint": {}, "proposal_fingerprint": "27e48156942c", "tags": ["repeat_proposal"], "evidence": [], "author": null, "expired": false, "status": "candidate"}
{"id": "les_Z_3206f0_authored_oeis_a000045__cassini", "ts": "2026-10-07T21:51:15Z", "cycle_id": "20261007T215110Z_3206f0", "type": "authored_check", "decision": "skip", "check": "authoring", "mutation": "authored_oeis_a000045__cassini", "what": "authored disabled feed cross-check `authored_oeis_a000045__cassini`: OEIS A000045 held-out terms vs `fibonacci` + proven lemma cassini on a new window; awaits Oracle via proposal", "source": "conjecture_desk", "family": "hard_tier", "before_score": null, "after_score": null, "skill_bias": {}, "genome_prior": {}, "catalog_hint": {}, "proposal_fingerprint": "", "tags": ["authoring", "authored_check", "cassini", "feed", "oeis"], "evidence": ["society/benchmarks/artifacts/lemma_impl.py::check_cassini_identity", "society/benchmarks/artifacts/lemma_impl.py::fibonacci", "society/benchmarks/lemma_microbench.py", "lemma:cassini", "oeis:A000045", "https://oeis.org/A000045", "feed:oeis:A000045:fibonacci"], "author": null, "expired": false, "status": "candidate"}
{"id": "les_Z_3206f0_conjecture", "ts": "2026-10-07T21:51:15Z", "cycle_id": "20261007T215110Z_3206f0", "type": "catalog_exhausted", "decision": "skip", "check": "conjecture", "mutation": "", "what": "catalog exhausted — queue next hard_enable stub from lessons/external mind", "source": "conjecture_desk", "family": "hard_tier", "before_score": null, "after_score": null, "skill_bias": {}, "genome_prior": {}, "catalog_hint": {"add_mutation": "catalan_convolution", "kind": "hard_enable"}, "proposal_fingerprint": "", "tags": ["catalog_exhausted"], "evidence": [], "author": null, "expired": false, "status": "candidate"}
{"id": "les_Z_3206f0_vandermonde", "ts": "2026-10-07T21:51:16Z", "cycle_id": "20261007T215110Z_3206f0", "type": "skip", "decision": "skip", "check": "oracle_seen_claim", "mutation": "vandermonde", "what": "skip re-oracle of vandermonde:1706.03762", "source": "claim_pipeline", "family": "novelty", "before_score": null, "after_score": null, "skill_bias": {}, "genome_prior": {}, "catalog_hint": {}, "proposal_fingerprint": "vandermonde:1706.03762", "tags": ["repeat_claim"], "evidence": [], "author": null, "expired": false, "status": "candidate"}
{"id": "les_Z_3206f0_pilot", "ts": "2026-10-07T21:51:35Z", "cycle_id": "20261007T215110Z_3206f0", "type": "skip", "decision": "skip", "check": "pilot", "mutation": "", "what": "empty rsi_bias pilot suppressed", "source": "pilot_lane", "family": "rsi", "before_score": null, "after_score": null, "skill_bias": {}, "genome_prior": {}, "catalog_hint": {}, "proposal_fingerprint": "", "tags": ["empty_rsi_bias"], "evidence": [], "author": null, "expired": false, "status": "candidate"}
{"id": "les_1:51:59Z_Chain `authored_oeis_a000045__cassi", "ts": "2026-10-07T21:51:59Z", "cycle_id": "", "type": "oracle_kill", "decision": "revert", "check": "oracle", "mutation": "Chain `authored_oeis_a000045__cassini` citing Square-free Word-representation of Word-representa", "what": "Oracle FAIL kills keep. kills=['stripped:stripped_not_useful_fail', 'held_out:held_out_fail', 'collective_kill']. No fitness credit.", "source": "novelty_gate", "family": "process", "before_score": null, "after_score": null, "skill_bias": {"improver.improve": 0.02, "geometer.gather": 0.02}, "genome_prior": {"explore": 0.02, "gather": 0.0}, "catalog_hint": {}, "proposal_fingerprint": "", "tags": ["oracle_kill", "stripped:stripped_not_useful_fail", "held_out:held_out_fail", "collective_kill"], "evidence": ["kill:stripped:stripped_not_useful_fail", "kill:held_out:held_out_fail", "kill:collective_kill"], "author": null, "expired": false, "status": "candidate"}
{"id": "les_1:52:00Z_Chain `authored_oeis_a000045__cassi", "ts": "2026-10-07T21:52:00Z", "cycle_id": "", "type": "oracle_kill", "decision": "revert", "check": "oracle", "mutation": "Chain `authored_oeis_a000045__cassini` citing Square-free Word-representation of Word-representa (cycle 181)", "what": "Oracle FAIL kills keep. kills=['stripped:stripped_not_useful_fail', 'held_out:held_out_fail', 'collective_kill']. No fitness credit.", "source": "novelty_gate", "family": "process", "before_score": null, "after_score": null, "skill_bias": {"improver.improve": 0.02, "geometer.gather": 0.02}, "genome_prior": {"explore": 0.02, "gather": 0.0}, "catalog_hint": {}, "proposal_fingerprint": "", "tags": ["oracle_kill", "stripped:stripped_not_useful_fail", "held_out:held_out_fail", "collective_kill"], "evidence": ["kill:stripped:stripped_not_useful_fail", "kill:held_out:held_out_fail", "kill:collective_kill"], "author": null, "expired": false, "status": "candidate"}
{"id": "les_Z_97485e_vandermonde", "ts": "2026-10-07T21:52:00Z", "cycle_id": "20261007T215154Z_97485e", "type": "skip", "decision": "skip", "check": "oracle_seen_claim", "mutation": "vandermonde", "what": "skip re-oracle of vandermonde:1706.03762", "source": "claim_pipeline", "family": "novelty", "before_score": null, "after_score": null, "skill_bias": {}, "genome_prior": {}, "catalog_hint": {}, "proposal_fingerprint": "vandermonde:1706.03762", "tags": ["repeat_claim"], "evidence": [], "author": null, "expired": false, "status": "candidate"}
{"id": "les_Z_97485e_pilot", "ts": "2026-10-07T21:52:19Z", "cycle_id": "20261007T215154Z_97485e", "type": "skip", "decision": "skip", "check": "pilot", "mutation": "", "what": "empty rsi_bias pilot suppressed", "source": "pilot_lane", "family": "rsi", "before_score": null, "after_score": null, "skill_bias": {}, "genome_prior": {}, "catalog_hint": {}, "proposal_fingerprint": "", "tags": ["empty_rsi_bias"], "evidence": [], "author": null, "expired": false, "status": "candidate"}
{"id": "les_Z_02007f_dedupe", "ts": "2026-10-07T21:52:43Z", "cycle_id": "20261007T215238Z_02007f", "type": "repeat_proposal", "decision": "block", "check": "dedupe", "mutation": "", "what": "blocked repeat: Deepen compute-useful math from accepted findings after hearing", "source": "growth_hearing", "family": "process", "before_score": null, "after_score": null, "skill_bias": {}, "genome_prior": {}, "catalog_hint": {}, "proposal_fingerprint": "810bc050d326", "tags": ["repeat_proposal"], "evidence": [], "author": null, "expired": false, "status": "candidate"}
{"id": "les_Z_02007f_dedupe", "ts": "2026-10-07T21:52:43Z", "cycle_id": "20261007T215238Z_02007f", "type": "repeat_proposal", "decision": "block", "check": "dedupe", "mutation": "", "what": "blocked repeat: Feed accepted/strong RSI findings into skill_router + genome bias", "source": "growth_hearing", "family": "process", "before_score": null, "after_score": null, "skill_bias": {}, "genome_prior": {}, "catalog_hint": {}, "proposal_fingerprint": "27e48156942c", "tags": ["repeat_proposal"], "evidence": [], "author": null, "expired": false, "status": "candidate"}
{"id": "les_Z_02007f_authored_binomial_symmetry__catalan", "ts": "2026-10-07T21:52:44Z", "cycle_id": "20261007T215238Z_02007f", "type": "authored_check", "decision": "skip", "check": "authoring", "mutation": "authored_binomial_symmetry__catalan_convolution_w1", "what": "authored disabled hard check `authored_binomial_symmetry__catalan_convolution_w1` from proven lemmas binomial_symmetry + catalan_convolution on new windows; awaits Oracle via proposal", "source": "conjecture_desk", "family": "hard_tier", "before_score": null, "after_score": null, "skill_bias": {}, "genome_prior": {}, "catalog_hint": {}, "proposal_fingerprint": "", "tags": ["authoring", "authored_check", "binomial_symmetry", "catalan_convolution"], "evidence": ["society/benchmarks/artifacts/lemma_impl.py::check_binomial_symmetry", "society/benchmarks/artifacts/lemma_impl.py::check_catalan_convolution", "society/benchmarks/lemma_microbench.py", "lemma:binomial_symmetry", "lemma:catalan_convolution"], "author": null, "expired": false, "status": "candidate"}
{"id": "les_Z_02007f_vandermonde", "ts": "2026-10-07T21:52:44Z", "cycle_id": "20261007T215238Z_02007f", "type": "skip", "decision": "skip", "check": "oracle_seen_claim", "mutation": "vandermonde", "what": "skip re-oracle of vandermonde:1706.03762", "source": "claim_pipeline", "family": "novelty", "before_score": null, "after_score": null, "skill_bias": {}, "genome_prior": {}, "catalog_hint": {}, "proposal_fingerprint": "vandermonde:1706.03762", "tags": ["repeat_claim"], "evidence": [], "author": null, "expired": false, "status": "candidate"}
{"id": "les_Z_02007f_pilot", "ts": "2026-10-07T21:53:02Z", "cycle_id": "20261007T215238Z_02007f", "type": "skip", "decision": "skip", "check": "pilot", "mutation": "", "what": "empty rsi_bias pilot suppressed", "source": "pilot_lane", "family": "rsi", "before_score": null, "after_score": null, "skill_bias": {}, "genome_prior": {}, "catalog_hint": {}, "proposal_fingerprint": "", "tags": ["empty_rsi_bias"], "evidence": [], "author": null, "expired": false, "status": "candidate"}
{"id": "les_Z_ef1eec_vandermonde", "ts": "2026-10-07T23:04:32Z", "cycle_id": "20261007T230426Z_ef1eec", "type": "skip", "decision": "skip", "check": "oracle_seen_claim", "mutation": "vandermonde", "what": "skip re-oracle of vandermonde:1706.03762", "source": "claim_pipeline", "family": "novelty", "before_score": null, "after_score": null, "skill_bias": {}, "genome_prior": {}, "catalog_hint": {}, "proposal_fingerprint": "vandermonde:1706.03762", "tags": ["repeat_claim"], "evidence": [], "author": null, "expired": false, "status": "candidate"}
{"id": "les_Z_ef1eec_pilot", "ts": "2026-10-07T23:04:49Z", "cycle_id": "20261007T230426Z_ef1eec", "type": "skip", "decision": "skip", "check": "pilot", "mutation": "", "what": "empty rsi_bias pilot suppressed", "source": "pilot_lane", "family": "rsi", "before_score": null, "after_score": null, "skill_bias": {}, "genome_prior": {}, "catalog_hint": {}, "proposal_fingerprint": "", "tags": ["empty_rsi_bias"], "evidence": [], "author": null, "expired": false, "status": "candidate"}
{"id": "les_Z_bfcb21_dedupe", "ts": "2026-10-07T23:05:11Z", "cycle_id": "20261007T230507Z_bfcb21", "type": "repeat_proposal", "decision": "block", "check": "dedupe", "mutation": "", "what": "blocked repeat: Deepen compute-useful math from accepted findings after hearing", "source": "growth_hearing", "family": "process", "before_score": null, "after_score": null, "skill_bias": {}, "genome_prior": {}, "catalog_hint": {}, "proposal_fingerprint": "810bc050d326", "tags": ["repeat_proposal"], "evidence": [], "author": null, "expired": false, "status": "candidate"}
{"id": "les_Z_bfcb21_dedupe", "ts": "2026-10-07T23:05:11Z", "cycle_id": "20261007T230507Z_bfcb21", "type": "repeat_proposal", "decision": "block", "check": "dedupe", "mutation": "", "what": "blocked repeat: Feed accepted/strong RSI findings into skill_router + genome bias", "source": "growth_hearing", "family": "process", "before_score": null, "after_score": null, "skill_bias": {}, "genome_prior": {}, "catalog_hint": {}, "proposal_fingerprint": "27e48156942c", "tags": ["repeat_proposal"], "evidence": [], "author": null, "expired": false, "status": "candidate"}
{"id": "les_Z_bfcb21_authored_central_binom_bound__deran", "ts": "2026-10-07T23:05:12Z", "cycle_id": "20261007T230507Z_bfcb21", "type": "authored_check", "decision": "skip", "check": "authoring", "mutation": "authored_central_binom_bound__derangement_subfactorial_w1", "what": "authored disabled hard check `authored_central_binom_bound__derangement_subfactorial_w1` from proven lemmas central_binom_bound + derangement_subfactorial on new windows; awaits Oracle via proposal", "source": "conjecture_desk", "family": "hard_tier", "before_score": null, "after_score": null, "skill_bias": {}, "genome_prior": {}, "catalog_hint": {}, "proposal_fingerprint": "", "tags": ["authoring", "authored_check", "central_binom_bound", "derangement_subfactorial"], "evidence": ["society/benchmarks/artifacts/lemma_impl.py::check_central_binom_bound", "society/benchmarks/artifacts/lemma_impl.py::check_derangement_subfactorial", "society/benchmarks/lemma_microbench.py", "lemma:central_binom_bound", "lemma:derangement_subfactorial"], "author": null, "expired": false, "status": "candidate"}
{"id": "les_Z_bfcb21_vandermonde", "ts": "2026-10-07T23:05:12Z", "cycle_id": "20261007T230507Z_bfcb21", "type": "skip", "decision": "skip", "check": "oracle_seen_claim", "mutation": "vandermonde", "what": "skip re-oracle of vandermonde:1706.03762", "source": "claim_pipeline", "family": "novelty", "before_score": null, "after_score": null, "skill_bias": {}, "genome_prior": {}, "catalog_hint": {}, "proposal_fingerprint": "vandermonde:1706.03762", "tags": ["repeat_claim"], "evidence": [], "author": null, "expired": false, "status": "candidate"}
{"id": "les_Z_bfcb21_pilot", "ts": "2026-10-07T23:05:29Z", "cycle_id": "20261007T230507Z_bfcb21", "type": "skip", "decision": "skip", "check": "pilot", "mutation": "", "what": "empty rsi_bias pilot suppressed", "source": "pilot_lane", "family": "rsi", "before_score": null, "after_score": null, "skill_bias": {}, "genome_prior": {}, "catalog_hint": {}, "proposal_fingerprint": "", "tags": ["empty_rsi_bias"], "evidence": [], "author": null, "expired": false, "status": "candidate"}
{"id": "les_Z_fa8aba_vandermonde", "ts": "2026-10-07T23:05:52Z", "cycle_id": "20261007T230547Z_fa8aba", "type": "skip", "decision": "skip", "check": "oracle_seen_claim", "mutation": "vandermonde", "what": "skip re-oracle of vandermonde:1706.03762", "source": "claim_pipeline", "family": "novelty", "before_score": null, "after_score": null, "skill_bias": {}, "genome_prior": {}, "catalog_hint": {}, "proposal_fingerprint": "vandermonde:1706.03762", "tags": ["repeat_claim"], "evidence": [], "author": null, "expired": false, "status": "candidate"}
{"id": "les_Z_fa8aba_pilot", "ts": "2026-10-07T23:06:09Z", "cycle_id": "20261007T230547Z_fa8aba", "type": "skip", "decision": "skip", "check": "pilot", "mutation": "", "what": "empty rsi_bias pilot suppressed", "source": "pilot_lane", "family": "rsi", "before_score": null, "after_score": null, "skill_bias": {}, "genome_prior": {}, "catalog_hint": {}, "proposal_fingerprint": "", "tags": ["empty_rsi_bias"], "evidence": [], "author": null, "expired": false, "status": "candidate"}
{"id": "les_Z_b2e5a4_dedupe", "ts": "2026-10-07T23:13:50Z", "cycle_id": "20261007T231345Z_b2e5a4", "type": "repeat_proposal", "decision": "block", "check": "dedupe", "mutation": "", "what": "blocked repeat: Deepen compute-useful math from accepted findings after hearing", "source": "growth_hearing", "family": "process", "before_score": null, "after_score": null, "skill_bias": {}, "genome_prior": {}, "catalog_hint": {}, "proposal_fingerprint": "810bc050d326", "tags": ["repeat_proposal"], "evidence": [], "author": null, "expired": false, "status": "candidate"}
{"id": "les_Z_b2e5a4_dedupe", "ts": "2026-10-07T23:13:51Z", "cycle_id": "20261007T231345Z_b2e5a4", "type": "repeat_proposal", "decision": "block", "check": "dedupe", "mutation": "", "what": "blocked repeat: Feed accepted/strong RSI findings into skill_router + genome bias", "source": "growth_hearing", "family": "process", "before_score": null, "after_score": null, "skill_bias": {}, "genome_prior": {}, "catalog_hint": {}, "proposal_fingerprint": "27e48156942c", "tags": ["repeat_proposal"], "evidence": [], "author": null, "expired": false, "status": "candidate"}
{"id": "les_Z_b2e5a4_authored_euler_totient_multiplicati", "ts": "2026-10-07T23:13:51Z", "cycle_id": "20261007T231345Z_b2e5a4", "type": "authored_check", "decision": "skip", "check": "authoring", "mutation": "authored_euler_totient_multiplicative__hermite_recurrence_w1", "what": "authored disabled hard check `authored_euler_totient_multiplicative__hermite_recurrence_w1` from proven lemmas euler_totient_multiplicative + hermite_recurrence on new windows; awaits Oracle via proposal", "source": "conjecture_desk", "family": "hard_tier", "before_score": null, "after_score": null, "skill_bias": {}, "genome_prior": {}, "catalog_hint": {}, "proposal_fingerprint": "", "tags": ["authoring", "authored_check", "euler_totient_multiplicative", "hermite_recurrence"], "evidence": ["society/benchmarks/artifacts/lemma_impl.py::check_euler_totient_multiplicative", "society/benchmarks/artifacts/lemma_impl.py::check_hermite_recurrence", "society/benchmarks/lemma_microbench.py", "lemma:euler_totient_multiplicative", "lemma:hermite_recurrence"], "author": null, "expired": false, "status": "candidate"}
{"id": "les_Z_b2e5a4_easy_pad_assoc_add", "ts": "2026-10-07T23:13:51Z", "cycle_id": "20261007T231345Z_b2e5a4", "type": "oracle_kill", "decision": "revert", "check": "oracle", "mutation": "easy_pad_assoc_add", "what": "Oracle FAIL kills keep. kills=['stripped:easy_pad_baseline_already_useful', 'held_out:easy_pad_dies_on_held_out', 'cas:easy_pad_fails_cas_usefulness', 'easy_pad_oracle_kill', 'collective_kill']. No fitness credit.", "source": "conjecture_desk", "family": "easy_pad", "before_score": null, "after_score": null, "skill_bias": {"improver.improve": 0.02, "geometer.gather": 0.02}, "genome_prior": {"explore": 0.02, "gather": 0.0}, "catalog_hint": {}, "proposal_fingerprint": "", "tags": ["oracle_kill", "stripped:easy_pad_baseline_already_useful", "held_out:easy_pad_dies_on_held_out", "cas:easy_pad_fails_cas_usefulness", "easy_pad_oracle_kill"], "evidence": ["kill:stripped:easy_pad_baseline_already_useful", "kill:held_out:easy_pad_dies_on_held_out", "kill:cas:easy_pad_fails_cas_usefulness", "kill:easy_pad_oracle_kill", "kill:collective_kill"], "author": null, "expired": false, "status": "candidate"}
