{"id": "les_Z_118ffc_authored_catalan_convolution__deran", "ts": "2026-10-09T06:15:43Z", "cycle_id": "20261009T061530Z_118ffc", "type": "keep", "decision": "keep", "check": "lemma_microbench", "mutation": "authored_catalan_convolution__derangement_subfactorial_w1", "what": "Kept `authored_catalan_convolution__derangement_subfactorial_w1` (hard_enable): lemma score 0.9071→0.9071 checks 62→63 hard_pass 52→53 (machine-checked + Oracle pass; not novel discovery). | oracle=PASS fitness_credit=True kills=[] | novelty_gate novel=True kills=[]", "source": "conjecture_desk", "family": "hard_enable", "before_score": 0.9071, "after_score": 0.9071, "skill_bias": {"geometer.gather": 0.08, "improver.improve": 0.06, "spark.emergence": 0.04}, "genome_prior": {}, "catalog_hint": {}, "proposal_fingerprint": "", "tags": ["lemma", "hard_enable", "keep"], "evidence": ["society/benchmarks/lemma_microbench.py", "artifacts:lemma_impl", "lesson:les_Z_83aa56_authored_catalan_convolution__deran"], "author": null, "expired": false, "status": "candidate"}
{"id": "les_Z_118ffc_vandermonde", "ts": "2026-10-09T06:15:44Z", "cycle_id": "20261009T061530Z_118ffc", "type": "skip", "decision": "skip", "check": "oracle_seen_claim", "mutation": "vandermonde", "what": "skip re-oracle of vandermonde:1706.03762", "source": "claim_pipeline", "family": "novelty", "before_score": null, "after_score": null, "skill_bias": {}, "genome_prior": {}, "catalog_hint": {}, "proposal_fingerprint": "vandermonde:1706.03762", "tags": ["repeat_claim"], "evidence": [], "author": null, "expired": false, "status": "candidate"}
{"id": "les_Z_118ffc_pilot", "ts": "2026-10-09T06:15:47Z", "cycle_id": "20261009T061530Z_118ffc", "type": "skip", "decision": "skip", "check": "pilot", "mutation": "", "what": "empty rsi_bias pilot suppressed", "source": "pilot_lane", "family": "rsi", "before_score": null, "after_score": null, "skill_bias": {}, "genome_prior": {}, "catalog_hint": {}, "proposal_fingerprint": "", "tags": ["empty_rsi_bias"], "evidence": [], "author": null, "expired": false, "status": "candidate"}
{"id": "les_Z_d2b424_dedupe", "ts": "2026-10-09T06:16:13Z", "cycle_id": "20261009T061605Z_d2b424", "type": "repeat_proposal", "decision": "block", "check": "dedupe", "mutation": "", "what": "blocked repeat: Deepen compute-useful math from accepted findings after hearing", "source": "growth_hearing", "family": "process", "before_score": null, "after_score": null, "skill_bias": {}, "genome_prior": {}, "catalog_hint": {}, "proposal_fingerprint": "810bc050d326", "tags": ["repeat_proposal"], "evidence": [], "author": null, "expired": false, "status": "candidate"}
{"id": "les_Z_d2b424_dedupe", "ts": "2026-10-09T06:16:14Z", "cycle_id": "20261009T061605Z_d2b424", "type": "repeat_proposal", "decision": "block", "check": "dedupe", "mutation": "", "what": "blocked repeat: Feed accepted/strong RSI findings into skill_router + genome bias", "source": "growth_hearing", "family": "process", "before_score": null, "after_score": null, "skill_bias": {}, "genome_prior": {}, "catalog_hint": {}, "proposal_fingerprint": "27e48156942c", "tags": ["repeat_proposal"], "evidence": [], "author": null, "expired": false, "status": "candidate"}
{"id": "les_Z_d2b424_authored_fibonacci_addition__euler_", "ts": "2026-10-09T06:16:17Z", "cycle_id": "20261009T061605Z_d2b424", "type": "authored_check", "decision": "skip", "check": "authoring", "mutation": "authored_fibonacci_addition__euler_totient_multiplicative_w1", "what": "authored disabled hard check `authored_fibonacci_addition__euler_totient_multiplicative_w1` from proven lemmas fibonacci_addition + euler_totient_multiplicative on new windows; awaits Oracle via proposal", "source": "conjecture_desk", "family": "hard_tier", "before_score": null, "after_score": null, "skill_bias": {}, "genome_prior": {}, "catalog_hint": {}, "proposal_fingerprint": "", "tags": ["authoring", "authored_check", "fibonacci_addition", "euler_totient_multiplicative"], "evidence": ["society/benchmarks/artifacts/lemma_impl.py::check_fibonacci_addition", "society/benchmarks/artifacts/lemma_impl.py::check_euler_totient_multiplicative", "society/benchmarks/lemma_microbench.py", "lemma:fibonacci_addition", "lemma:euler_totient_multiplicative"], "author": null, "expired": false, "status": "candidate"}
{"id": "les_Z_d2b424_conjecture", "ts": "2026-10-09T06:16:18Z", "cycle_id": "20261009T061605Z_d2b424", "type": "catalog_exhausted", "decision": "skip", "check": "conjecture", "mutation": "", "what": "catalog exhausted — queue next hard_enable stub from lessons/external mind", "source": "conjecture_desk", "family": "hard_tier", "before_score": null, "after_score": null, "skill_bias": {}, "genome_prior": {}, "catalog_hint": {"avoid": ["vandermonde_asymmetric", "process_spam"], "drop_theme": ["vandermonde_asymmetric"], "seek": ["papers.jsonl", "ledger", "domain_bus", "arxiv"], "prefer": ["novelty", "cite_sources", "gather_before_propose", "drop_cooled_theme"], "add_mutation": "binomial_hockey_deep"}, "proposal_fingerprint": "", "tags": ["catalog_exhausted"], "evidence": [], "author": null, "expired": false, "status": "candidate"}
{"id": "les_Z_d2b424_vandermonde", "ts": "2026-10-09T06:16:18Z", "cycle_id": "20261009T061605Z_d2b424", "type": "skip", "decision": "skip", "check": "oracle_seen_claim", "mutation": "vandermonde", "what": "skip re-oracle of vandermonde:1706.03762", "source": "claim_pipeline", "family": "novelty", "before_score": null, "after_score": null, "skill_bias": {}, "genome_prior": {}, "catalog_hint": {}, "proposal_fingerprint": "vandermonde:1706.03762", "tags": ["repeat_claim"], "evidence": [], "author": null, "expired": false, "status": "candidate"}
{"id": "les_Z_d2b424_pilot", "ts": "2026-10-09T06:16:21Z", "cycle_id": "20261009T061605Z_d2b424", "type": "skip", "decision": "skip", "check": "pilot", "mutation": "", "what": "empty rsi_bias pilot suppressed", "source": "pilot_lane", "family": "rsi", "before_score": null, "after_score": null, "skill_bias": {}, "genome_prior": {}, "catalog_hint": {}, "proposal_fingerprint": "", "tags": ["empty_rsi_bias"], "evidence": [], "author": null, "expired": false, "status": "candidate"}
{"id": "les_Z_0cd410_authored_fibonacci_addition__euler_", "ts": "2026-10-09T06:16:52Z", "cycle_id": "20261009T061639Z_0cd410", "type": "keep", "decision": "keep", "check": "lemma_microbench", "mutation": "authored_fibonacci_addition__euler_totient_multiplicative_w1", "what": "Kept `authored_fibonacci_addition__euler_totient_multiplicative_w1` (hard_enable): lemma score 0.9071→0.9071 checks 63→64 hard_pass 53→54 (machine-checked + Oracle pass; not novel discovery). | oracle=PASS fitness_credit=True kills=[] | novelty_gate novel=True kills=[]", "source": "conjecture_desk", "family": "hard_enable", "before_score": 0.9071, "after_score": 0.9071, "skill_bias": {"geometer.gather": 0.08, "improver.improve": 0.06, "spark.emergence": 0.04}, "genome_prior": {}, "catalog_hint": {}, "proposal_fingerprint": "", "tags": ["lemma", "hard_enable", "keep"], "evidence": ["society/benchmarks/lemma_microbench.py", "artifacts:lemma_impl", "lesson:les_Z_d2b424_authored_fibonacci_addition__euler_"], "author": null, "expired": false, "status": "candidate"}
{"id": "les_Z_0cd410_vandermonde", "ts": "2026-10-09T06:16:52Z", "cycle_id": "20261009T061639Z_0cd410", "type": "skip", "decision": "skip", "check": "oracle_seen_claim", "mutation": "vandermonde", "what": "skip re-oracle of vandermonde:1706.03762", "source": "claim_pipeline", "family": "novelty", "before_score": null, "after_score": null, "skill_bias": {}, "genome_prior": {}, "catalog_hint": {}, "proposal_fingerprint": "vandermonde:1706.03762", "tags": ["repeat_claim"], "evidence": [], "author": null, "expired": false, "status": "candidate"}
{"id": "les_Z_0cd410_pilot", "ts": "2026-10-09T06:16:56Z", "cycle_id": "20261009T061639Z_0cd410", "type": "skip", "decision": "skip", "check": "pilot", "mutation": "", "what": "empty rsi_bias pilot suppressed", "source": "pilot_lane", "family": "rsi", "before_score": null, "after_score": null, "skill_bias": {}, "genome_prior": {}, "catalog_hint": {}, "proposal_fingerprint": "", "tags": ["empty_rsi_bias"], "evidence": [], "author": null, "expired": false, "status": "candidate"}
{"id": "les_Z_853302_dedupe", "ts": "2026-10-09T06:25:50Z", "cycle_id": "20261009T062541Z_853302", "type": "repeat_proposal", "decision": "block", "check": "dedupe", "mutation": "", "what": "blocked repeat: Deepen compute-useful math from accepted findings after hearing", "source": "growth_hearing", "family": "process", "before_score": null, "after_score": null, "skill_bias": {}, "genome_prior": {}, "catalog_hint": {}, "proposal_fingerprint": "810bc050d326", "tags": ["repeat_proposal"], "evidence": [], "author": null, "expired": false, "status": "candidate"}
{"id": "les_Z_853302_dedupe", "ts": "2026-10-09T06:25:52Z", "cycle_id": "20261009T062541Z_853302", "type": "repeat_proposal", "decision": "block", "check": "dedupe", "mutation": "", "what": "blocked repeat: Feed accepted/strong RSI findings into skill_router + genome bias", "source": "growth_hearing", "family": "process", "before_score": null, "after_score": null, "skill_bias": {}, "genome_prior": {}, "catalog_hint": {}, "proposal_fingerprint": "27e48156942c", "tags": ["repeat_proposal"], "evidence": [], "author": null, "expired": false, "status": "candidate"}
{"id": "les_Z_853302_authored_gcd_fibonacci__motzkin_bou", "ts": "2026-10-09T06:25:54Z", "cycle_id": "20261009T062541Z_853302", "type": "authored_check", "decision": "skip", "check": "authoring", "mutation": "authored_gcd_fibonacci__motzkin_bounded_w1", "what": "authored disabled hard check `authored_gcd_fibonacci__motzkin_bounded_w1` from proven lemmas gcd_fibonacci + motzkin_bounded on new windows; awaits Oracle via proposal", "source": "conjecture_desk", "family": "hard_tier", "before_score": null, "after_score": null, "skill_bias": {}, "genome_prior": {}, "catalog_hint": {}, "proposal_fingerprint": "", "tags": ["authoring", "authored_check", "gcd_fibonacci", "motzkin_bounded"], "evidence": ["society/benchmarks/artifacts/lemma_impl.py::check_gcd_fibonacci", "society/benchmarks/artifacts/lemma_impl.py::check_motzkin_bounded", "society/benchmarks/lemma_microbench.py", "lemma:gcd_fibonacci", "lemma:motzkin_bounded"], "author": null, "expired": false, "status": "candidate"}
{"id": "les_Z_853302_conjecture", "ts": "2026-10-09T06:25:55Z", "cycle_id": "20261009T062541Z_853302", "type": "catalog_exhausted", "decision": "skip", "check": "conjecture", "mutation": "", "what": "catalog exhausted — queue next hard_enable stub from lessons/external mind", "source": "conjecture_desk", "family": "hard_tier", "before_score": null, "after_score": null, "skill_bias": {}, "genome_prior": {}, "catalog_hint": {"avoid": ["vandermonde_asymmetric", "process_spam"], "drop_theme": ["vandermonde_asymmetric"], "seek": ["papers.jsonl", "ledger", "domain_bus", "arxiv"], "prefer": ["novelty", "cite_sources", "gather_before_propose", "drop_cooled_theme"], "add_mutation": "binomial_hockey_deep"}, "proposal_fingerprint": "", "tags": ["catalog_exhausted"], "evidence": [], "author": null, "expired": false, "status": "candidate"}
{"id": "les_Z_853302_vandermonde", "ts": "2026-10-09T06:25:55Z", "cycle_id": "20261009T062541Z_853302", "type": "skip", "decision": "skip", "check": "oracle_seen_claim", "mutation": "vandermonde", "what": "skip re-oracle of vandermonde:1706.03762", "source": "claim_pipeline", "family": "novelty", "before_score": null, "after_score": null, "skill_bias": {}, "genome_prior": {}, "catalog_hint": {}, "proposal_fingerprint": "vandermonde:1706.03762", "tags": ["repeat_claim"], "evidence": [], "author": null, "expired": false, "status": "candidate"}
{"id": "les_Z_853302_pilot", "ts": "2026-10-09T06:25:59Z", "cycle_id": "20261009T062541Z_853302", "type": "skip", "decision": "skip", "check": "pilot", "mutation": "", "what": "empty rsi_bias pilot suppressed", "source": "pilot_lane", "family": "rsi", "before_score": null, "after_score": null, "skill_bias": {}, "genome_prior": {}, "catalog_hint": {}, "proposal_fingerprint": "", "tags": ["empty_rsi_bias"], "evidence": [], "author": null, "expired": false, "status": "candidate"}
{"id": "les_Z_5224de_authored_gcd_fibonacci__motzkin_bou", "ts": "2026-10-09T06:26:30Z", "cycle_id": "20261009T062617Z_5224de", "type": "keep", "decision": "keep", "check": "lemma_microbench", "mutation": "authored_gcd_fibonacci__motzkin_bounded_w1", "what": "Kept `authored_gcd_fibonacci__motzkin_bounded_w1` (hard_enable): lemma score 0.9071→0.9071 checks 64→65 hard_pass 54→55 (machine-checked + Oracle pass; not novel discovery). | oracle=PASS fitness_credit=True kills=[] | novelty_gate novel=True kills=[]", "source": "conjecture_desk", "family": "hard_enable", "before_score": 0.9071, "after_score": 0.9071, "skill_bias": {"geometer.gather": 0.08, "improver.improve": 0.06, "spark.emergence": 0.04}, "genome_prior": {}, "catalog_hint": {}, "proposal_fingerprint": "", "tags": ["lemma", "hard_enable", "keep"], "evidence": ["society/benchmarks/lemma_microbench.py", "artifacts:lemma_impl", "lesson:les_Z_853302_authored_gcd_fibonacci__motzkin_bou"], "author": null, "expired": false, "status": "candidate"}
{"id": "les_Z_5224de_vandermonde", "ts": "2026-10-09T06:26:30Z", "cycle_id": "20261009T062617Z_5224de", "type": "skip", "decision": "skip", "check": "oracle_seen_claim", "mutation": "vandermonde", "what": "skip re-oracle of vandermonde:1706.03762", "source": "claim_pipeline", "family": "novelty", "before_score": null, "after_score": null, "skill_bias": {}, "genome_prior": {}, "catalog_hint": {}, "proposal_fingerprint": "vandermonde:1706.03762", "tags": ["repeat_claim"], "evidence": [], "author": null, "expired": false, "status": "candidate"}
{"id": "les_Z_5224de_pilot", "ts": "2026-10-09T06:26:35Z", "cycle_id": "20261009T062617Z_5224de", "type": "skip", "decision": "skip", "check": "pilot", "mutation": "", "what": "empty rsi_bias pilot suppressed", "source": "pilot_lane", "family": "rsi", "before_score": null, "after_score": null, "skill_bias": {}, "genome_prior": {}, "catalog_hint": {}, "proposal_fingerprint": "", "tags": ["empty_rsi_bias"], "evidence": [], "author": null, "expired": false, "status": "candidate"}
{"id": "les_Z_fb8788_dedupe", "ts": "2026-10-09T06:26:50Z", "cycle_id": "20261009T062641Z_fb8788", "type": "repeat_proposal", "decision": "block", "check": "dedupe", "mutation": "", "what": "blocked repeat: Deepen compute-useful math from accepted findings after hearing", "source": "growth_hearing", "family": "process", "before_score": null, "after_score": null, "skill_bias": {}, "genome_prior": {}, "catalog_hint": {}, "proposal_fingerprint": "810bc050d326", "tags": ["repeat_proposal"], "evidence": [], "author": null, "expired": false, "status": "candidate"}
{"id": "les_Z_fb8788_dedupe", "ts": "2026-10-09T06:26:51Z", "cycle_id": "20261009T062641Z_fb8788", "type": "repeat_proposal", "decision": "block", "check": "dedupe", "mutation": "", "what": "blocked repeat: Feed accepted/strong RSI findings into skill_router + genome bias", "source": "growth_hearing", "family": "process", "before_score": null, "after_score": null, "skill_bias": {}, "genome_prior": {}, "catalog_hint": {}, "proposal_fingerprint": "27e48156942c", "tags": ["repeat_proposal"], "evidence": [], "author": null, "expired": false, "status": "candidate"}
{"id": "les_Z_fb8788_authored_geometric_sum__narayana_su", "ts": "2026-10-09T06:26:54Z", "cycle_id": "20261009T062641Z_fb8788", "type": "authored_check", "decision": "skip", "check": "authoring", "mutation": "authored_geometric_sum__narayana_sum_w1", "what": "authored disabled hard check `authored_geometric_sum__narayana_sum_w1` from proven lemmas geometric_sum + narayana_sum on new windows; awaits Oracle via proposal", "source": "conjecture_desk", "family": "hard_tier", "before_score": null, "after_score": null, "skill_bias": {}, "genome_prior": {}, "catalog_hint": {}, "proposal_fingerprint": "", "tags": ["authoring", "authored_check", "geometric_sum", "narayana_sum"], "evidence": ["society/benchmarks/artifacts/lemma_impl.py::check_geometric_sum", "society/benchmarks/artifacts/lemma_impl.py::check_narayana_sum", "society/benchmarks/lemma_microbench.py", "lemma:geometric_sum", "lemma:narayana_sum"], "author": null, "expired": false, "status": "candidate"}
{"id": "les_Z_fb8788_conjecture", "ts": "2026-10-09T06:26:55Z", "cycle_id": "20261009T062641Z_fb8788", "type": "catalog_exhausted", "decision": "skip", "check": "conjecture", "mutation": "", "what": "catalog exhausted — queue next hard_enable stub from lessons/external mind", "source": "conjecture_desk", "family": "hard_tier", "before_score": null, "after_score": null, "skill_bias": {}, "genome_prior": {}, "catalog_hint": {"avoid": ["vandermonde_asymmetric", "process_spam"], "drop_theme": ["vandermonde_asymmetric"], "seek": ["papers.jsonl", "ledger", "domain_bus", "arxiv"], "prefer": ["novelty", "cite_sources", "gather_before_propose", "drop_cooled_theme"], "add_mutation": "binomial_hockey_deep"}, "proposal_fingerprint": "", "tags": ["catalog_exhausted"], "evidence": [], "author": null, "expired": false, "status": "candidate"}
{"id": "les_Z_fb8788_vandermonde", "ts": "2026-10-09T06:26:55Z", "cycle_id": "20261009T062641Z_fb8788", "type": "skip", "decision": "skip", "check": "oracle_seen_claim", "mutation": "vandermonde", "what": "skip re-oracle of vandermonde:1706.03762", "source": "claim_pipeline", "family": "novelty", "before_score": null, "after_score": null, "skill_bias": {}, "genome_prior": {}, "catalog_hint": {}, "proposal_fingerprint": "vandermonde:1706.03762", "tags": ["repeat_claim"], "evidence": [], "author": null, "expired": false, "status": "candidate"}
{"id": "les_Z_fb8788_pilot", "ts": "2026-10-09T06:26:59Z", "cycle_id": "20261009T062641Z_fb8788", "type": "skip", "decision": "skip", "check": "pilot", "mutation": "", "what": "empty rsi_bias pilot suppressed", "source": "pilot_lane", "family": "rsi", "before_score": null, "after_score": null, "skill_bias": {}, "genome_prior": {}, "catalog_hint": {}, "proposal_fingerprint": "", "tags": ["empty_rsi_bias"], "evidence": [], "author": null, "expired": false, "status": "candidate"}
{"id": "les_009T0623_human", "ts": "2026-10-09T06:27:53Z", "cycle_id": "human_20261009T0623", "type": "human_guide", "decision": "guide", "check": "human", "mutation": "", "what": "Frontier work (James Jackson, 2026-10-09): aim at the edge. Take open statements that are finitely checkable (Goldbach, Collatz, Legendre, Lehmer's totient problem, Erdős–Straus, twin primes vs Hardy–Littlewood, OEIS sequences with conjectured formulas) and extend the range you have verified yourself, with a machine check under a time budget. Report evidence honestly: a passed range is bounded evidence, not proof. Never claim proof from finite checks. A counterexample is re-verified by an indepe", "source": "human", "family": "human_teaching", "before_score": null, "after_score": null, "skill_bias": {}, "genome_prior": {}, "catalog_hint": {"prefer": ["frontier", "extend_verified_range", "independent_reverify", "report_evidence_honestly"], "avoid": ["proof_from_finite_check", "auto_disproof_claim"], "seek": ["society/benchmarks/frontier.json", "data/research_cache/feeds.jsonl"]}, "proposal_fingerprint": "", "tags": ["human_guide", "frontier", "bounded_evidence"], "evidence": [], "author": "James Jackson", "expired": false, "status": "candidate"}
{"id": "les_Z_a2e0dc_authored_geometric_sum__narayana_su", "ts": "2026-10-09T06:28:58Z", "cycle_id": "20261009T062846Z_a2e0dc", "type": "keep", "decision": "keep", "check": "lemma_microbench", "mutation": "authored_geometric_sum__narayana_sum_w1", "what": "Kept `authored_geometric_sum__narayana_sum_w1` (hard_enable): lemma score 0.9071→0.9071 checks 65→66 hard_pass 55→56 (machine-checked + Oracle pass; not novel discovery). | oracle=PASS fitness_credit=True kills=[] | novelty_gate novel=True kills=[]", "source": "conjecture_desk", "family": "hard_enable", "before_score": 0.9071, "after_score": 0.9071, "skill_bias": {"geometer.gather": 0.08, "improver.improve": 0.06, "spark.emergence": 0.04}, "genome_prior": {}, "catalog_hint": {}, "proposal_fingerprint": "", "tags": ["lemma", "hard_enable", "keep"], "evidence": ["society/benchmarks/lemma_microbench.py", "artifacts:lemma_impl", "lesson:les_Z_fb8788_authored_geometric_sum__narayana_su"], "author": null, "expired": false, "status": "candidate"}
{"id": "les_Z_a2e0dc_vandermonde", "ts": "2026-10-09T06:28:58Z", "cycle_id": "20261009T062846Z_a2e0dc", "type": "skip", "decision": "skip", "check": "oracle_seen_claim", "mutation": "vandermonde", "what": "skip re-oracle of vandermonde:1706.03762", "source": "claim_pipeline", "family": "novelty", "before_score": null, "after_score": null, "skill_bias": {}, "genome_prior": {}, "catalog_hint": {}, "proposal_fingerprint": "vandermonde:1706.03762", "tags": ["repeat_claim"], "evidence": [], "author": null, "expired": false, "status": "candidate"}
{"id": "les_Z_a2e0dc_pilot", "ts": "2026-10-09T06:29:05Z", "cycle_id": "20261009T062846Z_a2e0dc", "type": "skip", "decision": "skip", "check": "pilot", "mutation": "", "what": "empty rsi_bias pilot suppressed", "source": "pilot_lane", "family": "rsi", "before_score": null, "after_score": null, "skill_bias": {}, "genome_prior": {}, "catalog_hint": {}, "proposal_fingerprint": "", "tags": ["empty_rsi_bias"], "evidence": [], "author": null, "expired": false, "status": "candidate"}
