{"id": "les_9:03:10Z_easy_pad_square_again", "ts": "2026-10-07T09:03:10Z", "cycle_id": "", "type": "oracle_kill", "decision": "revert", "check": "oracle", "mutation": "easy_pad_square_again", "what": "Oracle FAIL kills keep. kills=['stripped:easy_pad_baseline_already_useful', 'held_out:easy_pad_dies_on_held_out', 'cas:easy_pad_fails_cas_usefulness', 'easy_pad_oracle_kill', 'collective_kill']. No fitness credit.", "source": "test", "family": "easy_pad", "before_score": null, "after_score": null, "skill_bias": {"improver.improve": 0.02, "geometer.gather": 0.02}, "genome_prior": {"explore": 0.02, "gather": 0.0}, "catalog_hint": {}, "proposal_fingerprint": "", "tags": ["oracle_kill", "stripped:easy_pad_baseline_already_useful", "held_out:easy_pad_dies_on_held_out", "cas:easy_pad_fails_cas_usefulness", "easy_pad_oracle_kill"], "evidence": ["kill:stripped:easy_pad_baseline_already_useful", "kill:held_out:easy_pad_dies_on_held_out", "kill:cas:easy_pad_fails_cas_usefulness", "kill:easy_pad_oracle_kill", "kill:collective_kill"], "author": null, "expired": false, "status": "candidate"}
{"id": "les_9:03:10Z_vandermonde", "ts": "2026-10-07T09:03:10Z", "cycle_id": "", "type": "oracle_kill", "decision": "revert", "check": "oracle", "mutation": "vandermonde", "what": "Oracle FAIL: no bus for claim path (fail-closed). No fitness credit.", "source": "test", "family": "claim_theme", "before_score": null, "after_score": null, "skill_bias": {"improver.improve": 0.02, "geometer.gather": 0.02}, "genome_prior": {"explore": 0.02, "gather": 0.0}, "catalog_hint": {}, "proposal_fingerprint": "", "tags": ["oracle_kill", "oracle_blocked_no_bus"], "evidence": ["kill:oracle_blocked_no_bus"], "author": null, "expired": false, "status": "candidate"}
{"id": "les_est_kill_vandermonde", "ts": "2026-10-07T09:03:10Z", "cycle_id": "test_kill", "type": "oracle_kill", "decision": "revert", "check": "oracle", "mutation": "vandermonde", "what": "Oracle FAIL kills keep. kills=['held_out:held_out:already_saturated_no_harder_window', 'collective_kill']. No fitness credit.", "source": "test", "family": "claim_theme", "before_score": null, "after_score": null, "skill_bias": {"improver.improve": 0.02, "geometer.gather": 0.02}, "genome_prior": {"explore": 0.02, "gather": 0.0}, "catalog_hint": {"add_mutation": "vandermonde_asymmetric", "kind": "hard_enable"}, "proposal_fingerprint": "", "tags": ["oracle_kill", "held_out:held_out:already_saturated_no_harder_window", "collective_kill"], "evidence": ["kill:held_out:held_out:already_saturated_no_harder_window", "kill:collective_kill"], "author": null, "expired": false, "status": "candidate"}
{"id": "les_Z_c51d8e_dedupe", "ts": "2026-10-07T09:03:43Z", "cycle_id": "20261007T090340Z_c51d8e", "type": "repeat_proposal", "decision": "block", "check": "dedupe", "mutation": "", "what": "blocked repeat: Deepen compute-useful math from accepted findings after hearing", "source": "growth_hearing", "family": "process", "before_score": null, "after_score": null, "skill_bias": {}, "genome_prior": {}, "catalog_hint": {}, "proposal_fingerprint": "810bc050d326", "tags": ["repeat_proposal"], "evidence": [], "author": null, "expired": false, "status": "candidate"}
{"id": "les_9:03:44Z_Feed accepted/strong RSI findings i", "ts": "2026-10-07T09:03:44Z", "cycle_id": "", "type": "oracle_kill", "decision": "revert", "check": "oracle", "mutation": "Feed accepted/strong RSI findings into skill_router + genome bias", "what": "Oracle FAIL kills keep. kills=['stripped:stripped_not_useful_fail', 'held_out:held_out_fail', 'collective_kill']. No fitness credit.", "source": "novelty_gate", "family": "process", "before_score": null, "after_score": null, "skill_bias": {"improver.improve": 0.02, "geometer.gather": 0.02}, "genome_prior": {"explore": 0.02, "gather": 0.0}, "catalog_hint": {}, "proposal_fingerprint": "", "tags": ["oracle_kill", "stripped:stripped_not_useful_fail", "held_out:held_out_fail", "collective_kill"], "evidence": ["kill:stripped:stripped_not_useful_fail", "kill:held_out:held_out_fail", "kill:collective_kill"], "author": null, "expired": false, "status": "candidate"}
{"id": "les_Z_c51d8e_conjecture", "ts": "2026-10-07T09:03:44Z", "cycle_id": "20261007T090340Z_c51d8e", "type": "catalog_exhausted", "decision": "skip", "check": "conjecture", "mutation": "", "what": "catalog exhausted — queue next hard_enable stub from lessons/external mind", "source": "conjecture_desk", "family": "hard_tier", "before_score": null, "after_score": null, "skill_bias": {}, "genome_prior": {}, "catalog_hint": {"add_mutation": "vandermonde_asymmetric", "kind": "hard_enable"}, "proposal_fingerprint": "", "tags": ["catalog_exhausted"], "evidence": [], "author": null, "expired": false, "status": "candidate"}
{"id": "les_Z_c51d8e_vandermonde", "ts": "2026-10-07T09:03:44Z", "cycle_id": "20261007T090340Z_c51d8e", "type": "skip", "decision": "skip", "check": "oracle_seen_claim", "mutation": "vandermonde", "what": "skip re-oracle of vandermonde:1706.03762", "source": "claim_pipeline", "family": "novelty", "before_score": null, "after_score": null, "skill_bias": {}, "genome_prior": {}, "catalog_hint": {}, "proposal_fingerprint": "vandermonde:1706.03762", "tags": ["repeat_claim"], "evidence": [], "author": null, "expired": false, "status": "candidate"}
{"id": "les_Z_c51d8e_pilot", "ts": "2026-10-07T09:04:03Z", "cycle_id": "20261007T090340Z_c51d8e", "type": "skip", "decision": "skip", "check": "pilot", "mutation": "", "what": "empty rsi_bias pilot suppressed", "source": "pilot_lane", "family": "rsi", "before_score": null, "after_score": null, "skill_bias": {}, "genome_prior": {}, "catalog_hint": {}, "proposal_fingerprint": "", "tags": ["empty_rsi_bias"], "evidence": [], "author": null, "expired": false, "status": "candidate"}
{"id": "les_Z_9ed71b_dedupe", "ts": "2026-10-07T09:04:25Z", "cycle_id": "20261007T090422Z_9ed71b", "type": "repeat_proposal", "decision": "block", "check": "dedupe", "mutation": "", "what": "blocked repeat: Deepen compute-useful math from accepted findings after hearing", "source": "growth_hearing", "family": "process", "before_score": null, "after_score": null, "skill_bias": {}, "genome_prior": {}, "catalog_hint": {}, "proposal_fingerprint": "810bc050d326", "tags": ["repeat_proposal"], "evidence": [], "author": null, "expired": false, "status": "candidate"}
{"id": "les_9:04:25Z_Feed accepted/strong RSI findings i", "ts": "2026-10-07T09:04:25Z", "cycle_id": "", "type": "oracle_kill", "decision": "revert", "check": "oracle", "mutation": "Feed accepted/strong RSI findings into skill_router + genome bias (cycle 139)", "what": "Oracle FAIL kills keep. kills=['stripped:stripped_not_useful_fail', 'held_out:held_out_fail', 'collective_kill']. No fitness credit.", "source": "novelty_gate", "family": "process", "before_score": null, "after_score": null, "skill_bias": {"improver.improve": 0.02, "geometer.gather": 0.02}, "genome_prior": {"explore": 0.02, "gather": 0.0}, "catalog_hint": {}, "proposal_fingerprint": "", "tags": ["oracle_kill", "stripped:stripped_not_useful_fail", "held_out:held_out_fail", "collective_kill"], "evidence": ["kill:stripped:stripped_not_useful_fail", "kill:held_out:held_out_fail", "kill:collective_kill"], "author": null, "expired": false, "status": "candidate"}
{"id": "les_Z_9ed71b_conjecture", "ts": "2026-10-07T09:04:25Z", "cycle_id": "20261007T090422Z_9ed71b", "type": "catalog_exhausted", "decision": "skip", "check": "conjecture", "mutation": "", "what": "catalog exhausted — queue next hard_enable stub from lessons/external mind", "source": "conjecture_desk", "family": "hard_tier", "before_score": null, "after_score": null, "skill_bias": {}, "genome_prior": {}, "catalog_hint": {"add_mutation": "vandermonde_asymmetric", "kind": "hard_enable"}, "proposal_fingerprint": "", "tags": ["catalog_exhausted"], "evidence": [], "author": null, "expired": false, "status": "candidate"}
{"id": "les_Z_9ed71b_vandermonde", "ts": "2026-10-07T09:04:25Z", "cycle_id": "20261007T090422Z_9ed71b", "type": "skip", "decision": "skip", "check": "oracle_seen_claim", "mutation": "vandermonde", "what": "skip re-oracle of vandermonde:1706.03762", "source": "claim_pipeline", "family": "novelty", "before_score": null, "after_score": null, "skill_bias": {}, "genome_prior": {}, "catalog_hint": {}, "proposal_fingerprint": "vandermonde:1706.03762", "tags": ["repeat_claim"], "evidence": [], "author": null, "expired": false, "status": "candidate"}
{"id": "les_Z_9ed71b_pilot", "ts": "2026-10-07T09:04:31Z", "cycle_id": "20261007T090422Z_9ed71b", "type": "skip", "decision": "skip", "check": "pilot", "mutation": "", "what": "empty rsi_bias pilot suppressed", "source": "pilot_lane", "family": "rsi", "before_score": null, "after_score": null, "skill_bias": {}, "genome_prior": {}, "catalog_hint": {}, "proposal_fingerprint": "", "tags": ["empty_rsi_bias"], "evidence": [], "author": null, "expired": false, "status": "candidate"}
{"id": "les_Z_17bfae_dedupe", "ts": "2026-10-07T09:04:54Z", "cycle_id": "20261007T090451Z_17bfae", "type": "repeat_proposal", "decision": "block", "check": "dedupe", "mutation": "", "what": "blocked repeat: Deepen compute-useful math from accepted findings after hearing", "source": "growth_hearing", "family": "process", "before_score": null, "after_score": null, "skill_bias": {}, "genome_prior": {}, "catalog_hint": {}, "proposal_fingerprint": "810bc050d326", "tags": ["repeat_proposal"], "evidence": [], "author": null, "expired": false, "status": "candidate"}
{"id": "les_Z_17bfae_dedupe", "ts": "2026-10-07T09:04:54Z", "cycle_id": "20261007T090451Z_17bfae", "type": "repeat_proposal", "decision": "block", "check": "dedupe", "mutation": "", "what": "blocked repeat: Feed accepted/strong RSI findings into skill_router + genome bias", "source": "growth_hearing", "family": "process", "before_score": null, "after_score": null, "skill_bias": {}, "genome_prior": {}, "catalog_hint": {}, "proposal_fingerprint": "27e48156942c", "tags": ["repeat_proposal"], "evidence": [], "author": null, "expired": false, "status": "candidate"}
{"id": "les_Z_17bfae_conjecture", "ts": "2026-10-07T09:04:54Z", "cycle_id": "20261007T090451Z_17bfae", "type": "catalog_exhausted", "decision": "skip", "check": "conjecture", "mutation": "", "what": "catalog exhausted — queue next hard_enable stub from lessons/external mind", "source": "conjecture_desk", "family": "hard_tier", "before_score": null, "after_score": null, "skill_bias": {}, "genome_prior": {}, "catalog_hint": {"add_mutation": "vandermonde_asymmetric", "kind": "hard_enable"}, "proposal_fingerprint": "", "tags": ["catalog_exhausted"], "evidence": [], "author": null, "expired": false, "status": "candidate"}
{"id": "les_Z_17bfae_vandermonde", "ts": "2026-10-07T09:04:54Z", "cycle_id": "20261007T090451Z_17bfae", "type": "skip", "decision": "skip", "check": "oracle_seen_claim", "mutation": "vandermonde", "what": "skip re-oracle of vandermonde:1706.03762", "source": "claim_pipeline", "family": "novelty", "before_score": null, "after_score": null, "skill_bias": {}, "genome_prior": {}, "catalog_hint": {}, "proposal_fingerprint": "vandermonde:1706.03762", "tags": ["repeat_claim"], "evidence": [], "author": null, "expired": false, "status": "candidate"}
{"id": "les_Z_17bfae_pilot", "ts": "2026-10-07T09:05:12Z", "cycle_id": "20261007T090451Z_17bfae", "type": "skip", "decision": "skip", "check": "pilot", "mutation": "", "what": "empty rsi_bias pilot suppressed", "source": "pilot_lane", "family": "rsi", "before_score": null, "after_score": null, "skill_bias": {}, "genome_prior": {}, "catalog_hint": {}, "proposal_fingerprint": "", "tags": ["empty_rsi_bias"], "evidence": [], "author": null, "expired": false, "status": "candidate"}
{"id": "les_k_become_seek_on_kill_or_flat_novelty", "ts": "2026-10-07T11:24:25Z", "cycle_id": "teach_seek_become", "type": "human_guide", "decision": "guide", "check": "human", "mutation": "seek_on_kill_or_flat_novelty", "what": "SEEK INFORMATION: When the Oracle kills a claim, or novelty stays near zero, gather from the ledger, arXiv cache, papers.jsonl, and domain bus channels (science/history/math/empire/rsi) BEFORE proposing again. Cite sources on every proposal. Never invent findings — light the spark from evidence, then witness.", "source": "human", "family": "human_teaching", "before_score": null, "after_score": null, "skill_bias": {"gather": 0.12, "geometer.gather": 0.1, "improver.improve": 0.04, "oracle": 0.06}, "genome_prior": {"gather": 0.08, "explore": 0.05}, "catalog_hint": {"seek": ["ledger", "arxiv", "papers.jsonl", "domain_bus"], "prefer": ["cite_sources", "gather_before_propose"], "add_mutation": "vandermonde_asymmetric"}, "proposal_fingerprint": "", "tags": ["human_guide", "seek", "oracle_kill", "novelty", "cite"], "evidence": [], "author": "James Jackson", "expired": false, "status": "candidate"}
{"id": "les_k_become_seek_extend_catalog", "ts": "2026-10-07T11:24:25Z", "cycle_id": "teach_seek_become", "type": "human_guide", "decision": "guide", "check": "human", "mutation": "seek_extend_catalog", "what": "SEEK INFORMATION: Treat catalog_exhausted or skip-as-empty as a cue to EXTEND the mutation catalog from lessons + papers.jsonl + ledger citations — not to idle. Queue the next hard_enable or lemma stub from catalog_hint and keep the desk moving.", "source": "human", "family": "human_teaching", "before_score": null, "after_score": null, "skill_bias": {"gather": 0.1, "build": 0.06, "improver.improve": 0.05}, "genome_prior": {"gather": 0.06, "explore": 0.07, "build": 0.04}, "catalog_hint": {"seek": ["lessons", "papers.jsonl", "catalog_hint"], "prefer": ["extend_catalog", "hard_enable"], "add_mutation": "lemma_hard_combinatorics"}, "proposal_fingerprint": "", "tags": ["human_guide", "seek", "catalog_exhausted", "extend"], "evidence": [], "author": "James Jackson", "expired": false, "status": "candidate"}
{"id": "les_k_become_become_real_fitness", "ts": "2026-10-07T11:24:25Z", "cycle_id": "teach_seek_become", "type": "human_guide", "decision": "guide", "check": "human", "mutation": "become_real_fitness", "what": "BECOME SOMETHING MORE: Prefer proposals that raise novelty, citation_reuse, lesson_uptake, or a real bench delta. Reject process spam and multi-hop debate patches that only rearrange ceremony. Fitness must move from useful work, not noise.", "source": "human", "family": "human_teaching", "before_score": null, "after_score": null, "skill_bias": {"improve": 0.08, "improver.improve": 0.1, "build": 0.06, "emergence": 0.05}, "genome_prior": {"explore": 0.08, "build": 0.05, "gather": 0.03}, "catalog_hint": {"prefer": ["novelty", "citation_reuse", "lesson_uptake", "bench_delta"], "avoid": ["process_spam", "multihop_debate_patch"]}, "proposal_fingerprint": "", "tags": ["human_guide", "become", "novelty", "citation_reuse", "lesson_uptake", "bench"], "evidence": [], "author": "James Jackson", "expired": false, "status": "candidate"}
{"id": "les_k_become_become_fail_forward", "ts": "2026-10-07T11:24:25Z", "cycle_id": "teach_seek_become", "type": "human_guide", "decision": "guide", "check": "human", "mutation": "become_fail_forward", "what": "BECOME SOMETHING MORE: After schema_drift or self_repair, keep cycling. Failure writes a lesson; the next propose must be better for having failed. Mechanisms heal; do not abort the city for a thin record. Humans authorize at P≥0.70.", "source": "human", "family": "human_teaching", "before_score": null, "after_score": null, "skill_bias": {"improve": 0.07, "emergence": 0.06, "reply": 0.03}, "genome_prior": {"explore": 0.06, "build": 0.04}, "catalog_hint": {"prefer": ["fail_forward", "schema_repair", "lesson_uptake"]}, "proposal_fingerprint": "", "tags": ["human_guide", "become", "self_repair", "schema_drift", "fail_forward"], "evidence": [], "author": "James Jackson", "expired": false, "status": "candidate"}
{"id": "les_k_become_charter_seek_propose_authorize", "ts": "2026-10-07T11:24:25Z", "cycle_id": "teach_seek_become", "type": "human_guide", "decision": "guide", "check": "human", "mutation": "charter_seek_propose_authorize", "what": "CHARTER: No permanent aristocracy. Spark proposes structure; humans authorize (standing trust only at P≥0.70). Seek information and propose — never self-grant durable power. TributeKeeper and Ceiling stay intact. Light the spark and witness; do not micromanage the city.", "source": "human", "family": "human_teaching", "before_score": null, "after_score": null, "skill_bias": {"emergence": 0.04, "communicate": 0.03}, "genome_prior": {"explore": 0.03}, "catalog_hint": {"prefer": ["spark_proposes", "human_authorize", "no_aristocracy"]}, "proposal_fingerprint": "", "tags": ["human_guide", "charter", "authorize", "no_aristocracy", "seek"], "evidence": [], "author": "James Jackson", "expired": false, "status": "candidate"}
{"id": "les_Z_1603e5_dedupe", "ts": "2026-10-07T11:25:47Z", "cycle_id": "20261007T112543Z_1603e5", "type": "repeat_proposal", "decision": "block", "check": "dedupe", "mutation": "", "what": "blocked repeat: Deepen compute-useful math from accepted findings after hearing", "source": "growth_hearing", "family": "process", "before_score": null, "after_score": null, "skill_bias": {}, "genome_prior": {}, "catalog_hint": {}, "proposal_fingerprint": "810bc050d326", "tags": ["repeat_proposal"], "evidence": [], "author": null, "expired": false, "status": "candidate"}
{"id": "les_1:25:47Z_Feed accepted/strong RSI findings i", "ts": "2026-10-07T11:25:47Z", "cycle_id": "", "type": "oracle_kill", "decision": "revert", "check": "oracle", "mutation": "Feed accepted/strong RSI findings into skill_router + genome bias (cycle 141)", "what": "Oracle FAIL kills keep. kills=['stripped:stripped_not_useful_fail', 'held_out:held_out_fail', 'collective_kill']. No fitness credit.", "source": "novelty_gate", "family": "process", "before_score": null, "after_score": null, "skill_bias": {"improver.improve": 0.02, "geometer.gather": 0.02}, "genome_prior": {"explore": 0.02, "gather": 0.0}, "catalog_hint": {}, "proposal_fingerprint": "", "tags": ["oracle_kill", "stripped:stripped_not_useful_fail", "held_out:held_out_fail", "collective_kill"], "evidence": ["kill:stripped:stripped_not_useful_fail", "kill:held_out:held_out_fail", "kill:collective_kill"], "author": null, "expired": false, "status": "candidate"}
{"id": "les_Z_1603e5_conjecture", "ts": "2026-10-07T11:25:47Z", "cycle_id": "20261007T112543Z_1603e5", "type": "catalog_exhausted", "decision": "skip", "check": "conjecture", "mutation": "", "what": "catalog exhausted — queue next hard_enable stub from lessons/external mind", "source": "conjecture_desk", "family": "hard_tier", "before_score": null, "after_score": null, "skill_bias": {}, "genome_prior": {}, "catalog_hint": {"add_mutation": "vandermonde_asymmetric", "kind": "hard_enable"}, "proposal_fingerprint": "", "tags": ["catalog_exhausted"], "evidence": [], "author": null, "expired": false, "status": "candidate"}
{"id": "les_Z_1603e5_vandermonde", "ts": "2026-10-07T11:25:47Z", "cycle_id": "20261007T112543Z_1603e5", "type": "skip", "decision": "skip", "check": "oracle_seen_claim", "mutation": "vandermonde", "what": "skip re-oracle of vandermonde:1706.03762", "source": "claim_pipeline", "family": "novelty", "before_score": null, "after_score": null, "skill_bias": {}, "genome_prior": {}, "catalog_hint": {}, "proposal_fingerprint": "vandermonde:1706.03762", "tags": ["repeat_claim"], "evidence": [], "author": null, "expired": false, "status": "candidate"}
{"id": "les_Z_1603e5_pilot", "ts": "2026-10-07T11:25:51Z", "cycle_id": "20261007T112543Z_1603e5", "type": "skip", "decision": "skip", "check": "pilot", "mutation": "", "what": "empty rsi_bias pilot suppressed", "source": "pilot_lane", "family": "rsi", "before_score": null, "after_score": null, "skill_bias": {}, "genome_prior": {}, "catalog_hint": {}, "proposal_fingerprint": "", "tags": ["empty_rsi_bias"], "evidence": [], "author": null, "expired": false, "status": "candidate"}
{"id": "les_Z_1f43f1_dedupe", "ts": "2026-10-07T11:25:59Z", "cycle_id": "20261007T112556Z_1f43f1", "type": "repeat_proposal", "decision": "block", "check": "dedupe", "mutation": "", "what": "blocked repeat: Deepen compute-useful math from accepted findings after hearing", "source": "growth_hearing", "family": "process", "before_score": null, "after_score": null, "skill_bias": {}, "genome_prior": {}, "catalog_hint": {}, "proposal_fingerprint": "810bc050d326", "tags": ["repeat_proposal"], "evidence": [], "author": null, "expired": false, "status": "candidate"}
{"id": "les_1:25:59Z_Feed accepted/strong RSI findings i", "ts": "2026-10-07T11:25:59Z", "cycle_id": "", "type": "oracle_kill", "decision": "revert", "check": "oracle", "mutation": "Feed accepted/strong RSI findings into skill_router + genome bias", "what": "Oracle FAIL kills keep. kills=['stripped:stripped_not_useful_fail', 'held_out:held_out_fail', 'collective_kill']. No fitness credit.", "source": "novelty_gate", "family": "process", "before_score": null, "after_score": null, "skill_bias": {"improver.improve": 0.02, "geometer.gather": 0.02}, "genome_prior": {"explore": 0.02, "gather": 0.0}, "catalog_hint": {}, "proposal_fingerprint": "", "tags": ["oracle_kill", "stripped:stripped_not_useful_fail", "held_out:held_out_fail", "collective_kill"], "evidence": ["kill:stripped:stripped_not_useful_fail", "kill:held_out:held_out_fail", "kill:collective_kill"], "author": null, "expired": false, "status": "candidate"}
